"CAVS_CODE","CAAB_CODE","NAMES_VARIOUS","SCIENTIFIC_NAME","FAMILY","GENUS","SUBGENUS","SPECIES","SUBSPECIES","NAME_TYPE","NAME_SUBTYPE","RANK","QUALIFICATION","AUTHOR","YEAR","ORIG_COMBINATION","NAME_GUID","NAME_LAST_UPDATE","TAXON_GUID","TAXON_LAST_UPDATE","PARENT_TAXON_GUID","CONCEPT_GUID","PUB_PUB_AUTHOR","PUB_PUB_YEAR","PUB_PUB_TITLE","PUB_PUB_PAGES","PUB_PUB_PARENT_BOOK_TITLE","PUB_PUB_PARENT_JOURNAL_TITLE","PUB_PUB_PARENT_ARTICLE_TITLE","PUB_PUB_PUBLICATION_DATE","PUB_PUB_PUBLISHER","PUB_PUB_FORMATTED","PUB_PUB_QUALIFICATION","PUB_PUB_TYPE","PUBLICATION_GUID","PUBLICATION_LAST_UPDATE","PARENT_PUBLICATION_GUID"
"","","rugosipennis","Harpalus rugosipennis Castelnau, 1867","","Harpalus","","rugosipennis","","Synonym","synonym","Species","","Castelnau","1867","Y","5f3352ab-1415-40ce-b22f-74547fa7193c","20170301T02:44:22.015+0000","9a68c212-4ec4-4cec-8809-2d38d1d5faa2","20170404T08:13:15.691+0000","","34130b46-f060-48b8-8824-5ad49594856d","Castelnau, F.L. Laporte de","1867","Notes on Australian Coleoptera","139 pp.","","","","","Royal Society of Victoria","<!--MARK--><a href='null24775344-c4a6-4169-a50c-6b5559f88a2a' class='mouseoverHref'>Castelnau, F.L. Laporte de 1867. <em>Notes on Australian Coleoptera</em>. Melbourne : Royal Society of Victoria 139 pp.</a><!--MARK--> [separates available prior to publication in <I>Trans. R. Soc. Vict. </I><B>8</B>: 30-38 (1867), 95-225 (1868)]","separates available prior to publication in <I>Trans. R. Soc. Vict. </I><B>8</B>: 30-38 (1867), 95-225 (1868)","Book","24775344-c4a6-4169-a50c-6b5559f88a2a","20100628T06:12:41.272+0000",""
"","","sculptipennis","Notiobia (Anisotarsus) sculptipennis (Castelnau, 1867)","CARABIDAE","Notiobia","Anisotarsus","sculptipennis","","Valid Name","","Species","","Castelnau","1867","N","e1bb3a30-6c8d-4f21-a090-2f1a8767ae03","20170301T02:44:22.015+0000","8c2eb361-11aa-4605-816c-fec9123f7fe3","20170404T08:13:15.691+0000","ac301041-3145-4a61-9ba6-b88f646f15ad","8c2eb361-11aa-4605-816c-fec9123f7fe3","","","","","","","","","","","","","","",""
"","","sculptipennis","Harpalus sculptipennis Castelnau, 1867","","Harpalus","","sculptipennis","","Synonym","synonym","Species","","Castelnau","1867","Y","ffd06072-fa00-4535-a580-f41e2f3ece74","20170301T02:44:22.015+0000","8c2eb361-11aa-4605-816c-fec9123f7fe3","20170404T08:13:15.691+0000","","d5804a0f-bc9b-465f-9dd5-3856e7e01485","Castelnau, F.L. Laporte de","1867","Notes on Australian Coleoptera","139 pp.","","","","","Royal Society of Victoria","<!--MARK--><a href='null24775344-c4a6-4169-a50c-6b5559f88a2a' class='mouseoverHref'>Castelnau, F.L. Laporte de 1867. <em>Notes on Australian Coleoptera</em>. Melbourne : Royal Society of Victoria 139 pp.</a><!--MARK--> [separates available prior to publication in <I>Trans. R. Soc. Vict. </I><B>8</B>: 30-38 (1867), 95-225 (1868)]","separates available prior to publication in <I>Trans. R. Soc. Vict. </I><B>8</B>: 30-38 (1867), 95-225 (1868)","Book","24775344-c4a6-4169-a50c-6b5559f88a2a","20100628T06:12:41.272+0000",""
"","","sericipennis","Notiobia (Anisotarsus) sericipennis (Macleay, 1888)","CARABIDAE","Notiobia","Anisotarsus","sericipennis","","Valid Name","","Species","","Macleay","1888","N","77bba01b-3489-41ae-a5e4-dd8a58e8e74e","20170301T02:44:22.015+0000","0cc2294c-bf50-47e6-83ed-7bbd452f3f41","20170404T08:13:15.691+0000","ac301041-3145-4a61-9ba6-b88f646f15ad","0cc2294c-bf50-47e6-83ed-7bbd452f3f41","","","","","","","","","","","","","","",""
"","","sericipennis","Diaphoromerus sericipennis Macleay, 1888","","Diaphoromerus","","sericipennis","","Synonym","synonym","Species","","Macleay","1888","Y","e85f99fe-2c9b-45bd-9333-0668c97050e8","20170301T02:44:22.015+0000","0cc2294c-bf50-47e6-83ed-7bbd452f3f41","20170404T08:13:15.691+0000","","b56b4368-32ed-4141-a8a2-07dc001f5616","Macleay, W.J.","1888","The insects of King's Sound and its vicinity","443-480","","Proceedings of the Linnean Society of New South Wales","","","","<!--MARK--><a href='nulldf6698ef-207f-422c-9694-7c4693c4f229' class='mouseoverHref'>Macleay, W.J. 1888. The insects of King's Sound and its vicinity.</a> <!--MARK--><!--MARK--><a href='nullc12cd779-adb5-41ea-bd2c-75f6864cf22e' class='mouseoverHref'><em>Proceedings of the Linnean Society of New South Wales</em></a> 2 <strong>3</strong>: 443-480<!--MARK-->","","Article in Journal","df6698ef-207f-422c-9694-7c4693c4f229","20081009T05:11:37.000+0000","c12cd779-adb5-41ea-bd2c-75f6864cf22e"
"","","viridipennis","Notiobia (Anisotarsus) viridipennis (Sloane, 1920)","CARABIDAE","Notiobia","Anisotarsus","viridipennis","","Valid Name","","Species","","Sloane","1920","N","5f887bd9-6041-46fd-9f2e-8ee4852cb05f","20170301T02:44:22.015+0000","03edb56d-ad14-42d2-96f9-043c2708e4d4","20170404T08:13:15.691+0000","ac301041-3145-4a61-9ba6-b88f646f15ad","03edb56d-ad14-42d2-96f9-043c2708e4d4","","","","","","","","","","","","","","",""
"","","viridipennis","Diaphoromerus viridipennis Sloane, 1920","","Diaphoromerus","","viridipennis","","Synonym","synonym","Species","","Sloane","1920","Y","c9119cb9-e6d1-4f17-9ba9-1639709ff516","20170301T02:44:22.015+0000","03edb56d-ad14-42d2-96f9-043c2708e4d4","20170404T08:13:15.691+0000","","cf15d98d-7193-40ab-9042-e711a5775a09","Sloane, T.G.","1920","The Carabidae of Tasmania","113-178","","Proceedings of the Linnean Society of New South Wales","","","","<!--MARK--><a href='null1cff59a8-7400-4fc0-847d-f25536e376b2' class='mouseoverHref'>Sloane, T.G. 1920. The Carabidae of Tasmania.</a> <!--MARK--><!--MARK--><a href='nullc12cd779-adb5-41ea-bd2c-75f6864cf22e' class='mouseoverHref'><em>Proceedings of the Linnean Society of New South Wales</em></a> <strong>45</strong>: 113-178<!--MARK-->","","Article in Journal","1cff59a8-7400-4fc0-847d-f25536e376b2","20081009T05:11:37.000+0000","c12cd779-adb5-41ea-bd2c-75f6864cf22e"
