"CAVS_CODE","CAAB_CODE","NAMES_VARIOUS","SCIENTIFIC_NAME","FAMILY","GENUS","SUBGENUS","SPECIES","SUBSPECIES","NAME_TYPE","NAME_SUBTYPE","RANK","QUALIFICATION","AUTHOR","YEAR","ORIG_COMBINATION","NAME_GUID","NAME_LAST_UPDATE","TAXON_GUID","TAXON_LAST_UPDATE","PARENT_TAXON_GUID","CONCEPT_GUID","PUB_PUB_AUTHOR","PUB_PUB_YEAR","PUB_PUB_TITLE","PUB_PUB_PAGES","PUB_PUB_PARENT_BOOK_TITLE","PUB_PUB_PARENT_JOURNAL_TITLE","PUB_PUB_PARENT_ARTICLE_TITLE","PUB_PUB_PUBLICATION_DATE","PUB_PUB_PUBLISHER","PUB_PUB_FORMATTED","PUB_PUB_QUALIFICATION","PUB_PUB_TYPE","PUBLICATION_GUID","PUBLICATION_LAST_UPDATE","PARENT_PUBLICATION_GUID"
"","","Syntomus","Syntomus Hope, 1838","CARABIDAE","Syntomus","","","","Valid Name","","Genus","","Hope","1838","Y","24fcd6af-5641-4121-b89a-f6ff4d031529","20160509T01:03:35.011+0000","248971d6-3891-4bfb-b52a-94c517bb6b63","20160518T03:04:34.966+0000","8632d372-256a-4d4c-9880-a6b785b41fde","248971d6-3891-4bfb-b52a-94c517bb6b63","","","","","","","","","","","","","","",""
"","","Syntomus","Syntomus Hope, 1838","","Syntomus","","","","Synonym","synonym","Genus","","Hope","1838","Y","2f09f11e-d7bc-4163-8a99-10589eaa15c7","20160509T01:03:35.011+0000","248971d6-3891-4bfb-b52a-94c517bb6b63","20160518T03:04:34.966+0000","","afd505bc-2571-4ad3-9308-c3df0dc2ab45","Hope, F.W.","1838","The Coleopterist's Manual, containing the predaceous and water beetles of Linneus and Fabricius","xvi 168 pp. 4 pls","","","","","Henry G. Bohn","<!--MARK--><a href='nulle7e10ca8-f572-40c6-80fd-8810fce8ac20' class='mouseoverHref'>Hope, F.W. 1838. <em>The Coleopterist's Manual, containing the predaceous and water beetles of Linneus and Fabricius</em>. London : Henry G. Bohn Vol. 2 xvi 168 pp. 4 pls.</a><!--MARK-->","","Book","e7e10ca8-f572-40c6-80fd-8810fce8ac20","20081009T05:11:37.000+0000",""
"","","Metabletus","Metabletus Schmidt-Goebel, 1846","","Metabletus","","","","Synonym","synonym","Genus","","Schmidt-Goebel","1846","Y","f1a58b69-1650-4a70-a663-f3f454a0dba0","20160509T01:03:35.011+0000","248971d6-3891-4bfb-b52a-94c517bb6b63","20160518T03:04:34.966+0000","","d278072a-4024-4f65-85b2-ac081d2ab604","Schmidt-Goebel, H.M.","1846","Faunula Coleopterorum Birmaniae, adjectis nonullis Bengaliae indiginis Med. Dr. Johann Wilhelm Halfer압 hinterlassene Sammlungen aus Vorder- und Hinter-Indien. Nach seinem Tode in Aufrage des b沈m. National-Museums unter Mitwirkung Mehrerer","94 pp. 3 pls","","","","","G. Haase S沈ne","<!--MARK--><a href='null6d8ddcbc-d9da-4596-b154-89ac6454fbf1' class='mouseoverHref'>Schmidt-Goebel, H.M. 1846. <em>Faunula Coleopterorum Birmaniae, adjectis nonullis Bengaliae indiginis Med. Dr. Johann Wilhelm Halfer압 hinterlassene Sammlungen aus Vorder- und Hinter-Indien. Nach seinem Tode in Aufrage des b沈m. National-Museums unter Mitwirkung Mehrerer</em>. Prague : G. Haase S沈ne 94 pp. 3 pls.</a><!--MARK-->","","Book","6d8ddcbc-d9da-4596-b154-89ac6454fbf1","20160522T23:47:00.534+0000",""
"","","quadripunctatus","Syntomus quadripunctatus (Schmidt-Goebel, 1846)","CARABIDAE","Syntomus","","quadripunctatus","","Valid Name","","Species","","Schmidt-Goebel","1846","N","919632f1-5eb6-4cfc-abca-4a2e568570aa","20160509T01:03:35.011+0000","25ea1c85-e1a3-4066-ad42-bfbc01037724","20160518T03:04:34.966+0000","248971d6-3891-4bfb-b52a-94c517bb6b63","25ea1c85-e1a3-4066-ad42-bfbc01037724","","","","","","","","","","","","","","",""
"","","quadripunctatus","Metabletus quadripunctatus Schmidt-Goebel, 1846","","Metabletus","","quadripunctatus","","Synonym","synonym","Species","","Schmidt-Goebel","1846","Y","9d7780d3-831b-4d60-bfb8-7e9b1630221a","20160509T01:03:35.011+0000","25ea1c85-e1a3-4066-ad42-bfbc01037724","20160518T03:04:34.966+0000","","2d6db9dd-ed96-44ad-bd7b-801aa206eb55","Schmidt-Goebel, H.M.","1846","Faunula Coleopterorum Birmaniae, adjectis nonullis Bengaliae indiginis Med. Dr. Johann Wilhelm Halfer압 hinterlassene Sammlungen aus Vorder- und Hinter-Indien. Nach seinem Tode in Aufrage des b沈m. National-Museums unter Mitwirkung Mehrerer","94 pp. 3 pls","","","","","G. Haase S沈ne","<!--MARK--><a href='null6d8ddcbc-d9da-4596-b154-89ac6454fbf1' class='mouseoverHref'>Schmidt-Goebel, H.M. 1846. <em>Faunula Coleopterorum Birmaniae, adjectis nonullis Bengaliae indiginis Med. Dr. Johann Wilhelm Halfer압 hinterlassene Sammlungen aus Vorder- und Hinter-Indien. Nach seinem Tode in Aufrage des b沈m. National-Museums unter Mitwirkung Mehrerer</em>. Prague : G. Haase S沈ne 94 pp. 3 pls.</a><!--MARK-->","","Book","6d8ddcbc-d9da-4596-b154-89ac6454fbf1","20160522T23:47:00.534+0000",""
