"PUB_AUTHOR","PUB_YEAR","PUB_TITLE","PUB_PAGES","PUB_PARENT_BOOK_TITLE","PUB_PARENT_JOURNAL_TITLE","PUB_PARENT_ARTICLE_TITLE","PUB_PUBLICATION_DATE","PUB_PUBLISHER","PUB_FORMATTED","PUB_QUALIFICATION","PUB_TYPE","PUBLICATION_GUID","PUBLICATION_LAST_UPDATE","PARENT_PUBLICATION_GUID"
"Blackburn, T.","1889","Further notes on Australian Coleoptera, with descriptions of new genera and species","1387-1506","","Proceedings of the Linnean Society of New South Wales","","22 March 1889","","<!--MARK--><a href='nulld4f8fef7-2826-4cc1-b828-320074ab3eb4' class='mouseoverHref'>Blackburn, T. 1889. Further notes on Australian Coleoptera, with descriptions of new genera and species.</a> <!--MARK--><!--MARK--><a href='nullc12cd779-adb5-41ea-bd2c-75f6864cf22e' class='mouseoverHref'><em>Proceedings of the Linnean Society of New South Wales</em></a> 2 <strong>3</strong>: 1387-1506<!--MARK--> [Date published 22 March 1889]","","Article in Journal","d4f8fef7-2826-4cc1-b828-320074ab3eb4","20111129T00:40:57.802+0000","c12cd779-adb5-41ea-bd2c-75f6864cf22e"
"Bryant, G.E.","1923","Notes on the synonymy of Phytophaga (Coleoptera)","130-147","","Annals and Magazine of Natural History","","","","<!--MARK--><a href='null932bbc76-93fe-4c39-9075-dc520cdc6415' class='mouseoverHref'>Bryant, G.E. 1923. Notes on the synonymy of Phytophaga (Coleoptera).</a> <!--MARK--><!--MARK--><a href='nullefa8de69-3a29-4a43-8ef2-cbefda205976' class='mouseoverHref'><em>Annals and Magazine of Natural History</em></a> 9 <strong>12</strong>: 130-147<!--MARK-->","","Article in Journal","932bbc76-93fe-4c39-9075-dc520cdc6415","20081009T05:11:37.000+0000","efa8de69-3a29-4a43-8ef2-cbefda205976"
"Chapuis, F.","1874","Famille des Phytophages","","Histoire naturelle des insectes. Genera des Coléoptères","","","","","<!--MARK--><a href='nullf8d6ef26-3678-416d-b9b9-85da2c0c8410' class='mouseoverHref'>Chapuis, F. 1874. Famille des Phytophages.</a> <!--MARK--><em>In,</em> <!--MARK--><a href='nulle7d53f3f-4501-4512-8f44-6cf9e07175de' class='mouseoverHref'>Laccordaire, T. & Chapuis, F. (eds). <em>Histoire naturelle des insectes. Genera des Coléoptères</em>. Paris : Libraire Encyclopédique de Roret Vol. 10 455 pp.</a><!--MARK-->","","Chapter in Book","f8d6ef26-3678-416d-b9b9-85da2c0c8410","20081009T05:11:37.000+0000","e7d53f3f-4501-4512-8f44-6cf9e07175de"
"Clavareau, H.","1914","Chrysomelidae II. Eumolpinae","1-215","","","","","","<!--MARK--><a href='null0f016117-de79-43d9-be65-070dc14a2562' class='mouseoverHref'>Clavareau, H. 1914. Chrysomelidae II. Eumolpinae. <I>Coleopterorum Catalogus</I>. Pars 59. Junk : Berlin. 1-215 pp.</a>","","Miscellaneous","0f016117-de79-43d9-be65-070dc14a2562","20081009T05:11:37.000+0000",""
"Jacoby, M.","1882","Descriptions of new genera and species of phytophagous Coleoptera","50-58","","Proceedings of the Zoological Society of London","","","","<!--MARK--><a href='nullb356fee5-0a45-4c5a-9b3e-c1a20ed04072' class='mouseoverHref'>Jacoby, M. 1882. Descriptions of new genera and species of phytophagous Coleoptera.</a> <!--MARK--><!--MARK--><a href='null511f299d-99ec-413c-bc4c-04a380829c96' class='mouseoverHref'><em>Proceedings of the Zoological Society of London</em></a> <strong>1882</strong>(1): 50-58<!--MARK--> [1 Jun. 1882]","1 Jun. 1882","Article in Journal","b356fee5-0a45-4c5a-9b3e-c1a20ed04072","","511f299d-99ec-413c-bc4c-04a380829c96"
"Lea, A.M.","1915","Notes on Australian Eumolpides (Coleoptera: Chrysomelidae), with descriptions of new species","102-339","","Transactions of the Royal Society of South Australia","","","","<!--MARK--><a href='nulla99b4bd6-bc9f-4896-87cd-1b2ca2054361' class='mouseoverHref'>Lea, A.M. 1915. Notes on Australian Eumolpides (Coleoptera: Chrysomelidae), with descriptions of new species.</a> <!--MARK--><!--MARK--><a href='null8b48b0a3-dd7a-4aea-be0d-10a223710ebc' class='mouseoverHref'><em>Transactions of the Royal Society of South Australia</em></a> <strong>39</strong>: 102-339<!--MARK-->","","Article in Journal","a99b4bd6-bc9f-4896-87cd-1b2ca2054361","20081009T05:11:37.000+0000","8b48b0a3-dd7a-4aea-be0d-10a223710ebc"
"Lea, A.M.","1922","On Australian Coleoptera. Part IV. Family Chrysomelidae","271-309","","Records of the South Australian Museum (Adelaide)","","","","<!--MARK--><a href='null1f1773fe-d76c-4bd3-bca1-37352f0188b2' class='mouseoverHref'>Lea, A.M. 1922. On Australian Coleoptera. Part IV. Family Chrysomelidae.</a> <!--MARK--><!--MARK--><a href='nullf7f76869-b0b8-4c0e-a1bc-1d8c43cc0f89' class='mouseoverHref'><em>Records of the South Australian Museum (Adelaide)</em></a> <strong>2</strong>: 271-309<!--MARK-->","","Article in Journal","1f1773fe-d76c-4bd3-bca1-37352f0188b2","20081009T05:11:37.000+0000","f7f76869-b0b8-4c0e-a1bc-1d8c43cc0f89"
