"PUB_AUTHOR","PUB_YEAR","PUB_TITLE","PUB_PAGES","PUB_PARENT_BOOK_TITLE","PUB_PARENT_JOURNAL_TITLE","PUB_PARENT_ARTICLE_TITLE","PUB_PUBLICATION_DATE","PUB_PUBLISHER","PUB_FORMATTED","PUB_QUALIFICATION","PUB_TYPE","PUBLICATION_GUID","PUBLICATION_LAST_UPDATE","PARENT_PUBLICATION_GUID"
"Hamilton, J. et al.","2006","<i>On the Fly, The interactive atlas and key to Australian fly families</i>","","","","","","","<!--MARK--><a href='nulle4fcb2d7-cd9e-4116-855a-86ab7be9b1f6' class='mouseoverHref'>Hamilton, J. <i>et al</i>. 2006. <i>On the Fly, The interactive atlas and key to Australian fly families</i>. [CD-Rom] CBIT & Australian Biological Resources Study, Brisbane & Canberra.</a>","","Miscellaneous","e4fcb2d7-cd9e-4116-855a-86ab7be9b1f6","20101212T22:08:30.777+0000",""
"Nagatomi, A., Saigusa, T., Nagatomi, H. & Lyneborg, L.","1991","Apsilocephalidae, a new family of orthorrhaphous Brachycera (Insecta, Diptera)","579-591","","Zoological Science (Tokyo)","","","","<!--MARK--><a href='null8b3780e7-a2b1-47c1-a29a-4235a67608b7' class='mouseoverHref'>Nagatomi, A., Saigusa, T., Nagatomi, H. & Lyneborg, L. 1991. Apsilocephalidae, a new family of orthorrhaphous Brachycera (Insecta, Diptera).</a> <!--MARK--><!--MARK--><a href='nulldb6b6d0b-f7f7-488c-8d64-e11b551800fd' class='mouseoverHref'><em>Zoological Science (Tokyo)</em></a> <strong>8</strong>: 579-591<!--MARK-->","","Article in Journal","8b3780e7-a2b1-47c1-a29a-4235a67608b7","20110406T22:15:18.752+0000","db6b6d0b-f7f7-488c-8d64-e11b551800fd"
"Nagatomi in Nagatomi, A., Saigusa, T., Nagatomi, H. & Lyneborg, L.","1991","Apsilocephalidae, a new family of orthorrhaphous Brachycera (Insecta, Diptera)","579-591","","Zoological Science (Tokyo)","","","","<!--MARK--><a href='nulla3a1d932-cd59-400b-abb3-f444a6414de7' class='mouseoverHref'>Nagatomi <i>in</i> Nagatomi, A., Saigusa, T., Nagatomi, H. & Lyneborg, L. 1991. Apsilocephalidae, a new family of orthorrhaphous Brachycera (Insecta, Diptera).</a> <!--MARK--><!--MARK--><a href='nulldb6b6d0b-f7f7-488c-8d64-e11b551800fd' class='mouseoverHref'><em>Zoological Science (Tokyo)</em></a> <strong>8</strong>: 579-591<!--MARK-->","","Article in Journal","a3a1d932-cd59-400b-abb3-f444a6414de7","20110406T05:04:13.892+0000","db6b6d0b-f7f7-488c-8d64-e11b551800fd"
"White, A.","1914","The Diptera-Brachycera of Tasmania. Part I. Families Leptidae, Stratiomyidae, Nemestrinidae, & Cyrtidae","35-74","","Papers and Proceedings of the Royal Society of Tasmania","","10 September 1914","","<!--MARK--><a href='null30471a35-18ea-41a0-a796-eb265ba3528c' class='mouseoverHref'>White, A. 1914. The Diptera-Brachycera of Tasmania. Part I. Families Leptidae, Stratiomyidae, Nemestrinidae, & Cyrtidae.</a> <!--MARK--><!--MARK--><a href='nulldb793adc-ebf2-40c5-9d92-48a121ea03ae' class='mouseoverHref'><em>Papers and Proceedings of the Royal Society of Tasmania</em></a> <strong>1914</strong>: 35-74<!--MARK--> [Date published 10 September 1914]","","Article in Journal","30471a35-18ea-41a0-a796-eb265ba3528c","20111103T00:16:20.928+0000","db793adc-ebf2-40c5-9d92-48a121ea03ae"
"Winterton, S.L. & Irwin, M.E.","2008","<i>Kaurimyia</i> gen. nov.: discovery of Apsilocephalidae (Diptera: Therevoid clade) in New Zealand","38-44","","Zootaxa","","","","<!--MARK--><a href='null4375d9a7-f69e-4b02-93c0-25b3e4df0956' class='mouseoverHref'>Winterton, S.L. & Irwin, M.E. 2008. <i>Kaurimyia</i> gen. nov.: discovery of Apsilocephalidae (Diptera: Therevoid clade) in New Zealand.</a> <!--MARK--><!--MARK--><a href='null96466227-221c-4922-ac97-1ac2dd946d0a' class='mouseoverHref'><em>Zootaxa</em></a> <strong>1779</strong>: 38-44<!--MARK-->","","Article in Journal","4375d9a7-f69e-4b02-93c0-25b3e4df0956","20110406T04:42:35.445+0000","96466227-221c-4922-ac97-1ac2dd946d0a"
