"PUB_AUTHOR","PUB_YEAR","PUB_TITLE","PUB_PAGES","PUB_PARENT_BOOK_TITLE","PUB_PARENT_JOURNAL_TITLE","PUB_PARENT_ARTICLE_TITLE","PUB_PUBLICATION_DATE","PUB_PUBLISHER","PUB_FORMATTED","PUB_QUALIFICATION","PUB_TYPE","PUBLICATION_GUID","PUBLICATION_LAST_UPDATE","PARENT_PUBLICATION_GUID"
"Audinet-Serville, J.G.","1834","Nouvelle classification de la famille des longicornes","5-110","","Annales de la Société Entomologique de France","","","","<!--MARK--><a href='null60f9f840-663f-4db8-899e-565c4942d027' class='mouseoverHref'>Audinet-Serville, J.G. 1834. Nouvelle classification de la famille des longicornes.</a> <!--MARK--><!--MARK--><a href='null6462279b-2aaf-46a3-a434-cab7d8a2c33d' class='mouseoverHref'><em>Annales de la Société Entomologique de France</em></a> <strong>3</strong>: 5-110<!--MARK-->","","Article in Journal","60f9f840-663f-4db8-899e-565c4942d027","20100802T01:39:33.306+0000","6462279b-2aaf-46a3-a434-cab7d8a2c33d"
"Dejean, P.F.M.A.","1835","Catalogue des coléoptères de la collection de M. le comte Dejean","257-360","","","","22-VIII-1835","Méquignon-Marvis","<!--MARK--><a href='nulle3520e8c-9e87-44d0-8aec-ee3267337444' class='mouseoverHref'>Dejean, P.F.M.A. 1835. <em>Catalogue des coléoptères de la collection de M. le comte Dejean</em>. Paris : Méquignon-Marvis Part 4 2nd edn, pp. 257-360.</a><!--MARK--> [Date published 22-VIII-1835]","","Book","e3520e8c-9e87-44d0-8aec-ee3267337444","20150317T04:04:48.186+0000",""
"Linnaeus, C. von","1758","<i>Systema Naturae</i> per Regna Tria Naturae, secundum classes, ordines, genera, species, cum characteribus, differentiis, synonymis. locis","823 pp.","","","","","Laurentii Salvii","<!--MARK--><a href='null2ff26305-034f-459e-b8b6-24ab85df6c60' class='mouseoverHref'>Linnaeus, C. von 1758. <em><i>Systema Naturae</i> per Regna Tria Naturae, secundum classes, ordines, genera, species, cum characteribus, differentiis, synonymis. locis</em>. Holmiae : Laurentii Salvii Vol. 1 823 pp.</a><!--MARK-->","","Book","2ff26305-034f-459e-b8b6-24ab85df6c60","20130430T21:54:33.902+0000",""
"Mulsant, E.","1839","Histoire Naturelle des Coléoptères de France. Longicornes","304 pp. 3 pls","","","","","L. Maison","<!--MARK--><a href='nulla884a8ac-d939-430a-83ab-0b565b4e441b' class='mouseoverHref'>Mulsant, E. 1839. <em>Histoire Naturelle des Coléoptères de France. Longicornes</em>. Lyon (et Paris) : L. Maison Vol. xi 304 pp. 3 pls.</a><!--MARK-->","","Book","a884a8ac-d939-430a-83ab-0b565b4e441b","20101001T01:44:54.363+0000",""
"Reitter, E.","1895","Beschreibung neuer oder wenig gekannter Coleopteren aus der Umgebung von Akbes in Syrien","79-88","","Wiener Entomologische Zeitung","","","","<!--MARK--><a href='nullb742b032-4725-4ab8-8ae3-f0bcbf82dc60' class='mouseoverHref'>Reitter, E. 1895. Beschreibung neuer oder wenig gekannter Coleopteren aus der Umgebung von Akbes in Syrien.</a> <!--MARK--><!--MARK--><a href='null9b6f9f14-04ca-437e-a5d2-714ac39f9aa0' class='mouseoverHref'><em>Wiener Entomologische Zeitung</em></a> <strong>14</strong>(3): 79-88<!--MARK--> [31 Mar. 1895]","31 Mar. 1895","Article in Journal","b742b032-4725-4ab8-8ae3-f0bcbf82dc60","","9b6f9f14-04ca-437e-a5d2-714ac39f9aa0"
"Sharp, D.","1905","The genus <i>Criocephalus</i>","145-164 pl. IX","","Transactions of the Entomological Society of London","","","","<!--MARK--><a href='nulld30f72d5-b836-4a38-a595-5c52121ffaba' class='mouseoverHref'>Sharp, D. 1905. The genus <i>Criocephalus</i>.</a> <!--MARK--><!--MARK--><a href='null5cf355b3-abc5-451e-9abc-ed3282d7811a' class='mouseoverHref'><em>Transactions of the Entomological Society of London</em></a> <strong>1905</strong>(1): 145-164 pl. IX<!--MARK--> [May 1905]","May 1905","Article in Journal","d30f72d5-b836-4a38-a595-5c52121ffaba","","5cf355b3-abc5-451e-9abc-ed3282d7811a"
"?lipi?ski, A. & Escalona, H.E.","2013","Australian Longhorn Beetles (Coleoptera: Cerambycidae)","484 pp. + xviii","","","","","CSIRO","<!--MARK--><a href='nulldef40227-b8e0-4ca5-94bc-fe596cf4463d' class='mouseoverHref'>?lipi?ski, A. & Escalona, H.E. 2013. <em>Australian Longhorn Beetles (Coleoptera: Cerambycidae)</em>. Collingwood, Vic : CSIRO Vol. 1: Introduction and Subfamily Lamiinae 484 pp. + xviii.</a><!--MARK-->","","Book","def40227-b8e0-4ca5-94bc-fe596cf4463d","20170706T04:24:30.967+0000",""
"Wang, Q. & Leschen, R.A.B.","2003","Identification and distribution of <i>Arhopalus</i> species (Coleoptera: Cerambycidae: Aseminae) in Australia and New Zealand","53-59","","New Zealand Entomologist","","","","<!--MARK--><a href='null77bfa6e1-2720-47be-9964-66e5a1700de2' class='mouseoverHref'>Wang, Q. & Leschen, R.A.B. 2003. Identification and distribution of <i>Arhopalus</i> species (Coleoptera: Cerambycidae: Aseminae) in Australia and New Zealand.</a> <!--MARK--><!--MARK--><a href='nullf86f120b-5516-4822-b304-3d5a1520c2e2' class='mouseoverHref'><em>New Zealand Entomologist</em></a> <strong>26</strong>: 53-59<!--MARK-->","","Article in Journal","77bfa6e1-2720-47be-9964-66e5a1700de2","20130829T06:51:49.919+0000","f86f120b-5516-4822-b304-3d5a1520c2e2"
"Webb, G.A. & Eldridge, R.H.","1997","<i>Arhopalus syriacus</i> (Reitter) (Coleoptera: Cerambycidae): a potential economic pest of <i>Pinus</i> in Australia, with notes on its biology and distribution","125-129","","Australian Forestry","","","","<!--MARK--><a href='null8288387b-00e2-485e-b807-a20ceb904193' class='mouseoverHref'>Webb, G.A. & Eldridge, R.H. 1997. <i>Arhopalus syriacus</i> (Reitter) (Coleoptera: Cerambycidae): a potential economic pest of <i>Pinus</i> in Australia, with notes on its biology and distribution.</a> <!--MARK--><!--MARK--><a href='null8e7750fe-4897-4a5c-8bde-2d782394548f' class='mouseoverHref'><em>Australian Forestry</em></a> <strong>60</strong>: 125-129<!--MARK-->","","Article in Journal","8288387b-00e2-485e-b807-a20ceb904193","20130829T06:49:46.986+0000","8e7750fe-4897-4a5c-8bde-2d782394548f"
