"PUB_AUTHOR","PUB_YEAR","PUB_TITLE","PUB_PAGES","PUB_PARENT_BOOK_TITLE","PUB_PARENT_JOURNAL_TITLE","PUB_PARENT_ARTICLE_TITLE","PUB_PUBLICATION_DATE","PUB_PUBLISHER","PUB_FORMATTED","PUB_QUALIFICATION","PUB_TYPE","PUBLICATION_GUID","PUBLICATION_LAST_UPDATE","PARENT_PUBLICATION_GUID"
"Cameron, M.","1944","Description of a new genus of Euaesthetinae (Col., Staph.)","68-70","","Annals and Magazine of Natural History","","","","<!--MARK--><a href='null3c0a4748-9156-4e25-9738-3224284d6c70' class='mouseoverHref'>Cameron, M. 1944. Description of a new genus of Euaesthetinae (Col., Staph.).</a> <!--MARK--><!--MARK--><a href='nullefa8de69-3a29-4a43-8ef2-cbefda205976' class='mouseoverHref'><em>Annals and Magazine of Natural History</em></a> 11 <strong>11</strong>: 68-70<!--MARK-->","","Article in Journal","3c0a4748-9156-4e25-9738-3224284d6c70","20110711T06:50:11.044+0000","efa8de69-3a29-4a43-8ef2-cbefda205976"
"Oke, C.","1933","Australian Staphylinidae","101-136","","Proceedings of the Royal Society of Victoria","","","","<!--MARK--><a href='nullee213be5-7102-452b-9364-8260113547f7' class='mouseoverHref'>Oke, C. 1933. Australian Staphylinidae.</a> <!--MARK--><!--MARK--><a href='nullce333794-3a02-427f-ba27-346079f1efa0' class='mouseoverHref'><em>Proceedings of the Royal Society of Victoria</em></a> n.s. <strong>45</strong>: 101-136<!--MARK-->","","Article in Journal","ee213be5-7102-452b-9364-8260113547f7","","ce333794-3a02-427f-ba27-346079f1efa0"
"Puthz, V.","1978","Revision of the Australian Euaesthetinae (Coleoptera: Staphylinidae)","117-133","","Memoirs of the National Museum of Victoria, Melbourne","","","","<!--MARK--><a href='null261eefdd-ccc6-4e10-bfa1-5158d489ad33' class='mouseoverHref'>Puthz, V. 1978. Revision of the Australian Euaesthetinae (Coleoptera: Staphylinidae).</a> <!--MARK--><!--MARK--><a href='null6d019674-04b0-4fab-8903-0612d147ec4d' class='mouseoverHref'><em>Memoirs of the National Museum of Victoria, Melbourne</em></a> <strong>39</strong>: 117-133<!--MARK-->","","Article in Journal","261eefdd-ccc6-4e10-bfa1-5158d489ad33","","6d019674-04b0-4fab-8903-0612d147ec4d"
"Puthz, V.","1995","<i>Chilioesthetus ernstjuengeri</i> sp. n., der erste Gattungsvertreter aus Australien (Coleoptera, Staphylinidae)","109-111","","Revue Suisse de Zoologie","","","","<!--MARK--><a href='nulla88f5b3c-0094-4a87-bee5-d10f6caa81ce' class='mouseoverHref'>Puthz, V. 1995. <i>Chilioesthetus ernstjuengeri</i> sp. n., der erste Gattungsvertreter aus Australien (Coleoptera, Staphylinidae).</a> <!--MARK--><!--MARK--><a href='nulldd4d5125-6d92-411c-86c0-7181702e62a5' class='mouseoverHref'><em>Revue Suisse de Zoologie</em></a> <strong>102</strong>(1): 109-111<!--MARK-->","","Article in Journal","a88f5b3c-0094-4a87-bee5-d10f6caa81ce","","dd4d5125-6d92-411c-86c0-7181702e62a5"
"Saiz, F.","1968","<i>Chilioesthetus</i>, nuevo genero de la subfamilia Euaesthetinae (Col. Staphylinidae)","73-79","","Revista Chilena de Entomología","","","","<!--MARK--><a href='null180d6254-4dc8-4a60-b3c7-f945d3ceffb4' class='mouseoverHref'>Saiz, F. 1968. <i>Chilioesthetus</i>, nuevo genero de la subfamilia Euaesthetinae (Col. Staphylinidae).</a> <!--MARK--><!--MARK--><a href='nulle4aee7c2-1156-4052-b574-ce822e251304' class='mouseoverHref'><em>Revista Chilena de Entomología</em></a> <strong>6</strong>: 73-79<!--MARK-->","","Article in Journal","180d6254-4dc8-4a60-b3c7-f945d3ceffb4","","e4aee7c2-1156-4052-b574-ce822e251304"
