"PUB_AUTHOR","PUB_YEAR","PUB_TITLE","PUB_PAGES","PUB_PARENT_BOOK_TITLE","PUB_PARENT_JOURNAL_TITLE","PUB_PARENT_ARTICLE_TITLE","PUB_PUBLICATION_DATE","PUB_PUBLISHER","PUB_FORMATTED","PUB_QUALIFICATION","PUB_TYPE","PUBLICATION_GUID","PUBLICATION_LAST_UPDATE","PARENT_PUBLICATION_GUID"
"Dyar, H.G.","1914","Report on the Lepidoptera of the Smithsonian biological survey of the Panama Canal Zone","139-350","","Proceedings of the United States National Museum","","","","<!--MARK--><a href='nullefee3091-9a54-490c-821f-3dbc1edb430d' class='mouseoverHref'>Dyar, H.G. 1914. Report on the Lepidoptera of the Smithsonian biological survey of the Panama Canal Zone.</a> <!--MARK--><!--MARK--><a href='null0e32c453-4bc6-48a2-a3a2-d40281874533' class='mouseoverHref'><em>Proceedings of the United States National Museum</em></a> no. 2050 <strong>47</strong>: 139-350<!--MARK-->","","Article in Journal","efee3091-9a54-490c-821f-3dbc1edb430d","20081009T05:11:37.000+0000","0e32c453-4bc6-48a2-a3a2-d40281874533"
"Hampson, G.F.","1917","Descriptions of new Pyralidae of the sub-families Hydrocampinae, Scoparianae etc.","361-376, 457-472","","Annals of Natural History","","","","<!--MARK--><a href='null90189b63-f916-49f1-9422-db0562012b48' class='mouseoverHref'>Hampson, G.F. 1917. Descriptions of new Pyralidae of the sub-families Hydrocampinae, Scoparianae etc.</a> <!--MARK--><!--MARK--><a href='null49064907-7f69-404b-b6d0-6e1a9be97dbb' class='mouseoverHref'><em>Annals of Natural History</em></a> <strong>19</strong>: 361-376, 457-472<!--MARK-->","","Article in Journal","90189b63-f916-49f1-9422-db0562012b48","20140317T00:13:57.431+0000","49064907-7f69-404b-b6d0-6e1a9be97dbb"
"Hübner, J.","1825","Verzeichniss bekannter Schmetterlinge [sic]","431 pp.","","","","","","<!--MARK--><a href='nulla726d673-c4e5-4349-9c30-7c8819906dad' class='mouseoverHref'>Hübner, J. 1825. <em>Verzeichniss bekannter Schmetterlinge [sic]</em>. Augsburg (1816-[1825]) 431 pp.</a><!--MARK-->","","Book","a726d673-c4e5-4349-9c30-7c8819906dad","20110418T03:45:12.763+0000",""
"Lederer, J.","1863","Beitrag zur Kenntnis der Pyralidinen","243-280, 331-501","","Wiener Entomologische Monatschrift","","","","<!--MARK--><a href='nulla3b6a1b1-d125-47de-b824-4ef3d49dd3f0' class='mouseoverHref'>Lederer, J. 1863. Beitrag zur Kenntnis der Pyralidinen.</a> <!--MARK--><!--MARK--><a href='null7a8843c1-d1ee-4ce7-8e14-54f7451d3e99' class='mouseoverHref'><em>Wiener Entomologische Monatschrift</em></a> <strong>7</strong>: 243-280, 331-501<!--MARK-->","","Article in Journal","a3b6a1b1-d125-47de-b824-4ef3d49dd3f0","20081009T05:11:37.000+0000","7a8843c1-d1ee-4ce7-8e14-54f7451d3e99"
"Turner, A.J.","1908","New Australian Lepidoptera of the families Noctuidae and Pyralidae","55-109","","Transactions of the Royal Society of South Australia","","","","<!--MARK--><a href='null039b93f9-44fe-44af-9952-a7f6205701f9' class='mouseoverHref'>Turner, A.J. 1908. New Australian Lepidoptera of the families Noctuidae and Pyralidae.</a> <!--MARK--><!--MARK--><a href='null8b48b0a3-dd7a-4aea-be0d-10a223710ebc' class='mouseoverHref'><em>Transactions of the Royal Society of South Australia</em></a> <strong>32</strong>: 55-109<!--MARK-->","","Article in Journal","039b93f9-44fe-44af-9952-a7f6205701f9","20081009T05:11:37.000+0000","8b48b0a3-dd7a-4aea-be0d-10a223710ebc"
"Turner, A.J.","1937","New Australian Pyraloidea (Lepidoptera)","61-88","","Proceedings of the Royal Society of Queensland","","","","<!--MARK--><a href='null6f7d6a92-4fd3-4f07-a91d-04ee801d8bed' class='mouseoverHref'>Turner, A.J. 1937. New Australian Pyraloidea (Lepidoptera).</a> <!--MARK--><!--MARK--><a href='null642ab613-813a-48d0-8bc0-42c78157f7b0' class='mouseoverHref'><em>Proceedings of the Royal Society of Queensland</em></a> <strong>48</strong>: 61-88<!--MARK-->","","Article in Journal","6f7d6a92-4fd3-4f07-a91d-04ee801d8bed","20081009T05:11:37.000+0000","642ab613-813a-48d0-8bc0-42c78157f7b0"
"Walker, F.","1859","Pyralides","254-508","","List of the Specimens of Lepidopterous Insects in the Collection of the British Museum","","","","<!--MARK--><a href='nulld867a4e3-987a-42ff-976c-eedc2b6aa7ff' class='mouseoverHref'>Walker, F. 1859. Pyralides.</a> <!--MARK--><!--MARK--><a href='null642c8f2c-b31c-4c9f-9ca3-4c940f907155' class='mouseoverHref'><em>List of the Specimens of Lepidopterous Insects in the Collection of the British Museum</em></a> <strong>17</strong>: 254-508<!--MARK-->","","Article in Journal","d867a4e3-987a-42ff-976c-eedc2b6aa7ff","20081009T05:11:37.000+0000","642c8f2c-b31c-4c9f-9ca3-4c940f907155"
