"PUB_AUTHOR","PUB_YEAR","PUB_TITLE","PUB_PAGES","PUB_PARENT_BOOK_TITLE","PUB_PARENT_JOURNAL_TITLE","PUB_PARENT_ARTICLE_TITLE","PUB_PUBLICATION_DATE","PUB_PUBLISHER","PUB_FORMATTED","PUB_QUALIFICATION","PUB_TYPE","PUBLICATION_GUID","PUBLICATION_LAST_UPDATE","PARENT_PUBLICATION_GUID"
"Baly, J.S.","1860","Descriptions of some new species of <i>Sagra</i>; remarks on that genus; and the characters of <i>Cheiloxena</i>, a new genus belonging to the same family (concluded)","236-260","","Transactions of the Entomological Society of London","","","","<!--MARK--><a href='null76d8b0b5-9c64-4f08-a419-d48dc3588300' class='mouseoverHref'>Baly, J.S. 1860. Descriptions of some new species of <i>Sagra</i>; remarks on that genus; and the characters of <i>Cheiloxena</i>, a new genus belonging to the same family (concluded).</a> <!--MARK--><!--MARK--><a href='null5cf355b3-abc5-451e-9abc-ed3282d7811a' class='mouseoverHref'><em>Transactions of the Entomological Society of London</em></a> n.s. <strong>5</strong>: 236-260<!--MARK-->","","Article in Journal","76d8b0b5-9c64-4f08-a419-d48dc3588300","20120321T00:27:03.719+0000","5cf355b3-abc5-451e-9abc-ed3282d7811a"
"Blackburn, T.","1893","Further notes on Australian Coleoptera, with descriptions of new genera and species. Part XIII","130-140","","Transactions of the Royal Society of South Australia","","","","<!--MARK--><a href='null51c754e0-0004-4d5d-bd5a-0fbc1886735f' class='mouseoverHref'>Blackburn, T. 1893. Further notes on Australian Coleoptera, with descriptions of new genera and species. Part XIII.</a> <!--MARK--><!--MARK--><a href='null8b48b0a3-dd7a-4aea-be0d-10a223710ebc' class='mouseoverHref'><em>Transactions of the Royal Society of South Australia</em></a> <strong>17</strong>: 130-140<!--MARK-->","","Article in Journal","51c754e0-0004-4d5d-bd5a-0fbc1886735f","20130318T00:50:49.054+0000","8b48b0a3-dd7a-4aea-be0d-10a223710ebc"
"Blackburn, T.","1896","Further notes on Australian Coleoptera, with descriptions of new genera and species. Part XIX","35-109","","Transactions of the Royal Society of South Australia","","Sept. 30, 1896","","<!--MARK--><a href='null591c8d9c-b255-4c0b-ba45-6abd5b6440c6' class='mouseoverHref'>Blackburn, T. 1896. Further notes on Australian Coleoptera, with descriptions of new genera and species. Part XIX.</a> <!--MARK--><!--MARK--><a href='null8b48b0a3-dd7a-4aea-be0d-10a223710ebc' class='mouseoverHref'><em>Transactions of the Royal Society of South Australia</em></a> <strong>20</strong>: 35-109<!--MARK--> [Date published Sept. 30, 1896]","","Article in Journal","591c8d9c-b255-4c0b-ba45-6abd5b6440c6","20081009T05:11:37.000+0000","8b48b0a3-dd7a-4aea-be0d-10a223710ebc"
"Clavareau, H.","1913","Chrysomelidae: 1. Sagrinae, 2. Donaciinae, 3. Orsodacninae, 4. Criocerinae","1-103","","","","","","<!--MARK--><a href='nulla6ce71ee-e0a5-418c-a2c4-5c48166dfb66' class='mouseoverHref'>Clavareau, H. 1913. Chrysomelidae: 1. Sagrinae, 2. Donaciinae, 3. Orsodacninae, 4. Criocerinae. Coleopterorum Catalogus. Pars 51. S. Schenkling ed. Junk. Berlin. 1-103 pp.</a>","","Miscellaneous","a6ce71ee-e0a5-418c-a2c4-5c48166dfb66","20081009T05:11:37.000+0000",""
"Gemminger, M. & Harold, E. von","1874","Chrysomelidae pars 1","3233-3478","","","","","","<!--MARK--><a href='null57ff7c12-7785-4836-9ae6-3633a6444454' class='mouseoverHref'>Gemminger, M. & Harold, E. von 1874. Chrysomelidae pars 1. Catalogus Coleopterorum hucusque discriptorum synonimicus et systematicus XI. 3233-3478 pp.</a>","","Miscellaneous","57ff7c12-7785-4836-9ae6-3633a6444454","20081009T05:11:37.000+0000",""
"Jolivet, P.","1950","Rectifications de nomenclature chez les Chrysomeloidea","1-4","","Bulletin de l'Institut Royal des Sciences Naturelles de Belgique","","","","<!--MARK--><a href='null078b5c12-120e-402e-af5d-92100d080ff9' class='mouseoverHref'>Jolivet, P. 1950. Rectifications de nomenclature chez les Chrysomeloidea.</a> <!--MARK--><!--MARK--><a href='nullc23e8b41-25c3-4670-a436-a1aee129531e' class='mouseoverHref'><em>Bulletin de l'Institut Royal des Sciences Naturelles de Belgique</em></a> <strong>26</strong>(56): 1-4<!--MARK-->","","Article in Journal","078b5c12-120e-402e-af5d-92100d080ff9","20081009T05:11:37.000+0000","c23e8b41-25c3-4670-a436-a1aee129531e"
"Jolivet, P.","1957","Recherches sur l'aile des Chyrsomeloidea I","3-180","","Mémoires de l'Institut Royal des Sciences Naturelles de Belgique","","","","<!--MARK--><a href='nullf35c76b0-51de-4ebb-ab17-ee28bebec841' class='mouseoverHref'>Jolivet, P. 1957. Recherches sur l'aile des Chyrsomeloidea I.</a> <!--MARK--><!--MARK--><a href='nulld685363a-2366-4dd4-82af-b7f4006d9e44' class='mouseoverHref'><em>Mémoires de l'Institut Royal des Sciences Naturelles de Belgique</em></a> <strong>2</strong>(51): 3-180<!--MARK-->","","Article in Journal","f35c76b0-51de-4ebb-ab17-ee28bebec841","20081009T05:11:37.000+0000","d685363a-2366-4dd4-82af-b7f4006d9e44"
"Reid, C.A.M.","1992","Revision of the genus <i>Cheiloxena</i> Baly (Coleoptera: Chyrsomelidae: Eumolpinae)","101-114","","Memoirs of the National Museum of Victoria, Melbourne","","","","<!--MARK--><a href='null4d20c66e-0b7c-4f0b-a551-f9f248c22dd3' class='mouseoverHref'>Reid, C.A.M. 1992. Revision of the genus <i>Cheiloxena</i> Baly (Coleoptera: Chyrsomelidae: Eumolpinae).</a> <!--MARK--><!--MARK--><a href='null6d019674-04b0-4fab-8903-0612d147ec4d' class='mouseoverHref'><em>Memoirs of the National Museum of Victoria, Melbourne</em></a> <strong>53</strong>(1): 101-114<!--MARK-->","","Article in Journal","4d20c66e-0b7c-4f0b-a551-f9f248c22dd3","20081009T05:11:37.000+0000","6d019674-04b0-4fab-8903-0612d147ec4d"
"Selman, B.J.","1963","A revision of the genus <i>Deretrichia</i> Weise (Coleoptera: Eumolpidae)","155-196","","Bulletin of the British Museum (Natural History) Entomology","","","","<!--MARK--><a href='nulled404131-1e81-41ab-8686-7ae58bcd4314' class='mouseoverHref'>Selman, B.J. 1963. A revision of the genus <i>Deretrichia</i> Weise (Coleoptera: Eumolpidae).</a> <!--MARK--><!--MARK--><a href='nullc224aaab-feb2-40a3-8b48-daa6dba8e04d' class='mouseoverHref'><em>Bulletin of the British Museum (Natural History) Entomology</em></a> <strong>14</strong>(4): 155-196<!--MARK--> [9 Oct. 1963]","9 Oct. 1963","Article in Journal","ed404131-1e81-41ab-8686-7ae58bcd4314","","c224aaab-feb2-40a3-8b48-daa6dba8e04d"
