"PUB_AUTHOR","PUB_YEAR","PUB_TITLE","PUB_PAGES","PUB_PARENT_BOOK_TITLE","PUB_PARENT_JOURNAL_TITLE","PUB_PARENT_ARTICLE_TITLE","PUB_PUBLICATION_DATE","PUB_PUBLISHER","PUB_FORMATTED","PUB_QUALIFICATION","PUB_TYPE","PUBLICATION_GUID","PUBLICATION_LAST_UPDATE","PARENT_PUBLICATION_GUID"
"Gray, M.R.","1973","Cavernicolous spiders from the Nullarbor Plain and south-west Australia","207-221","","Journal of the Australian Entomological Society","","","","<!--MARK--><a href='null51b0b696-551b-4de7-830e-626578cb54e8' class='mouseoverHref'>Gray, M.R. 1973. Cavernicolous spiders from the Nullarbor Plain and south-west Australia.</a> <!--MARK--><!--MARK--><a href='nullc2544f9f-3978-4f18-846d-a1fd3122c9c4' class='mouseoverHref'><em>Journal of the Australian Entomological Society</em></a> <strong>12</strong>: 207-221<!--MARK-->","","Article in Journal","51b0b696-551b-4de7-830e-626578cb54e8","20081009T05:11:37.000+0000","c2544f9f-3978-4f18-846d-a1fd3122c9c4"
"Gray, M.R. & Thompson, J.A.","2001","New lycosoid spiders from cave and surface habitats in southern Australia and Cape Range peninsula (Araneae: Lycosoidea)","159-170","","Records of the Western Australian Museum, Supplement","","","","<!--MARK--><a href='nullf66a599d-4172-402b-af0b-516a903e155e' class='mouseoverHref'>Gray, M.R. & Thompson, J.A. 2001. New lycosoid spiders from cave and surface habitats in southern Australia and Cape Range peninsula (Araneae: Lycosoidea).</a> <!--MARK--><!--MARK--><a href='null841f1546-1bce-4548-adc9-7b08f6ca73a0' class='mouseoverHref'><em>Records of the Western Australian Museum, Supplement</em></a> <strong>64</strong>: 159-170<!--MARK-->","","Article in Journal","f66a599d-4172-402b-af0b-516a903e155e","20081009T05:11:37.000+0000","841f1546-1bce-4548-adc9-7b08f6ca73a0"
"Koch, L.","1878","Die Arachniden Australiens, nach der Natur beschrieben und abgebildet","969-1044 pp.","","","","","Bauer & Raspe","<!--MARK--><a href='null0836ede9-0687-431d-9fd4-315707fdea82' class='mouseoverHref'>Koch, L. 1878. <em>Die Arachniden Australiens, nach der Natur beschrieben und abgebildet</em>. Nürnberg : Bauer & Raspe Vol. 1 969-1044 pp.</a><!--MARK-->","","Book","0836ede9-0687-431d-9fd4-315707fdea82","20100321T23:22:35.564+0000",""
"Raven, R.J., Stumkat, K. & Gray, M.R.","2001","Revisions of Australian ground-hunting spiders: I. <i>Amauropelma</i> gen. nov. (Araneomorphae: Ctenidae)","187-227","","Records of the Western Australian Museum, Supplement","","","","<!--MARK--><a href='null72f7d867-f143-4764-9f41-b69a1fd7981c' class='mouseoverHref'>Raven, R.J., Stumkat, K. & Gray, M.R. 2001. Revisions of Australian ground-hunting spiders: I. <i>Amauropelma</i> gen. nov. (Araneomorphae: Ctenidae).</a> <!--MARK--><!--MARK--><a href='null841f1546-1bce-4548-adc9-7b08f6ca73a0' class='mouseoverHref'><em>Records of the Western Australian Museum, Supplement</em></a> <strong>64</strong>: 187-227<!--MARK-->","","Article in Journal","72f7d867-f143-4764-9f41-b69a1fd7981c","20081009T05:11:37.000+0000","841f1546-1bce-4548-adc9-7b08f6ca73a0"
"Raven, R.J. & Gray, M.R. in Raven, R.J., Stumkat, K. & Gray, M.R.","2001","Revisions of Australian ground-hunting spiders: I. <i>Amauropelma</i> gen. nov. (Araneomorphae: Ctenidae)","187-227","","Records of the Western Australian Museum, Supplement","","","","<!--MARK--><a href='null19850245-d2ca-4a9c-a446-f2ee99ecda5c' class='mouseoverHref'>Raven, R.J. & Gray, M.R. <i>in</i> Raven, R.J., Stumkat, K. & Gray, M.R. 2001. Revisions of Australian ground-hunting spiders: I. <i>Amauropelma</i> gen. nov. (Araneomorphae: Ctenidae).</a> <!--MARK--><!--MARK--><a href='null841f1546-1bce-4548-adc9-7b08f6ca73a0' class='mouseoverHref'><em>Records of the Western Australian Museum, Supplement</em></a> <strong>64</strong>: 187-227<!--MARK-->","","Article in Journal","19850245-d2ca-4a9c-a446-f2ee99ecda5c","20081009T05:11:37.000+0000","841f1546-1bce-4548-adc9-7b08f6ca73a0"
"Raven, R.J. & Stumkat, K. in Raven, R.J., Stumkat, K. & Gray, M.R.","2001","Revisions of Australian ground-hunting spiders: I. <i>Amauropelma</i> gen. nov. (Araneomorphae: Ctenidae)","187-227","","Records of the Western Australian Museum, Supplement","","","","<!--MARK--><a href='nulla263f2d3-9f63-40df-987d-d96460ee2626' class='mouseoverHref'>Raven, R.J. & Stumkat, K. <i>in</i> Raven, R.J., Stumkat, K. & Gray, M.R. 2001. Revisions of Australian ground-hunting spiders: I. <i>Amauropelma</i> gen. nov. (Araneomorphae: Ctenidae).</a> <!--MARK--><!--MARK--><a href='null841f1546-1bce-4548-adc9-7b08f6ca73a0' class='mouseoverHref'><em>Records of the Western Australian Museum, Supplement</em></a> <strong>64</strong>: 187-227<!--MARK-->","","Article in Journal","a263f2d3-9f63-40df-987d-d96460ee2626","20081009T05:11:37.000+0000","841f1546-1bce-4548-adc9-7b08f6ca73a0"
"Thorell, T.","1881","Studi sui Ragni Malesi e Papuani III. Ragni dell'Austro Malesia e del Capo York, conservati nel Museo Civico di Storia Naturale di Genova","1-727","","Annali del Museo Civico di Storia Naturale, Genova","","","","<!--MARK--><a href='null3ed482af-e4ed-4dc8-b1ea-7bbcd3159998' class='mouseoverHref'>Thorell, T. 1881. Studi sui Ragni Malesi e Papuani III. Ragni dell'Austro Malesia e del Capo York, conservati nel Museo Civico di Storia Naturale di Genova.</a> <!--MARK--><!--MARK--><a href='null461059ea-ead7-4f6d-83f4-52913f06d09f' class='mouseoverHref'><em>Annali del Museo Civico di Storia Naturale, Genova</em></a> <strong>17</strong>: 1-727<!--MARK-->","","Article in Journal","3ed482af-e4ed-4dc8-b1ea-7bbcd3159998","20170407T02:06:27.416+0000","461059ea-ead7-4f6d-83f4-52913f06d09f"
"Walckenaer, C.A.","1805","<i>Tableau des Aranéides</i> ou Caractères Essentiels des Tribus, Genres, Familles et Races que venforme le genre Aranea de Linné, avec la désignation des espèces comprises dans chacune de ces divisions","xii 88 pp. 9 pls","","","","","Dentu","<!--MARK--><a href='null9619a1ff-7d48-49ed-b9be-96f229c42dc2' class='mouseoverHref'>Walckenaer, C.A. 1805. <em><i>Tableau des Aranéides</i> ou Caractères Essentiels des Tribus, Genres, Familles et Races que venforme le genre Aranea de Linné, avec la désignation des espèces comprises dans chacune de ces divisions</em>. Paris : Dentu xii 88 pp. 9 pls.</a><!--MARK-->","","Book","9619a1ff-7d48-49ed-b9be-96f229c42dc2","20081009T05:11:37.000+0000",""
