"PUB_AUTHOR","PUB_YEAR","PUB_TITLE","PUB_PAGES","PUB_PARENT_BOOK_TITLE","PUB_PARENT_JOURNAL_TITLE","PUB_PARENT_ARTICLE_TITLE","PUB_PUBLICATION_DATE","PUB_PUBLISHER","PUB_FORMATTED","PUB_QUALIFICATION","PUB_TYPE","PUBLICATION_GUID","PUBLICATION_LAST_UPDATE","PARENT_PUBLICATION_GUID"
"Gemminger, M. & Harold, E. von","1872","Catalogus Coleopterum hucusque descriptorum synonymicus et systematicus. Scolytidae, Brenthidae, Anthotribidae, Cerambycidae","pp. 2669-2988","","","","","E.H. Gummi","<!--MARK--><a href='nulled671e14-65df-429d-964a-a663a0de0ce0' class='mouseoverHref'>Gemminger, M. & Harold, E. von 1872. <em>Catalogus Coleopterum hucusque descriptorum synonymicus et systematicus. Scolytidae, Brenthidae, Anthotribidae, Cerambycidae</em>. Monachi : E.H. Gummi Vol. 9 pp. 2669-2988.</a><!--MARK-->","","Book","ed671e14-65df-429d-964a-a663a0de0ce0","20101020T23:17:31.492+0000",""
"Pascoe, F.P.","1865","A second series of descriptions of new Australian longicornia","352-374 pl. xvi","","Journal of Entomology","","Mar. 1865","","<!--MARK--><a href='nulla505bf2a-8876-4d35-9ba9-6eaa00622230' class='mouseoverHref'>Pascoe, F.P. 1865. A second series of descriptions of new Australian longicornia.</a> <!--MARK--><!--MARK--><a href='null594ca738-5ec4-4752-84d7-686b8074e352' class='mouseoverHref'><em>Journal of Entomology</em></a> <strong>2</strong>(12): 352-374 pl. xvi<!--MARK--> [Date published Mar. 1865]","","Article in Journal","a505bf2a-8876-4d35-9ba9-6eaa00622230","20120111T21:41:21.846+0000","594ca738-5ec4-4752-84d7-686b8074e352"
"?lipi?ski, A. & Escalona, H.","2016","Australian Longhorn Beetles (Coleoptera: Cerambycidae), Volume 2, Subfamily Cerambycinae","640 pp.","","","","","CSIRO Publishing","<!--MARK--><a href='null036ed928-8a2e-44dc-a15b-df5d0d7e5b6b' class='mouseoverHref'>?lipi?ski, A. & Escalona, H. 2016. <em>Australian Longhorn Beetles (Coleoptera: Cerambycidae), Volume 2, Subfamily Cerambycinae</em>. Melbourne, Australia : CSIRO Publishing 640 pp.</a><!--MARK-->","","Book","036ed928-8a2e-44dc-a15b-df5d0d7e5b6b","20170706T04:24:15.628+0000",""
"?lipi?ski, A. & Escalona, H.E.","2013","Australian Longhorn Beetles (Coleoptera: Cerambycidae)","484 pp. + xviii","","","","","CSIRO","<!--MARK--><a href='nulldef40227-b8e0-4ca5-94bc-fe596cf4463d' class='mouseoverHref'>?lipi?ski, A. & Escalona, H.E. 2013. <em>Australian Longhorn Beetles (Coleoptera: Cerambycidae)</em>. Collingwood, Vic : CSIRO Vol. 1: Introduction and Subfamily Lamiinae 484 pp. + xviii.</a><!--MARK-->","","Book","def40227-b8e0-4ca5-94bc-fe596cf4463d","20170706T04:24:30.967+0000",""
"White, A.","1855","Catalogue of Coleopterous Insects in the Collection of the British Museum. Part viii. Longicornia II","iii 175-409 pls v-x","","","","Jun. 1855","British Museum","<!--MARK--><a href='null0e1124b4-7421-4b78-8394-7c702692ccfe' class='mouseoverHref'>White, A. 1855. <em>Catalogue of Coleopterous Insects in the Collection of the British Museum. Part viii. Longicornia II</em>. London : British Museum iii 175-409 pls v-x.</a><!--MARK--> [Date published Jun. 1855]","","Book","0e1124b4-7421-4b78-8394-7c702692ccfe","20120112T02:01:56.186+0000",""
