"PUB_AUTHOR","PUB_YEAR","PUB_TITLE","PUB_PAGES","PUB_PARENT_BOOK_TITLE","PUB_PARENT_JOURNAL_TITLE","PUB_PARENT_ARTICLE_TITLE","PUB_PUBLICATION_DATE","PUB_PUBLISHER","PUB_FORMATTED","PUB_QUALIFICATION","PUB_TYPE","PUBLICATION_GUID","PUBLICATION_LAST_UPDATE","PARENT_PUBLICATION_GUID"
"Meyrick, E.","1890","Revision of Australian Lepidoptera. III","1117-1216","","Proceedings of the Linnean Society of New South Wales","","","","<!--MARK--><a href='nulldcf74d3e-e6dc-4ada-93b9-020897c2937f' class='mouseoverHref'>Meyrick, E. 1890. Revision of Australian Lepidoptera. III.</a> <!--MARK--><!--MARK--><a href='nullc12cd779-adb5-41ea-bd2c-75f6864cf22e' class='mouseoverHref'><em>Proceedings of the Linnean Society of New South Wales</em></a> 2-n.s. <strong>4</strong>(4): 1117-1216<!--MARK--> [year of publication not confirmed]","year of publication not confirmed","Article in Journal","dcf74d3e-e6dc-4ada-93b9-020897c2937f","","c12cd779-adb5-41ea-bd2c-75f6864cf22e"
"Turner, A.J.","1904","New Australian Lepidoptera...with synonomic notes and other notes","212-247","","Transactions of the Royal Society of South Australia","","","","<!--MARK--><a href='null56397945-30b3-4fd9-8d42-f216899634e4' class='mouseoverHref'>Turner, A.J. 1904. New Australian Lepidoptera...with synonomic notes and other notes.</a> <!--MARK--><!--MARK--><a href='null8b48b0a3-dd7a-4aea-be0d-10a223710ebc' class='mouseoverHref'><em>Transactions of the Royal Society of South Australia</em></a> <strong>28</strong>: 212-247<!--MARK-->","","Article in Journal","56397945-30b3-4fd9-8d42-f216899634e4","20100826T05:51:58.431+0000","8b48b0a3-dd7a-4aea-be0d-10a223710ebc"
"Turner, A.J.","1919","Revision of Australian Lepidoptera. VI (Third instalment)","258-310, 383-413","","Proceedings of the Linnean Society of New South Wales","","","","<!--MARK--><a href='nullc798f5e5-90c3-4f7b-9276-602d983e098e' class='mouseoverHref'>Turner, A.J. 1919. Revision of Australian Lepidoptera. VI (Third instalment).</a> <!--MARK--><!--MARK--><a href='nullc12cd779-adb5-41ea-bd2c-75f6864cf22e' class='mouseoverHref'><em>Proceedings of the Linnean Society of New South Wales</em></a> <strong>44</strong>: 258-310, 383-413<!--MARK--> [2 Oct. 1919]","2 Oct. 1919","Article in Journal","c798f5e5-90c3-4f7b-9276-602d983e098e","","c12cd779-adb5-41ea-bd2c-75f6864cf22e"
"Walker, F.","1863","Geometrites","1478-1796","","List of the Specimens of Lepidopterous Insects in the Collection of the British Museum","","1863","","<!--MARK--><a href='null5b9987f0-346f-4e3f-ba76-47640ca46d29' class='mouseoverHref'>Walker, F. 1863. Geometrites.</a> <!--MARK--><!--MARK--><a href='null642c8f2c-b31c-4c9f-9ca3-4c940f907155' class='mouseoverHref'><em>List of the Specimens of Lepidopterous Insects in the Collection of the British Museum</em></a> <strong>26</strong>: 1478-1796<!--MARK--> [Date published 1863: incl. Index to parts 20-26; dated 1862]","incl. Index to parts 20-26; dated 1862","Article in Journal","5b9987f0-346f-4e3f-ba76-47640ca46d29","20140610T00:52:17.505+0000","642c8f2c-b31c-4c9f-9ca3-4c940f907155"
"Walker, F.","1866","Supplement 5","1534-2040","","List of the Specimens of Lepidopterous Insects in the Collection of the British Museum","","","","<!--MARK--><a href='null56a82836-2f3e-4d80-9768-9feacf9e0642' class='mouseoverHref'>Walker, F. 1866. Supplement 5.</a> <!--MARK--><!--MARK--><a href='null642c8f2c-b31c-4c9f-9ca3-4c940f907155' class='mouseoverHref'><em>List of the Specimens of Lepidopterous Insects in the Collection of the British Museum</em></a> <strong>35</strong>: 1534-2040<!--MARK--> [incl. Summary and Index to parts 31-35]","incl. Summary and Index to parts 31-35","Article in Journal","56a82836-2f3e-4d80-9768-9feacf9e0642","20081009T05:11:37.000+0000","642c8f2c-b31c-4c9f-9ca3-4c940f907155"
