"PUB_AUTHOR","PUB_YEAR","PUB_TITLE","PUB_PAGES","PUB_PARENT_BOOK_TITLE","PUB_PARENT_JOURNAL_TITLE","PUB_PARENT_ARTICLE_TITLE","PUB_PUBLICATION_DATE","PUB_PUBLISHER","PUB_FORMATTED","PUB_QUALIFICATION","PUB_TYPE","PUBLICATION_GUID","PUBLICATION_LAST_UPDATE","PARENT_PUBLICATION_GUID"
"Sainsbury, K.J., Kailola, P.J. & Leyland, G.G.","1984","Continental Shelf Fishes of Northern and North-Western Australia","375 pp. figs & pls","","","","","Fisheries Information Service","<!--MARK--><a href='null1f034040-9224-47e1-9e29-3d0ab0a470c2' class='mouseoverHref'>Sainsbury, K.J., Kailola, P.J. & Leyland, G.G. 1984. <em>Continental Shelf Fishes of Northern and North-Western Australia</em>. Canberra : Fisheries Information Service 375 pp. figs & pls.</a><!--MARK-->","","Book","1f034040-9224-47e1-9e29-3d0ab0a470c2","20160707T23:43:18.376+0000",""
"Seafood Services Australia","2008","Australian Fish Names Standard","","","","","","","<!--MARK--><a href='null4be1ce0c-a18a-4795-a6c0-b9ecb91bb936' class='mouseoverHref'>Seafood Services Australia 2008. Australian Fish Names Standard. http://www.fishnames.com.au/.</a>","","Miscellaneous","4be1ce0c-a18a-4795-a6c0-b9ecb91bb936","20081009T05:11:37.000+0000",""
"Taylor, W.R.","1964","Fishes of Arnhem Land","44-307 figs 1-68","","Records of the American-Australian Scientific Expedition to Arnhem Land","","","","<!--MARK--><a href='null88b0a780-a2be-4138-bad3-c9d291fa8da1' class='mouseoverHref'>Taylor, W.R. 1964. Fishes of Arnhem Land.</a> <!--MARK--><!--MARK--><a href='null43c7a85e-99c4-43bb-b7ec-f485bc987922' class='mouseoverHref'><em>Records of the American-Australian Scientific Expedition to Arnhem Land</em></a> <strong>4</strong>: 44-307 figs 1-68<!--MARK-->","","Article in Journal","88b0a780-a2be-4138-bad3-c9d291fa8da1","20081009T05:11:37.000+0000","43c7a85e-99c4-43bb-b7ec-f485bc987922"
"Whitley, G.P.","1930","Ichthyological miscellanea","8-31 fig. 1 pl. 1","","Memoirs of the Queensland Museum","","","","<!--MARK--><a href='null8b7e9a76-d367-449b-8a4e-a56069031729' class='mouseoverHref'>Whitley, G.P. 1930. Ichthyological miscellanea.</a> <!--MARK--><!--MARK--><a href='null1a0a2982-9f30-43e1-a641-b0379699837c' class='mouseoverHref'><em>Memoirs of the Queensland Museum</em></a> <strong>10</strong>(1): 8-31 fig. 1 pl. 1<!--MARK-->","","Article in Journal","8b7e9a76-d367-449b-8a4e-a56069031729","20081009T05:11:37.000+0000","1a0a2982-9f30-43e1-a641-b0379699837c"
"Whitley, G.P.","1964","A survey of Australian Ichthyology","11-127","","Proceedings of the Linnean Society of New South Wales","","","","<!--MARK--><a href='nullf3980983-16bf-4fca-b2ea-83255a9ca6e2' class='mouseoverHref'>Whitley, G.P. 1964. A survey of Australian Ichthyology.</a> <!--MARK--><!--MARK--><a href='nullc12cd779-adb5-41ea-bd2c-75f6864cf22e' class='mouseoverHref'><em>Proceedings of the Linnean Society of New South Wales</em></a> <strong>89</strong>(1): 11-127<!--MARK-->","","Article in Journal","f3980983-16bf-4fca-b2ea-83255a9ca6e2","20081009T05:11:37.000+0000","c12cd779-adb5-41ea-bd2c-75f6864cf22e"
"Yearsley, G.K., Last, P.R. & Morris, G.B.","1997","Codes for Australian Aquatic Biota (CAAB): an upgraded and expanded species coding system for Australian fisheries databases","15 pp. + appendices","","","","","","<!--MARK--><a href='nulld0a1bd97-d100-402f-a9a7-22eeba8e3f36' class='mouseoverHref'>Yearsley, G.K., Last, P.R. & Morris, G.B. 1997. Codes for Australian Aquatic Biota (CAAB): an upgraded and expanded species coding system for Australian fisheries databases. CSIRO Marine Laboratories Report No. 224. 15 pp. + appendices</a>","","Miscellaneous","d0a1bd97-d100-402f-a9a7-22eeba8e3f36","20081009T05:11:37.000+0000",""
"Yearsley, G.K., Last, P.R. & Ward, R.D. (eds)","1999","Australian Seafood Handbook","460 pp.","","","","","CSIRO Marine Research","<!--MARK--><a href='null7aba7d26-f58b-44a0-9a6e-288ca449690a' class='mouseoverHref'>Yearsley, G.K., Last, P.R. & Ward, R.D. (eds) 1999. <em>Australian Seafood Handbook</em>. Hobart : CSIRO Marine Research 460 pp.</a><!--MARK-->","","Book","7aba7d26-f58b-44a0-9a6e-288ca449690a","20081009T05:11:37.000+0000",""
