"PUB_AUTHOR","PUB_YEAR","PUB_TITLE","PUB_PAGES","PUB_PARENT_BOOK_TITLE","PUB_PARENT_JOURNAL_TITLE","PUB_PARENT_ARTICLE_TITLE","PUB_PUBLICATION_DATE","PUB_PUBLISHER","PUB_FORMATTED","PUB_QUALIFICATION","PUB_TYPE","PUBLICATION_GUID","PUBLICATION_LAST_UPDATE","PARENT_PUBLICATION_GUID"
"Brown, W.L. jr","1948","A preliminary generic revision of the higher Dacetini (Hymenoptera: Formicidae)","101-129","","Transactions of the American Entomological Society","","","","<!--MARK--><a href='../../../../publication/63aacb4c-ddd8-41ae-9a38-4d99068ab5db' class='mouseoverHref'>Brown, W.L. jr 1948. A preliminary generic revision of the higher Dacetini (Hymenoptera: Formicidae).</a> <!--MARK--><!--MARK--><a href='../../../../publication/ab463570-432f-4c53-bc7c-2254ed8f75b1' class='mouseoverHref'><em>Transactions of the American Entomological Society</em></a> <strong>74</strong>: 101-129<!--MARK--> [27 July 1948]","27 July 1948","Article in Journal","63aacb4c-ddd8-41ae-9a38-4d99068ab5db","20081009T05:11:37.000+0000","ab463570-432f-4c53-bc7c-2254ed8f75b1"
"Brown, W.L. jr","1973","A comparison of the Hylean and Congo-West African rain forest ant faunas. pp. 161-185 <i>in</i> Meggers, B.J., Ayensu, E.S. & Duckworth, W.D. (eds) <i>Tropical forest ecosystems in Africa and South America: a comparative review.</i> Washington : Smithsonian Institution Press","","","","","","","<!--MARK--><a href='../../../../publication/4532561f-402c-48e7-a6ee-c757dab82a0c' class='mouseoverHref'>Brown, W.L. jr 1973. A comparison of the Hylean and Congo-West African rain forest ant faunas. pp. 161-185 <i>in</i> Meggers, B.J., Ayensu, E.S. & Duckworth, W.D. (eds) <i>Tropical forest ecosystems in Africa and South America: a comparative review.</i> Washington : Smithsonian Institution Press.</a>","","Miscellaneous","4532561f-402c-48e7-a6ee-c757dab82a0c","20081009T05:11:37.000+0000",""
"Forel, A.","1895","Nouvelles fourmis d'Australie, récoltée à The Ridge, Mackay, Queensland par M. Gilbert Turner","417-428","","Annales de la Société Entomologique de Belgique (Comptes-rendus)","","","","<!--MARK--><a href='../../../../publication/9c0e99b7-8d18-4c87-9cd0-57b34e688e09' class='mouseoverHref'>Forel, A. 1895. Nouvelles fourmis d'Australie, récoltée à The Ridge, Mackay, Queensland par M. Gilbert Turner.</a> <!--MARK--><!--MARK--><a href='../../../../publication/acc7fcdb-707a-4cbe-8f70-d7595ac25c58' class='mouseoverHref'><em>Annales de la Société Entomologique de Belgique (Comptes-rendus)</em></a> <strong>39</strong>: 417-428<!--MARK-->","","Article in Journal","9c0e99b7-8d18-4c87-9cd0-57b34e688e09","20081009T05:11:37.000+0000","acc7fcdb-707a-4cbe-8f70-d7595ac25c58"
"Forel, A.","1910","Formicides australiens reçus de M. M. Froggatt et Rowland Turner","1-94","","Revue Suisse de Zoologie","","","","<!--MARK--><a href='../../../../publication/001b5384-1ce0-4e72-b79a-151ab261df31' class='mouseoverHref'>Forel, A. 1910. Formicides australiens reçus de M. M. Froggatt et Rowland Turner.</a> <!--MARK--><!--MARK--><a href='../../../../publication/dd4d5125-6d92-411c-86c0-7181702e62a5' class='mouseoverHref'><em>Revue Suisse de Zoologie</em></a> <strong>18</strong>: 1-94<!--MARK-->","","Article in Journal","001b5384-1ce0-4e72-b79a-151ab261df31","20081009T05:11:37.000+0000","dd4d5125-6d92-411c-86c0-7181702e62a5"
"Shattuck, S.O.","2000","The epopostrumiform genus group","30-67","","Memoirs of the American Entomological Institute","","","","<!--MARK--><a href='../../../../publication/aaa04aa9-55a8-4524-a294-59cc356a98e5' class='mouseoverHref'>Shattuck, S.O. 2000. The epopostrumiform genus group.</a> <!--MARK--><!--MARK--><a href='../../../../publication/68c5f11e-7ef5-44e0-8361-2a9052a673b6' class='mouseoverHref'><em>Memoirs of the American Entomological Institute</em></a> <strong>65</strong>: 30-67<!--MARK-->","","Article in Journal","aaa04aa9-55a8-4524-a294-59cc356a98e5","20110113T03:11:49.872+0000","68c5f11e-7ef5-44e0-8361-2a9052a673b6"
"Shattuck, S.O.","2007","New species of Myrmicine ants from Western Australia (Hymenoptera: Formicidae)","47-53","","Zootaxa","","","","<!--MARK--><a href='../../../../publication/a17b0bf9-1e60-4f48-9b42-1783e5a7fdd3' class='mouseoverHref'>Shattuck, S.O. 2007. New species of Myrmicine ants from Western Australia (Hymenoptera: Formicidae).</a> <!--MARK--><!--MARK--><a href='../../../../publication/96466227-221c-4922-ac97-1ac2dd946d0a' class='mouseoverHref'><em>Zootaxa</em></a> <strong>1661</strong>: 47-53<!--MARK-->","","Article in Journal","a17b0bf9-1e60-4f48-9b42-1783e5a7fdd3","20110113T04:16:22.198+0000","96466227-221c-4922-ac97-1ac2dd946d0a"
"Taylor, R.W.","1991","Nomenclature and ditribution of some Australasian ants of the Myrmicinae (Hymenoptera: Formicidae)","599-614","","Memoirs of the Queensland Museum","","","","<!--MARK--><a href='../../../../publication/fb787cbc-f7b8-4de5-8e4c-20e02b3f3f69' class='mouseoverHref'>Taylor, R.W. 1991. Nomenclature and ditribution of some Australasian ants of the Myrmicinae (Hymenoptera: Formicidae).</a> <!--MARK--><!--MARK--><a href='../../../../publication/1a0a2982-9f30-43e1-a641-b0379699837c' class='mouseoverHref'><em>Memoirs of the Queensland Museum</em></a> <strong>30</strong>: 599-614<!--MARK-->","","Article in Journal","fb787cbc-f7b8-4de5-8e4c-20e02b3f3f69","20081009T05:11:37.000+0000","1a0a2982-9f30-43e1-a641-b0379699837c"
"Viehmeyer, H.","1925","Formiciden der australischen Faunenregion","25-39","","Entomologische Mitteilungen. Berlin-Dahlem","","","","<!--MARK--><a href='../../../../publication/54a0ffd9-d1cd-4ca2-8055-f007cf34498f' class='mouseoverHref'>Viehmeyer, H. 1925. Formiciden der australischen Faunenregion.</a> <!--MARK--><!--MARK--><a href='../../../../publication/ac06ba2d-be9d-4dfe-91bb-bb21ae357dec' class='mouseoverHref'><em>Entomologische Mitteilungen. Berlin-Dahlem</em></a> <strong>14</strong>: 25-39<!--MARK-->","","Article in Journal","54a0ffd9-d1cd-4ca2-8055-f007cf34498f","20081009T05:11:37.000+0000","ac06ba2d-be9d-4dfe-91bb-bb21ae357dec"
