"PUB_AUTHOR","PUB_YEAR","PUB_TITLE","PUB_PAGES","PUB_PARENT_BOOK_TITLE","PUB_PARENT_JOURNAL_TITLE","PUB_PARENT_ARTICLE_TITLE","PUB_PUBLICATION_DATE","PUB_PUBLISHER","PUB_FORMATTED","PUB_QUALIFICATION","PUB_TYPE","PUBLICATION_GUID","PUBLICATION_LAST_UPDATE","PARENT_PUBLICATION_GUID"
"Berio, E.","1992","Ricerca di possibli modelli sistematici per le Catocalinae e Ophiderinae del globo","287-303","","Memorie della Società Entomologica Italiana. Genova","","","","<!--MARK--><a href='nullf449d5a0-b673-46dc-aeca-8ca7f6bf5557' class='mouseoverHref'>Berio, E. 1992. Ricerca di possibli modelli sistematici per le Catocalinae e Ophiderinae del globo.</a> <!--MARK--><!--MARK--><a href='null2b4020b8-372e-4058-b982-84e9d80d225f' class='mouseoverHref'><em>Memorie della Società Entomologica Italiana. Genova</em></a> <strong>70</strong>: 287-303<!--MARK-->","","Article in Journal","f449d5a0-b673-46dc-aeca-8ca7f6bf5557","20170707T07:16:39.804+0000","2b4020b8-372e-4058-b982-84e9d80d225f"
"Bethune-Baker, G.T.","1906","New Noctuidae from British New Guinea","191-287","","Novitates Zoologicae","","","","<!--MARK--><a href='nulle05a2fa4-1bea-4fae-ba7e-c23414dce685' class='mouseoverHref'>Bethune-Baker, G.T. 1906. New Noctuidae from British New Guinea.</a> <!--MARK--><!--MARK--><a href='null25791c0c-6650-411b-b9d3-6433789fce38' class='mouseoverHref'><em>Novitates Zoologicae</em></a> <strong>13</strong>: 191-287<!--MARK-->","","Article in Journal","e05a2fa4-1bea-4fae-ba7e-c23414dce685","20081009T05:11:37.000+0000","25791c0c-6650-411b-b9d3-6433789fce38"
"Butler, A.G.","1874","Revision of the homopterous genera <i>Cosmoscarta</i> and <i>Phymatostetha</i>, with descriptions of new species","245-270","","Cistula Entomologica","","","","<!--MARK--><a href='null31405a79-2efe-4bae-90ed-3633767abfac' class='mouseoverHref'>Butler, A.G. 1874. Revision of the homopterous genera <i>Cosmoscarta</i> and <i>Phymatostetha</i>, with descriptions of new species.</a> <!--MARK--><!--MARK--><a href='null6d769ad4-3958-459c-9047-dfb75cc3158f' class='mouseoverHref'><em>Cistula Entomologica</em></a> <strong>1</strong>: 245-270<!--MARK-->","","Article in Journal","31405a79-2efe-4bae-90ed-3633767abfac","20120417T04:35:31.145+0000","6d769ad4-3958-459c-9047-dfb75cc3158f"
"Edwards, E.D.","1996","Noctuidae","pp. 291-333","Checklist of the Lepidoptera of Australia. Monographs on Australian Lepidoptera","","","","","<!--MARK--><a href='null151b1997-8938-456b-9fe9-7403c0414ff6' class='mouseoverHref'>Edwards, E.D. 1996. Noctuidae. pp. 291-333</a> <!--MARK--><em>in</em> <!--MARK--><a href='null378b3781-ecbb-4844-8fe3-625daadd926d' class='mouseoverHref'>Nielsen, E.S., Edwards, E.D. & Rangsi, T.V. (eds). <em>Checklist of the Lepidoptera of Australia. Monographs on Australian Lepidoptera</em>. Collingwood : CSIRO Publishing Vol. 4 xiv 529 pp. & CD-ROM.</a><!--MARK-->","","Chapter in Book","151b1997-8938-456b-9fe9-7403c0414ff6","20110927T02:08:13.890+0000","378b3781-ecbb-4844-8fe3-625daadd926d"
"Lucas, T.P.","1894","Descriptions of new Australian Lepidoptera, with additional localities for known species","133-166","","Proceedings of the Linnean Society of New South Wales","","","","<!--MARK--><a href='nulldc9d861b-ed6f-4abc-91af-9e91d5fa8a02' class='mouseoverHref'>Lucas, T.P. 1894. Descriptions of new Australian Lepidoptera, with additional localities for known species.</a> <!--MARK--><!--MARK--><a href='nullc12cd779-adb5-41ea-bd2c-75f6864cf22e' class='mouseoverHref'><em>Proceedings of the Linnean Society of New South Wales</em></a> 2 <strong>8</strong>: 133-166<!--MARK-->","","Article in Journal","dc9d861b-ed6f-4abc-91af-9e91d5fa8a02","20120110T02:15:17.998+0000","c12cd779-adb5-41ea-bd2c-75f6864cf22e"
"Walker, F.","1858","Noctuidae","983-1236","","List of the Specimens of Lepidopterous Insects in the Collection of the British Museum","","9 Jan. 1858","","<!--MARK--><a href='nulld43374b5-6957-407e-8275-df5be3a9ec6d' class='mouseoverHref'>Walker, F. 1858. Noctuidae.</a> <!--MARK--><!--MARK--><a href='null642c8f2c-b31c-4c9f-9ca3-4c940f907155' class='mouseoverHref'><em>List of the Specimens of Lepidopterous Insects in the Collection of the British Museum</em></a> <strong>13</strong>: 983-1236<!--MARK--> [Date published 9 Jan. 1858]","","Article in Journal","d43374b5-6957-407e-8275-df5be3a9ec6d","20111122T05:59:45.147+0000","642c8f2c-b31c-4c9f-9ca3-4c940f907155"
