"PUB_AUTHOR","PUB_YEAR","PUB_TITLE","PUB_PAGES","PUB_PARENT_BOOK_TITLE","PUB_PARENT_JOURNAL_TITLE","PUB_PARENT_ARTICLE_TITLE","PUB_PUBLICATION_DATE","PUB_PUBLISHER","PUB_FORMATTED","PUB_QUALIFICATION","PUB_TYPE","PUBLICATION_GUID","PUBLICATION_LAST_UPDATE","PARENT_PUBLICATION_GUID"
"Boisduval, J.-A. & Guenée, A. (eds)","1852","Histoire Naturelle des Insectes. Species Général des Lépidoptères","442 pp., 24 pls","","","","","Librarie Encyclopédique de Roret","<!--MARK--><a href='null8df48d76-7d1d-41f2-8b56-6d107c44c9cb' class='mouseoverHref'>Boisduval, J.-A. & Guenée, A. (eds) 1852. <em>Histoire Naturelle des Insectes. Species Général des Lépidoptères</em>. Paris : Librarie Encyclopédique de Roret Vol. 7 442 pp., 24 pls.</a><!--MARK-->","","Book","8df48d76-7d1d-41f2-8b56-6d107c44c9cb","20081009T05:11:37.000+0000",""
"Boisduval, J.-A. & Guenée, A. (eds)","1852","Noctuélites III","442 pp., 24 pls","","","","","Librarie Encyclopédique de Roret","<!--MARK--><a href='null890e1f64-f28e-4b55-bc9e-3e8815cf7141' class='mouseoverHref'>Boisduval, J.-A. & Guenée, A. (eds) 1852. <em>Noctuélites III</em>. Paris : Librarie Encyclopédique de Roret Vol. 7 442 pp., 24 pls.</a><!--MARK-->","","Book","890e1f64-f28e-4b55-bc9e-3e8815cf7141","20120110T02:08:47.409+0000",""
"Butler, A.G.","1876","On a small collection of Lepidoptera from Cape York and the south-east coast of New Guinea","122-128","","Annals and Magazine of Natural History","","","","<!--MARK--><a href='nulldff84a1f-bc8a-482b-840a-4e4dcd9c1a69' class='mouseoverHref'>Butler, A.G. 1876. On a small collection of Lepidoptera from Cape York and the south-east coast of New Guinea.</a> <!--MARK--><!--MARK--><a href='nullefa8de69-3a29-4a43-8ef2-cbefda205976' class='mouseoverHref'><em>Annals and Magazine of Natural History</em></a> 4 <strong>18</strong>(104): 122-128<!--MARK-->","","Article in Journal","dff84a1f-bc8a-482b-840a-4e4dcd9c1a69","","efa8de69-3a29-4a43-8ef2-cbefda205976"
"Edwards, E.D.","1996","Noctuidae","pp. 291-333","Checklist of the Lepidoptera of Australia. Monographs on Australian Lepidoptera","","","","","<!--MARK--><a href='null151b1997-8938-456b-9fe9-7403c0414ff6' class='mouseoverHref'>Edwards, E.D. 1996. Noctuidae. pp. 291-333</a> <!--MARK--><em>in</em> <!--MARK--><a href='null378b3781-ecbb-4844-8fe3-625daadd926d' class='mouseoverHref'>Nielsen, E.S., Edwards, E.D. & Rangsi, T.V. (eds). <em>Checklist of the Lepidoptera of Australia. Monographs on Australian Lepidoptera</em>. Collingwood : CSIRO Publishing Vol. 4 xiv 529 pp. & CD-ROM.</a><!--MARK-->","","Chapter in Book","151b1997-8938-456b-9fe9-7403c0414ff6","20110927T02:08:13.890+0000","378b3781-ecbb-4844-8fe3-625daadd926d"
"Fletcher, D.S.","1957","Macroheterocera of Rennell Island","31-66, [1-13], 90 figs","","Natural History of Rennell Island, British Solomon Islands","","","","<!--MARK--><a href='null07317bfb-a215-460d-ae9e-1eec2e5e004e' class='mouseoverHref'>Fletcher, D.S. 1957. Macroheterocera of Rennell Island.</a> <!--MARK--><!--MARK--><a href='null417d6d28-ca57-44be-b6ab-2c81c06a65be' class='mouseoverHref'><em>Natural History of Rennell Island, British Solomon Islands</em></a> <strong>2</strong>: 31-66, [1-13], 90 figs<!--MARK-->","","Article in Journal","07317bfb-a215-460d-ae9e-1eec2e5e004e","","417d6d28-ca57-44be-b6ab-2c81c06a65be"
"Gaede, M.","1938","Catocalinae","454-488, pls 44-56","The Macrolepidoptera of the World. The Macrolepidoptera of the Indo-Australian Fauna. <B><i>11</B></i>. Noctuiform Phalaenae","","","","","<!--MARK--><a href='nullbd461f7b-13a8-4d27-9e19-0d08a023af28' class='mouseoverHref'>Gaede, M. 1938. Catocalinae. 454-488, pls 44-56</a> <!--MARK--><em>in</em> <!--MARK--><a href='null34d55de2-3bae-44b9-9ab1-eb2acd0a2da8' class='mouseoverHref'>Seitz, A. (ed.). <em>The Macrolepidoptera of the World. The Macrolepidoptera of the Indo-Australian Fauna. <B><i>11</B></i>. Noctuiform Phalaenae</em>. Stuttgart : Alfred Kernen Verlag.</a><!--MARK-->","","Chapter in Book","bd461f7b-13a8-4d27-9e19-0d08a023af28","","34d55de2-3bae-44b9-9ab1-eb2acd0a2da8"
"Latreille, P.A.","1810","Considération Générales sur l'Order Naturel des Animaux Composant les Classes des Crustacés, des Arachnides et des Insectes; avec un Tableau Méthodique de leurs Genres Disposés en Familles","viii 444 pp.","","","","","F. Schoell","<!--MARK--><a href='null2b7a6bd1-c5fe-4092-b9b8-4f60cc2aad90' class='mouseoverHref'>Latreille, P.A. 1810. <em>Considération Générales sur l'Order Naturel des Animaux Composant les Classes des Crustacés, des Arachnides et des Insectes; avec un Tableau Méthodique de leurs Genres Disposés en Familles</em>. Paris : F. Schoell viii 444 pp.</a><!--MARK--> [this work is the subject of Opinions 11 and 136, ICZN, and is on the Official List of Works approved as available for Zoological Nomenclature]","this work is the subject of Opinions 11 and 136, ICZN, and is on the Official List of Works approved as available for Zoological Nomenclature","Book","2b7a6bd1-c5fe-4092-b9b8-4f60cc2aad90","20150820T01:56:15.991+0000",""
"Linnaeus, C.","1758","Systema naturae per regna tria naturae, secundem classes, ordines, genera, species, cum characteribus, differentis, synonymis, locis. Editio decima, reformata","824","","","","","Laurentii Salvii","<!--MARK--><a href='null95f7aebe-acdc-4241-a7a8-403bf099042e' class='mouseoverHref'>Linnaeus, C. 1758. <em>Systema naturae per regna tria naturae, secundem classes, ordines, genera, species, cum characteribus, differentis, synonymis, locis. Editio decima, reformata</em>. Holmiae : Laurentii Salvii Tomus I 824 pp.</a><!--MARK-->","","Book","95f7aebe-acdc-4241-a7a8-403bf099042e","20171116T23:58:37.127+0000",""
"Snellen, P.C.T.","1880","Lepidoptera van Celebes verzameld door Mr. M.C. Piepers, met aanteekeningen en beschrijving der nieuwe soorten","42-138, 5 pls","","Tijdschrift voor Entomologie","","","","<!--MARK--><a href='nullb67d52f4-971e-40b5-b0ef-e820cced6610' class='mouseoverHref'>Snellen, P.C.T. 1880. Lepidoptera van Celebes verzameld door Mr. M.C. Piepers, met aanteekeningen en beschrijving der nieuwe soorten.</a> <!--MARK--><!--MARK--><a href='null6b0f0fc0-01fc-4ed4-aae0-c8b621477f01' class='mouseoverHref'><em>Tijdschrift voor Entomologie</em></a> <strong>23</strong>: 42-138, 5 pls<!--MARK-->","","Article in Journal","b67d52f4-971e-40b5-b0ef-e820cced6610","20081009T05:11:37.000+0000","6b0f0fc0-01fc-4ed4-aae0-c8b621477f01"
"Walker, F.","1865","Supplement 3","707-1120","","List of the Specimens of Lepidopterous Insects in the Collection of the British Museum","","","","<!--MARK--><a href='nulla5f0020f-8e3c-4f67-b6a2-928b94a0ac94' class='mouseoverHref'>Walker, F. 1865. Supplement 3.</a> <!--MARK--><!--MARK--><a href='null642c8f2c-b31c-4c9f-9ca3-4c940f907155' class='mouseoverHref'><em>List of the Specimens of Lepidopterous Insects in the Collection of the British Museum</em></a> <strong>33</strong>: 707-1120<!--MARK-->","","Article in Journal","a5f0020f-8e3c-4f67-b6a2-928b94a0ac94","","642c8f2c-b31c-4c9f-9ca3-4c940f907155"
"Zahiri, R., Holloway, J.D., Kitching, I.J., Lafontaine, J.D., Mutanen, M. & Wahlberg, N.","2012","Molecular phylogenetics of Erebidae (Lepidoptera, Noctuoidea).","102-124","","Systematic Entomology","","online 31 Oct 2011","","<!--MARK--><a href='null28ea4fa1-dbde-41e6-9b0b-06b7d1c03fde' class='mouseoverHref'>Zahiri, R., Holloway, J.D., Kitching, I.J., Lafontaine, J.D., Mutanen, M. & Wahlberg, N. 2012. Molecular phylogenetics of Erebidae (Lepidoptera, Noctuoidea).</a> <!--MARK--><!--MARK--><a href='null129a4a7d-1c4c-4650-87ea-27d58ad726d5' class='mouseoverHref'><em>Systematic Entomology</em></a> <strong>37</strong>(1): 102-124<!--MARK--> [Date published online 31 Oct 2011]","","Article in Journal","28ea4fa1-dbde-41e6-9b0b-06b7d1c03fde","20170518T05:44:26.440+0000","129a4a7d-1c4c-4650-87ea-27d58ad726d5"
