"PUB_AUTHOR","PUB_YEAR","PUB_TITLE","PUB_PAGES","PUB_PARENT_BOOK_TITLE","PUB_PARENT_JOURNAL_TITLE","PUB_PARENT_ARTICLE_TITLE","PUB_PUBLICATION_DATE","PUB_PUBLISHER","PUB_FORMATTED","PUB_QUALIFICATION","PUB_TYPE","PUBLICATION_GUID","PUBLICATION_LAST_UPDATE","PARENT_PUBLICATION_GUID"
"Curtiss, A.","1938","A Short Zoology of Tahiti in the Society Islands","i-xvi, 193 pp.","","","","","Self-published","<!--MARK--><a href='nullb64c4c2f-4562-4419-a674-4e97b6d9e462' class='mouseoverHref'>Curtiss, A. 1938. <em>A Short Zoology of Tahiti in the Society Islands</em>. New York : Self-published i-xvi, 193 pp.</a><!--MARK-->","","Book","b64c4c2f-4562-4419-a674-4e97b6d9e462","20100201T01:43:07.529+0000",""
"Dana, J.D.","1852","Conspectus Crustaceorum, etc. Conspectus of the Crustacea of the Exploring Expedition under Capt Wilkes, U.S.N., including the Crustacea Cancroidea Corystoidea","73-86","","Proceedings of the Academy of Natural Sciences, Philadelphia","","","","<!--MARK--><a href='nulle2ab1edb-28e9-4594-95a9-5151919c0c4e' class='mouseoverHref'>Dana, J.D. 1852. Conspectus Crustaceorum, etc. Conspectus of the Crustacea of the Exploring Expedition under Capt Wilkes, U.S.N., including the Crustacea Cancroidea Corystoidea.</a> <!--MARK--><!--MARK--><a href='null9dfe7fba-63cc-4968-b0be-a8904006864b' class='mouseoverHref'><em>Proceedings of the Academy of Natural Sciences, Philadelphia</em></a> <strong>6</strong>: 73-86<!--MARK-->","","Article in Journal","e2ab1edb-28e9-4594-95a9-5151919c0c4e","20081009T05:11:37.000+0000","9dfe7fba-63cc-4968-b0be-a8904006864b"
"Davie, P.","2002","Crustacea: Malacostraca: Eucarida (Part 2): Decapoda--Anomura, Brachyura","","","","","","","<!--MARK--><a href='nulld47384d3-27be-4ade-967c-8b828620536a' class='mouseoverHref'>Davie, P. 2002. Crustacea: Malacostraca: Eucarida (Part 2): Decapoda--Anomura, Brachyura. <I>In</I> Wells, A. & Houston, W.W.K. (eds) <I>Zoological Catalogue of Australia</I>. Vol. 19.3B. Melbourne : CSIRO Publishing, Australia xiv 641 pp.</a>","","Miscellaneous","d47384d3-27be-4ade-967c-8b828620536a","20110104T22:17:37.193+0000",""
"Guérin-Méneville, F.É.","1829","Iconographie du règne animal de G. Cuvier, ou représentation d'après nature de l'une des espèces les plus remarquables, et souvent non figurées, de chaque genre d'animaux, avec un text descriptif mis au courant de la science. Ouvrage pouvant servir d'atlas à tous les traitès de zoologie","450 plates in 45 livraisons. Crustacea: 36 pls, 48 pp.","","","","","J.B. Baillière","<!--MARK--><a href='null3ab4183d-2355-498c-9b0c-16d0aac938d9' class='mouseoverHref'>Guérin-Méneville, F.É. 1829. <em>Iconographie du règne animal de G. Cuvier, ou représentation d'après nature de l'une des espèces les plus remarquables, et souvent non figurées, de chaque genre d'animaux, avec un text descriptif mis au courant de la science. Ouvrage pouvant servir d'atlas à tous les traitès de zoologie</em>. Paris : J.B. Baillière 450 plates in 45 livraisons. Crustacea: 36 pls, 48 pp.</a><!--MARK-->","","Book","3ab4183d-2355-498c-9b0c-16d0aac938d9","20100210T23:52:41.420+0000",""
"Hess, W.","1865","Beiträge zur Kenntniss der Decapoden-Krebse Ost-Australiens","127-173 pls 6-7","","Archiv für Naturgeschichte","","","","<!--MARK--><a href='nulldb134e98-4688-4d64-b7f2-2303e0b04105' class='mouseoverHref'>Hess, W. 1865. Beiträge zur Kenntniss der Decapoden-Krebse Ost-Australiens.</a> <!--MARK--><!--MARK--><a href='nullf5b5f7c7-fc53-4502-951d-1c96b680d874' class='mouseoverHref'><em>Archiv für Naturgeschichte</em></a> <strong>31</strong>: 127-173 pls 6-7<!--MARK-->","","Article in Journal","db134e98-4688-4d64-b7f2-2303e0b04105","20081009T05:11:37.000+0000","f5b5f7c7-fc53-4502-951d-1c96b680d874"
"Latreille, P.A.","1817","<i>Nouveau dictionnaire d'histoire naturelle</i>, appliquée aux arts, à l'agriculture, à l'economie rurale et domestique, à la médecine, etc","404","","","","","","<!--MARK--><a href='null3419a82e-f7d3-4c73-962a-cd39b883529a' class='mouseoverHref'>Latreille, P.A. 1817. <i>Nouveau dictionnaire d'histoire naturelle</i>, appliquée aux arts, à l'agriculture, à l'economie rurale et domestique, à la médecine, etc. Vol. 10. 404 pp.</a>","","Miscellaneous","3419a82e-f7d3-4c73-962a-cd39b883529a","20081009T05:11:37.000+0000",""
"Latreille, P.A.","1818","Crustacés","1-39 pls 268-397","","","","","","<!--MARK--><a href='null26850269-0ca0-4ad4-810a-3b9dbdd55f45' class='mouseoverHref'>Latreille, P.A. 1818. Crustacés. <I>In, Crustacés, Arachnides et Insectes. Atlas. Tableau encyclopédique et méthodique des trois régnes de la nature</I>. 1-39 pls 268-397</a>","","Miscellaneous","26850269-0ca0-4ad4-810a-3b9dbdd55f45","20081009T05:11:37.000+0000",""
"MacLeay, W.S.","1838","On the Brachyurous Decapod Crustacea brought from the Cape by Dr Smith","75 pp. 4 pls","","","","","","<!--MARK--><a href='null9b64cfc2-6861-4f91-87d2-e4e6ec3634d2' class='mouseoverHref'>MacLeay, W.S. 1838. On the Brachyurous Decapod Crustacea brought from the Cape by Dr Smith. pp. 53-71 pl. 3 <I>in, Illustrations of the Annulosa of South Africa</I>; being a portion of the objects of natural history collected during an expedition into the interior of South Africa, under the direction of Dr Andrew Smith, in the years 1834, 1835, and 1836; fitted out by The Cape of Good Hope Association for Exploring Central Africa. London. 75 pp. 4 pls</a>","","Miscellaneous","9b64cfc2-6861-4f91-87d2-e4e6ec3634d2","20081009T05:11:37.000+0000",""
"Shaw, G. & Nodder, F.P.","1803","Vivarium Naturae, sive rerum naturalium, variae et vividae icones, ad ipsam naturam depictae et descriptae. Crustacea","","","","","","","<!--MARK--><a href='nulleb1841b0-8c3f-41d1-b56e-74fe1f77b3cc' class='mouseoverHref'>Shaw, G. & Nodder, F.P. 1803. Vivarium Naturae, sive rerum naturalium, variae et vividae icones, ad ipsam naturam depictae et descriptae. Crustacea. <I>The Naturalist's Miscellany</I>, or Coloured Figures of Natural Objects, Drawn and Described Immediately from Nature. Vol. 15. London. [unnumbered pages] pls 589-612.</a>","","Miscellaneous","eb1841b0-8c3f-41d1-b56e-74fe1f77b3cc","20081009T05:11:37.000+0000",""
"Stevcic, Z.","2011","Addition to the reclassification of brachyuran crabs (Crustacea: Decapoda: Brachyura). Part I. New taxa.","125-139","","Natura Croatica","","","","<!--MARK--><a href='null4496450b-df87-4bf1-80a2-c365542c0734' class='mouseoverHref'>Stevcic, Z. 2011. Addition to the reclassification of brachyuran crabs (Crustacea: Decapoda: Brachyura). Part I. New taxa.</a> <!--MARK--><!--MARK--><a href='null47342e7c-2a28-4514-bad2-242d95aaa7d0' class='mouseoverHref'><em>Natura Croatica</em></a> <strong>20</strong>(1): 125-139<!--MARK-->","","Article in Journal","4496450b-df87-4bf1-80a2-c365542c0734","20120326T06:31:47.516+0000","47342e7c-2a28-4514-bad2-242d95aaa7d0"
"Ward, M.","1939","The Brachyura of the Second Templeton Crocker-American Museum Expedition to the Pacific Ocean","1-15 figs 1-17","","American Museum Novitates","","","","<!--MARK--><a href='null2617164e-ea5b-4f14-8435-014b26efc72a' class='mouseoverHref'>Ward, M. 1939. The Brachyura of the Second Templeton Crocker-American Museum Expedition to the Pacific Ocean.</a> <!--MARK--><!--MARK--><a href='null6502b0bb-309f-414e-9d7f-4cb7a3619a03' class='mouseoverHref'><em>American Museum Novitates</em></a> <strong>No. 1049</strong>: 1-15 figs 1-17<!--MARK-->","","Article in Journal","2617164e-ea5b-4f14-8435-014b26efc72a","20081009T05:11:37.000+0000","6502b0bb-309f-414e-9d7f-4cb7a3619a03"
