"PUB_AUTHOR","PUB_YEAR","PUB_TITLE","PUB_PAGES","PUB_PARENT_BOOK_TITLE","PUB_PARENT_JOURNAL_TITLE","PUB_PARENT_ARTICLE_TITLE","PUB_PUBLICATION_DATE","PUB_PUBLISHER","PUB_FORMATTED","PUB_QUALIFICATION","PUB_TYPE","PUBLICATION_GUID","PUBLICATION_LAST_UPDATE","PARENT_PUBLICATION_GUID"
"Baly, J.S.","1855","Monograph of the Australian species of <i>Chrysomela</i>, <i>Phyllocaris</i> and allied genera","170-186","","Transactions of the Entomological Society of London","","","","<!--MARK--><a href='null09f5bfb5-93cf-471d-9d1f-3e4043eb950d' class='mouseoverHref'>Baly, J.S. 1855. Monograph of the Australian species of <i>Chrysomela</i>, <i>Phyllocaris</i> and allied genera.</a> <!--MARK--><!--MARK--><a href='null5cf355b3-abc5-451e-9abc-ed3282d7811a' class='mouseoverHref'><em>Transactions of the Entomological Society of London</em></a> <strong>3</strong>(5): 170-186<!--MARK-->","","Article in Journal","09f5bfb5-93cf-471d-9d1f-3e4043eb950d","20120321T00:21:09.388+0000","5cf355b3-abc5-451e-9abc-ed3282d7811a"
"Blackburn, T.","1889","Notes on Australian Coleoptera with descriptions of new species. Part III","445-482","","Proceedings of the Linnean Society of New South Wales","","20/Sept/1889","","<!--MARK--><a href='null55db7602-b387-4cec-a29e-85c5b5345f29' class='mouseoverHref'>Blackburn, T. 1889. Notes on Australian Coleoptera with descriptions of new species. Part III.</a> <!--MARK--><!--MARK--><a href='nullc12cd779-adb5-41ea-bd2c-75f6864cf22e' class='mouseoverHref'><em>Proceedings of the Linnean Society of New South Wales</em></a> 2 <strong>4</strong>(2): 445-482<!--MARK--> [Date published 20/Sept/1889]","","Article in Journal","55db7602-b387-4cec-a29e-85c5b5345f29","20081009T05:11:37.000+0000","c12cd779-adb5-41ea-bd2c-75f6864cf22e"
"Blackburn, T.","1893","Notes on Australian Coleoptera, with descriptions of new species, Part XIII","185-208","","Proceedings of the Linnean Society of New South Wales","","","","<!--MARK--><a href='null9c79cd86-0e46-40c7-afde-0641027c52c7' class='mouseoverHref'>Blackburn, T. 1893. Notes on Australian Coleoptera, with descriptions of new species, Part XIII.</a> <!--MARK--><!--MARK--><a href='nullc12cd779-adb5-41ea-bd2c-75f6864cf22e' class='mouseoverHref'><em>Proceedings of the Linnean Society of New South Wales</em></a> 2 <strong>7</strong>: 185-208<!--MARK-->","","Article in Journal","9c79cd86-0e46-40c7-afde-0641027c52c7","20081009T05:11:37.000+0000","c12cd779-adb5-41ea-bd2c-75f6864cf22e"
"Daccordi, M.","2003","New species of Chrysomelinae in the Northern Territory (Coleoptera Chrysomelidae, Chrysomelinae)","pp. 461-502","Results of the Zoological Missions to Australia of the Regional Museum of Natural Sciences of Turin, Italy. I.","","","","","<!--MARK--><a href='null4f47c6ff-701f-4cfa-a3be-d78ed5216380' class='mouseoverHref'>Daccordi, M. 2003. New species of Chrysomelinae in the Northern Territory (Coleoptera Chrysomelidae, Chrysomelinae). pp. 461-502</a> <!--MARK--><em>in</em> <!--MARK--><a href='null69aaad0f-c2ba-451a-8ed2-bf274c04c49c' class='mouseoverHref'>Daccordi, M. & Giachino, P.M. (eds). <em>Results of the Zoological Missions to Australia of the Regional Museum of Natural Sciences of Turin, Italy. I</em>. Monografie del Museo Regionale di Scienze Naturali, Torino, 35, 565 pp.</a><!--MARK-->","","Chapter in Book","4f47c6ff-701f-4cfa-a3be-d78ed5216380","20170323T01:48:20.263+0000","69aaad0f-c2ba-451a-8ed2-bf274c04c49c"
"Daccordi, M.","2005","Notes on some Australian Chrysomelinae (Coleoptera Chrysomelidae)","pp. 615-620","Results of the Zoological Missions to Australia of the Regional Museum of Natural Sciences of Turin, Italy. II.","","","","","<!--MARK--><a href='nulld5afaa33-b30a-4e8a-9e06-7d983a36b2a4' class='mouseoverHref'>Daccordi, M. 2005. Notes on some Australian Chrysomelinae (Coleoptera Chrysomelidae). pp. 615-620</a> <!--MARK--><em>in</em> <!--MARK--><a href='nullc63672bf-42fe-4e56-a695-fa8642e0230f' class='mouseoverHref'>Daccordi, M. & Giachino, P.M. (eds). <em>Results of the Zoological Missions to Australia of the Regional Museum of Natural Sciences of Turin, Italy. II</em>. Monografie del Museo Regionale di Scienze Naturali, Torino, 42, 644 pp.</a><!--MARK-->","","Chapter in Book","d5afaa33-b30a-4e8a-9e06-7d983a36b2a4","20170323T02:46:37.135+0000","c63672bf-42fe-4e56-a695-fa8642e0230f"
"Erichson, W.F.","1842","Beitrag zur Insecten-fauna von Vandiemensland, mit besonderer Berucksichtigung der geographischen Verbreitung der Insecten","83-287, pls 4, 5","","Archiv für Naturgeschichte","","","","<!--MARK--><a href='null2ae5a27f-fd1b-4bb9-b72e-a5997ccf96b3' class='mouseoverHref'>Erichson, W.F. 1842. Beitrag zur Insecten-fauna von Vandiemensland, mit besonderer Berucksichtigung der geographischen Verbreitung der Insecten.</a> <!--MARK--><!--MARK--><a href='nullf5b5f7c7-fc53-4502-951d-1c96b680d874' class='mouseoverHref'><em>Archiv für Naturgeschichte</em></a> <strong>8</strong>(1): 83-287, pls 4, 5<!--MARK-->","","Article in Journal","2ae5a27f-fd1b-4bb9-b72e-a5997ccf96b3","20120514T22:59:43.847+0000","f5b5f7c7-fc53-4502-951d-1c96b680d874"
"Germar, E.F.","1848","Beiträge zur Insektenfauna von Adelaide.","153-247","","Linnaea Entomologica","","","","<!--MARK--><a href='nulla30fc011-fd68-429c-846c-c82e2462c71b' class='mouseoverHref'>Germar, E.F. 1848. Beiträge zur Insektenfauna von Adelaide.</a> <!--MARK--><!--MARK--><a href='null1bd3bf76-d7c0-4a57-98cf-a1c6278fdaac' class='mouseoverHref'><em>Linnaea Entomologica</em></a> <strong>3</strong>: 153-247<!--MARK-->","","Article in Journal","a30fc011-fd68-429c-846c-c82e2462c71b","","1bd3bf76-d7c0-4a57-98cf-a1c6278fdaac"
"Lea, A.M.","1903","Descriptions of some new species of Australian and Tasmanian Chrysomelidae","384-431","","Report of the Australasian Association for the Advancement of Science","","","","<!--MARK--><a href='nullc1c57501-dce9-4cd3-befc-2dcaecaeafdb' class='mouseoverHref'>Lea, A.M. 1903. Descriptions of some new species of Australian and Tasmanian Chrysomelidae.</a> <!--MARK--><!--MARK--><a href='null7bf23c29-01b5-492c-b138-e20197a2a14d' class='mouseoverHref'><em>Report of the Australasian Association for the Advancement of Science</em></a> <strong>9</strong>: 384-431<!--MARK-->","","Article in Journal","c1c57501-dce9-4cd3-befc-2dcaecaeafdb","20081009T05:11:37.000+0000","7bf23c29-01b5-492c-b138-e20197a2a14d"
"Lea, A.M.","1916","Notes on some miscellaneous Coleoptera with descriptions of new species. Part II","272-436","","Transactions of the Royal Society of South Australia","","Dec. 23, 1916","","<!--MARK--><a href='nullf04f160e-3e71-4d09-8eda-694897f58945' class='mouseoverHref'>Lea, A.M. 1916. Notes on some miscellaneous Coleoptera with descriptions of new species. Part II.</a> <!--MARK--><!--MARK--><a href='null8b48b0a3-dd7a-4aea-be0d-10a223710ebc' class='mouseoverHref'><em>Transactions of the Royal Society of South Australia</em></a> <strong>40</strong>: 272-436<!--MARK--> [Date published Dec. 23, 1916]","","Article in Journal","f04f160e-3e71-4d09-8eda-694897f58945","20081009T05:11:37.000+0000","8b48b0a3-dd7a-4aea-be0d-10a223710ebc"
"Lhoste, J.","1934","Étude des Chrysomelinae de la région Australienne","347-362","","Annales de la Société Entomologique de France","","","","<!--MARK--><a href='nullcad72db8-aeba-4463-9156-c2e1fa362b03' class='mouseoverHref'>Lhoste, J. 1934. Étude des Chrysomelinae de la région Australienne.</a> <!--MARK--><!--MARK--><a href='null6462279b-2aaf-46a3-a434-cab7d8a2c33d' class='mouseoverHref'><em>Annales de la Société Entomologique de France</em></a> <strong>103</strong>: 347-362<!--MARK-->","","Article in Journal","cad72db8-aeba-4463-9156-c2e1fa362b03","20081009T05:11:37.000+0000","6462279b-2aaf-46a3-a434-cab7d8a2c33d"
"Reid, C.A.M.","2006","A taxonomic revision of the Australian Chrysomelinae, with a key to the genera (Coleoptera: Chrysomelidae)","1-119","","Zootaxa","","","","<!--MARK--><a href='null1fdb4155-f9b8-4d38-a33c-55d0fbd5c231' class='mouseoverHref'>Reid, C.A.M. 2006. A taxonomic revision of the Australian Chrysomelinae, with a key to the genera (Coleoptera: Chrysomelidae).</a> <!--MARK--><!--MARK--><a href='null96466227-221c-4922-ac97-1ac2dd946d0a' class='mouseoverHref'><em>Zootaxa</em></a> <strong>1292</strong>: 1-119<!--MARK-->","","Article in Journal","1fdb4155-f9b8-4d38-a33c-55d0fbd5c231","20081009T05:11:37.000+0000","96466227-221c-4922-ac97-1ac2dd946d0a"
"Weise, J.","1908","Chrysomelidae und Coccinelidae","1-13","","","","","","<!--MARK--><a href='null5aa6d93f-3b77-421b-951e-3ac86a227021' class='mouseoverHref'>Weise, J. 1908. Chrysomelidae und Coccinelidae. Fauna South Western Australia 2(1). 1-13 pp.</a>","","Miscellaneous","5aa6d93f-3b77-421b-951e-3ac86a227021","20081009T05:11:37.000+0000",""
"Wilson, F.E.","1921","New Australian Coleoptera with notes on some previously described species, Part I","33-41","","Proceedings of the Royal Society of Victoria","","31 October 1921","","<!--MARK--><a href='null52efd944-1718-4017-a0ae-c5cc08b47824' class='mouseoverHref'>Wilson, F.E. 1921. New Australian Coleoptera with notes on some previously described species, Part I.</a> <!--MARK--><!--MARK--><a href='nullce333794-3a02-427f-ba27-346079f1efa0' class='mouseoverHref'><em>Proceedings of the Royal Society of Victoria</em></a> n.s. <strong>34</strong>(1): 33-41<!--MARK--> [Date published 31 October 1921]","","Article in Journal","52efd944-1718-4017-a0ae-c5cc08b47824","20081009T05:11:37.000+0000","ce333794-3a02-427f-ba27-346079f1efa0"
