"PUB_AUTHOR","PUB_YEAR","PUB_TITLE","PUB_PAGES","PUB_PARENT_BOOK_TITLE","PUB_PARENT_JOURNAL_TITLE","PUB_PARENT_ARTICLE_TITLE","PUB_PUBLICATION_DATE","PUB_PUBLISHER","PUB_FORMATTED","PUB_QUALIFICATION","PUB_TYPE","PUBLICATION_GUID","PUBLICATION_LAST_UPDATE","PARENT_PUBLICATION_GUID"
"Bethune-Baker, G.T.","1906","New Noctuidae from British New Guinea","191-287","","Novitates Zoologicae","","","","<!--MARK--><a href='nulle05a2fa4-1bea-4fae-ba7e-c23414dce685' class='mouseoverHref'>Bethune-Baker, G.T. 1906. New Noctuidae from British New Guinea.</a> <!--MARK--><!--MARK--><a href='null25791c0c-6650-411b-b9d3-6433789fce38' class='mouseoverHref'><em>Novitates Zoologicae</em></a> <strong>13</strong>: 191-287<!--MARK-->","","Article in Journal","e05a2fa4-1bea-4fae-ba7e-c23414dce685","20081009T05:11:37.000+0000","25791c0c-6650-411b-b9d3-6433789fce38"
"Boisduval, J.-A. & Guenée, A. (eds)","1852","Histoire Naturelle des Insectes. Species Général des Lépidoptères","442 pp., 24 pls","","","","","Librarie Encyclopédique de Roret","<!--MARK--><a href='null8df48d76-7d1d-41f2-8b56-6d107c44c9cb' class='mouseoverHref'>Boisduval, J.-A. & Guenée, A. (eds) 1852. <em>Histoire Naturelle des Insectes. Species Général des Lépidoptères</em>. Paris : Librarie Encyclopédique de Roret Vol. 7 442 pp., 24 pls.</a><!--MARK-->","","Book","8df48d76-7d1d-41f2-8b56-6d107c44c9cb","20081009T05:11:37.000+0000",""
"Cramer, P.","1780","Uitlandsche Kapellen. [Dutch title] or Papilions exotiques des trois parties du monde l'Asie, l'Afrique et l'Amérique. [French title]","105-176 pp., pls 253-288","","","","","Wild","<!--MARK--><a href='nullf23babdc-a40b-4db5-bacc-5e079bf8db94' class='mouseoverHref'>Cramer, P. 1780. <em>Uitlandsche Kapellen. [Dutch title] or Papilions exotiques des trois parties du monde l'Asie, l'Afrique et l'Amérique. [French title]</em>. Amsterdam Baalde and Utrecht : Wild Vol. 3 (22-24) 105-176 pp., pls 253-288.</a><!--MARK--> [issued 1780, dated 1775-1790; written by Cramer, published posthumously by Stoll]","issued 1780, dated 1775-1790; written by Cramer, published posthumously by Stoll","Book","f23babdc-a40b-4db5-bacc-5e079bf8db94","20100107T05:38:16.103+0000",""
"Donovan, E.","1805","An Epitome of the Natural History of the Insects of New Holland, New Zealand, New Guinea, Otaheite, and other Islands in the Indian, Southern, and Pacific Oceans: including Figures and Descriptions of One Hundred and Fifty-three Species of the more Splendid, Beautiful, and Interesting Insects, hitherto Discovered in those Countries, and which for the most Part have not appeared in the Works of any Preceding Author.","iv + [167] pp. + [41] pls","","","","January","Rivington","<!--MARK--><a href='null2a5de61b-c80e-4b9b-8705-937135fbc75b' class='mouseoverHref'>Donovan, E. 1805. <em>An Epitome of the Natural History of the Insects of New Holland, New Zealand, New Guinea, Otaheite, and other Islands in the Indian, Southern, and Pacific Oceans: including Figures and Descriptions of One Hundred and Fifty-three Species of the more Splendid, Beautiful, and Interesting Insects, hitherto Discovered in those Countries, and which for the most Part have not appeared in the Works of any Preceding Author</em>. London : Rivington iv + [167] pp. + [41] pls.</a><!--MARK--> [Date published January]","","Book","2a5de61b-c80e-4b9b-8705-937135fbc75b","20150408T01:26:08.794+0000",""
"Edwards, E.D.","1996","Noctuidae","pp. 291-333","Checklist of the Lepidoptera of Australia. Monographs on Australian Lepidoptera","","","","","<!--MARK--><a href='null151b1997-8938-456b-9fe9-7403c0414ff6' class='mouseoverHref'>Edwards, E.D. 1996. Noctuidae. pp. 291-333</a> <!--MARK--><em>in</em> <!--MARK--><a href='null378b3781-ecbb-4844-8fe3-625daadd926d' class='mouseoverHref'>Nielsen, E.S., Edwards, E.D. & Rangsi, T.V. (eds). <em>Checklist of the Lepidoptera of Australia. Monographs on Australian Lepidoptera</em>. Collingwood : CSIRO Publishing Vol. 4 xiv 529 pp. & CD-ROM.</a><!--MARK-->","","Chapter in Book","151b1997-8938-456b-9fe9-7403c0414ff6","20110927T02:08:13.890+0000","378b3781-ecbb-4844-8fe3-625daadd926d"
"Fabricius, J.C.","1775","Systema Entomologiae, sistens Insectorum Classes, Ordines, Genera, Species, adiectis Synonymis, Locis, Descriptionibus, Observationibus","xxxii 832 pp.","","","","17 April","Kortii","<!--MARK--><a href='nullda77a1b5-cdfa-4c8b-a4fa-3ba1ead48929' class='mouseoverHref'>Fabricius, J.C. 1775. <em>Systema Entomologiae, sistens Insectorum Classes, Ordines, Genera, Species, adiectis Synonymis, Locis, Descriptionibus, Observationibus</em>. Flensburgi et Lipsiae [= Flensburg & Leipzig] : Kortii xxxii 832 pp.</a><!--MARK--> [Date published 17 April]","","Book","da77a1b5-cdfa-4c8b-a4fa-3ba1ead48929","20110508T01:53:06.371+0000",""
"Hampson, G.F.","1913","Catalogue of the Lepidoptera Phalaenae in the British Museum. Catalogue of the Noctuidae in the Collection of the British Museum","xiii 626 pp., 1 folded page","","","","","British Museum (Natural History)","<!--MARK--><a href='null12bd8edd-dd73-4009-9831-b83d366e6978' class='mouseoverHref'>Hampson, G.F. 1913. <em>Catalogue of the Lepidoptera Phalaenae in the British Museum. Catalogue of the Noctuidae in the Collection of the British Museum</em>. London : British Museum (Natural History) Vol. 12 xiii 626 pp., 1 folded page.</a><!--MARK-->","","Book","12bd8edd-dd73-4009-9831-b83d366e6978","20081009T05:11:37.000+0000",""
"Hübner, J.","1823","<i>Verzeichniss bekannter Schmettlinge</i> [sic]","431 pp.","","","","","","<!--MARK--><a href='null89a95845-ed1f-4ea3-a761-eee20dc7edb6' class='mouseoverHref'>Hübner, J. 1823. <i>Verzeichniss bekannter Schmettlinge</i> [sic]. Augsburg (1816-[1825]). 431 pp.</a>","","Miscellaneous","89a95845-ed1f-4ea3-a761-eee20dc7edb6","20081009T05:11:37.000+0000",""
"Lower, O.B.","1902","Descriptions of new Australian Lepidoptera","639-671","","Proceedings of the Linnean Society of New South Wales","","20 May 1902","","<!--MARK--><a href='nullfcabcf68-5b0d-4772-a1cf-474feaf90a0a' class='mouseoverHref'>Lower, O.B. 1902. Descriptions of new Australian Lepidoptera.</a> <!--MARK--><!--MARK--><a href='nullc12cd779-adb5-41ea-bd2c-75f6864cf22e' class='mouseoverHref'><em>Proceedings of the Linnean Society of New South Wales</em></a> <strong>26</strong>: 639-671<!--MARK--> [Date published 20 May 1902: the journal issue was scheduled for 1901]","the journal issue was scheduled for 1901","Article in Journal","fcabcf68-5b0d-4772-a1cf-474feaf90a0a","20120305T21:49:36.446+0000","c12cd779-adb5-41ea-bd2c-75f6864cf22e"
"Lucas, T.P.","1894","Descriptions of new Australian Lepidoptera, with additional localities for known species","133-166","","Proceedings of the Linnean Society of New South Wales","","","","<!--MARK--><a href='nulldc9d861b-ed6f-4abc-91af-9e91d5fa8a02' class='mouseoverHref'>Lucas, T.P. 1894. Descriptions of new Australian Lepidoptera, with additional localities for known species.</a> <!--MARK--><!--MARK--><a href='nullc12cd779-adb5-41ea-bd2c-75f6864cf22e' class='mouseoverHref'><em>Proceedings of the Linnean Society of New South Wales</em></a> 2 <strong>8</strong>: 133-166<!--MARK-->","","Article in Journal","dc9d861b-ed6f-4abc-91af-9e91d5fa8a02","20120110T02:15:17.998+0000","c12cd779-adb5-41ea-bd2c-75f6864cf22e"
"Lucas, T.P.","1901","Queensland Lepidoptera","73-95","","Proceedings of the Royal Society of Queensland","","","","<!--MARK--><a href='nullc5c7e9dc-0180-4ada-b437-3673b70ae2de' class='mouseoverHref'>Lucas, T.P. 1901. Queensland Lepidoptera.</a> <!--MARK--><!--MARK--><a href='null642ab613-813a-48d0-8bc0-42c78157f7b0' class='mouseoverHref'><em>Proceedings of the Royal Society of Queensland</em></a> <strong>16</strong>: 73-95<!--MARK-->","","Article in Journal","c5c7e9dc-0180-4ada-b437-3673b70ae2de","20081009T05:11:37.000+0000","642ab613-813a-48d0-8bc0-42c78157f7b0"
"Meyrick, E.","1897","Descriptions of new Lepidoptera from Australia and New Zealand","367-390","","Transactions of the Entomological Society of London","","","","<!--MARK--><a href='null330ae97b-7163-4875-ab85-3a81856cb546' class='mouseoverHref'>Meyrick, E. 1897. Descriptions of new Lepidoptera from Australia and New Zealand.</a> <!--MARK--><!--MARK--><a href='null5cf355b3-abc5-451e-9abc-ed3282d7811a' class='mouseoverHref'><em>Transactions of the Entomological Society of London</em></a> <strong>1897</strong>: 367-390<!--MARK-->","","Article in Journal","330ae97b-7163-4875-ab85-3a81856cb546","20081009T05:11:37.000+0000","5cf355b3-abc5-451e-9abc-ed3282d7811a"
"Prout, A.E.","1924","Some apparently new Noctuidae from Sumatra, New Guinea, Mefor, and Buru","427-450, 3 plates","","Bulletin of the Hill Museum (Witley)","","","","<!--MARK--><a href='null9d0ff392-35ee-498b-b57e-cc54dfa69a56' class='mouseoverHref'>Prout, A.E. 1924. Some apparently new Noctuidae from Sumatra, New Guinea, Mefor, and Buru.</a> <!--MARK--><!--MARK--><a href='nulle6cf36f4-1553-4bfb-80df-c48629921881' class='mouseoverHref'><em>Bulletin of the Hill Museum (Witley)</em></a> <strong>1</strong>: 427-450, 3 plates<!--MARK-->","","Article in Journal","9d0ff392-35ee-498b-b57e-cc54dfa69a56","20120113T03:18:06.808+0000","e6cf36f4-1553-4bfb-80df-c48629921881"
"Strand, E.","1924","Lepidoptera aus Südwest-Australien","135-148","","Deutsche entomologische Zeitschrift Iris","","","","<!--MARK--><a href='null1f558fef-a595-478b-be39-52e031886cf8' class='mouseoverHref'>Strand, E. 1924. Lepidoptera aus Südwest-Australien.</a> <!--MARK--><!--MARK--><a href='nullb6150072-c4d1-4bbf-823d-88ba96707b39' class='mouseoverHref'><em>Deutsche entomologische Zeitschrift Iris</em></a> <strong>38</strong>: 135-148<!--MARK-->","","Article in Journal","1f558fef-a595-478b-be39-52e031886cf8","20081009T05:11:37.000+0000","b6150072-c4d1-4bbf-823d-88ba96707b39"
"Turner, A.J.","1904","New Australian Lepidoptera...with synonomic notes and other notes","212-247","","Transactions of the Royal Society of South Australia","","","","<!--MARK--><a href='null56397945-30b3-4fd9-8d42-f216899634e4' class='mouseoverHref'>Turner, A.J. 1904. New Australian Lepidoptera...with synonomic notes and other notes.</a> <!--MARK--><!--MARK--><a href='null8b48b0a3-dd7a-4aea-be0d-10a223710ebc' class='mouseoverHref'><em>Transactions of the Royal Society of South Australia</em></a> <strong>28</strong>: 212-247<!--MARK-->","","Article in Journal","56397945-30b3-4fd9-8d42-f216899634e4","20100826T05:51:58.431+0000","8b48b0a3-dd7a-4aea-be0d-10a223710ebc"
"Turner, A.J.","1908","New Australian Lepidoptera of the families Noctuidae and Pyralidae","55-109","","Transactions of the Royal Society of South Australia","","","","<!--MARK--><a href='null039b93f9-44fe-44af-9952-a7f6205701f9' class='mouseoverHref'>Turner, A.J. 1908. New Australian Lepidoptera of the families Noctuidae and Pyralidae.</a> <!--MARK--><!--MARK--><a href='null8b48b0a3-dd7a-4aea-be0d-10a223710ebc' class='mouseoverHref'><em>Transactions of the Royal Society of South Australia</em></a> <strong>32</strong>: 55-109<!--MARK-->","","Article in Journal","039b93f9-44fe-44af-9952-a7f6205701f9","20081009T05:11:37.000+0000","8b48b0a3-dd7a-4aea-be0d-10a223710ebc"
"Walker, F.","1856","Noctuidae","1-252","","List of the Specimens of Lepidopterous Insects in the Collection of the British Museum","","","","<!--MARK--><a href='null76ab6561-51ad-4aca-86b6-d9fabd7f1fd9' class='mouseoverHref'>Walker, F. 1856. Noctuidae.</a> <!--MARK--><!--MARK--><a href='null642c8f2c-b31c-4c9f-9ca3-4c940f907155' class='mouseoverHref'><em>List of the Specimens of Lepidopterous Insects in the Collection of the British Museum</em></a> <strong>9</strong>: 1-252<!--MARK-->","","Article in Journal","76ab6561-51ad-4aca-86b6-d9fabd7f1fd9","","642c8f2c-b31c-4c9f-9ca3-4c940f907155"
"Walker, F.","1858","Noctuidae","1237-1519","","List of the Specimens of Lepidopterous Insects in the Collection of the British Museum","","","","<!--MARK--><a href='null476e32a8-0dde-459e-9f0d-eff80cda8a24' class='mouseoverHref'>Walker, F. 1858. Noctuidae.</a> <!--MARK--><!--MARK--><a href='null642c8f2c-b31c-4c9f-9ca3-4c940f907155' class='mouseoverHref'><em>List of the Specimens of Lepidopterous Insects in the Collection of the British Museum</em></a> <strong>14</strong>: 1237-1519<!--MARK-->","","Article in Journal","476e32a8-0dde-459e-9f0d-eff80cda8a24","20081009T05:11:37.000+0000","642c8f2c-b31c-4c9f-9ca3-4c940f907155"
"Walker, F.","1858","Noctuidae","983-1236","","List of the Specimens of Lepidopterous Insects in the Collection of the British Museum","","9 Jan. 1858","","<!--MARK--><a href='nulld43374b5-6957-407e-8275-df5be3a9ec6d' class='mouseoverHref'>Walker, F. 1858. Noctuidae.</a> <!--MARK--><!--MARK--><a href='null642c8f2c-b31c-4c9f-9ca3-4c940f907155' class='mouseoverHref'><em>List of the Specimens of Lepidopterous Insects in the Collection of the British Museum</em></a> <strong>13</strong>: 983-1236<!--MARK--> [Date published 9 Jan. 1858]","","Article in Journal","d43374b5-6957-407e-8275-df5be3a9ec6d","20111122T05:59:45.147+0000","642c8f2c-b31c-4c9f-9ca3-4c940f907155"
"Walker, F.","1858","Noctuidae","1520-1888 [incl. index to parts 9-15]","","List of the Specimens of Lepidopterous Insects in the Collection of the British Museum","","","","<!--MARK--><a href='null4ae7258a-c3f7-4caf-abf1-e14b4e0513b1' class='mouseoverHref'>Walker, F. 1858. Noctuidae.</a> <!--MARK--><!--MARK--><a href='null642c8f2c-b31c-4c9f-9ca3-4c940f907155' class='mouseoverHref'><em>List of the Specimens of Lepidopterous Insects in the Collection of the British Museum</em></a> <strong>15</strong>: 1520-1888 [incl. index to parts 9-15]<!--MARK-->","","Article in Journal","4ae7258a-c3f7-4caf-abf1-e14b4e0513b1","","642c8f2c-b31c-4c9f-9ca3-4c940f907155"
