"PUB_AUTHOR","PUB_YEAR","PUB_TITLE","PUB_PAGES","PUB_PARENT_BOOK_TITLE","PUB_PARENT_JOURNAL_TITLE","PUB_PARENT_ARTICLE_TITLE","PUB_PUBLICATION_DATE","PUB_PUBLISHER","PUB_FORMATTED","PUB_QUALIFICATION","PUB_TYPE","PUBLICATION_GUID","PUBLICATION_LAST_UPDATE","PARENT_PUBLICATION_GUID"
"Ahyong, S.T.","2008","Deepwater crabs from seamounts and chemosynthetic habitats off eastern New Zealand (Crustacea: Decapoda: Brachyura)","1-72","","Zootaxa","","","","<!--MARK--><a href='nulld7675021-dc2e-4eb8-82aa-bc3d7c53e2b6' class='mouseoverHref'>Ahyong, S.T. 2008. Deepwater crabs from seamounts and chemosynthetic habitats off eastern New Zealand (Crustacea: Decapoda: Brachyura).</a> <!--MARK--><!--MARK--><a href='null96466227-221c-4922-ac97-1ac2dd946d0a' class='mouseoverHref'><em>Zootaxa</em></a> <strong>1708</strong>: 1-72<!--MARK-->","","Article in Journal","d7675021-dc2e-4eb8-82aa-bc3d7c53e2b6","20110309T05:56:45.100+0000","96466227-221c-4922-ac97-1ac2dd946d0a"
"Alcock, A.","1900","Materials for a Carcinological Fauna of India. No. 6. The Brachyura Catametopa, or Grapsoidea","279-456","","Journal of the Asiatic Society of Bengal","","","","<!--MARK--><a href='null9efd211a-40a3-4ae9-ad8c-d21467a90490' class='mouseoverHref'>Alcock, A. 1900. Materials for a Carcinological Fauna of India. No. 6. The Brachyura Catametopa, or Grapsoidea.</a> <!--MARK--><!--MARK--><a href='nulld16b9dfb-88f3-4e8f-aa43-b64265b2b69a' class='mouseoverHref'><em>Journal of the Asiatic Society of Bengal</em></a> <strong>69</strong>(Pt 2 No. 3): 279-456<!--MARK-->","","Article in Journal","9efd211a-40a3-4ae9-ad8c-d21467a90490","20081009T05:11:37.000+0000","d16b9dfb-88f3-4e8f-aa43-b64265b2b69a"
"Campbell, B.M.","1969","The genus <i>Eucrate</i> (Crustacea: Goneplacidae) in Eastern Australia and the Indo-west Pacific","117-140 figs 1-7","","Memoirs of the Queensland Museum","","","","<!--MARK--><a href='null0a0c7752-4938-488f-a739-e7919b95ba8a' class='mouseoverHref'>Campbell, B.M. 1969. The genus <i>Eucrate</i> (Crustacea: Goneplacidae) in Eastern Australia and the Indo-west Pacific.</a> <!--MARK--><!--MARK--><a href='null1a0a2982-9f30-43e1-a641-b0379699837c' class='mouseoverHref'><em>Memoirs of the Queensland Museum</em></a> <strong>15</strong>(3): 117-140 figs 1-7<!--MARK-->","","Article in Journal","0a0c7752-4938-488f-a739-e7919b95ba8a","20081009T05:11:37.000+0000","1a0a2982-9f30-43e1-a641-b0379699837c"
"Castro, P.","2007","A reappraisal of the family Goneplacidae MacLeay, 1838 (Crustacea, Decapoda, Brachyura) and revision of the subfamily Goneplacinae, with the description of 10 new genera and 18 new species","609-774","","Zoosystema","","","","<!--MARK--><a href='null2c108977-6199-4bfb-8226-362358f1aad6' class='mouseoverHref'>Castro, P. 2007. A reappraisal of the family Goneplacidae MacLeay, 1838 (Crustacea, Decapoda, Brachyura) and revision of the subfamily Goneplacinae, with the description of 10 new genera and 18 new species.</a> <!--MARK--><!--MARK--><a href='null242db326-4ab2-44e1-b6fc-f07fd38c0136' class='mouseoverHref'><em>Zoosystema</em></a> <strong>29</strong>(4): 609-774<!--MARK-->","","Article in Journal","2c108977-6199-4bfb-8226-362358f1aad6","20110118T05:24:12.141+0000","242db326-4ab2-44e1-b6fc-f07fd38c0136"
"Davie, P.J.F.","1988","A new genus and species of goneplacid (Crustacea: Brachyura) from Queensland, Australia","259-264 figs 1-3","","Memoirs of the Queensland Museum","","","","<!--MARK--><a href='nulla9d90c5e-ddf0-49e6-b4ff-0479bcf20c16' class='mouseoverHref'>Davie, P.J.F. 1988. A new genus and species of goneplacid (Crustacea: Brachyura) from Queensland, Australia.</a> <!--MARK--><!--MARK--><a href='null1a0a2982-9f30-43e1-a641-b0379699837c' class='mouseoverHref'><em>Memoirs of the Queensland Museum</em></a> <strong>25</strong>(2): 259-264 figs 1-3<!--MARK-->","","Article in Journal","a9d90c5e-ddf0-49e6-b4ff-0479bcf20c16","20081009T05:11:37.000+0000","1a0a2982-9f30-43e1-a641-b0379699837c"
"Davie, P.J.F.","1989","A re-appraisal of <i>Heteropanope</i> Stimpson, and <i>Pilumnopeus</i> A. Milne Edwards (Crustacea: Decapoda: Pilumnidae) with descriptions of new species and new genera","129-156","","Memoirs of the Queensland Museum","","","","<!--MARK--><a href='null9d6f752a-510f-4a15-be72-593d573e509f' class='mouseoverHref'>Davie, P.J.F. 1989. A re-appraisal of <i>Heteropanope</i> Stimpson, and <i>Pilumnopeus</i> A. Milne Edwards (Crustacea: Decapoda: Pilumnidae) with descriptions of new species and new genera.</a> <!--MARK--><!--MARK--><a href='null1a0a2982-9f30-43e1-a641-b0379699837c' class='mouseoverHref'><em>Memoirs of the Queensland Museum</em></a> <strong>27</strong>(2): 129-156<!--MARK-->","","Article in Journal","9d6f752a-510f-4a15-be72-593d573e509f","20081009T05:11:37.000+0000","1a0a2982-9f30-43e1-a641-b0379699837c"
"Davie, P.J.F.","1998","A new species of <i>Intesius</i> (Crustacea, Decapoda, Goneplacidae) from deep water of French Polynesia","221-227","","Zoosystematica Rossica","","","","<!--MARK--><a href='nulle611e13d-7afd-4c2f-a46b-4fc4fa5095f4' class='mouseoverHref'>Davie, P.J.F. 1998. A new species of <i>Intesius</i> (Crustacea, Decapoda, Goneplacidae) from deep water of French Polynesia.</a> <!--MARK--><!--MARK--><a href='null4ebbb65b-72bd-47a8-bad5-f2d860f38d08' class='mouseoverHref'><em>Zoosystematica Rossica</em></a> <strong>20</strong>(2): 221-227<!--MARK-->","","Article in Journal","e611e13d-7afd-4c2f-a46b-4fc4fa5095f4","20081009T05:11:37.000+0000","4ebbb65b-72bd-47a8-bad5-f2d860f38d08"
"De Haan, W.","1833","Crustacea","i-xvii, i-xxxi, ix-xvi, 1-243 pls A-J,","Fauna Japonica sive Descriptio Animalium, quae in Itinere per Japoniam<i>, Jussu et Auspiciis Superiorum, qui Summum in India Batava Imperium Tenent, Suscepto, Annis 1823-1830 Collegit, Notis, Observationibus et Adumbrationibus Illustravit</i>","","","","","<!--MARK--><a href='null9249e415-0893-4288-be37-d8289334b19d' class='mouseoverHref'>De Haan, W. 1833. Crustacea. i-xvii, i-xxxi, ix-xvi, 1-243 pls A-J,</a> <!--MARK--><em>in</em> <!--MARK--><a href='null8fcd42e5-30fa-41a0-a67c-7e253cb1c03f' class='mouseoverHref'>Von Siebold, P.F. (ed.). <em>Fauna Japonica sive Descriptio Animalium, quae in Itinere per Japoniam<i>, Jussu et Auspiciis Superiorum, qui Summum in India Batava Imperium Tenent, Suscepto, Annis 1823-1830 Collegit, Notis, Observationibus et Adumbrationibus Illustravit</i></em>. Leiden : Lugduni-Batavorum.</a><!--MARK--><!--MARK--> [published from 1833-1850]","published from 1833-1850","Chapter in Book","9249e415-0893-4288-be37-d8289334b19d","20081009T05:11:37.000+0000","8fcd42e5-30fa-41a0-a67c-7e253cb1c03f"
"Griffin, D.J.G. & Campbell, B.M.","1969","The sub-littoral Goneplacidae and Pinnotheridae (Crustacea, Brachyura) of Moreton Bay","141-164, text-figs 1-8","","Memoirs of the Queensland Museum","","","","<!--MARK--><a href='nulla20083eb-f401-4639-88cf-ca28960ef03a' class='mouseoverHref'>Griffin, D.J.G. & Campbell, B.M. 1969. The sub-littoral Goneplacidae and Pinnotheridae (Crustacea, Brachyura) of Moreton Bay.</a> <!--MARK--><!--MARK--><a href='null1a0a2982-9f30-43e1-a641-b0379699837c' class='mouseoverHref'><em>Memoirs of the Queensland Museum</em></a> <strong>15</strong>(3): 141-164, text-figs 1-8<!--MARK-->","","Article in Journal","a20083eb-f401-4639-88cf-ca28960ef03a","20081009T05:11:37.000+0000","1a0a2982-9f30-43e1-a641-b0379699837c"
"Guinot, D.","1969","Recherches préliminaires sur les groupements naturels chez les Crustacés Décapodes Brachyoures. VII. Les Goneplacidae","241-265 figs 1-32 pl. 1","","Bulletin du Muséum National d'Histoire Naturelle, Paris","","","","<!--MARK--><a href='null66d96c9c-5d7b-4d27-b4e9-9f0593e191d9' class='mouseoverHref'>Guinot, D. 1969. Recherches préliminaires sur les groupements naturels chez les Crustacés Décapodes Brachyoures. VII. Les Goneplacidae.</a> <!--MARK--><!--MARK--><a href='null796711f5-67db-4504-bf92-fda69a7bdc27' class='mouseoverHref'><em>Bulletin du Muséum National d'Histoire Naturelle, Paris</em></a><!--MARK--> [published 1907-1971] 2 <strong>41</strong>(1): 241-265 figs 1-32 pl. 1<!--MARK-->","","Article in Journal","66d96c9c-5d7b-4d27-b4e9-9f0593e191d9","20081009T05:11:37.000+0000","796711f5-67db-4504-bf92-fda69a7bdc27"
"Guinot, D.","1969","Recherches préliminaires sur les groupements naturels chez les Crustacés Décapodes Brachyoures. VII. Les Goneplacidae (suite)","507-528 figs 33-82 pl. 2","","Bulletin du Muséum National d'Histoire Naturelle, Paris","","","","<!--MARK--><a href='null17c62b8a-e445-45c1-b75c-ed4e3e4278b7' class='mouseoverHref'>Guinot, D. 1969. Recherches préliminaires sur les groupements naturels chez les Crustacés Décapodes Brachyoures. VII. Les Goneplacidae (suite).</a> <!--MARK--><!--MARK--><a href='null796711f5-67db-4504-bf92-fda69a7bdc27' class='mouseoverHref'><em>Bulletin du Muséum National d'Histoire Naturelle, Paris</em></a><!--MARK--> [published 1907-1971] 2 <strong>41</strong>(2): 507-528 figs 33-82 pl. 2<!--MARK-->","","Article in Journal","17c62b8a-e445-45c1-b75c-ed4e3e4278b7","20081009T05:11:37.000+0000","796711f5-67db-4504-bf92-fda69a7bdc27"
"Guinot, D.","1969","Recherches préliminaires sur les groupements naturels chez les Crustacés Décapodes Brachyoures. VII. Les Goneplacidae (suite et fin)","688-724 figs 83-146 pls III-V","","Bulletin du Muséum National d'Histoire Naturelle, Paris","","","","<!--MARK--><a href='null9df247a2-9d70-4a59-91ce-4ca3e9ad25a8' class='mouseoverHref'>Guinot, D. 1969. Recherches préliminaires sur les groupements naturels chez les Crustacés Décapodes Brachyoures. VII. Les Goneplacidae (suite et fin).</a> <!--MARK--><!--MARK--><a href='null796711f5-67db-4504-bf92-fda69a7bdc27' class='mouseoverHref'><em>Bulletin du Muséum National d'Histoire Naturelle, Paris</em></a><!--MARK--> [published 1907-1971] <strong>41</strong>(3): 688-724 figs 83-146 pls III-V<!--MARK-->","","Article in Journal","9df247a2-9d70-4a59-91ce-4ca3e9ad25a8","20081009T05:11:37.000+0000","796711f5-67db-4504-bf92-fda69a7bdc27"
"Guinot, D.","1971","Recherches préliminaires sur les groupements naturels Chez les Crustacés Décapodes Brachyoures. VIII. Synthèse et bibliographie","1063-1090","","Bulletin du Muséum National d'Histoire Naturelle, Paris","","","","<!--MARK--><a href='nulldf016ea2-81d6-4aab-bd32-476809794f97' class='mouseoverHref'>Guinot, D. 1971. Recherches préliminaires sur les groupements naturels Chez les Crustacés Décapodes Brachyoures. VIII. Synthèse et bibliographie.</a> <!--MARK--><!--MARK--><a href='null796711f5-67db-4504-bf92-fda69a7bdc27' class='mouseoverHref'><em>Bulletin du Muséum National d'Histoire Naturelle, Paris</em></a><!--MARK--> [published 1907-1971] 2 <strong>42</strong>(5): 1063-1090<!--MARK-->","","Article in Journal","df016ea2-81d6-4aab-bd32-476809794f97","20081009T05:11:37.000+0000","796711f5-67db-4504-bf92-fda69a7bdc27"
"Guinot, D.","1978","Principes d'une classification évolutive des Crustacés Décapodes Brachyoures","211-292","","Bulletin Biologique de la France et de la Belgique","","","","<!--MARK--><a href='nulldd892de2-d6fc-40bb-be02-3212ce98232b' class='mouseoverHref'>Guinot, D. 1978. Principes d'une classification évolutive des Crustacés Décapodes Brachyoures.</a> <!--MARK--><!--MARK--><a href='null91664fd8-1881-4d95-befa-29e03c0123b3' class='mouseoverHref'><em>Bulletin Biologique de la France et de la Belgique</em></a> ns <strong>112</strong>: 211-292<!--MARK-->","","Article in Journal","dd892de2-d6fc-40bb-be02-3212ce98232b","20081009T05:11:37.000+0000","91664fd8-1881-4d95-befa-29e03c0123b3"
"Guinot, D.","1986","Description d'un Crabe cavernicole aveugle de Nouvelle-Bretagne (Papouasie Nouvelle-Guinée), <i>Trogloplax joliveti</i> gen. nov. sp. nov., et établissement d'une sous-famille nouvelle, Trogloplacinae subfam. nov","307-312","","Comptes Rendus (Hebdomadaires) des Séances de l'Academie des Sciences. Série D. Sciences Naturelles","","","","<!--MARK--><a href='null83e09131-61ba-4e79-8bee-1e9d22ef935c' class='mouseoverHref'>Guinot, D. 1986. Description d'un Crabe cavernicole aveugle de Nouvelle-Bretagne (Papouasie Nouvelle-Guinée), <i>Trogloplax joliveti</i> gen. nov. sp. nov., et établissement d'une sous-famille nouvelle, Trogloplacinae subfam. nov.</a> <!--MARK--><!--MARK--><a href='null77294646-7b61-4cee-974d-0ed045692670' class='mouseoverHref'><em>Comptes Rendus (Hebdomadaires) des Séances de l'Academie des Sciences. Série D. Sciences Naturelles</em></a> 3 <strong>303</strong>(8): 307-312<!--MARK-->","","Article in Journal","83e09131-61ba-4e79-8bee-1e9d22ef935c","20081009T05:11:37.000+0000","77294646-7b61-4cee-974d-0ed045692670"
"Guinot, D.","1989","Le genre <i>Carcinoplax</i> H. Milne Edwards, 1852 (Crustacea, Brachyura: Goneplacidae)","pp. 265-345","","Mémoires du Muséum national d'Histoire naturelle, Paris","Résultats des Campagnes MUSORSTOM, Volume 5","","","<!--MARK--><a href='null14f2abe5-dc13-4b43-8864-dc8a9e8c2d96' class='mouseoverHref'>Guinot, D. 1989. Le genre <i>Carcinoplax</i> H. Milne Edwards, 1852 (Crustacea, Brachyura: Goneplacidae). pp. 265-345</a> <!--MARK--><em>in</em> <!--MARK--><a href='null1b6e3476-8234-4262-a243-738b0da08bfe' class='mouseoverHref'>Forest, J. Résultats des Campagnes MUSORSTOM, Volume 5.</a> <!--MARK--><!--MARK--><a href='null93c2cf00-5323-4c6b-85b2-9b9ff8e2dfb9' class='mouseoverHref'><em>Mémoires du Muséum national d'Histoire naturelle, Paris</em></a><!--MARK--> [1936-1950] A <strong>144</strong>: 1-385<!--MARK-->","","Section in Article","14f2abe5-dc13-4b43-8864-dc8a9e8c2d96","20081009T05:11:37.000+0000","1b6e3476-8234-4262-a243-738b0da08bfe"
"Guinot, D. & Macpherson, E.","1987","Revision du genre <i>Pilumnoides</i> Lucas, 1844, avec description de quatre espèces nouvelles et creation de Pilumnoidinae subfam. nov. (Crustacea Decapoda Brachyura)","211-247","","Bulletin du Muséum National d'Histoire Naturelle, Paris","","","","<!--MARK--><a href='null88b6820f-f442-4894-86b3-a9997ae3bf80' class='mouseoverHref'>Guinot, D. & Macpherson, E. 1987. Revision du genre <i>Pilumnoides</i> Lucas, 1844, avec description de quatre espèces nouvelles et creation de Pilumnoidinae subfam. nov. (Crustacea Decapoda Brachyura).</a> <!--MARK--><!--MARK--><a href='null796711f5-67db-4504-bf92-fda69a7bdc27' class='mouseoverHref'><em>Bulletin du Muséum National d'Histoire Naturelle, Paris</em></a><!--MARK--> [published 1907-1971] <strong>9</strong>(1): 211-247<!--MARK-->","","Article in Journal","88b6820f-f442-4894-86b3-a9997ae3bf80","20081009T05:11:37.000+0000","796711f5-67db-4504-bf92-fda69a7bdc27"
"Guinot, D. & Richer de Forges, B.","1981","Crabes de profondeur, nouveaux ou rares, de l'Indo-Pacifique (Crustacea, Decapoda, Brachyura). (Deuxième partie)","227-260 figs 4-12","","Bulletin du Muséum National d'Histoire Naturelle, Paris","","","","<!--MARK--><a href='null530e7826-2d57-4500-a340-b6925a628d40' class='mouseoverHref'>Guinot, D. & Richer de Forges, B. 1981. Crabes de profondeur, nouveaux ou rares, de l'Indo-Pacifique (Crustacea, Decapoda, Brachyura). (Deuxième partie).</a> <!--MARK--><!--MARK--><a href='null796711f5-67db-4504-bf92-fda69a7bdc27' class='mouseoverHref'><em>Bulletin du Muséum National d'Histoire Naturelle, Paris</em></a><!--MARK--> [published 1907-1971] <strong>3</strong>(1): 227-260 figs 4-12<!--MARK-->","","Article in Journal","530e7826-2d57-4500-a340-b6925a628d40","20081009T05:11:37.000+0000","796711f5-67db-4504-bf92-fda69a7bdc27"
"Huys, R., Low, M.E.Y., de Grave, S., Ng, P.K.L. & Clark, P.F.","2014","On two reports associated with James Wood-Mason and Alfred William Alcock published by the Indian Museum and the Indian Marine Survey between 1890 and 1891: implications for malacostracan nomenclature","1-78","","Zootaxa","","","","<!--MARK--><a href='nullf4391b8f-bfe9-444a-a2d5-08525cc9178d' class='mouseoverHref'>Huys, R., Low, M.E.Y., de Grave, S., Ng, P.K.L. & Clark, P.F. 2014. On two reports associated with James Wood-Mason and Alfred William Alcock published by the Indian Museum and the Indian Marine Survey between 1890 and 1891: implications for malacostracan nomenclature.</a> <!--MARK--><!--MARK--><a href='null96466227-221c-4922-ac97-1ac2dd946d0a' class='mouseoverHref'><em>Zootaxa</em></a> <strong>3757</strong>(1): 1-78<!--MARK-->","","Article in Journal","f4391b8f-bfe9-444a-a2d5-08525cc9178d","20140223T22:00:53.928+0000","96466227-221c-4922-ac97-1ac2dd946d0a"
"MacLeay, W.S.","1838","On the Brachyurous Decapod Crustacea brought from the Cape by Dr Smith","75 pp. 4 pls","","","","","","<!--MARK--><a href='null9b64cfc2-6861-4f91-87d2-e4e6ec3634d2' class='mouseoverHref'>MacLeay, W.S. 1838. On the Brachyurous Decapod Crustacea brought from the Cape by Dr Smith. pp. 53-71 pl. 3 <I>in, Illustrations of the Annulosa of South Africa</I>; being a portion of the objects of natural history collected during an expedition into the interior of South Africa, under the direction of Dr Andrew Smith, in the years 1834, 1835, and 1836; fitted out by The Cape of Good Hope Association for Exploring Central Africa. London. 75 pp. 4 pls</a>","","Miscellaneous","9b64cfc2-6861-4f91-87d2-e4e6ec3634d2","20081009T05:11:37.000+0000",""
"Manning, R.B. & Holthuis, L.B.","1981","West African Brachyuran Crabs (Crustacea: Decapoda)","i-xii, 1-379 figs 1-88, 2 appendices","","Smithsonian Contributions to Zoology","","","","<!--MARK--><a href='nulle26d6150-04f7-4b04-b228-b1763c36442e' class='mouseoverHref'>Manning, R.B. & Holthuis, L.B. 1981. West African Brachyuran Crabs (Crustacea: Decapoda).</a> <!--MARK--><!--MARK--><a href='nullcf8b640e-574a-4713-8a6f-74b8ef9e2f2c' class='mouseoverHref'><em>Smithsonian Contributions to Zoology</em></a> <strong>No. 306</strong>: i-xii, 1-379 figs 1-88, 2 appendices<!--MARK-->","","Article in Journal","e26d6150-04f7-4b04-b228-b1763c36442e","20081009T05:11:37.000+0000","cf8b640e-574a-4713-8a6f-74b8ef9e2f2c"
"Milne Edwards, A.","1873","Recherches sur la faune carcinologique de la Nouvelle-Calédonie. Pt. 2. Groupe des Cyclometopes Neptunens","155-332 pls 4-18","","Nouvelles Archives du Muséum d'Histoire Naturelle. Paris","","","","<!--MARK--><a href='null286c2053-c141-48e3-b424-e0ccbc6e6afa' class='mouseoverHref'>Milne Edwards, A. 1873. Recherches sur la faune carcinologique de la Nouvelle-Calédonie. Pt. 2. Groupe des Cyclometopes Neptunens.</a> <!--MARK--><!--MARK--><a href='null32f9675c-85d3-47c1-9d80-ec0519ac2c6d' class='mouseoverHref'><em>Nouvelles Archives du Muséum d'Histoire Naturelle. Paris</em></a> <strong>9</strong>: 155-332 pls 4-18<!--MARK-->","","Article in Journal","286c2053-c141-48e3-b424-e0ccbc6e6afa","20081009T05:11:37.000+0000","32f9675c-85d3-47c1-9d80-ec0519ac2c6d"
"Milne Edwards, H.","1852","De la famille des ocypodides (<i>Ocypodidae</i>). Second Mémoire, <i>in</i>, Observations sur les affinités zoologiques et la classification naturelle des Crustacés","128-166 pls 3, 4","","Annales des Sciences Naturelles, Paris","","","","<!--MARK--><a href='null5ebf664f-f42f-467d-b10c-02202e943448' class='mouseoverHref'>Milne Edwards, H. 1852. De la famille des ocypodides (<i>Ocypodidae</i>). Second Mémoire, <i>in</i>, Observations sur les affinités zoologiques et la classification naturelle des Crustacés.</a> <!--MARK--><!--MARK--><a href='null8728aca1-f2e1-4662-b5b6-40183f95151b' class='mouseoverHref'><em>Annales des Sciences Naturelles, Paris</em></a> Zoology <strong>18</strong>: 128-166 pls 3, 4<!--MARK-->","","Article in Journal","5ebf664f-f42f-467d-b10c-02202e943448","20081009T05:11:37.000+0000","8728aca1-f2e1-4662-b5b6-40183f95151b"
"Ng, P.K.L.","1987","The Indo-Pacific Pilumnidae II. A revision of the genus <i>Rhizopa</i> Stimpson, 1858, and the status of the Rhizopinae Stimpson, 1858 (Crustacea, Decapoda, Brachyura)","69-111 figs 1, 2 pl. 1 table 1","","Indo-Malayan Zoology","","","","<!--MARK--><a href='null30b247eb-e552-47a0-9be2-947b03f703f6' class='mouseoverHref'>Ng, P.K.L. 1987. The Indo-Pacific Pilumnidae II. A revision of the genus <i>Rhizopa</i> Stimpson, 1858, and the status of the Rhizopinae Stimpson, 1858 (Crustacea, Decapoda, Brachyura).</a> <!--MARK--><!--MARK--><a href='nullffcc365a-d626-4c90-bd2a-325ba113eacb' class='mouseoverHref'><em>Indo-Malayan Zoology</em></a> <strong>4</strong>: 69-111 figs 1, 2 pl. 1 table 1<!--MARK-->","","Article in Journal","30b247eb-e552-47a0-9be2-947b03f703f6","20081009T05:11:37.000+0000","ffcc365a-d626-4c90-bd2a-325ba113eacb"
"Ng, P.K.L., Wang, C-H., Ho, P-H. & Shih, H-T.","2001","An annotated checklist of brachyuran crabs from Taiwan (Crustacea: Decapoda)","1-86, 8 colour pls","","National Taiwan Museum Special Publication Series, Taipei, Taiwan","","","","<!--MARK--><a href='null02ab4ef1-cb74-4297-bbeb-9b6f3adcae0b' class='mouseoverHref'>Ng, P.K.L., Wang, C-H., Ho, P-H. & Shih, H-T. 2001. An annotated checklist of brachyuran crabs from Taiwan (Crustacea: Decapoda).</a> <!--MARK--><!--MARK--><a href='nulld3191959-80f7-44c3-926b-f113834ec850' class='mouseoverHref'><em>National Taiwan Museum Special Publication Series, Taipei, Taiwan</em></a> <strong>No. 11</strong>: 1-86, 8 colour pls<!--MARK-->","","Article in Journal","02ab4ef1-cb74-4297-bbeb-9b6f3adcae0b","20081009T05:11:37.000+0000","d3191959-80f7-44c3-926b-f113834ec850"
"Ng, P.K.L. & Wang, C.H.","1994","Notes on the enigmatic genus <i>Pseudozius</i> Dana, 1851 (Crustacea, Decapoda, Brachyura)","83-99","","Journal of the Taiwan Museum","","","","<!--MARK--><a href='null70901f21-ec1e-4af8-a551-58bf973c7b42' class='mouseoverHref'>Ng, P.K.L. & Wang, C.H. 1994. Notes on the enigmatic genus <i>Pseudozius</i> Dana, 1851 (Crustacea, Decapoda, Brachyura).</a> <!--MARK--><!--MARK--><a href='null49d5caa0-41ed-4ee0-ad6f-37a046a15250' class='mouseoverHref'><em>Journal of the Taiwan Museum</em></a> <strong>47</strong>(1): 83-99<!--MARK-->","","Article in Journal","70901f21-ec1e-4af8-a551-58bf973c7b42","20081009T05:11:37.000+0000","49d5caa0-41ed-4ee0-ad6f-37a046a15250"
"Poore, G.C.B, McCallum, A.W. & Tayor, J.","2008","Decapod Crustacea of the continental margin of southwestern and central Western Australia: preliminary identifications of 524 species from FRV <i>Southern Surveyor</i> voyage SS10-2005","pp. 1-106","","","","","","<!--MARK--><a href='nulle5de476f-6ab8-46cd-b9fc-d0ba6079e40b' class='mouseoverHref'>Poore, G.C.B, McCallum, A.W. & Tayor, J. 2008. Decapod Crustacea of the continental margin of southwestern and central Western Australia: preliminary identifications of 524 species from FRV <i>Southern Surveyor</i> voyage SS10-2005. pp. 1-106</a>","","Miscellaneous","e5de476f-6ab8-46cd-b9fc-d0ba6079e40b","20110105T01:01:21.006+0000",""
"Poore, G.C.B.","2004","Marine Decapod Crustacea of Southern Australia. A guide to identification (with chapter on Stomatopoda by Shane Ahyong)","574 pp.","","","","","CSIRO Publishing","<!--MARK--><a href='nulldc9a2fbd-1ed4-4f0e-9c3f-204cb9798539' class='mouseoverHref'>Poore, G.C.B. 2004. <em>Marine Decapod Crustacea of Southern Australia. A guide to identification (with chapter on Stomatopoda by Shane Ahyong)</em>. Melbourne : CSIRO Publishing 574 pp.</a><!--MARK-->","","Book","dc9a2fbd-1ed4-4f0e-9c3f-204cb9798539","20100616T23:08:07.346+0000",""
"Poore, G.C.B., McCallum, A.W. & Taylor, J.","2008","Decapod Crustacea of the continental margin of southwestern and central Western Australia: preliminary identifications of 524 species from FRV <i>Southern Surveyor</i> voyage SS10-2005","pp. 1-106","","","","","","<!--MARK--><a href='nulle5c8e21a-fcfd-42d1-9cfa-f43025ac8501' class='mouseoverHref'>Poore, G.C.B., McCallum, A.W. & Taylor, J. 2008. Decapod Crustacea of the continental margin of southwestern and central Western Australia: preliminary identifications of 524 species from FRV <i>Southern Surveyor</i> voyage SS10-2005. Museum Victoria Reports 11. pp. 1-106</a>","","Miscellaneous","e5c8e21a-fcfd-42d1-9cfa-f43025ac8501","20110105T01:53:49.978+0000",""
"Rathbun, M.J.","1914","A new genus and some new species of the family Goneplacidae","137-154","","Proceedings of the United States National Museum","","","","<!--MARK--><a href='nulldfe6e496-a601-4f74-9aa6-0e17fac5c664' class='mouseoverHref'>Rathbun, M.J. 1914. A new genus and some new species of the family Goneplacidae.</a> <!--MARK--><!--MARK--><a href='null0e32c453-4bc6-48a2-a3a2-d40281874533' class='mouseoverHref'><em>Proceedings of the United States National Museum</em></a> <strong>48</strong>(2067): 137-154<!--MARK-->","","Article in Journal","dfe6e496-a601-4f74-9aa6-0e17fac5c664","20081009T05:11:37.000+0000","0e32c453-4bc6-48a2-a3a2-d40281874533"
"Rathbun, M.J.","1923","Report on the Crabs obtained by the F.I.S. Endeavour on the Coasts of Queensland, New South Wales, Victoria, South Australia and Tasmania. Report on the Brachyrhyncha, Oxystomata and Dromiacea","","","","","","","<!--MARK--><a href='nullc19a0968-59ec-4a27-83b6-4d41ce97fae8' class='mouseoverHref'>Rathbun, M.J. 1923. Report on the Crabs obtained by the F.I.S. Endeavour on the Coasts of Queensland, New South Wales, Victoria, South Australia and Tasmania. Report on the Brachyrhyncha, Oxystomata and Dromiacea. pp. 95-156 figs 1-3, pls 16-42 <I>in</I>, <I>Biological Results of the Fishing Experiments carried on by the F.I.S. Endeavour, 1909-14</I>. Sydney : Commonwealth of Australia, Department of Trade and Customs. Vol. 5 398 pp.</a>","","Miscellaneous","c19a0968-59ec-4a27-83b6-4d41ce97fae8","20081009T05:11:37.000+0000",""
"Sakai, T.","1976","Crabs of Japan and the Adjacent Seas","xxix 773 pp. [English vol.]; 1-16, 251 pls [Plates vol.]; 461 pp. [Japanese vol.]","","","","","Kodansha","<!--MARK--><a href='null41eceb73-06aa-44a4-ace8-2d8428fc079e' class='mouseoverHref'>Sakai, T. 1976. <em>Crabs of Japan and the Adjacent Seas</em>. Tokyo : Kodansha 3 vols xxix 773 pp. [English vol.]; 1-16, 251 pls [Plates vol.]; 461 pp. [Japanese vol.].</a><!--MARK-->","","Book","41eceb73-06aa-44a4-ace8-2d8428fc079e","20120507T03:57:26.330+0000",""
