"PUB_AUTHOR","PUB_YEAR","PUB_TITLE","PUB_PAGES","PUB_PARENT_BOOK_TITLE","PUB_PARENT_JOURNAL_TITLE","PUB_PARENT_ARTICLE_TITLE","PUB_PUBLICATION_DATE","PUB_PUBLISHER","PUB_FORMATTED","PUB_QUALIFICATION","PUB_TYPE","PUBLICATION_GUID","PUBLICATION_LAST_UPDATE","PARENT_PUBLICATION_GUID"
"Serène, R.","1984","Crustacés Décapodes Brachyoures de l'Océan Indien occidental et de la Mer Rouge. Xanthoidea: Xanthidae et Trapeziidae. Avec un addendum par Crosnier, A.: Carpilliidae et Menippidae","1-400 figs A-C, 1-243 pls 1-48","","Faune Tropicale","","","","<!--MARK--><a href='nullb4d59a64-c426-4c15-8fe2-3e2910ca9e31' class='mouseoverHref'>Serène, R. 1984. Crustacés Décapodes Brachyoures de l'Océan Indien occidental et de la Mer Rouge. Xanthoidea: Xanthidae et Trapeziidae. Avec un addendum par Crosnier, A.: Carpilliidae et Menippidae.</a> <!--MARK--><!--MARK--><a href='null4c886a47-4641-4e93-b539-d8e9c6faa082' class='mouseoverHref'><em>Faune Tropicale</em></a> <strong>24</strong>: 1-400 figs A-C, 1-243 pls 1-48<!--MARK-->","","Article in Journal","b4d59a64-c426-4c15-8fe2-3e2910ca9e31","20081009T05:11:37.000+0000","4c886a47-4641-4e93-b539-d8e9c6faa082"
"Serène, R. & Lohavanijaya, P.","1973","The Brachyura (Crustacea: Decapoda) collected by the Naga Expedition, including a review of the Homolidae. <i>In</i>, Scientific Results of Marine Investigations of the south China Sea and the gulf of Thailand 1959-1961","1-186 figs 1-21","","Naga Report. Scientific Results of Marine Investigations of the South China Sea and the Gulf of Thailand","","","","<!--MARK--><a href='nullee64e120-7611-47d2-9702-54b0ed5b54ee' class='mouseoverHref'>Serène, R. & Lohavanijaya, P. 1973. The Brachyura (Crustacea: Decapoda) collected by the Naga Expedition, including a review of the Homolidae. <i>In</i>, Scientific Results of Marine Investigations of the south China Sea and the gulf of Thailand 1959-1961.</a> <!--MARK--><!--MARK--><a href='nullb99cf1e4-bc79-4dc4-9afe-4eb241564fcf' class='mouseoverHref'><em>Naga Report. Scientific Results of Marine Investigations of the South China Sea and the Gulf of Thailand</em></a> <strong>4</strong>(4): 1-186 figs 1-21<!--MARK-->","","Article in Journal","ee64e120-7611-47d2-9702-54b0ed5b54ee","20081009T05:11:37.000+0000","b99cf1e4-bc79-4dc4-9afe-4eb241564fcf"
"Stebbing, T.R.R.","1902","South African Crustacea, Part II","1-92 pls 5-16","","Marine Investigations in South Africa","","","","<!--MARK--><a href='null92bd6c02-8690-4f2d-a7b5-5fb535489466' class='mouseoverHref'>Stebbing, T.R.R. 1902. South African Crustacea, Part II.</a> <!--MARK--><!--MARK--><a href='null44ec8aeb-db58-430c-8be1-c020da74e01f' class='mouseoverHref'><em>Marine Investigations in South Africa</em></a> <strong>2</strong>: 1-92 pls 5-16<!--MARK-->","","Article in Journal","92bd6c02-8690-4f2d-a7b5-5fb535489466","20081009T05:11:37.000+0000","44ec8aeb-db58-430c-8be1-c020da74e01f"
"Tesch, J.J.","1918","The Decapoda Brachyura of the Siboga-Expedition. II, Goneplacidae and Pinnotheridae","149-295 pls 7-18","","Siboga Expéditie Monographie","","","","<!--MARK--><a href='null3aa32604-9f83-488a-87a8-6f70e4522e96' class='mouseoverHref'>Tesch, J.J. 1918. The Decapoda Brachyura of the Siboga-Expedition. II, Goneplacidae and Pinnotheridae.</a> <!--MARK--><!--MARK--><a href='null1301a24b-af5e-4886-82ed-518422484bc0' class='mouseoverHref'><em>Siboga Expéditie Monographie</em></a> <strong>39</strong>(c1): 149-295 pls 7-18<!--MARK-->","","Article in Journal","3aa32604-9f83-488a-87a8-6f70e4522e96","20081009T05:11:37.000+0000","1301a24b-af5e-4886-82ed-518422484bc0"
"White, A.","1851","Descriptions of some apparently new species of Annulosa (collected by Mr. MacGillivray during the Voyage of H.M.S. Rattlesnake)","2, Appendix No. 6, pp. 387-395 pls 4-5","Narrative of the Voyage of the H.M.S. Rattlesnake, commanded by the late Captain Owen Stanley, during the years 1846-1850","","","","","<!--MARK--><a href='null66e27320-9996-49c0-9fa2-9ab515e9210b' class='mouseoverHref'>White, A. 1851. Descriptions of some apparently new species of Annulosa (collected by Mr. MacGillivray during the Voyage of H.M.S. Rattlesnake). 2, Appendix No. 6, pp. 387-395 pls 4-5</a> <!--MARK--><em>in</em> <!--MARK--><a href='nullcdba445f-e64d-4f35-8b30-33bceb5e83a9' class='mouseoverHref'>MacGillivray, J. (ed.). <em>Narrative of the Voyage of the H.M.S. Rattlesnake, commanded by the late Captain Owen Stanley, during the years 1846-1850</em>. London : T. & W. Boone Vol. 2 395 pp.</a><!--MARK-->","","Chapter in Book","66e27320-9996-49c0-9fa2-9ab515e9210b","20140313T03:45:23.888+0000","cdba445f-e64d-4f35-8b30-33bceb5e83a9"
"Wood-Mason, J.","1892","<i>Illustrations of the Zoology of the Royal Indian Marine Surveying Steamer Investigator</i>","","","","","","","<!--MARK--><a href='null10ddcbd8-1d66-498f-a608-da94164a4f61' class='mouseoverHref'>Wood-Mason, J. 1892. <i>Illustrations of the Zoology of the Royal Indian Marine Surveying Steamer Investigator</i>. Crustacea, Pt 1, pls 1-5.</a>","","Miscellaneous","10ddcbd8-1d66-498f-a608-da94164a4f61","20081009T05:11:37.000+0000",""
"Wood-Mason J.","1891","Administration Report of Marine Survey of India [for 1890-1891].","20 pp.","","","","","","<!--MARK--><a href='null25d13f3e-653b-4658-b9b1-8d64c57b20fd' class='mouseoverHref'>Wood-Mason J. 1891. Administration Report of Marine Survey of India [for 1890-1891]. Office of the Superintendent of Government Printing, Calcutta. 20 pp.</a>","","Miscellaneous","25d13f3e-653b-4658-b9b1-8d64c57b20fd","20120209T04:35:40.096+0000",""
