"PUB_AUTHOR","PUB_YEAR","PUB_TITLE","PUB_PAGES","PUB_PARENT_BOOK_TITLE","PUB_PARENT_JOURNAL_TITLE","PUB_PARENT_ARTICLE_TITLE","PUB_PUBLICATION_DATE","PUB_PUBLISHER","PUB_FORMATTED","PUB_QUALIFICATION","PUB_TYPE","PUBLICATION_GUID","PUBLICATION_LAST_UPDATE","PARENT_PUBLICATION_GUID"
"Andres, H. G.","1983","Die Gammaridea (Crustacea: Amphipoda) der Deutschen Antarktis-Expeditionen 1975/76 und 1977/78. 3. Lysianassidae","183-220","","Mitteilungen aus dem Hamburgischen Zoologischen Museum und Institut","","","","<!--MARK--><a href='null2a59283b-a574-4f1e-9686-b03dfe19e8ed' class='mouseoverHref'>Andres, H. G. 1983. Die Gammaridea (Crustacea: Amphipoda) der Deutschen Antarktis-Expeditionen 1975/76 und 1977/78. 3. Lysianassidae.</a> <!--MARK--><!--MARK--><a href='null171ccd89-642b-4041-beef-26bac3a726db' class='mouseoverHref'><em>Mitteilungen aus dem Hamburgischen Zoologischen Museum und Institut</em></a> <strong>80</strong>: 183-220<!--MARK-->","","Article in Journal","2a59283b-a574-4f1e-9686-b03dfe19e8ed","20100618T00:35:57.819+0000","171ccd89-642b-4041-beef-26bac3a726db"
"Chevreux, E.","1889","Amphipodes nouveaux provenant des campagnes de l'Hirondelle 1887-1888","283-289","","Bulletin de la Société Zoologique de France","","","","<!--MARK--><a href='null6d73d243-9af9-43e5-b38e-f519cd163baa' class='mouseoverHref'>Chevreux, E. 1889. Amphipodes nouveaux provenant des campagnes de l'Hirondelle 1887-1888.</a> <!--MARK--><!--MARK--><a href='null8dec2bf0-72c6-4775-b21a-2bd0ec166210' class='mouseoverHref'><em>Bulletin de la Société Zoologique de France</em></a> <strong>14</strong>: 283-289<!--MARK-->","","Article in Journal","6d73d243-9af9-43e5-b38e-f519cd163baa","20081009T05:11:37.000+0000","8dec2bf0-72c6-4775-b21a-2bd0ec166210"
"Lowry, J.K. & Stoddart, H.E.","2010","The deep-sea scavenging genus <i>Hirondellea</i> (Crustacea: Amphipoda: Lysianassoidea: Hirondelleidae fam. nov.) in Australian waters","37-55","","Zootaxa","","","","<!--MARK--><a href='null39a847ae-af26-4dd4-92d4-c6ae3f11aa91' class='mouseoverHref'>Lowry, J.K. & Stoddart, H.E. 2010. The deep-sea scavenging genus <i>Hirondellea</i> (Crustacea: Amphipoda: Lysianassoidea: Hirondelleidae fam. nov.) in Australian waters.</a> <!--MARK--><!--MARK--><a href='null96466227-221c-4922-ac97-1ac2dd946d0a' class='mouseoverHref'><em>Zootaxa</em></a> <strong>2329</strong>: 37-55<!--MARK-->","","Article in Journal","39a847ae-af26-4dd4-92d4-c6ae3f11aa91","20101223T23:49:18.014+0000","96466227-221c-4922-ac97-1ac2dd946d0a"
"Schellenberg, A.","1926","Die Gammariden der Deutschen Südpolar-Expedition 1901-1903","235-414","","Deutsche Südpolar Expedition 1901-1903","","","","<!--MARK--><a href='nullca8dd7e8-3b58-4226-90e7-5bc7de797dc2' class='mouseoverHref'>Schellenberg, A. 1926. Die Gammariden der Deutschen Südpolar-Expedition 1901-1903.</a> <!--MARK--><!--MARK--><a href='null1e6c2fa4-f0c9-4399-ac9b-d74fe0e51abe' class='mouseoverHref'><em>Deutsche Südpolar Expedition 1901-1903</em></a> 10 <strong>18</strong>: 235-414<!--MARK-->","","Article in Journal","ca8dd7e8-3b58-4226-90e7-5bc7de797dc2","20120427T05:46:37.425+0000","1e6c2fa4-f0c9-4399-ac9b-d74fe0e51abe"
"Stephensen, K.","1923","Crustacea Malacostraca. V. (Amphipoda I)","1-100","","Danish Ingolf-Expedition","","","","<!--MARK--><a href='null01e8073e-74ea-417c-bab8-7f362c81a837' class='mouseoverHref'>Stephensen, K. 1923. Crustacea Malacostraca. V. (Amphipoda I).</a> <!--MARK--><!--MARK--><a href='null78ff66b0-ea2e-4e22-bd4f-fb6398e78aeb' class='mouseoverHref'><em>Danish Ingolf-Expedition</em></a> <strong>3</strong>(8): 1-100<!--MARK-->","","Article in Journal","01e8073e-74ea-417c-bab8-7f362c81a837","20081009T05:11:37.000+0000","78ff66b0-ea2e-4e22-bd4f-fb6398e78aeb"
