"PUB_AUTHOR","PUB_YEAR","PUB_TITLE","PUB_PAGES","PUB_PARENT_BOOK_TITLE","PUB_PARENT_JOURNAL_TITLE","PUB_PARENT_ARTICLE_TITLE","PUB_PUBLICATION_DATE","PUB_PUBLISHER","PUB_FORMATTED","PUB_QUALIFICATION","PUB_TYPE","PUBLICATION_GUID","PUBLICATION_LAST_UPDATE","PARENT_PUBLICATION_GUID"
"Day, M.F. & Fletcher, M.J.","1994","An annotated catalogue of the Australian Cicadelloidea (Hemiptera: Auchenorrhyncha)","1117-1288","","Invertebrate Taxonomy","","","","<!--MARK--><a href='null7055e710-57ef-4362-a392-69b69518a9b4' class='mouseoverHref'>Day, M.F. & Fletcher, M.J. 1994. An annotated catalogue of the Australian Cicadelloidea (Hemiptera: Auchenorrhyncha).</a> <!--MARK--><!--MARK--><a href='null9846f41b-d755-4682-9049-5e59d363951b' class='mouseoverHref'><em>Invertebrate Taxonomy</em></a> <strong>8</strong>: 1117-1288<!--MARK-->","","Article in Journal","7055e710-57ef-4362-a392-69b69518a9b4","20081009T05:11:37.000+0000","9846f41b-d755-4682-9049-5e59d363951b"
"Distant, W.L.","1908","On some Australian Homoptera","97-111","","Annales de la Société Entomologique de Belgique (Comptes-rendus)","","","","<!--MARK--><a href='nullf8806c71-0e18-441c-8dc9-268d8f732abc' class='mouseoverHref'>Distant, W.L. 1908. On some Australian Homoptera.</a> <!--MARK--><!--MARK--><a href='nullacc7fcdb-707a-4cbe-8f70-d7595ac25c58' class='mouseoverHref'><em>Annales de la Société Entomologique de Belgique (Comptes-rendus)</em></a> <strong>52</strong>: 97-111<!--MARK-->","","Article in Journal","f8806c71-0e18-441c-8dc9-268d8f732abc","20081009T05:11:37.000+0000","acc7fcdb-707a-4cbe-8f70-d7595ac25c58"
"Evans, J.W.","1933","A revision of the Eurymelini (Homoptera: Bythoscopidae)","73-90","","Transactions of the Royal Society of South Australia","","","","<!--MARK--><a href='null2ef2f2fe-5666-4678-b25b-f644903d4565' class='mouseoverHref'>Evans, J.W. 1933. A revision of the Eurymelini (Homoptera: Bythoscopidae).</a> <!--MARK--><!--MARK--><a href='null8b48b0a3-dd7a-4aea-be0d-10a223710ebc' class='mouseoverHref'><em>Transactions of the Royal Society of South Australia</em></a> <strong>57</strong>: 73-90<!--MARK-->","","Article in Journal","2ef2f2fe-5666-4678-b25b-f644903d4565","20081009T05:11:37.000+0000","8b48b0a3-dd7a-4aea-be0d-10a223710ebc"
"Evans, J.W.","1934","A revision of the Ipoinae (Homoptera: Eurymelidae)","149-167","","Transactions of the Royal Society of South Australia","","","","<!--MARK--><a href='nulle0c34242-1029-45bb-b905-c705072c85cc' class='mouseoverHref'>Evans, J.W. 1934. A revision of the Ipoinae (Homoptera: Eurymelidae).</a> <!--MARK--><!--MARK--><a href='null8b48b0a3-dd7a-4aea-be0d-10a223710ebc' class='mouseoverHref'><em>Transactions of the Royal Society of South Australia</em></a> <strong>58</strong>: 149-167<!--MARK-->","","Article in Journal","e0c34242-1029-45bb-b905-c705072c85cc","20081009T05:11:37.000+0000","8b48b0a3-dd7a-4aea-be0d-10a223710ebc"
"Evans, J.W.","1938","Australian Leafhoppers (Homoptera: Jassoidea): Part VIII","1-18","","Papers and Proceedings of the Royal Society of Tasmania","","","","<!--MARK--><a href='null0ded2bbf-b59b-4d7e-a516-fc72f4b32319' class='mouseoverHref'>Evans, J.W. 1938. Australian Leafhoppers (Homoptera: Jassoidea): Part VIII.</a> <!--MARK--><!--MARK--><a href='nulldb793adc-ebf2-40c5-9d92-48a121ea03ae' class='mouseoverHref'><em>Papers and Proceedings of the Royal Society of Tasmania</em></a> <strong>1938</strong>: 1-18<!--MARK-->","","Article in Journal","0ded2bbf-b59b-4d7e-a516-fc72f4b32319","20081009T05:11:37.000+0000","db793adc-ebf2-40c5-9d92-48a121ea03ae"
"Evans, J.W.","1939","Some new Australian Leafhoppers (Homoptera: Jassoidea)","44-50","","Transactions of the Royal Society of South Australia","","","","<!--MARK--><a href='null2c190f24-7852-4820-ab07-7f4f39481825' class='mouseoverHref'>Evans, J.W. 1939. Some new Australian Leafhoppers (Homoptera: Jassoidea).</a> <!--MARK--><!--MARK--><a href='null8b48b0a3-dd7a-4aea-be0d-10a223710ebc' class='mouseoverHref'><em>Transactions of the Royal Society of South Australia</em></a> <strong>63</strong>(1): 44-50<!--MARK-->","","Article in Journal","2c190f24-7852-4820-ab07-7f4f39481825","20081009T05:11:37.000+0000","8b48b0a3-dd7a-4aea-be0d-10a223710ebc"
"Evans, J.W.","1942","New leafhoppers (Homoptera: Jassoidea) from Western Australia","143-163","","Journal of the Royal Society of Western Australia","","","","<!--MARK--><a href='null70bc661b-5aa6-4acf-b937-155bbfda0cdd' class='mouseoverHref'>Evans, J.W. 1942. New leafhoppers (Homoptera: Jassoidea) from Western Australia.</a> <!--MARK--><!--MARK--><a href='null666efb8f-4a3f-4a3d-ae40-e9ab98f3cdf5' class='mouseoverHref'><em>Journal of the Royal Society of Western Australia</em></a> <strong>27</strong>: 143-163<!--MARK-->","","Article in Journal","70bc661b-5aa6-4acf-b937-155bbfda0cdd","20081009T05:11:37.000+0000","666efb8f-4a3f-4a3d-ae40-e9ab98f3cdf5"
"Evans, J.W.","1947","Some new eurymelids from Australia and New Guinea (Homoptera: Jassoidea)","225-227","","Transactions of the Royal Society of South Australia","","","","<!--MARK--><a href='null073a02ef-4d37-4e02-828c-781ea8b7d3cb' class='mouseoverHref'>Evans, J.W. 1947. Some new eurymelids from Australia and New Guinea (Homoptera: Jassoidea).</a> <!--MARK--><!--MARK--><a href='null8b48b0a3-dd7a-4aea-be0d-10a223710ebc' class='mouseoverHref'><em>Transactions of the Royal Society of South Australia</em></a> <strong>71</strong>(2): 225-227<!--MARK-->","","Article in Journal","073a02ef-4d37-4e02-828c-781ea8b7d3cb","20081009T05:11:37.000+0000","8b48b0a3-dd7a-4aea-be0d-10a223710ebc"
"Evans, J.W.","1954","Les Cicadellidae de Madagascar (Homoptères)","87-137","","Mémoires de l'Institut Scientifique de Madagascar","","","","<!--MARK--><a href='null0e28febd-1b31-4b0a-8aa2-01f50bb87b16' class='mouseoverHref'>Evans, J.W. 1954. Les Cicadellidae de Madagascar (Homoptères).</a> <!--MARK--><!--MARK--><a href='null9d3633d7-87ec-4d11-9d50-c061e08a2c57' class='mouseoverHref'><em>Mémoires de l'Institut Scientifique de Madagascar</em></a> E <strong>4</strong>: 87-137<!--MARK-->","","Article in Journal","0e28febd-1b31-4b0a-8aa2-01f50bb87b16","","9d3633d7-87ec-4d11-9d50-c061e08a2c57"
"Evans, J.W.","1966","The leafhoppers and froghoppers of Australia and New Zealand","1-347","","Memoirs of the Australian Museum","","","","<!--MARK--><a href='nullcf31631c-c286-4cf5-abd5-ec22b69d45f8' class='mouseoverHref'>Evans, J.W. 1966. The leafhoppers and froghoppers of Australia and New Zealand.</a> <!--MARK--><!--MARK--><a href='null272826c2-c2bf-425b-bd6f-11ddaf2aaeaa' class='mouseoverHref'><em>Memoirs of the Australian Museum</em></a> <strong>12</strong>: 1-347<!--MARK-->","","Article in Journal","cf31631c-c286-4cf5-abd5-ec22b69d45f8","20100816T04:29:34.739+0000","272826c2-c2bf-425b-bd6f-11ddaf2aaeaa"
"Evans, J.W.","1969","Notes on the Eurymelidae (Homoptera; Cicadelloidea) and some new species from Eastern and Western Australia","51-55","","Proceedings of the Royal Society of Queensland","","","","<!--MARK--><a href='nulldc97c4ae-f8ca-4a56-bb97-aac58d8e0ea8' class='mouseoverHref'>Evans, J.W. 1969. Notes on the Eurymelidae (Homoptera; Cicadelloidea) and some new species from Eastern and Western Australia.</a> <!--MARK--><!--MARK--><a href='null642ab613-813a-48d0-8bc0-42c78157f7b0' class='mouseoverHref'><em>Proceedings of the Royal Society of Queensland</em></a> <strong>81</strong>(4): 51-55<!--MARK-->","","Article in Journal","dc97c4ae-f8ca-4a56-bb97-aac58d8e0ea8","20081009T05:11:37.000+0000","642ab613-813a-48d0-8bc0-42c78157f7b0"
"Evans, J.W.","1973","Some new genera and species of Cicadelloidea from Australia and New Guinea (Homoptera)","185-197","","Pacific Insects","","","","<!--MARK--><a href='null87959ed8-f906-47fe-b5f5-c55022cf8685' class='mouseoverHref'>Evans, J.W. 1973. Some new genera and species of Cicadelloidea from Australia and New Guinea (Homoptera).</a> <!--MARK--><!--MARK--><a href='nullf8876116-72f2-47c6-b8af-6b514f4719b7' class='mouseoverHref'><em>Pacific Insects</em></a> <strong>15</strong>(2): 185-197<!--MARK-->","","Article in Journal","87959ed8-f906-47fe-b5f5-c55022cf8685","20081009T05:11:37.000+0000","f8876116-72f2-47c6-b8af-6b514f4719b7"
"Evans, J.W.","1977","The leafhoppers and froghoppers of Australia and New Zealand. Part 2","83-129","","Records of the Australian Museum","","","","<!--MARK--><a href='nullccdcf7ef-771c-4b0b-95bf-e8adf211b83a' class='mouseoverHref'>Evans, J.W. 1977. The leafhoppers and froghoppers of Australia and New Zealand. Part 2.</a> <!--MARK--><!--MARK--><a href='null7c07530b-0b38-44f5-8f95-368da97d6ac2' class='mouseoverHref'><em>Records of the Australian Museum</em></a> <strong>31</strong>(3): 83-129<!--MARK-->","","Article in Journal","ccdcf7ef-771c-4b0b-95bf-e8adf211b83a","20081009T05:11:37.000+0000","7c07530b-0b38-44f5-8f95-368da97d6ac2"
"Fabricius, J.C.","1775","Ryngota","816 pp.","","","","","","<!--MARK--><a href='null31bdb5d7-3ddd-4b1d-8eb4-64e04eabec90' class='mouseoverHref'>Fabricius, J.C. 1775. Ryngota. <I>Systema entomologiae, sistens insectorum classes, ordines, genera, species, adiectis synonymis, locis, descriptionibus, observationibus</I>. 816 pp.</a><!--MARK--> [dated 1775]","dated 1775","Miscellaneous","31bdb5d7-3ddd-4b1d-8eb4-64e04eabec90","20081009T05:11:37.000+0000",""
"Jacobi, A.","1909","Homoptera","337-345","","Die Fauna Südwest-Australiens. Ergebnisse der Hamburger Südwest-Australischen Forschungsreise 1905","","","","<!--MARK--><a href='nullfcf3d053-9fba-429c-9fc4-d0fb584636c2' class='mouseoverHref'>Jacobi, A. 1909. Homoptera.</a> <!--MARK--><!--MARK--><a href='nulld7dceaf5-10b5-4fbd-bc2e-64d3b78f1dfc' class='mouseoverHref'><em>Die Fauna Südwest-Australiens. Ergebnisse der Hamburger Südwest-Australischen Forschungsreise 1905</em></a> <strong>2</strong>(20): 337-345<!--MARK-->","","Article in Journal","fcf3d053-9fba-429c-9fc4-d0fb584636c2","20081009T05:11:37.000+0000","d7dceaf5-10b5-4fbd-bc2e-64d3b78f1dfc"
"Kirkaldy, G.W.","1906","Leafhoppers and their natural enemies","271-479","","Bulletin of the Hawaiian Sugar Planters' Association Experimental Station Entomological Series","","","","<!--MARK--><a href='nulle8227547-7cdd-4e84-83a4-90fb28f1b8e9' class='mouseoverHref'>Kirkaldy, G.W. 1906. Leafhoppers and their natural enemies.</a> <!--MARK--><!--MARK--><a href='null434303ef-012d-4278-bb03-dfca5d1e6fec' class='mouseoverHref'><em>Bulletin of the Hawaiian Sugar Planters' Association Experimental Station Entomological Series</em></a> <strong>1</strong>(9): 271-479<!--MARK-->","","Article in Journal","e8227547-7cdd-4e84-83a4-90fb28f1b8e9","20081009T05:11:37.000+0000","434303ef-012d-4278-bb03-dfca5d1e6fec"
"Kirkaldy, G.W.","1907","Leafhoppers -- Supplement (Hemiptera)","1-186","","Bulletin of the Hawaiian Sugar Planters' Association Experimental Station Entomological Series","","","","<!--MARK--><a href='null9c606d89-aa48-4eb6-8dac-9e4ba42a128d' class='mouseoverHref'>Kirkaldy, G.W. 1907. Leafhoppers -- Supplement (Hemiptera).</a> <!--MARK--><!--MARK--><a href='null434303ef-012d-4278-bb03-dfca5d1e6fec' class='mouseoverHref'><em>Bulletin of the Hawaiian Sugar Planters' Association Experimental Station Entomological Series</em></a> <strong>3</strong>: 1-186<!--MARK-->","","Article in Journal","9c606d89-aa48-4eb6-8dac-9e4ba42a128d","20081009T05:11:37.000+0000","434303ef-012d-4278-bb03-dfca5d1e6fec"
"Monteith, G.B.","1991","The Butterfly Man of Kuranda, Frederick Parkhurst Dodd","34 pp.","","","","","Queensland Museum","<!--MARK--><a href='null839e3c89-fc8c-4c68-9243-9b56951aa271' class='mouseoverHref'>Monteith, G.B. 1991. <em>The Butterfly Man of Kuranda, Frederick Parkhurst Dodd</em>. South Brisbane : Queensland Museum 1, 34 pp.</a><!--MARK--> [ISBN 0 7242 4481 6]","ISBN 0 7242 4481 6","Book","839e3c89-fc8c-4c68-9243-9b56951aa271","20100830T06:26:47.531+0000",""
"Signoret, V.A.","1850","Notice sur le groupe des Eurymélides","497-513","","Annales de la Société Entomologique de France","","","","<!--MARK--><a href='nullaa02366f-00ac-4e09-8168-2d80ccc70905' class='mouseoverHref'>Signoret, V.A. 1850. Notice sur le groupe des Eurymélides.</a> <!--MARK--><!--MARK--><a href='null6462279b-2aaf-46a3-a434-cab7d8a2c33d' class='mouseoverHref'><em>Annales de la Société Entomologique de France</em></a> 2 <strong>8</strong>: 497-513<!--MARK-->","","Article in Journal","aa02366f-00ac-4e09-8168-2d80ccc70905","20081009T05:11:37.000+0000","6462279b-2aaf-46a3-a434-cab7d8a2c33d"
"Walker, F.","1851","List of the Specimens of Homopterous Insects in the Collection of the British Museum","637-907","","","","","British Museum (Natural History)","<!--MARK--><a href='nulld450e7eb-4518-4c89-92b1-7f1697b71b77' class='mouseoverHref'>Walker, F. 1851. <em>List of the Specimens of Homopterous Insects in the Collection of the British Museum</em>. London : British Museum (Natural History) Vol. 3 pp. 637-907.</a><!--MARK-->","","Book","d450e7eb-4518-4c89-92b1-7f1697b71b77","20081009T05:11:37.000+0000",""
"Walker, F.","1858","Insecta Saundersiana: or characters of undescribed insects in the collection of William Wilson Saunders, Esq","1-117","","","","","British Museum","<!--MARK--><a href='null8828aaad-2946-4ae9-b7df-9eb1003111c4' class='mouseoverHref'>Walker, F. 1858. <em>Insecta Saundersiana: or characters of undescribed insects in the collection of William Wilson Saunders, Esq</em>. London : British Museum pp. 1-117.</a><!--MARK-->","","Book","8828aaad-2946-4ae9-b7df-9eb1003111c4","20081009T05:11:37.000+0000",""
"Walker, F.","1858","List of specimens of Homopterous insects in the collection of the British Museum. Supplement","369","","","","","British Museum (Natural History)","<!--MARK--><a href='nullfdce4388-ea8e-4493-aa7e-41a6695387d0' class='mouseoverHref'>Walker, F. 1858. <em>List of specimens of Homopterous insects in the collection of the British Museum. Supplement</em>. London : British Museum (Natural History) 369 pp.</a><!--MARK-->","","Book","fdce4388-ea8e-4493-aa7e-41a6695387d0","20081009T05:11:37.000+0000",""
