"PUB_AUTHOR","PUB_YEAR","PUB_TITLE","PUB_PAGES","PUB_PARENT_BOOK_TITLE","PUB_PARENT_JOURNAL_TITLE","PUB_PARENT_ARTICLE_TITLE","PUB_PUBLICATION_DATE","PUB_PUBLISHER","PUB_FORMATTED","PUB_QUALIFICATION","PUB_TYPE","PUBLICATION_GUID","PUBLICATION_LAST_UPDATE","PARENT_PUBLICATION_GUID"
"Allen, G.R.","1997","Marine Fishes of Tropical Australia and South-east Asia","292 pp. 106 pls","","","","","Western Australian Museum","<!--MARK--><a href='null4f61c4f6-5604-4752-9552-6f9bd9fdfa99' class='mouseoverHref'>Allen, G.R. 1997. <em>Marine Fishes of Tropical Australia and South-east Asia</em>. Perth : Western Australian Museum 292 pp. 106 pls.</a><!--MARK-->","","Book","4f61c4f6-5604-4752-9552-6f9bd9fdfa99","20081009T05:11:37.000+0000",""
"Allen, G.R. & Swainston, R.","1988","The Marine Fishes of North-Western Australia. A field guide for anglers and divers","vi 201 pp., 70 pls","","","","","Western Australian Museum","<!--MARK--><a href='null370d86f7-c121-49b9-9b97-511231fd781f' class='mouseoverHref'>Allen, G.R. & Swainston, R. 1988. <em>The Marine Fishes of North-Western Australia. A field guide for anglers and divers</em>. Perth, WA : Western Australian Museum vi 201 pp., 70 pls.</a><!--MARK-->","","Book","370d86f7-c121-49b9-9b97-511231fd781f","20111021T02:50:26.431+0000",""
"Fricke, R.","2005","Types in the fish collection of the Staatliches Museum für Naturkunde in Stuttgart, described in 1845-2004","1-95","","Stuttgarter Beiträge zur Naturkunde. Serie A (Biologie)","","","","<!--MARK--><a href='nulld39fe49d-6a2f-4750-8480-113ae3f982e8' class='mouseoverHref'>Fricke, R. 2005. Types in the fish collection of the Staatliches Museum für Naturkunde in Stuttgart, described in 1845-2004.</a> <!--MARK--><!--MARK--><a href='nullb9131741-2c94-4d33-a7c2-d35f26c72527' class='mouseoverHref'><em>Stuttgarter Beiträge zur Naturkunde. Serie A (Biologie)</em></a> <strong>684</strong>: 1-95<!--MARK-->","","Article in Journal","d39fe49d-6a2f-4750-8480-113ae3f982e8","20110805T00:16:06.353+0000","b9131741-2c94-4d33-a7c2-d35f26c72527"
"Grant, E.M.","1975","Guide to Fishes","640 pp.","","","","","Queensland Government, Co-ordinator General?s Department","<!--MARK--><a href='null930b11a7-6f7f-4f47-b047-02cf8cc07868' class='mouseoverHref'>Grant, E.M. 1975. <em>Guide to Fishes</em>. Brisbane : Queensland Government, Co-ordinator General?s Department 640 pp.</a><!--MARK-->","","Book","930b11a7-6f7f-4f47-b047-02cf8cc07868","20081009T05:11:37.000+0000",""
"Grant, E.M.","1991","Fishes of Australia","480 pp.","","","","","EM Grant Pty Ltd","<!--MARK--><a href='null91e7196f-4bce-468d-9157-c1ea88b1bd2f' class='mouseoverHref'>Grant, E.M. 1991. <em>Fishes of Australia</em>. Brisbane : EM Grant Pty Ltd 480 pp.</a><!--MARK-->","","Book","91e7196f-4bce-468d-9157-c1ea88b1bd2f","20081009T05:11:37.000+0000",""
"Grant, E.M.","2002","Guide to Fishes","880 pp.","","","","","EM Grant Pty Ltd","<!--MARK--><a href='null42420526-c395-4209-aacb-a7954c43b3cd' class='mouseoverHref'>Grant, E.M. 2002. <em>Guide to Fishes</em>. Redcliffe : EM Grant Pty Ltd 880 pp.</a><!--MARK-->","","Book","42420526-c395-4209-aacb-a7954c43b3cd","20081009T05:11:37.000+0000",""
"Hoese, D.F., Bray, D.J., Paxton, J.R. & Allen, G.R.","2006","Fishes. <em>In</em>, Beesley, P.L. & Wells, A. (eds) Zoological Catalogue of Australia. Vol. 35","2178","","","","","ABRS & CSIRO Publishing","<!--MARK--><a href='null0a6a2902-cbfa-4849-8a10-a529af8fee7d' class='mouseoverHref'>Hoese, D.F., Bray, D.J., Paxton, J.R. & Allen, G.R. 2006. <em>Fishes. <em>In</em>, Beesley, P.L. & Wells, A. (eds) Zoological Catalogue of Australia. Vol. 35</em>. <em>Volume 35</em> Australia : ABRS & CSIRO Publishing Parts 1-3, 2178 pp.</a><!--MARK-->","","Book","0a6a2902-cbfa-4849-8a10-a529af8fee7d","20180418T05:30:18.859+0000",""
"Hoese, D.F. & Bray, D.J.","2006","Family Leptobramidae","pp. 1280","Fishes. <em>In</em>, Beesley, P.L. & Wells, A. (eds) Zoological Catalogue of Australia. Vol. 35","","","","","<!--MARK--><a href='null7647c682-70d1-49cf-a126-071b5f3b7ca6' class='mouseoverHref'>Hoese, D.F. & Bray, D.J. 2006. Family Leptobramidae. pp. 1280</a> <!--MARK--><em>in</em> <!--MARK--><a href='null0a6a2902-cbfa-4849-8a10-a529af8fee7d' class='mouseoverHref'>Hoese, D.F., Bray, D.J., Paxton, J.R. & Allen, G.R. <em>Fishes. <em>In</em>, Beesley, P.L. & Wells, A. (eds) Zoological Catalogue of Australia. Vol. 35</em>. <em>Volume 35</em> Australia : ABRS & CSIRO Publishing Parts 1-3, 2178 pp.</a><!--MARK-->","","Chapter in Book","7647c682-70d1-49cf-a126-071b5f3b7ca6","20120122T13:31:52.202+0000","0a6a2902-cbfa-4849-8a10-a529af8fee7d"
"Johnson, J.W.","2010","Fishes of the Moreton Bay Marine Park and adjacent continental shelf waters, Queensland, Australia.","pp. 299-353","","Memoirs of the Queensland Museum","Proceedings of the Thirteenth International Marine Biological Workshop, The Marine Fauna and Flora of Moreton Bay","","","<!--MARK--><a href='null19d1c83e-8b5b-4d3b-aab2-8bfc45677252' class='mouseoverHref'>Johnson, J.W. 2010. Fishes of the Moreton Bay Marine Park and adjacent continental shelf waters, Queensland, Australia. pp. 299-353</a> <!--MARK--><em>in</em> <!--MARK--><a href='nullbef10d96-c300-4b36-b4f0-ce1923f90a19' class='mouseoverHref'>Davie, P.J.F. & Phillips, J.A. Proceedings of the Thirteenth International Marine Biological Workshop, The Marine Fauna and Flora of Moreton Bay.</a> <!--MARK--><!--MARK--><a href='null1a0a2982-9f30-43e1-a641-b0379699837c' class='mouseoverHref'><em>Memoirs of the Queensland Museum</em></a> <strong>54</strong>(3)<!--MARK-->","","Section in Article","19d1c83e-8b5b-4d3b-aab2-8bfc45677252","20121212T08:04:18.604+0000","bef10d96-c300-4b36-b4f0-ce1923f90a19"
"Larson, H.K. & Williams, R.S.","1997","Darwin Harbour fishes: a survey and annotated checklist","339-380","The Marine Flora and Fauna of Darwin Harbour, Northern Territory, Australia. Proceedings of the Sixth International  Marine Biology Workshop","","","","","<!--MARK--><a href='null1b8d3fea-59b5-484f-a6af-993735c3ea30' class='mouseoverHref'>Larson, H.K. & Williams, R.S. 1997. Darwin Harbour fishes: a survey and annotated checklist. pp. 339-380</a> <!--MARK--><em>in</em> <!--MARK--><a href='null70752299-3f11-4a85-baa1-80f42f74ab4c' class='mouseoverHref'>Hanley, H.R., Caswell, G., Megirian, D. & Larson, H.K. (eds). <em>The Marine Flora and Fauna of Darwin Harbour, Northern Territory, Australia. Proceedings of the Sixth International  Marine Biology Workshop</em>. Darwin : Museum and Art Gallery of the Northern Territory 466 pp.</a><!--MARK-->","","Chapter in Book","1b8d3fea-59b5-484f-a6af-993735c3ea30","20081009T05:11:37.000+0000","70752299-3f11-4a85-baa1-80f42f74ab4c"
"Macleay, W.J.","1881","Descriptive catalogue of the fishes of Australia. Part 2","510-629 pls 13-14","","Proceedings of the Linnean Society of New South Wales","","","","<!--MARK--><a href='nullab908bb4-4554-4d3b-aff4-d14cb0736d76' class='mouseoverHref'>Macleay, W.J. 1881. Descriptive catalogue of the fishes of Australia. Part 2.</a> <!--MARK--><!--MARK--><a href='nullc12cd779-adb5-41ea-bd2c-75f6864cf22e' class='mouseoverHref'><em>Proceedings of the Linnean Society of New South Wales</em></a> 1 <strong>5</strong>(4): 510-629 pls 13-14<!--MARK-->","","Article in Journal","ab908bb4-4554-4d3b-aff4-d14cb0736d76","20081009T05:11:37.000+0000","c12cd779-adb5-41ea-bd2c-75f6864cf22e"
"Marshall, T.C.","1964","Fishes of the Great Barrier Reef and Coastal Waters of Queensland","566 pp. 136 pls","","","","","Angus & Robertson","<!--MARK--><a href='null55952eaf-fe4c-482e-8650-e193fd8a6db4' class='mouseoverHref'>Marshall, T.C. 1964. <em>Fishes of the Great Barrier Reef and Coastal Waters of Queensland</em>. Sydney : Angus & Robertson 566 pp. 136 pls.</a><!--MARK-->","","Book","55952eaf-fe4c-482e-8650-e193fd8a6db4","20081009T05:11:37.000+0000",""
"McCulloch, A.R.","1929","A check-list of the fishes recorded from Australia. Part II","145-329","","Memoirs of the Australian Museum","","","","<!--MARK--><a href='nullf27925fa-c0dd-461b-95a4-9f80faed76bf' class='mouseoverHref'>McCulloch, A.R. 1929. A check-list of the fishes recorded from Australia. Part II.</a> <!--MARK--><!--MARK--><a href='null272826c2-c2bf-425b-bd6f-11ddaf2aaeaa' class='mouseoverHref'><em>Memoirs of the Australian Museum</em></a> <strong>5</strong>: 145-329<!--MARK-->","","Article in Journal","f27925fa-c0dd-461b-95a4-9f80faed76bf","20110331T13:51:19.162+0000","272826c2-c2bf-425b-bd6f-11ddaf2aaeaa"
"Mooi, R.D.","2001","Family Leptobramidae","pp. 3210","The Living Marine Resources of the Western Central Pacific. FAO Species Identification Guide for Fisheries Purposes","","","","","<!--MARK--><a href='null08d7f97c-c30b-44e5-bdb9-2277bec51a91' class='mouseoverHref'>Mooi, R.D. 2001. Family Leptobramidae. pp. 3210</a> <!--MARK--><em>in</em> <!--MARK--><a href='null60bd9e2a-89b8-4ced-9142-accb0d0db524' class='mouseoverHref'>Carpenter, K.E. & Niem, V.H. (eds). <em>The Living Marine Resources of the Western Central Pacific. FAO Species Identification Guide for Fisheries Purposes</em>. Rome : FAO Vol. 5 2791-3379 pp.</a><!--MARK-->","","Chapter in Book","08d7f97c-c30b-44e5-bdb9-2277bec51a91","20120122T09:17:28.577+0000","60bd9e2a-89b8-4ced-9142-accb0d0db524"
"Nelson, J.S.","2006","Fishes of the World","601 pp.","","","","","John Wiley & Sons, Inc.","<!--MARK--><a href='null1779d514-b8ea-4031-8b5b-d668b33699cd' class='mouseoverHref'>Nelson, J.S. 2006. <em>Fishes of the World</em>. Hoboken, New Jersey : John Wiley & Sons, Inc. 601 pp.</a><!--MARK-->","","Book","1779d514-b8ea-4031-8b5b-d668b33699cd","20081009T05:11:37.000+0000",""
"Pollard, J. (ed.)","1980","G.P. Whitley's Handbook of Australian Fishes","629 pp.","","","","","Jack Pollard Publishing Pty Ltd","<!--MARK--><a href='null50d19202-a17e-4885-bb5b-2932e8413206' class='mouseoverHref'>Pollard, J. (ed.) 1980. <em>G.P. Whitley's Handbook of Australian Fishes</em>. North Sydney : Jack Pollard Publishing Pty Ltd 629 pp.</a><!--MARK-->","","Book","50d19202-a17e-4885-bb5b-2932e8413206","20081009T05:11:37.000+0000",""
"Ramsay, E.P. & Ogilby, J.D.","1887","Descriptions of new Australian fishes","561-564","","Proceedings of the Linnean Society of New South Wales","","","","<!--MARK--><a href='nullaaab69c0-416f-4f8c-b0c9-409b6eeba061' class='mouseoverHref'>Ramsay, E.P. & Ogilby, J.D. 1887. Descriptions of new Australian fishes.</a> <!--MARK--><!--MARK--><a href='nullc12cd779-adb5-41ea-bd2c-75f6864cf22e' class='mouseoverHref'><em>Proceedings of the Linnean Society of New South Wales</em></a> 2 <strong>2</strong>(3): 561-564<!--MARK-->","","Article in Journal","aaab69c0-416f-4f8c-b0c9-409b6eeba061","20081009T05:11:37.000+0000","c12cd779-adb5-41ea-bd2c-75f6864cf22e"
"Seafood Services Australia","2008","Australian Fish Names Standard","","","","","","","<!--MARK--><a href='null4be1ce0c-a18a-4795-a6c0-b9ecb91bb936' class='mouseoverHref'>Seafood Services Australia 2008. Australian Fish Names Standard. http://www.fishnames.com.au/.</a>","","Miscellaneous","4be1ce0c-a18a-4795-a6c0-b9ecb91bb936","20081009T05:11:37.000+0000",""
"Steindachner, F.","1878","Ichthyologische Beiträge (7)","377-400","","Sitzungsberichte der Akademie der Wissenschaften in Wien","","","","<!--MARK--><a href='null9255e131-2f6d-4fd6-a0d4-5e82d0feb9e6' class='mouseoverHref'>Steindachner, F. 1878. Ichthyologische Beiträge (7).</a> <!--MARK--><!--MARK--><a href='null0f062e5b-29e5-4a6a-b0d9-9bcdad1024c9' class='mouseoverHref'><em>Sitzungsberichte der Akademie der Wissenschaften in Wien</em></a> <strong>78</strong>(1): 377-400<!--MARK-->","","Article in Journal","9255e131-2f6d-4fd6-a0d4-5e82d0feb9e6","20081009T05:11:37.000+0000","0f062e5b-29e5-4a6a-b0d9-9bcdad1024c9"
"Tominaga, Y.","1965","The internal morphology and systematic poisition of <i>Leptobramma mülleri</i>, formerly included in the family Pempheridae","33-56 figs 1-10","","Japanese Journal of Ichthyology","","","","<!--MARK--><a href='nullddbebe53-d2a2-4c9d-830f-557f57df4908' class='mouseoverHref'>Tominaga, Y. 1965. The internal morphology and systematic poisition of <i>Leptobramma mülleri</i>, formerly included in the family Pempheridae.</a> <!--MARK--><!--MARK--><a href='null781f1ceb-ad10-4775-80b6-40acb3197155' class='mouseoverHref'><em>Japanese Journal of Ichthyology</em></a> <strong>12</strong>(3/6): 33-56 figs 1-10<!--MARK-->","","Article in Journal","ddbebe53-d2a2-4c9d-830f-557f57df4908","20081009T05:11:37.000+0000","781f1ceb-ad10-4775-80b6-40acb3197155"
"Whitley, G.P.","1964","A survey of Australian Ichthyology","11-127","","Proceedings of the Linnean Society of New South Wales","","","","<!--MARK--><a href='nullf3980983-16bf-4fca-b2ea-83255a9ca6e2' class='mouseoverHref'>Whitley, G.P. 1964. A survey of Australian Ichthyology.</a> <!--MARK--><!--MARK--><a href='nullc12cd779-adb5-41ea-bd2c-75f6864cf22e' class='mouseoverHref'><em>Proceedings of the Linnean Society of New South Wales</em></a> <strong>89</strong>(1): 11-127<!--MARK-->","","Article in Journal","f3980983-16bf-4fca-b2ea-83255a9ca6e2","20081009T05:11:37.000+0000","c12cd779-adb5-41ea-bd2c-75f6864cf22e"
"Yearsley, G.K., Last, P.R. & Morris, G.B.","1997","Codes for Australian Aquatic Biota (CAAB): an upgraded and expanded species coding system for Australian fisheries databases","15 pp. + appendices","","","","","","<!--MARK--><a href='nulld0a1bd97-d100-402f-a9a7-22eeba8e3f36' class='mouseoverHref'>Yearsley, G.K., Last, P.R. & Morris, G.B. 1997. Codes for Australian Aquatic Biota (CAAB): an upgraded and expanded species coding system for Australian fisheries databases. CSIRO Marine Laboratories Report No. 224. 15 pp. + appendices</a>","","Miscellaneous","d0a1bd97-d100-402f-a9a7-22eeba8e3f36","20081009T05:11:37.000+0000",""
