"PUB_AUTHOR","PUB_YEAR","PUB_TITLE","PUB_PAGES","PUB_PARENT_BOOK_TITLE","PUB_PARENT_JOURNAL_TITLE","PUB_PARENT_ARTICLE_TITLE","PUB_PUBLICATION_DATE","PUB_PUBLISHER","PUB_FORMATTED","PUB_QUALIFICATION","PUB_TYPE","PUBLICATION_GUID","PUBLICATION_LAST_UPDATE","PARENT_PUBLICATION_GUID"
"Bolton, B.B.","1995","A New General Catalogue of the Ants of the World","504 pp","","","","","Harvard Univ. Press","<!--MARK--><a href='nulld43efbd9-9055-4b01-bb36-4c6d372220f9' class='mouseoverHref'>Bolton, B.B. 1995. <em>A New General Catalogue of the Ants of the World</em>. Cambridge, Massachusetts : Harvard Univ. Press 504 pp.</a><!--MARK-->","","Book","d43efbd9-9055-4b01-bb36-4c6d372220f9","20120809T07:30:23.716+0000",""
"Borowiec, M.L.","2016","Generic revision of the ant subfamily Dorylinae (Hymenoptera, Formicidae)","1-280","","ZooKeys","","","","<!--MARK--><a href='null916871c9-f28c-49cc-a373-6a3bf6e68803' class='mouseoverHref'>Borowiec, M.L. 2016. Generic revision of the ant subfamily Dorylinae (Hymenoptera, Formicidae).</a> <!--MARK--><!--MARK--><a href='null8cb7bef9-51f4-441c-a060-649dc8095e71' class='mouseoverHref'><em>ZooKeys</em></a> <strong>608</strong>: 1-280<!--MARK-->","","Article in Journal","916871c9-f28c-49cc-a373-6a3bf6e68803","20161222T05:02:29.380+0000","8cb7bef9-51f4-441c-a060-649dc8095e71"
"Brown, W.L. jr","1975","Contributions toward a reclassification of the Formicidae. V. Ponerinae, tribes Platythreini, Cerapachyini, Cylindromyrmecini, Acanthostichini, and Aenictogitini","1-116","","Search. Agriculture (Ithaca, New York)","","","","<!--MARK--><a href='null1b67959f-10f7-4449-b700-3210e8795410' class='mouseoverHref'>Brown, W.L. jr 1975. Contributions toward a reclassification of the Formicidae. V. Ponerinae, tribes Platythreini, Cerapachyini, Cylindromyrmecini, Acanthostichini, and Aenictogitini.</a> <!--MARK--><!--MARK--><a href='nullbe1f64c7-bb5b-45db-8dfc-5447fdfc2f26' class='mouseoverHref'><em>Search. Agriculture (Ithaca, New York)</em></a> <strong>5</strong>: 1-116<!--MARK-->","","Article in Journal","1b67959f-10f7-4449-b700-3210e8795410","20081009T05:11:37.000+0000","be1f64c7-bb5b-45db-8dfc-5447fdfc2f26"
"Clark, J.","1924","Australian Formicidae","75-89 pls. VI-VII","","Journal and Proceedings of the Royal Society of Western Australia","","30 Apr. 1924","","<!--MARK--><a href='nulld6865b0d-104d-4a57-8da3-9684219200c4' class='mouseoverHref'>Clark, J. 1924. Australian Formicidae.</a> <!--MARK--><!--MARK--><a href='null6d0a243e-835c-41cd-8202-41a5fa2dd983' class='mouseoverHref'><em>Journal and Proceedings of the Royal Society of Western Australia</em></a> <strong>10</strong>: 75-89 pls. VI-VII<!--MARK--> [Date published 30 Apr. 1924]","","Article in Journal","d6865b0d-104d-4a57-8da3-9684219200c4","20170119T02:24:13.759+0000","6d0a243e-835c-41cd-8202-41a5fa2dd983"
"Clark, J.","1924","Australian Formicidae","72-89","","Journal and Proceedings of the Royal Society of Western Australia","","4 Jan. 1924","","<!--MARK--><a href='null2c993108-05ce-41a5-a7a0-77abeec0cb36' class='mouseoverHref'>Clark, J. 1924. Australian Formicidae.</a> <!--MARK--><!--MARK--><a href='null6d0a243e-835c-41cd-8202-41a5fa2dd983' class='mouseoverHref'><em>Journal and Proceedings of the Royal Society of Western Australia</em></a> <strong>9</strong>(1923): 72-89<!--MARK--> [Date published 4 Jan. 1924]","","Article in Journal","2c993108-05ce-41a5-a7a0-77abeec0cb36","20170119T02:29:11.509+0000","6d0a243e-835c-41cd-8202-41a5fa2dd983"
"Clark, J.","1926","Australian Formicidae","43-51 pl. 6","","Journal of the Royal Society of Western Australia","","","","<!--MARK--><a href='null33ebcb8b-5200-4430-855b-b62446997816' class='mouseoverHref'>Clark, J. 1926. Australian Formicidae.</a> <!--MARK--><!--MARK--><a href='null666efb8f-4a3f-4a3d-ae40-e9ab98f3cdf5' class='mouseoverHref'><em>Journal of the Royal Society of Western Australia</em></a> <strong>12</strong>: 43-51 pl. 6<!--MARK--> [25 Jan. 1926]","25 Jan. 1926","Article in Journal","33ebcb8b-5200-4430-855b-b62446997816","20081009T05:11:37.000+0000","666efb8f-4a3f-4a3d-ae40-e9ab98f3cdf5"
"Clark, J.","1930","New Formicidae, with notes on some little-known species","2-25","","Proceedings of the Royal Society of Victoria","","","","<!--MARK--><a href='null5206afec-ac28-481b-959a-6bc144fcf778' class='mouseoverHref'>Clark, J. 1930. New Formicidae, with notes on some little-known species.</a> <!--MARK--><!--MARK--><a href='nullce333794-3a02-427f-ba27-346079f1efa0' class='mouseoverHref'><em>Proceedings of the Royal Society of Victoria</em></a> <strong>43</strong>: 2-25<!--MARK--> [30 Aug. 1930]","30 Aug. 1930","Article in Journal","5206afec-ac28-481b-959a-6bc144fcf778","20081009T05:11:37.000+0000","ce333794-3a02-427f-ba27-346079f1efa0"
"Clark, J.","1934","New Australian ants","21-47","","Memoirs of the National Museum of Victoria, Melbourne","","","","<!--MARK--><a href='nullf21d9de2-47e7-4782-a328-a63bada8566a' class='mouseoverHref'>Clark, J. 1934. New Australian ants.</a> <!--MARK--><!--MARK--><a href='null6d019674-04b0-4fab-8903-0612d147ec4d' class='mouseoverHref'><em>Memoirs of the National Museum of Victoria, Melbourne</em></a> <strong>8</strong>: 21-47<!--MARK-->","","Article in Journal","f21d9de2-47e7-4782-a328-a63bada8566a","20081009T05:11:37.000+0000","6d019674-04b0-4fab-8903-0612d147ec4d"
"Clark, J.","1941","Australian Formicidae. Notes and new species","71-94","","Memoirs of the National Museum of Victoria, Melbourne","","","","<!--MARK--><a href='nulldb6a5607-be52-4a6a-929c-05bdaaf59edb' class='mouseoverHref'>Clark, J. 1941. Australian Formicidae. Notes and new species.</a> <!--MARK--><!--MARK--><a href='null6d019674-04b0-4fab-8903-0612d147ec4d' class='mouseoverHref'><em>Memoirs of the National Museum of Victoria, Melbourne</em></a> <strong>12</strong>: 71-94<!--MARK-->","","Article in Journal","db6a5607-be52-4a6a-929c-05bdaaf59edb","20081009T05:11:37.000+0000","6d019674-04b0-4fab-8903-0612d147ec4d"
"Crawley, W.C.","1922","New ants from Australia","427-448","","Annals and Magazine of Natural History","","","","<!--MARK--><a href='nullab1179b9-d264-40af-8a5e-d7c1bf8a9bbb' class='mouseoverHref'>Crawley, W.C. 1922. New ants from Australia.</a> <!--MARK--><!--MARK--><a href='nullefa8de69-3a29-4a43-8ef2-cbefda205976' class='mouseoverHref'><em>Annals and Magazine of Natural History</em></a> 9 <strong>9</strong>: 427-448<!--MARK-->","","Article in Journal","ab1179b9-d264-40af-8a5e-d7c1bf8a9bbb","20100617T02:46:04.049+0000","efa8de69-3a29-4a43-8ef2-cbefda205976"
"Emery, C.","1902","Note mirmecologiche","22-34","","Rendiconto delle Sessioni della R. Accademia delle Scienze dell'Istituto di Bologna","","31 Dec. 1902","","<!--MARK--><a href='nulla082d867-d481-4778-a70d-3502a63ef4ca' class='mouseoverHref'>Emery, C. 1902. Note mirmecologiche.</a> <!--MARK--><!--MARK--><a href='nulle62f95b4-6a5a-417a-bcfd-9cfc6ea2b3a8' class='mouseoverHref'><em>Rendiconto delle Sessioni della R. Accademia delle Scienze dell'Istituto di Bologna</em></a> N.S. <strong>6</strong>(1901): 22-34<!--MARK--> [Date published 31 Dec. 1902]","","Article in Journal","a082d867-d481-4778-a70d-3502a63ef4ca","20170119T03:43:53.041+0000","e62f95b4-6a5a-417a-bcfd-9cfc6ea2b3a8"
"Forel, A.","1895","Nouvelles fourmis d'Australie, récoltée à The Ridge, Mackay, Queensland par M. Gilbert Turner","417-428","","Annales de la Société Entomologique de Belgique (Comptes-rendus)","","","","<!--MARK--><a href='null9c0e99b7-8d18-4c87-9cd0-57b34e688e09' class='mouseoverHref'>Forel, A. 1895. Nouvelles fourmis d'Australie, récoltée à The Ridge, Mackay, Queensland par M. Gilbert Turner.</a> <!--MARK--><!--MARK--><a href='nullacc7fcdb-707a-4cbe-8f70-d7595ac25c58' class='mouseoverHref'><em>Annales de la Société Entomologique de Belgique (Comptes-rendus)</em></a> <strong>39</strong>: 417-428<!--MARK-->","","Article in Journal","9c0e99b7-8d18-4c87-9cd0-57b34e688e09","20081009T05:11:37.000+0000","acc7fcdb-707a-4cbe-8f70-d7595ac25c58"
"Forel, A.","1900","Ponerinae et Dorylinae d'Australie récoltées par MM. Turner, Froggatt, Nugent, Chase, Rothney, J.J. Walker, etc","54-77","","Annales de la Société Entomologique de Belgique (Comptes-rendus)","","","","<!--MARK--><a href='null7b6ad079-b3b4-41e1-bf48-df8223edc27a' class='mouseoverHref'>Forel, A. 1900. Ponerinae et Dorylinae d'Australie récoltées par MM. Turner, Froggatt, Nugent, Chase, Rothney, J.J. Walker, etc.</a> <!--MARK--><!--MARK--><a href='nullacc7fcdb-707a-4cbe-8f70-d7595ac25c58' class='mouseoverHref'><em>Annales de la Société Entomologique de Belgique (Comptes-rendus)</em></a> <strong>44</strong>: 54-77<!--MARK-->","","Article in Journal","7b6ad079-b3b4-41e1-bf48-df8223edc27a","20081009T05:11:37.000+0000","acc7fcdb-707a-4cbe-8f70-d7595ac25c58"
"Forel, A.","1902","Fourmis nouvelles d'Australie","405-548","","Revue Suisse de Zoologie","","","","<!--MARK--><a href='nullea03fd29-80e8-4730-ab7b-ce0c94fa3353' class='mouseoverHref'>Forel, A. 1902. Fourmis nouvelles d'Australie.</a> <!--MARK--><!--MARK--><a href='nulldd4d5125-6d92-411c-86c0-7181702e62a5' class='mouseoverHref'><em>Revue Suisse de Zoologie</em></a> <strong>10</strong>: 405-548<!--MARK-->","","Article in Journal","ea03fd29-80e8-4730-ab7b-ce0c94fa3353","20081009T05:11:37.000+0000","dd4d5125-6d92-411c-86c0-7181702e62a5"
"Forel, A.","1910","Formicides australiens reçus de M. M. Froggatt et Rowland Turner","1-94","","Revue Suisse de Zoologie","","","","<!--MARK--><a href='null001b5384-1ce0-4e72-b79a-151ab261df31' class='mouseoverHref'>Forel, A. 1910. Formicides australiens reçus de M. M. Froggatt et Rowland Turner.</a> <!--MARK--><!--MARK--><a href='nulldd4d5125-6d92-411c-86c0-7181702e62a5' class='mouseoverHref'><em>Revue Suisse de Zoologie</em></a> <strong>18</strong>: 1-94<!--MARK-->","","Article in Journal","001b5384-1ce0-4e72-b79a-151ab261df31","20081009T05:11:37.000+0000","dd4d5125-6d92-411c-86c0-7181702e62a5"
"Forel, A.","1915","Results of Dr. E. Mjöbergs Swedish Scientific Expeditions to Australia 1910-1913. 2. Ameisen","1-119, pls 1-3","","Arkiv för Zoologi","","4 Dec. 1915","","<!--MARK--><a href='null754605fe-9d76-4139-a599-27700cd29d6c' class='mouseoverHref'>Forel, A. 1915. Results of Dr. E. Mjöbergs Swedish Scientific Expeditions to Australia 1910-1913. 2. Ameisen.</a> <!--MARK--><!--MARK--><a href='nullea0f28cc-317a-4542-aaf0-5fa8122b7a93' class='mouseoverHref'><em>Arkiv för Zoologi</em></a> <strong>9</strong>(no.16): 1-119, pls 1-3<!--MARK--> [Date published 4 Dec. 1915]","","Article in Journal","754605fe-9d76-4139-a599-27700cd29d6c","20170119T05:38:42.679+0000","ea0f28cc-317a-4542-aaf0-5fa8122b7a93"
"Framenau, V.W. & Thomas, M.L.","2008","Ants (Hymenoptera: Formicidae) of Christmas Island (Indian Ocean): identification and distribution.","45-85","","Records of the Western Australian Museum","","","","<!--MARK--><a href='nulla69c0f66-cdca-4741-8b6a-2fb97e2379bd' class='mouseoverHref'>Framenau, V.W. & Thomas, M.L. 2008. Ants (Hymenoptera: Formicidae) of Christmas Island (Indian Ocean): identification and distribution.</a> <!--MARK--><!--MARK--><a href='nulla2cbd1fb-97d5-493a-a1d7-c2b99709890b' class='mouseoverHref'><em>Records of the Western Australian Museum</em></a> <strong>25</strong>: 45-85<!--MARK-->","","Article in Journal","a69c0f66-cdca-4741-8b6a-2fb97e2379bd","20150310T00:29:15.918+0000","a2cbd1fb-97d5-493a-a1d7-c2b99709890b"
"Heterick, B.E.","2009","A guide to the ants of the South-West Botanical Province, Western Australia","1-206","","Records of the Western Australian Museum, Supplement","","","","<!--MARK--><a href='null6528b684-6cc0-469f-8ddb-84985a3711ad' class='mouseoverHref'>Heterick, B.E. 2009. A guide to the ants of the South-West Botanical Province, Western Australia.</a> <!--MARK--><!--MARK--><a href='null841f1546-1bce-4548-adc9-7b08f6ca73a0' class='mouseoverHref'><em>Records of the Western Australian Museum, Supplement</em></a> <strong>76</strong>: 1-206<!--MARK-->","","Article in Journal","6528b684-6cc0-469f-8ddb-84985a3711ad","20110121T00:35:54.162+0000","841f1546-1bce-4548-adc9-7b08f6ca73a0"
"Heterick, B.E.","2013","A taxonomic overview and key to the ants of Barrow Island, Western Australia","375-404","","Records of the Western Australian Museum, Supplement","","","","<!--MARK--><a href='null8c43a6c0-7d42-43ad-8b7c-97dad42f2bf6' class='mouseoverHref'>Heterick, B.E. 2013. A taxonomic overview and key to the ants of Barrow Island, Western Australia.</a> <!--MARK--><!--MARK--><a href='null841f1546-1bce-4548-adc9-7b08f6ca73a0' class='mouseoverHref'><em>Records of the Western Australian Museum, Supplement</em></a> <strong>83</strong>: 375-404<!--MARK-->","","Article in Journal","8c43a6c0-7d42-43ad-8b7c-97dad42f2bf6","20140327T02:14:35.059+0000","841f1546-1bce-4548-adc9-7b08f6ca73a0"
"Mayr, G.L.","1879","Beiträge zur Amesien-Fauna Asiens","645-686","","Verhandlungen der Zoologisch-Botanischen Gesellschaft in Wien","","","","<!--MARK--><a href='nullad88f4dd-24ed-4c26-8033-aebbcc30adec' class='mouseoverHref'>Mayr, G.L. 1879. Beiträge zur Amesien-Fauna Asiens.</a> <!--MARK--><!--MARK--><a href='null14e4d839-6bc2-42e9-ae1b-979730866002' class='mouseoverHref'><em>Verhandlungen der Zoologisch-Botanischen Gesellschaft in Wien</em></a> <strong>28</strong>(1878): 645-686<!--MARK-->","","Article in Journal","ad88f4dd-24ed-4c26-8033-aebbcc30adec","20170118T23:20:26.751+0000","14e4d839-6bc2-42e9-ae1b-979730866002"
"Viehmeyer, H.","1914","Neue und unvollständig bekannte Ameisen der Alten Welt","24-60","","Archiv für Naturgeschichte","","","","<!--MARK--><a href='nullc8329eb1-1eb7-4c0c-b810-00b19c390b93' class='mouseoverHref'>Viehmeyer, H. 1914. Neue und unvollständig bekannte Ameisen der Alten Welt.</a> <!--MARK--><!--MARK--><a href='nullf5b5f7c7-fc53-4502-951d-1c96b680d874' class='mouseoverHref'><em>Archiv für Naturgeschichte</em></a> <strong>79A [1913]</strong>(12): 24-60<!--MARK-->","","Article in Journal","c8329eb1-1eb7-4c0c-b810-00b19c390b93","20140430T23:24:28.232+0000","f5b5f7c7-fc53-4502-951d-1c96b680d874"
"Viehmeyer, H.","1924","Formiciden der australischen Faunenregion","219-229","","Entomologische Mitteilungen. Berlin-Dahlem","","","","<!--MARK--><a href='nullba543bc1-c943-4a6b-aa47-2fd8fd22c8b3' class='mouseoverHref'>Viehmeyer, H. 1924. Formiciden der australischen Faunenregion.</a> <!--MARK--><!--MARK--><a href='nullac06ba2d-be9d-4dfe-91bb-bb21ae357dec' class='mouseoverHref'><em>Entomologische Mitteilungen. Berlin-Dahlem</em></a> <strong>13</strong>: 219-229<!--MARK-->","","Article in Journal","ba543bc1-c943-4a6b-aa47-2fd8fd22c8b3","20081009T05:11:37.000+0000","ac06ba2d-be9d-4dfe-91bb-bb21ae357dec"
"Wheeler, W.M.","1918","The Australian ants of the ponerine tribe Cerapachyini","213-265","","Proceedings of the American Academy of Arts and Sciences","","","","<!--MARK--><a href='null363fc761-9e55-4397-a8e7-1c37d851d165' class='mouseoverHref'>Wheeler, W.M. 1918. The Australian ants of the ponerine tribe Cerapachyini.</a> <!--MARK--><!--MARK--><a href='nullf2b4781b-5420-4d64-8c37-1e2f1df0a1e3' class='mouseoverHref'><em>Proceedings of the American Academy of Arts and Sciences</em></a> <strong>53</strong>: 213-265<!--MARK-->","","Article in Journal","363fc761-9e55-4397-a8e7-1c37d851d165","20081009T05:11:37.000+0000","f2b4781b-5420-4d64-8c37-1e2f1df0a1e3"
