"PUB_AUTHOR","PUB_YEAR","PUB_TITLE","PUB_PAGES","PUB_PARENT_BOOK_TITLE","PUB_PARENT_JOURNAL_TITLE","PUB_PARENT_ARTICLE_TITLE","PUB_PUBLICATION_DATE","PUB_PUBLISHER","PUB_FORMATTED","PUB_QUALIFICATION","PUB_TYPE","PUBLICATION_GUID","PUBLICATION_LAST_UPDATE","PARENT_PUBLICATION_GUID"
"Blackburn, T.","1892","Further notes on Australian Coleoptera, with descriptions of new genera and species. Part XII","207-261","","Transactions of the Royal Society of South Australia","","","","<!--MARK--><a href='null0d84cf24-1eeb-492f-b841-63c4658cc46e' class='mouseoverHref'>Blackburn, T. 1892. Further notes on Australian Coleoptera, with descriptions of new genera and species. Part XII.</a> <!--MARK--><!--MARK--><a href='null8b48b0a3-dd7a-4aea-be0d-10a223710ebc' class='mouseoverHref'><em>Transactions of the Royal Society of South Australia</em></a> <strong>15</strong>(2): 207-261<!--MARK-->","","Article in Journal","0d84cf24-1eeb-492f-b841-63c4658cc46e","20081009T05:11:37.000+0000","8b48b0a3-dd7a-4aea-be0d-10a223710ebc"
"Blackburn, T.","1892","Further notes on Australian Coleoptera with descriptions of new genera and species. Part XI","20-73","","Transactions of the Royal Society of South Australia","","July 1892","","<!--MARK--><a href='null9d396cf6-3248-4caf-9f5c-114c43249402' class='mouseoverHref'>Blackburn, T. 1892. Further notes on Australian Coleoptera with descriptions of new genera and species. Part XI.</a> <!--MARK--><!--MARK--><a href='null8b48b0a3-dd7a-4aea-be0d-10a223710ebc' class='mouseoverHref'><em>Transactions of the Royal Society of South Australia</em></a> <strong>15</strong>(1): 20-73<!--MARK--> [Date published July 1892]","","Article in Journal","9d396cf6-3248-4caf-9f5c-114c43249402","20111219T20:58:00.395+0000","8b48b0a3-dd7a-4aea-be0d-10a223710ebc"
"Boisduval, J.A.","1835","Voyage de Découvertes de l'<i>Astrolabe</i> exécuté par ordre du Roi, pendant les années 1826-1827-1828-1829, sous le commandement de M.J. Dumont d'Urville. Faune Entomologique de l'Océan Pacifique, avec l'illustration des insectes nouveaux recueillis pendant le voyage. 2me Partie. Coléoptères et autres Ordres","vii 716 pp.","","","","27-III-1835","J. Tastu","<!--MARK--><a href='nullf3f620b1-a19c-439c-88b6-243e5593b6bf' class='mouseoverHref'>Boisduval, J.A. 1835. <em>Voyage de Découvertes de l'<i>Astrolabe</i> exécuté par ordre du Roi, pendant les années 1826-1827-1828-1829, sous le commandement de M.J. Dumont d'Urville. Faune Entomologique de l'Océan Pacifique, avec l'illustration des insectes nouveaux recueillis pendant le voyage. 2me Partie. Coléoptères et autres Ordres</em>. Paris : J. Tastu vii 716 pp.</a><!--MARK--> [Date published 27-III-1835]","","Book","f3f620b1-a19c-439c-88b6-243e5593b6bf","20110901T05:19:23.377+0000",""
"Erichson, W.F.","1842","Beitrag zur Insecten-fauna von Vandiemensland, mit besonderer Berucksichtigung der geographischen Verbreitung der Insecten","83-287, pls 4, 5","","Archiv für Naturgeschichte","","","","<!--MARK--><a href='null2ae5a27f-fd1b-4bb9-b72e-a5997ccf96b3' class='mouseoverHref'>Erichson, W.F. 1842. Beitrag zur Insecten-fauna von Vandiemensland, mit besonderer Berucksichtigung der geographischen Verbreitung der Insecten.</a> <!--MARK--><!--MARK--><a href='nullf5b5f7c7-fc53-4502-951d-1c96b680d874' class='mouseoverHref'><em>Archiv für Naturgeschichte</em></a> <strong>8</strong>(1): 83-287, pls 4, 5<!--MARK-->","","Article in Journal","2ae5a27f-fd1b-4bb9-b72e-a5997ccf96b3","20120514T22:59:43.847+0000","f5b5f7c7-fc53-4502-951d-1c96b680d874"
"Gahan, C.J.","1893","Notes on the longicornia of Australia and Tasmania. Part I., with a list of the species collected by Mr. J. J. Walker, R.N., F.L.S., and descriptions of new forms","165-197","","Transactions of the Entomological Society of London","","","","<!--MARK--><a href='nulla0f2a3ae-8aa3-497c-a247-7ce9a6623588' class='mouseoverHref'>Gahan, C.J. 1893. Notes on the longicornia of Australia and Tasmania. Part I., with a list of the species collected by Mr. J. J. Walker, R.N., F.L.S., and descriptions of new forms.</a> <!--MARK--><!--MARK--><a href='null5cf355b3-abc5-451e-9abc-ed3282d7811a' class='mouseoverHref'><em>Transactions of the Entomological Society of London</em></a> <strong>1893</strong>: 165-197<!--MARK-->","","Article in Journal","a0f2a3ae-8aa3-497c-a247-7ce9a6623588","","5cf355b3-abc5-451e-9abc-ed3282d7811a"
"Gahan, C.J. in Waterhouse, C.O., Gahan, C.J. & Arrow, G.J.","1900","Order 4.-Coleoptera. New species descriptions","89-127","A Monograph of Christmas Island (Indian Ocean): physical features and geology; with descriptions of the fauna and flora by numerous contributors","","","","","<!--MARK--><a href='null75f7592f-8451-466c-92dd-5e5e31e73e24' class='mouseoverHref'>Gahan, C.J. <i>in</i> Waterhouse, C.O., Gahan, C.J. & Arrow, G.J. 1900. Order 4.-Coleoptera. New species descriptions. pp. 89-127</a> <!--MARK--><em>in</em> <!--MARK--><a href='null57813ba9-0a9a-466d-a644-d9d62e6fee70' class='mouseoverHref'>Andrews, C.W. (ed.). <em>A Monograph of Christmas Island (Indian Ocean): physical features and geology; with descriptions of the fauna and flora by numerous contributors</em>. London : British Museum (Natural History) xiii 337 pp.</a><!--MARK-->","","Chapter in Book","75f7592f-8451-466c-92dd-5e5e31e73e24","","57813ba9-0a9a-466d-a644-d9d62e6fee70"
"Hope, F.W.","1842","Observations on the Coleoptera of Port Essington, in Australia","423-430","","Annals and Magazine of Natural History","","1 Jul. 1842","","<!--MARK--><a href='null57111391-589c-4234-9e94-e5291bb1b508' class='mouseoverHref'>Hope, F.W. 1842. Observations on the Coleoptera of Port Essington, in Australia.</a> <!--MARK--><!--MARK--><a href='nullefa8de69-3a29-4a43-8ef2-cbefda205976' class='mouseoverHref'><em>Annals and Magazine of Natural History</em></a> 1 <strong>9</strong>: 423-430<!--MARK--> [Date published 1 Jul. 1842]","","Article in Journal","57111391-589c-4234-9e94-e5291bb1b508","20110420T01:57:36.925+0000","efa8de69-3a29-4a43-8ef2-cbefda205976"
"Jordan, K.","1895","Einige neue Käfer der Indo-Australischen Region in der Sammlung des Tring-Museums","266-271","","Stettiner Entomologische Zeitung","","Jul.-Sept. 1895","","<!--MARK--><a href='nullbc1b69e0-1701-469a-80c0-f7b83cd771d6' class='mouseoverHref'>Jordan, K. 1895. Einige neue Käfer der Indo-Australischen Region in der Sammlung des Tring-Museums.</a> <!--MARK--><!--MARK--><a href='null465e4fb4-3888-447c-909a-af4f7a23b95d' class='mouseoverHref'><em>Stettiner Entomologische Zeitung</em></a> <strong>56</strong>(7-9): 266-271<!--MARK--> [Date published Jul.-Sept. 1895]","","Article in Journal","bc1b69e0-1701-469a-80c0-f7b83cd771d6","20120111T22:01:27.184+0000","465e4fb4-3888-447c-909a-af4f7a23b95d"
"Lacordaire, J.T.","1869","Histoire naturelle des insectes. Genera des Coléoptères. Tome 8. Contenant les familles des Tricténotomides et des Longicornes","pp. 1-552","","","","","Paris : Librairie Encyclopédique de Roret","<!--MARK--><a href='null2624e877-ce46-479e-9c76-262723ebb860' class='mouseoverHref'>Lacordaire, J.T. 1869. <em>Histoire naturelle des insectes. Genera des Coléoptères. Tome 8. Contenant les familles des Tricténotomides et des Longicornes</em>. Paris : Librairie Encyclopédique de Roret pp. 1-552.</a><!--MARK-->","","Book","2624e877-ce46-479e-9c76-262723ebb860","20150128T02:10:33.780+0000",""
"Lameere, A.","1903","Revision des Prionides. Macrotomines","1-216","","Mémoires de la Société Entomologique de Belgique","","","","<!--MARK--><a href='null9adf8324-51a8-4a22-a333-49d9b5da33f7' class='mouseoverHref'>Lameere, A. 1903. Revision des Prionides. Macrotomines.</a> <!--MARK--><!--MARK--><a href='null919e8bdf-0a87-4070-9049-04f444aeaa06' class='mouseoverHref'><em>Mémoires de la Société Entomologique de Belgique</em></a> <strong>11</strong>: 1-216<!--MARK-->","","Article in Journal","9adf8324-51a8-4a22-a333-49d9b5da33f7","","919e8bdf-0a87-4070-9049-04f444aeaa06"
"Lameere, A.","1912","Revision des Prionides. Anacolines - Addenda et corrigenda","1-188","","Mémoires de la Société Entomologique de Belgique","","","","<!--MARK--><a href='nullbd38b75b-f7ff-42f9-a660-e47ca00c5024' class='mouseoverHref'>Lameere, A. 1912. Revision des Prionides. Anacolines - Addenda et corrigenda.</a> <!--MARK--><!--MARK--><a href='null919e8bdf-0a87-4070-9049-04f444aeaa06' class='mouseoverHref'><em>Mémoires de la Société Entomologique de Belgique</em></a> <strong>21</strong>: 1-188<!--MARK-->","","Article in Journal","bd38b75b-f7ff-42f9-a660-e47ca00c5024","","919e8bdf-0a87-4070-9049-04f444aeaa06"
"Lameere, A.","1916","Trois Prioninae nouveaux [Col. Cerambycidae]","233-235","","Bulletin de la Société Entomologique de France","","","","<!--MARK--><a href='nulldc7b0a24-3bad-4aff-8d6f-3ba366f195e7' class='mouseoverHref'>Lameere, A. 1916. Trois Prioninae nouveaux [Col. Cerambycidae].</a> <!--MARK--><!--MARK--><a href='null7853f77c-aa1b-42ec-bc2c-9758f7ff72c7' class='mouseoverHref'><em>Bulletin de la Société Entomologique de France</em></a> <strong>1916</strong>(15): 233-235<!--MARK-->","","Article in Journal","dc7b0a24-3bad-4aff-8d6f-3ba366f195e7","","7853f77c-aa1b-42ec-bc2c-9758f7ff72c7"
"Macleay, W.S.","1826","Annulosa, Catalogue of Insects, collected by Captain King, R.N","app. B, pp. 438-469, Table B","Narrative of a Survey of the Intertropical and Western Coasts of Australia. Performed between the years 1818 and 1822; with Appendix B","","","","","<!--MARK--><a href='nulle73e5ddf-498e-4a14-bc9d-ce16ec653bcc' class='mouseoverHref'>Macleay, W.S. 1826. Annulosa, Catalogue of Insects, collected by Captain King, R.N. app. B, pp. 438-469, Table B</a> <!--MARK--><em>in</em> <!--MARK--><a href='null7c52cb72-04a4-4b61-94c3-c0bed85a22ab' class='mouseoverHref'>King, P.P. (ed.). <em>Narrative of a Survey of the Intertropical and Western Coasts of Australia. Performed between the years 1818 and 1822; with Appendix B</em>. London : John Murray Vol. 2 viii 637 pp., 9 pls.</a><!--MARK--> [Date published 15 Apr 1826: imprint 1827]<!--MARK--> [Publication date established from Common, I.F.B. & Moulds, M.S. 1973. The date of publication of Captain Phillip King's Narrative of a survey of the intertropical and western coasts of Australia. <em>Journal of the Society for the Bibliography of Natural History</em> <strong>6</strong>(4): 257-259]","Publication date established from Common, I.F.B. & Moulds, M.S. 1973. The date of publication of Captain Phillip King's Narrative of a survey of the intertropical and western coasts of Australia. <em>Journal of the Society for the Bibliography of Natural History</em> <strong>6</strong>(4): 257-259","Chapter in Book","e73e5ddf-498e-4a14-bc9d-ce16ec653bcc","20140729T05:24:34.347+0000","7c52cb72-04a4-4b61-94c3-c0bed85a22ab"
"Newman, E.","1840","Nonnullorum Cerambycitum novorum, Novam Hollandiam et Insulam Van Diemen habitantium characteres","14-21","","Annals of Natural History","","Mar. 1840","","<!--MARK--><a href='null912c75f2-d7d6-47e8-ac77-4c05a8f913c6' class='mouseoverHref'>Newman, E. 1840. Nonnullorum Cerambycitum novorum, Novam Hollandiam et Insulam Van Diemen habitantium characteres.</a> <!--MARK--><!--MARK--><a href='null49064907-7f69-404b-b6d0-6e1a9be97dbb' class='mouseoverHref'><em>Annals of Natural History</em></a> 1 <strong>5</strong>: 14-21<!--MARK--> [Date published Mar. 1840]","","Article in Journal","912c75f2-d7d6-47e8-ac77-4c05a8f913c6","20120111T21:22:26.391+0000","49064907-7f69-404b-b6d0-6e1a9be97dbb"
"Newman, E.","1842","List of longicorns collected at Port Phillip, South Australia, by Edmund Higgins, Esq","351-354","","The Entomologist","","Aug. 1842","","<!--MARK--><a href='null4d33b6bd-36cd-426b-a85d-63c8b7e9b1af' class='mouseoverHref'>Newman, E. 1842. List of longicorns collected at Port Phillip, South Australia, by Edmund Higgins, Esq.</a> <!--MARK--><!--MARK--><a href='nullf3b5bc68-9fcf-42d6-b01d-f490d96af7e9' class='mouseoverHref'><em>The Entomologist</em></a> <strong>1</strong>(22): 351-354<!--MARK--> [Date published Aug. 1842]","","Article in Journal","4d33b6bd-36cd-426b-a85d-63c8b7e9b1af","20120111T22:03:53.944+0000","f3b5bc68-9fcf-42d6-b01d-f490d96af7e9"
"Newman, E.","1844","Description of <i>Hermerius impar</i>, a new beetle belonging to the stirps Macrocera and the natural order Cerambycites","414-415","","The Zoologist","","","","<!--MARK--><a href='nullf04e7937-d014-4fd7-bd09-ea5fb2dbedfd' class='mouseoverHref'>Newman, E. 1844. Description of <i>Hermerius impar</i>, a new beetle belonging to the stirps Macrocera and the natural order Cerambycites.</a> <!--MARK--><!--MARK--><a href='null8e1a36ca-3e07-4349-a03e-0b086b2588b3' class='mouseoverHref'><em>The Zoologist</em></a> <strong>2</strong>: 414-415<!--MARK-->","","Article in Journal","f04e7937-d014-4fd7-bd09-ea5fb2dbedfd","","8e1a36ca-3e07-4349-a03e-0b086b2588b3"
"Pascoe, F.P.","1859","On new genera and species of longicorn Coleoptera. Part IV","12-16","","Transactions of the Entomological Society of London","","May 1859","","<!--MARK--><a href='nulla99e0f70-79cc-4991-a9a7-25e8a0fd9032' class='mouseoverHref'>Pascoe, F.P. 1859. On new genera and species of longicorn Coleoptera. Part IV.</a> <!--MARK--><!--MARK--><a href='null5cf355b3-abc5-451e-9abc-ed3282d7811a' class='mouseoverHref'><em>Transactions of the Entomological Society of London</em></a> n.s. <strong>5</strong>(1): 12-16<!--MARK--> [Date published May 1859: <B>5</B> (1): 17-32 [Feb. 1859]; <B>5 </B>(2): 33-61 pl. ii]","<B>5</B> (1): 17-32 [Feb. 1859]; <B>5 </B>(2): 33-61 pl. ii","Article in Journal","a99e0f70-79cc-4991-a9a7-25e8a0fd9032","20120111T21:50:31.191+0000","5cf355b3-abc5-451e-9abc-ed3282d7811a"
"Pascoe, F.P.","1863","Notices of new or little-known genera and species of Coleoptera. Part IV","26-56 pls ii-iii","","Journal of Entomology","","Jan. 1863","","<!--MARK--><a href='null2d295ab9-11f2-4a20-b182-445c408e9dae' class='mouseoverHref'>Pascoe, F.P. 1863. Notices of new or little-known genera and species of Coleoptera. Part IV.</a> <!--MARK--><!--MARK--><a href='null594ca738-5ec4-4752-84d7-686b8074e352' class='mouseoverHref'><em>Journal of Entomology</em></a> <strong>2</strong>: 26-56 pls ii-iii<!--MARK--> [Date published Jan. 1863]","","Article in Journal","2d295ab9-11f2-4a20-b182-445c408e9dae","20120111T21:43:15.308+0000","594ca738-5ec4-4752-84d7-686b8074e352"
"Pascoe, F.P.","1864","Descriptions of some new Australian longicornia","223-245 pl. xi","","Journal of Entomology","","Jun. 1864","","<!--MARK--><a href='nulle855ebb8-2501-4503-bc3b-e07777e37cef' class='mouseoverHref'>Pascoe, F.P. 1864. Descriptions of some new Australian longicornia.</a> <!--MARK--><!--MARK--><a href='null594ca738-5ec4-4752-84d7-686b8074e352' class='mouseoverHref'><em>Journal of Entomology</em></a> <strong>2</strong>(10): 223-245 pl. xi<!--MARK--> [Date published Jun. 1864]","","Article in Journal","e855ebb8-2501-4503-bc3b-e07777e37cef","20120111T21:42:12.489+0000","594ca738-5ec4-4752-84d7-686b8074e352"
"Pascoe, F.P.","1871","Descriptions of new genera and species of longicorns, including three new subfamilies","268-281 pl. xiii","","Annals and Magazine of Natural History","","Oct. 1871","","<!--MARK--><a href='null74d61f94-7214-462a-ba0b-726169b34c40' class='mouseoverHref'>Pascoe, F.P. 1871. Descriptions of new genera and species of longicorns, including three new subfamilies.</a> <!--MARK--><!--MARK--><a href='nullefa8de69-3a29-4a43-8ef2-cbefda205976' class='mouseoverHref'><em>Annals and Magazine of Natural History</em></a> 4 <strong>8</strong>(46): 268-281 pl. xiii<!--MARK--> [Date published Oct. 1871]","","Article in Journal","74d61f94-7214-462a-ba0b-726169b34c40","20120111T21:31:20.247+0000","efa8de69-3a29-4a43-8ef2-cbefda205976"
"Quentin, R.M. & Villiers, A.","1981","Les Macrotomini de l'ancien monde (Région Éthiopienne exclue) genera et catalogue raisonné [Col. Cerambycidae Prioninae]","359-393","","Annales de la Société Entomologique de France","","","","<!--MARK--><a href='nullf5c755a8-ee8c-4a02-84e0-0c24e727dcd0' class='mouseoverHref'>Quentin, R.M. & Villiers, A. 1981. Les Macrotomini de l'ancien monde (Région Éthiopienne exclue) genera et catalogue raisonné [Col. Cerambycidae Prioninae].</a> <!--MARK--><!--MARK--><a href='null6462279b-2aaf-46a3-a434-cab7d8a2c33d' class='mouseoverHref'><em>Annales de la Société Entomologique de France</em></a> n.s. <strong>17</strong>(1): 359-393<!--MARK-->","","Article in Journal","f5c755a8-ee8c-4a02-84e0-0c24e727dcd0","","6462279b-2aaf-46a3-a434-cab7d8a2c33d"
"?lipi?ski, A. & Escalona, H.E.","2013","Australian Longhorn Beetles (Coleoptera: Cerambycidae)","484 pp. + xviii","","","","","CSIRO","<!--MARK--><a href='nulldef40227-b8e0-4ca5-94bc-fe596cf4463d' class='mouseoverHref'>?lipi?ski, A. & Escalona, H.E. 2013. <em>Australian Longhorn Beetles (Coleoptera: Cerambycidae)</em>. Collingwood, Vic : CSIRO Vol. 1: Introduction and Subfamily Lamiinae 484 pp. + xviii.</a><!--MARK-->","","Book","def40227-b8e0-4ca5-94bc-fe596cf4463d","20170706T04:24:30.967+0000",""
"Thomson, J.","1861","Essai d'une classification de la famille des cérambycides et materiaux pour servir a une monographie de cette famille","396 pp. + 3 pls","","","","","J. Thomson","<!--MARK--><a href='null4e8ec691-3fad-400c-a040-e86041da06b3' class='mouseoverHref'>Thomson, J. 1861. <em>Essai d'une classification de la famille des cérambycides et materiaux pour servir a une monographie de cette famille</em>. Paris : J. Thomson 396 pp. + 3 pls.</a><!--MARK--> [1860-1861: pp. xvi + 128 = 1860; pp. 129-396 = 1861]","1860-1861: pp. xvi + 128 = 1860; pp. 129-396 = 1861","Book","4e8ec691-3fad-400c-a040-e86041da06b3","20140618T23:15:36.508+0000",""
"Thomson, J.","1864","Systema cerambycidarum ou exposé de tous les genres compris dans la famille des cérambycides et familles limitrophes","578 pp.","","","","1864: pp. 1-352; 1865: 353-578","H. Dessain","<!--MARK--><a href='nullabd8b9f7-e92e-499d-90a9-6b1f54840e5f' class='mouseoverHref'>Thomson, J. 1864. <em>Systema cerambycidarum ou exposé de tous les genres compris dans la famille des cérambycides et familles limitrophes</em>. Liége : H. Dessain 578 pp.</a><!--MARK--> [Date published 1864: pp. 1-352; 1865: 353-578: 1864-1865]","1864-1865","Book","abd8b9f7-e92e-499d-90a9-6b1f54840e5f","20140618T23:14:46.683+0000",""
"Thomson, J.","1877","Les deux descriptions suivantes de nouvelles espèces de Coléoptères","lxxxviii-lxxxix","","Bulletin des Séances de la Société Entomologique de France","","","","<!--MARK--><a href='nullbe5f2667-acfc-4beb-b0a5-b8fdcd092338' class='mouseoverHref'>Thomson, J. 1877. Les deux descriptions suivantes de nouvelles espèces de Coléoptères.</a> <!--MARK--><!--MARK--><a href='null16edab39-5918-4307-997e-cbdc63500172' class='mouseoverHref'><em>Bulletin des Séances de la Société Entomologique de France</em></a> 5 <strong>7</strong>: lxxxviii-lxxxix<!--MARK-->","","Article in Journal","be5f2667-acfc-4beb-b0a5-b8fdcd092338","","16edab39-5918-4307-997e-cbdc63500172"
"Thomson, J.","1877","Typi Cerambycidarum musei thomsoniaiii","249-279","","Revue et Magasin de Zoologie Pure et Appliquée. Paris","","","","<!--MARK--><a href='nulld5ccbb51-4bed-4419-be5f-8450e89b1cfc' class='mouseoverHref'>Thomson, J. 1877. Typi Cerambycidarum musei thomsoniaiii.</a> <!--MARK--><!--MARK--><a href='nullbf10f781-3d0b-4bb9-8dc7-80285067962c' class='mouseoverHref'><em>Revue et Magasin de Zoologie Pure et Appliquée. Paris</em></a> <strong>5</strong>: 249-279<!--MARK-->","","Article in Journal","d5ccbb51-4bed-4419-be5f-8450e89b1cfc","20110118T03:26:11.185+0000","bf10f781-3d0b-4bb9-8dc7-80285067962c"
"Waterhouse, C.O.","1877","New Coleopterous insects from Queensland","423-425","","Annals and Magazine of Natural History","","May 1877","","<!--MARK--><a href='null2d1bdb5a-5bbc-46bd-bb2c-d5458c95411d' class='mouseoverHref'>Waterhouse, C.O. 1877. New Coleopterous insects from Queensland.</a> <!--MARK--><!--MARK--><a href='nullefa8de69-3a29-4a43-8ef2-cbefda205976' class='mouseoverHref'><em>Annals and Magazine of Natural History</em></a> 4 <strong>19</strong>(113): 423-425<!--MARK--> [Date published May 1877]","","Article in Journal","2d1bdb5a-5bbc-46bd-bb2c-d5458c95411d","20120111T22:03:17.356+0000","efa8de69-3a29-4a43-8ef2-cbefda205976"
"Wilson, F.E.","1923","New Australian Coleoptera, with notes on some previously described species. Part 2","117-133","","Proceedings of the Royal Society of Victoria","","","","<!--MARK--><a href='null78068616-fbcc-458e-93b0-b4ed445ea416' class='mouseoverHref'>Wilson, F.E. 1923. New Australian Coleoptera, with notes on some previously described species. Part 2.</a> <!--MARK--><!--MARK--><a href='nullce333794-3a02-427f-ba27-346079f1efa0' class='mouseoverHref'><em>Proceedings of the Royal Society of Victoria</em></a> n.s. <strong>35</strong>: 117-133<!--MARK-->","","Article in Journal","78068616-fbcc-458e-93b0-b4ed445ea416","","ce333794-3a02-427f-ba27-346079f1efa0"
