"PUB_AUTHOR","PUB_YEAR","PUB_TITLE","PUB_PAGES","PUB_PARENT_BOOK_TITLE","PUB_PARENT_JOURNAL_TITLE","PUB_PARENT_ARTICLE_TITLE","PUB_PUBLICATION_DATE","PUB_PUBLISHER","PUB_FORMATTED","PUB_QUALIFICATION","PUB_TYPE","PUBLICATION_GUID","PUBLICATION_LAST_UPDATE","PARENT_PUBLICATION_GUID"
"Alcock, A.","1898","Materials for a Carcinological Fauna of India. No. 3. The Brachyura Cyclometopa. Part I. The Family Xanthidae","67-233","","Journal of the Asiatic Society of Bengal","","","","<!--MARK--><a href='null5ade0402-4cf2-4636-8544-7e95f607dc27' class='mouseoverHref'>Alcock, A. 1898. Materials for a Carcinological Fauna of India. No. 3. The Brachyura Cyclometopa. Part I. The Family Xanthidae.</a> <!--MARK--><!--MARK--><a href='nulld16b9dfb-88f3-4e8f-aa43-b64265b2b69a' class='mouseoverHref'><em>Journal of the Asiatic Society of Bengal</em></a> <strong>67</strong>(Pt 2 No. 1): 67-233<!--MARK-->","","Article in Journal","5ade0402-4cf2-4636-8544-7e95f607dc27","20081009T05:11:37.000+0000","d16b9dfb-88f3-4e8f-aa43-b64265b2b69a"
"Bianconi, G.","1851","Specimina zoologica Mosambicana","91-112 pls 10-11","","Memorie della Reale Accademia delle Scienze dell'Istituto di Bologna","","","","<!--MARK--><a href='nullef9e8d90-9f8d-4927-b0a8-634275e4f714' class='mouseoverHref'>Bianconi, G. 1851. Specimina zoologica Mosambicana.</a> <!--MARK--><!--MARK--><a href='null8f2ee5d8-9815-49a7-bf84-20a00d7842ed' class='mouseoverHref'><em>Memorie della Reale Accademia delle Scienze dell'Istituto di Bologna</em></a> <strong>3</strong>(Fasc. 5): 91-112 pls 10-11<!--MARK-->","","Article in Journal","ef9e8d90-9f8d-4927-b0a8-634275e4f714","20081009T05:11:37.000+0000","8f2ee5d8-9815-49a7-bf84-20a00d7842ed"
"Davie, P.","2002","Crustacea: Malacostraca: Eucarida (Part 2): Decapoda--Anomura, Brachyura","","","","","","","<!--MARK--><a href='nulld47384d3-27be-4ade-967c-8b828620536a' class='mouseoverHref'>Davie, P. 2002. Crustacea: Malacostraca: Eucarida (Part 2): Decapoda--Anomura, Brachyura. <I>In</I> Wells, A. & Houston, W.W.K. (eds) <I>Zoological Catalogue of Australia</I>. Vol. 19.3B. Melbourne : CSIRO Publishing, Australia xiv 641 pp.</a>","","Miscellaneous","d47384d3-27be-4ade-967c-8b828620536a","20110104T22:17:37.193+0000",""
"De Haan, W.","1833","Crustacea","i-xvii, i-xxxi, ix-xvi, 1-243 pls A-J,","Fauna Japonica sive Descriptio Animalium, quae in Itinere per Japoniam<i>, Jussu et Auspiciis Superiorum, qui Summum in India Batava Imperium Tenent, Suscepto, Annis 1823-1830 Collegit, Notis, Observationibus et Adumbrationibus Illustravit</i>","","","","","<!--MARK--><a href='null9249e415-0893-4288-be37-d8289334b19d' class='mouseoverHref'>De Haan, W. 1833. Crustacea. i-xvii, i-xxxi, ix-xvi, 1-243 pls A-J,</a> <!--MARK--><em>in</em> <!--MARK--><a href='null8fcd42e5-30fa-41a0-a67c-7e253cb1c03f' class='mouseoverHref'>Von Siebold, P.F. (ed.). <em>Fauna Japonica sive Descriptio Animalium, quae in Itinere per Japoniam<i>, Jussu et Auspiciis Superiorum, qui Summum in India Batava Imperium Tenent, Suscepto, Annis 1823-1830 Collegit, Notis, Observationibus et Adumbrationibus Illustravit</i></em>. Leiden : Lugduni-Batavorum.</a><!--MARK--><!--MARK--> [published from 1833-1850]","published from 1833-1850","Chapter in Book","9249e415-0893-4288-be37-d8289334b19d","20081009T05:11:37.000+0000","8fcd42e5-30fa-41a0-a67c-7e253cb1c03f"
"Haswell, W.A.","1881","On some new Australian Brachyura","540-551","","Proceedings of the Linnean Society of New South Wales","","","","<!--MARK--><a href='null7aeaa7c5-e3de-4f50-acb0-eaaa9f85f5d6' class='mouseoverHref'>Haswell, W.A. 1881. On some new Australian Brachyura.</a> <!--MARK--><!--MARK--><a href='nullc12cd779-adb5-41ea-bd2c-75f6864cf22e' class='mouseoverHref'><em>Proceedings of the Linnean Society of New South Wales</em></a> <strong>6</strong>(3): 540-551<!--MARK-->","","Article in Journal","7aeaa7c5-e3de-4f50-acb0-eaaa9f85f5d6","20120501T00:25:16.777+0000","c12cd779-adb5-41ea-bd2c-75f6864cf22e"
"Hilgendorf, F.","1879","Die von Herrn W. Peters in Moçambique gesammelten Crustaceen, bearbeitet von Herrn Dr. F. Hilgendorf","782-851 pls 1-4","","Monatsberichte der Deutschen Akademie der Wissenschaften zu Berlin","","","","<!--MARK--><a href='nulld783c00c-80d9-48ee-9227-150be1a8a06a' class='mouseoverHref'>Hilgendorf, F. 1879. Die von Herrn W. Peters in Moçambique gesammelten Crustaceen, bearbeitet von Herrn Dr. F. Hilgendorf.</a> <!--MARK--><!--MARK--><a href='null320ff347-e7e6-4b81-9c0a-60da48e83474' class='mouseoverHref'><em>Monatsberichte der Deutschen Akademie der Wissenschaften zu Berlin</em></a> <strong>1878</strong>: 782-851 pls 1-4<!--MARK-->","","Article in Journal","d783c00c-80d9-48ee-9227-150be1a8a06a","20081009T05:11:37.000+0000","320ff347-e7e6-4b81-9c0a-60da48e83474"
"Holthuis, L.B.","1993","The non-Japanese new species established by W. de Haan in the Crustacea Volume of Fauna Japonica (1833-1850)","599-646","Ph.F von Siebold and Natural History in Japan. <i>Crustacea</i>","","","","","<!--MARK--><a href='nullfb7977fd-b9e3-4ef4-92f2-cb80c303894d' class='mouseoverHref'>Holthuis, L.B. 1993. The non-Japanese new species established by W. de Haan in the Crustacea Volume of Fauna Japonica (1833-1850). pp. 599-646</a> <!--MARK--><em>in</em> <!--MARK--><a href='nullebf2b32a-9b4d-454f-b2a5-fbabd474c017' class='mouseoverHref'>Yamaguchi, T. (ed.). <em>Ph.F von Siebold and Natural History in Japan. <i>Crustacea</i></em>. Tokyo : The Carcinological Society of Japan.</a><!--MARK-->","","Chapter in Book","fb7977fd-b9e3-4ef4-92f2-cb80c303894d","20081009T05:11:37.000+0000","ebf2b32a-9b4d-454f-b2a5-fbabd474c017"
"Lamarck, J.B.P.A.","1818","<i>Histoire Naturelle des Animaux sans vertèbres</i>, présentant les caractères généraux et particuliers de ces animaux, leur distribution, leurs classes, leurs familles, leurs genres, et la citation des principales espèces qui s'y rapportent; précédée d'une Introduction offrant la Détermination des caractères essentiels de l'Animal, sa distinction du végétal et des autres corps naturelles, enfin, l'Exposition des Principes fondamentaux de la Zoologie","","","","","","","<!--MARK--><a href='null8afc9894-8e09-4410-a0d7-9c5f34bd4685' class='mouseoverHref'>Lamarck, J.B.P.A. 1818. <i>Histoire Naturelle des Animaux sans vertèbres</i>, présentant les caractères généraux et particuliers de ces animaux, leur distribution, leurs classes, leurs familles, leurs genres, et la citation des principales espèces qui s'y rapportent; précédée d'une Introduction offrant la Détermination des caractères essentiels de l'Animal, sa distinction du végétal et des autres corps naturelles, enfin, l'Exposition des Principes fondamentaux de la Zoologie. Vol. 5. 612 pp.</a>","","Miscellaneous","8afc9894-8e09-4410-a0d7-9c5f34bd4685","20081009T05:11:37.000+0000",""
"McNeill, F.A.","1920","Studies in Australian Carcinology. No. 1","105-109 figs 1-5 pl. 19","","Records of the Australian Museum","","","","<!--MARK--><a href='nullc3519656-8ddb-4c09-aca0-e5b1ddb228b7' class='mouseoverHref'>McNeill, F.A. 1920. Studies in Australian Carcinology. No. 1.</a> <!--MARK--><!--MARK--><a href='null7c07530b-0b38-44f5-8f95-368da97d6ac2' class='mouseoverHref'><em>Records of the Australian Museum</em></a> <strong>13</strong>(3): 105-109 figs 1-5 pl. 19<!--MARK-->","","Article in Journal","c3519656-8ddb-4c09-aca0-e5b1ddb228b7","20081009T05:11:37.000+0000","7c07530b-0b38-44f5-8f95-368da97d6ac2"
"Milne Edwards, A.","1867","Descriptions de quelques espèces nouvelles de Crustacés Brachyures","263-288","","Annales de la Société Entomologique de France","","","","<!--MARK--><a href='null9cb72c6d-5f25-430c-bb0a-5dc2e49c9e41' class='mouseoverHref'>Milne Edwards, A. 1867. Descriptions de quelques espèces nouvelles de Crustacés Brachyures.</a> <!--MARK--><!--MARK--><a href='null6462279b-2aaf-46a3-a434-cab7d8a2c33d' class='mouseoverHref'><em>Annales de la Société Entomologique de France</em></a> 4 <strong>7</strong>: 263-288<!--MARK-->","","Article in Journal","9cb72c6d-5f25-430c-bb0a-5dc2e49c9e41","20081009T05:11:37.000+0000","6462279b-2aaf-46a3-a434-cab7d8a2c33d"
"Milne Edwards, H.","1834","Histoire naturelle des Crustacés<i>, comprenant l'anatomie, la physiologie et la classification de ces Animaux</i>","xxxv 468","","","","","Librairie encyclopédique de Roret","<!--MARK--><a href='null69e3f765-8ce0-48a3-a740-a7b15e7a82e7' class='mouseoverHref'>Milne Edwards, H. 1834. <em>Histoire naturelle des Crustacés<i>, comprenant l'anatomie, la physiologie et la classification de ces Animaux</i></em>. Paris : Librairie encyclopédique de Roret Vol. 1 xxxv 468 pp.</a><!--MARK-->","","Book","69e3f765-8ce0-48a3-a740-a7b15e7a82e7","20081009T05:11:37.000+0000",""
"Ortmann, A.E.","1893","Abtheilung: Brachyura (Brachyura genuina Boas) II. Unterabtheilung: Cancroidea, 2. Section: Cancrinea, 1. Gruppe: Clyclometopa. Die Decapoden-Krebse des Strassburger Museums, mit besonderer Berücksichtigung der von Herrn Dr Döderlein bei Japan und bei den Liu-Kiu-Inseln gesammelten und zur Zeit im Strassburger Museum aufbewahrten Formen, VII. Theil","411-495 pl. 17","","Zoologische Jahrbücher. Abteilung für Systematik, Geographie und Biologie der Tiere","","","","<!--MARK--><a href='null987a121e-4d40-45ae-ac12-274f8a15f034' class='mouseoverHref'>Ortmann, A.E. 1893. Abtheilung: Brachyura (Brachyura genuina Boas) II. Unterabtheilung: Cancroidea, 2. Section: Cancrinea, 1. Gruppe: Clyclometopa. Die Decapoden-Krebse des Strassburger Museums, mit besonderer Berücksichtigung der von Herrn Dr Döderlein bei Japan und bei den Liu-Kiu-Inseln gesammelten und zur Zeit im Strassburger Museum aufbewahrten Formen, VII. Theil.</a> <!--MARK--><!--MARK--><a href='null8510249c-347d-4bba-83dd-820829fb4260' class='mouseoverHref'><em>Zoologische Jahrbücher. Abteilung für Systematik, Geographie und Biologie der Tiere</em></a> <strong>7</strong>: 411-495 pl. 17<!--MARK-->","","Article in Journal","987a121e-4d40-45ae-ac12-274f8a15f034","20081009T05:11:37.000+0000","8510249c-347d-4bba-83dd-820829fb4260"
"Rathbun, M.J.","1923","Report on the Crabs obtained by the F.I.S. Endeavour on the Coasts of Queensland, New South Wales, Victoria, South Australia and Tasmania. Report on the Brachyrhyncha, Oxystomata and Dromiacea","","","","","","","<!--MARK--><a href='nullc19a0968-59ec-4a27-83b6-4d41ce97fae8' class='mouseoverHref'>Rathbun, M.J. 1923. Report on the Crabs obtained by the F.I.S. Endeavour on the Coasts of Queensland, New South Wales, Victoria, South Australia and Tasmania. Report on the Brachyrhyncha, Oxystomata and Dromiacea. pp. 95-156 figs 1-3, pls 16-42 <I>in</I>, <I>Biological Results of the Fishing Experiments carried on by the F.I.S. Endeavour, 1909-14</I>. Sydney : Commonwealth of Australia, Department of Trade and Customs. Vol. 5 398 pp.</a>","","Miscellaneous","c19a0968-59ec-4a27-83b6-4d41ce97fae8","20081009T05:11:37.000+0000",""
"Serène, R.","1968","The Brachyura of the Indo-West Pacific Region","33-112","Prodromus for a Checklist of the Nonplanktonic Marine Fauna of Southeast Asia","","","","","<!--MARK--><a href='null9ed338cb-3a1c-4d69-97c2-dd4f4a72cc1a' class='mouseoverHref'>Serène, R. 1968. The Brachyura of the Indo-West Pacific Region. pp. 33-112</a> <!--MARK--><em>in</em> <!--MARK--><a href='nullbdcd1f9b-f325-4ac2-9519-49a7d44933b6' class='mouseoverHref'>Serène, R. (ed.). <em>Prodromus for a Checklist of the Nonplanktonic Marine Fauna of Southeast Asia</em>. Singapore : Singapore National Academy of Sciences, Special Publication Vol. 1.</a><!--MARK-->","","Chapter in Book","9ed338cb-3a1c-4d69-97c2-dd4f4a72cc1a","20081009T05:11:37.000+0000","bdcd1f9b-f325-4ac2-9519-49a7d44933b6"
"Serène, R.","1984","Crustacés Décapodes Brachyoures de l'Océan Indien occidental et de la Mer Rouge. Xanthoidea: Xanthidae et Trapeziidae. Avec un addendum par Crosnier, A.: Carpilliidae et Menippidae","1-400 figs A-C, 1-243 pls 1-48","","Faune Tropicale","","","","<!--MARK--><a href='nullb4d59a64-c426-4c15-8fe2-3e2910ca9e31' class='mouseoverHref'>Serène, R. 1984. Crustacés Décapodes Brachyoures de l'Océan Indien occidental et de la Mer Rouge. Xanthoidea: Xanthidae et Trapeziidae. Avec un addendum par Crosnier, A.: Carpilliidae et Menippidae.</a> <!--MARK--><!--MARK--><a href='null4c886a47-4641-4e93-b539-d8e9c6faa082' class='mouseoverHref'><em>Faune Tropicale</em></a> <strong>24</strong>: 1-400 figs A-C, 1-243 pls 1-48<!--MARK-->","","Article in Journal","b4d59a64-c426-4c15-8fe2-3e2910ca9e31","20081009T05:11:37.000+0000","4c886a47-4641-4e93-b539-d8e9c6faa082"
"Ward, M.","1941","New Brachyura from the Gulf of Davao, Mindanao, Philippine Islands","1-15 figs 1-30","","American Museum Novitates","","","","<!--MARK--><a href='null63e1bf05-e98e-41e8-aed5-da8257a8ee4e' class='mouseoverHref'>Ward, M. 1941. New Brachyura from the Gulf of Davao, Mindanao, Philippine Islands.</a> <!--MARK--><!--MARK--><a href='null6502b0bb-309f-414e-9d7f-4cb7a3619a03' class='mouseoverHref'><em>American Museum Novitates</em></a> <strong>1104</strong>: 1-15 figs 1-30<!--MARK-->","","Article in Journal","63e1bf05-e98e-41e8-aed5-da8257a8ee4e","20081009T05:11:37.000+0000","6502b0bb-309f-414e-9d7f-4cb7a3619a03"
