"PUB_AUTHOR","PUB_YEAR","PUB_TITLE","PUB_PAGES","PUB_PARENT_BOOK_TITLE","PUB_PARENT_JOURNAL_TITLE","PUB_PARENT_ARTICLE_TITLE","PUB_PUBLICATION_DATE","PUB_PUBLISHER","PUB_FORMATTED","PUB_QUALIFICATION","PUB_TYPE","PUBLICATION_GUID","PUBLICATION_LAST_UPDATE","PARENT_PUBLICATION_GUID"
"Baehr, M.","2004","First record of the Oriental ground beetle genus <i>Chydaeus</i> Chaudoir from Australia (Insecta, Coleoptera, Carabidae, Harpalinae)","19-22","","Spixiana (Munich)","","","","<!--MARK--><a href='nullf1df1d0d-297d-4346-9e5c-f4ae3880c1b0' class='mouseoverHref'>Baehr, M. 2004. First record of the Oriental ground beetle genus <i>Chydaeus</i> Chaudoir from Australia (Insecta, Coleoptera, Carabidae, Harpalinae).</a> <!--MARK--><!--MARK--><a href='nullce825dec-bfed-4bd4-81bc-3368e292b581' class='mouseoverHref'><em>Spixiana (Munich)</em></a> <strong>27</strong>(1): 19-22<!--MARK-->","","Article in Journal","f1df1d0d-297d-4346-9e5c-f4ae3880c1b0","20081009T05:11:37.000+0000","ce825dec-bfed-4bd4-81bc-3368e292b581"
"Castelnau, F.L. Laporte de","1867","Notes on Australian Coleoptera","139 pp.","","","","","Royal Society of Victoria","<!--MARK--><a href='null24775344-c4a6-4169-a50c-6b5559f88a2a' class='mouseoverHref'>Castelnau, F.L. Laporte de 1867. <em>Notes on Australian Coleoptera</em>. Melbourne : Royal Society of Victoria 139 pp.</a><!--MARK--> [separates available prior to publication in <I>Trans. R. Soc. Vict. </I><B>8</B>: 30-38 (1867), 95-225 (1868)]","separates available prior to publication in <I>Trans. R. Soc. Vict. </I><B>8</B>: 30-38 (1867), 95-225 (1868)","Book","24775344-c4a6-4169-a50c-6b5559f88a2a","20100628T06:12:41.272+0000",""
"Chaudoir, M. de","1837","Genres nouveaux et espèces nouvelles de Coléoptères de la famille des Carabiques","3-50","","Bulletin de la Société Impériale des Naturalistes de Moscou","","","","<!--MARK--><a href='nulld2939d03-cd4e-4181-b80a-ec52db1fef89' class='mouseoverHref'>Chaudoir, M. de 1837. Genres nouveaux et espèces nouvelles de Coléoptères de la famille des Carabiques.</a> <!--MARK--><!--MARK--><a href='nulla7cbc93a-fdd0-40a5-9cc8-35de71b7d18a' class='mouseoverHref'><em>Bulletin de la Société Impériale des Naturalistes de Moscou</em></a> <strong>10</strong>(7): 3-50<!--MARK-->","","Article in Journal","d2939d03-cd4e-4181-b80a-ec52db1fef89","20081009T05:11:37.000+0000","a7cbc93a-fdd0-40a5-9cc8-35de71b7d18a"
"Chaudoir, M. de","1843","Genres nouveaux de la famille des Carabiques. (Continuation)","383-427","","Bulletin de la Société Impériale des Naturalistes de Moscou","","","","<!--MARK--><a href='null0b08ce5c-9c92-452e-886a-be2935d990f7' class='mouseoverHref'>Chaudoir, M. de 1843. Genres nouveaux de la famille des Carabiques. (Continuation).</a> <!--MARK--><!--MARK--><a href='nulla7cbc93a-fdd0-40a5-9cc8-35de71b7d18a' class='mouseoverHref'><em>Bulletin de la Société Impériale des Naturalistes de Moscou</em></a> <strong>16</strong>(3): 383-427<!--MARK-->","","Article in Journal","0b08ce5c-9c92-452e-886a-be2935d990f7","20081009T05:11:37.000+0000","a7cbc93a-fdd0-40a5-9cc8-35de71b7d18a"
"Chaudoir, M. de","1878","Les Harpaliens d'Australie d'après la collection de M. le Compte de Castelnau et la mienne","475-517","","Annali del Museo Civico di Storia Naturale, Genova","","","","<!--MARK--><a href='null25e0bc94-5446-4729-8902-f1039f5e8fd4' class='mouseoverHref'>Chaudoir, M. de 1878. Les Harpaliens d'Australie d'après la collection de M. le Compte de Castelnau et la mienne.</a> <!--MARK--><!--MARK--><a href='null461059ea-ead7-4f6d-83f4-52913f06d09f' class='mouseoverHref'><em>Annali del Museo Civico di Storia Naturale, Genova</em></a> <strong>12</strong>: 475-517<!--MARK-->","","Article in Journal","25e0bc94-5446-4729-8902-f1039f5e8fd4","20170407T02:06:27.416+0000","461059ea-ead7-4f6d-83f4-52913f06d09f"
"Csiki, E.","1932","Carabidae III: Harpalinae VI","1023-1278","Coleopterorum Catalogus auspiciis et auxilio W. Junk","","","","","<!--MARK--><a href='nulle7d91d79-60b3-4f91-aa72-d39521f89788' class='mouseoverHref'>Csiki, E. 1932. Carabidae III: Harpalinae VI. pp. 1023-1278</a> <!--MARK--><em>in</em> <!--MARK--><a href='null6acec11b-f100-442b-b508-d11b4e69228a' class='mouseoverHref'>Schenkling, S. (ed.). <em>Coleopterorum Catalogus auspiciis et auxilio W. Junk</em>. Berlin : W. Junk Vol. 3 Pars  121.</a><!--MARK--> [Date published 28/May/1932]","","Chapter in Book","e7d91d79-60b3-4f91-aa72-d39521f89788","20081009T05:11:37.000+0000","6acec11b-f100-442b-b508-d11b4e69228a"
"Dejean, P.F.M.A.","1829","Species général des Coléoptères de la Collection de M. le Compte Dejean","vii 520 pp.","","","","","Méquignon-Marvis","<!--MARK--><a href='nulle4b64df1-a959-464f-906e-99b13e4803ff' class='mouseoverHref'>Dejean, P.F.M.A. 1829. <em>Species général des Coléoptères de la Collection de M. le Compte Dejean</em>. Paris : Méquignon-Marvis Vol. IV vii 520 pp.</a><!--MARK--> [Nov. 1829]","Nov. 1829","Book","e4b64df1-a959-464f-906e-99b13e4803ff","20081009T05:11:37.000+0000",""
"Fauvel, A.","1862","Coléoptères de la Nouvelle Calédonie","120-185 (1861-1862)","","Bulletin de la Société Linnéenne de Normandie","","","","<!--MARK--><a href='null83152957-69ee-49a1-b5ce-e325e076aa06' class='mouseoverHref'>Fauvel, A. 1862. Coléoptères de la Nouvelle Calédonie.</a> <!--MARK--><!--MARK--><a href='nullee1e2e0c-7d8d-41c9-b98c-b6fda2d5b0c0' class='mouseoverHref'><em>Bulletin de la Société Linnéenne de Normandie</em></a> <strong>7</strong>: 120-185 (1861-1862)<!--MARK-->","","Article in Journal","83152957-69ee-49a1-b5ce-e325e076aa06","20081009T05:11:37.000+0000","ee1e2e0c-7d8d-41c9-b98c-b6fda2d5b0c0"
"Fauvel, A.","1882","Les Coléoptères de la Nouvelle-Calédonie et déendances avec descriptions, notes et synonymes nouvelles","265-274","","Revue d'Entomologie (Caen)","","","","<!--MARK--><a href='null40f0e4d1-e50d-44d1-8f59-a5ffbedd632e' class='mouseoverHref'>Fauvel, A. 1882. Les Coléoptères de la Nouvelle-Calédonie et déendances avec descriptions, notes et synonymes nouvelles.</a> <!--MARK--><!--MARK--><a href='null38321dc8-dea0-4f88-bdf3-a1b7460e3beb' class='mouseoverHref'><em>Revue d'Entomologie (Caen)</em></a> <strong>1</strong>: 265-274<!--MARK-->","","Article in Journal","40f0e4d1-e50d-44d1-8f59-a5ffbedd632e","20081009T05:11:37.000+0000","38321dc8-dea0-4f88-bdf3-a1b7460e3beb"
"Kataev, B.M.","2014","Systematic and nomenclatorial notes on some taxa of Zabrini and Harpalini from the Palaearctic, Oriental and Australian regions (Coleoptera : Carabidae)","252-267","","Proceedings of the Zoological Institute of the Russian Academy of Sciences","","","","<!--MARK--><a href='null9d973f41-9b8f-4ced-8a6e-70963b44de8e' class='mouseoverHref'>Kataev, B.M. 2014. Systematic and nomenclatorial notes on some taxa of Zabrini and Harpalini from the Palaearctic, Oriental and Australian regions (Coleoptera : Carabidae).</a> <!--MARK--><!--MARK--><a href='null8ab57d84-06d1-409d-9b5f-75ecaf281cfe' class='mouseoverHref'><em>Proceedings of the Zoological Institute of the Russian Academy of Sciences</em></a> <strong>318</strong>(3): 252-267<!--MARK-->","","Article in Journal","9d973f41-9b8f-4ced-8a6e-70963b44de8e","20160525T07:09:35.521+0000","8ab57d84-06d1-409d-9b5f-75ecaf281cfe"
"Macleay, W.J.","1864","Descriptions of new genera and species of Coleoptera from Port Denison","106-130, pl. IX","","Transactions of the Entomological Society of New South Wales","","","","<!--MARK--><a href='null0faf71d8-e7ac-4888-bcce-7db38d1da638' class='mouseoverHref'>Macleay, W.J. 1864. Descriptions of new genera and species of Coleoptera from Port Denison.</a> <!--MARK--><!--MARK--><a href='null69b821b6-f09d-44b0-ae3f-0e6c294b532e' class='mouseoverHref'><em>Transactions of the Entomological Society of New South Wales</em></a> <strong>1</strong>: 106-130, pl. IX<!--MARK-->","","Article in Journal","0faf71d8-e7ac-4888-bcce-7db38d1da638","20081009T05:11:37.000+0000","69b821b6-f09d-44b0-ae3f-0e6c294b532e"
"Macleay, W.J.","1888","The insects of King's Sound and its vicinity","443-480","","Proceedings of the Linnean Society of New South Wales","","","","<!--MARK--><a href='nulldf6698ef-207f-422c-9694-7c4693c4f229' class='mouseoverHref'>Macleay, W.J. 1888. The insects of King's Sound and its vicinity.</a> <!--MARK--><!--MARK--><a href='nullc12cd779-adb5-41ea-bd2c-75f6864cf22e' class='mouseoverHref'><em>Proceedings of the Linnean Society of New South Wales</em></a> 2 <strong>3</strong>: 443-480<!--MARK-->","","Article in Journal","df6698ef-207f-422c-9694-7c4693c4f229","20081009T05:11:37.000+0000","c12cd779-adb5-41ea-bd2c-75f6864cf22e"
"Montrouzier, P.","1860","Essai sur la faune entomologique de la Nouvelle-Calédonie (Balade) et des îles des Pins, Art, Lifui etc","233-308","","Annales de la Société Entomologique de France","","","","<!--MARK--><a href='null48b5d2b2-2c00-4640-abb6-843779cc8472' class='mouseoverHref'>Montrouzier, P. 1860. Essai sur la faune entomologique de la Nouvelle-Calédonie (Balade) et des îles des Pins, Art, Lifui etc.</a> <!--MARK--><!--MARK--><a href='null6462279b-2aaf-46a3-a434-cab7d8a2c33d' class='mouseoverHref'><em>Annales de la Société Entomologique de France</em></a> 3 <strong>8</strong>: 233-308<!--MARK-->","","Article in Journal","48b5d2b2-2c00-4640-abb6-843779cc8472","20081009T05:11:37.000+0000","6462279b-2aaf-46a3-a434-cab7d8a2c33d"
"Moore, B.P.","1992","The Carabidae of Lord Howe Island (Coleoptera: Carabidae)","159-173","The Biogeography of Ground Beetles of Mountains and Islands","","","","","<!--MARK--><a href='null0e483ed0-186f-498a-a10f-8b1544aa2e4c' class='mouseoverHref'>Moore, B.P. 1992. The Carabidae of Lord Howe Island (Coleoptera: Carabidae). pp. 159-173</a> <!--MARK--><em>in</em> <!--MARK--><a href='nulld1c2151d-e0ac-4c4d-9cb3-d1175d948893' class='mouseoverHref'>Noonan, G.R., Ball, G.E. & Stork, N.E. (eds). <em>The Biogeography of Ground Beetles of Mountains and Islands</em>. Andover, Hampshire, UK : Intercept 256 pp.</a><!--MARK-->","","Chapter in Book","0e483ed0-186f-498a-a10f-8b1544aa2e4c","20081009T05:11:37.000+0000","d1c2151d-e0ac-4c4d-9cb3-d1175d948893"
"Moore, B.P. & Wallbank, B.E.","1968","Chemical composition of the defensive secretion in carabid beetles and its importance as a taxonomic character","62-72","","Proceedings of the Royal Entomological Society of London","","","","<!--MARK--><a href='nulle84db0f1-2bda-440b-863b-5aa2a3f63cf1' class='mouseoverHref'>Moore, B.P. & Wallbank, B.E. 1968. Chemical composition of the defensive secretion in carabid beetles and its importance as a taxonomic character.</a> <!--MARK--><!--MARK--><a href='null6ca99b2d-b4f7-49d4-8f5c-8db6ec2f5294' class='mouseoverHref'><em>Proceedings of the Royal Entomological Society of London</em></a> <strong>37</strong>(5-6): 62-72<!--MARK-->","","Article in Journal","e84db0f1-2bda-440b-863b-5aa2a3f63cf1","20081009T05:11:37.000+0000","6ca99b2d-b4f7-49d4-8f5c-8db6ec2f5294"
"Noonan, G.R.","1973","The Anisodactylines (Insecta: Coleoptera: Carabidae: Harpalini): Classificaton, evolution, and zoogeography","266-480","","Quaestiones Entomologicae","","","","<!--MARK--><a href='null833179bb-9047-4e70-b89b-eca56834ccd2' class='mouseoverHref'>Noonan, G.R. 1973. The Anisodactylines (Insecta: Coleoptera: Carabidae: Harpalini): Classificaton, evolution, and zoogeography.</a> <!--MARK--><!--MARK--><a href='null98f2c9e4-2641-4cb2-ab80-823823956331' class='mouseoverHref'><em>Quaestiones Entomologicae</em></a> <strong>9</strong>: 266-480<!--MARK-->","","Article in Journal","833179bb-9047-4e70-b89b-eca56834ccd2","20081009T05:11:37.000+0000","98f2c9e4-2641-4cb2-ab80-823823956331"
"Noonan, G.R.","1976","Synopsis of the supra-specific taxa of the tribe Harpalini (Coleoptera: Carabidae)","3-87","","Quaestiones Entomologicae","","","","<!--MARK--><a href='null7f9da642-a5b2-4b5a-bf88-d24040227398' class='mouseoverHref'>Noonan, G.R. 1976. Synopsis of the supra-specific taxa of the tribe Harpalini (Coleoptera: Carabidae).</a> <!--MARK--><!--MARK--><a href='null98f2c9e4-2641-4cb2-ab80-823823956331' class='mouseoverHref'><em>Quaestiones Entomologicae</em></a> <strong>13</strong>: 3-87<!--MARK-->","","Article in Journal","7f9da642-a5b2-4b5a-bf88-d24040227398","20081009T05:11:37.000+0000","98f2c9e4-2641-4cb2-ab80-823823956331"
"Perty, J.A.M.","1830","Insecta brasiliensia","1-60","Delectus animalium articuatorum, quae in itinere per Brasiliam annis MDCCCXVIII-MDCCCXX jussu et auspiciis Maximiliani Josephi I. Bavariare Regis Augustissimi. fasc. 1","","","","","<!--MARK--><a href='nulld5019dd3-5423-4178-926f-28ac7ebca0b3' class='mouseoverHref'>Perty, J.A.M. 1830. Insecta brasiliensia. pp. 1-60</a> <!--MARK--><em>in</em> <!--MARK--><a href='null9b062db9-cb26-4dbb-b386-a08666bdb265' class='mouseoverHref'>Spix, J.B. von (ed.). <em>Delectus animalium articuatorum, quae in itinere per Brasiliam annis MDCCCXVIII-MDCCCXX jussu et auspiciis Maximiliani Josephi I. Bavariare Regis Augustissimi. fasc. 1</em>. Monachii : J.A.M. Perty.</a><!--MARK-->","","Chapter in Book","d5019dd3-5423-4178-926f-28ac7ebca0b3","20081009T05:11:37.000+0000","9b062db9-cb26-4dbb-b386-a08666bdb265"
"Sloane, T.G.","1916","Carabidae from the Upper Williams River, N.S.W. [Coleoptera]","196-208","","Proceedings of the Linnean Society of New South Wales","","","","<!--MARK--><a href='nullf479ce0a-d2c6-420a-a125-60ec60e730a3' class='mouseoverHref'>Sloane, T.G. 1916. Carabidae from the Upper Williams River, N.S.W. [Coleoptera].</a> <!--MARK--><!--MARK--><a href='nullc12cd779-adb5-41ea-bd2c-75f6864cf22e' class='mouseoverHref'><em>Proceedings of the Linnean Society of New South Wales</em></a> <strong>41</strong>: 196-208<!--MARK-->","","Article in Journal","f479ce0a-d2c6-420a-a125-60ec60e730a3","20081009T05:11:37.000+0000","c12cd779-adb5-41ea-bd2c-75f6864cf22e"
"Sloane, T.G.","1920","The Carabidae of Tasmania","113-178","","Proceedings of the Linnean Society of New South Wales","","","","<!--MARK--><a href='null1cff59a8-7400-4fc0-847d-f25536e376b2' class='mouseoverHref'>Sloane, T.G. 1920. The Carabidae of Tasmania.</a> <!--MARK--><!--MARK--><a href='nullc12cd779-adb5-41ea-bd2c-75f6864cf22e' class='mouseoverHref'><em>Proceedings of the Linnean Society of New South Wales</em></a> <strong>45</strong>: 113-178<!--MARK-->","","Article in Journal","1cff59a8-7400-4fc0-847d-f25536e376b2","20081009T05:11:37.000+0000","c12cd779-adb5-41ea-bd2c-75f6864cf22e"
