"PUB_AUTHOR","PUB_YEAR","PUB_TITLE","PUB_PAGES","PUB_PARENT_BOOK_TITLE","PUB_PARENT_JOURNAL_TITLE","PUB_PARENT_ARTICLE_TITLE","PUB_PUBLICATION_DATE","PUB_PUBLISHER","PUB_FORMATTED","PUB_QUALIFICATION","PUB_TYPE","PUBLICATION_GUID","PUBLICATION_LAST_UPDATE","PARENT_PUBLICATION_GUID"
"Sloane, T.G.","1923","Studies in Australian Entomology. No. XVIII New genera and species of Carabidae. (Scaritini, Pterostichini, Merizodini, Bembidiini, Trechini, Odacanthini, Panagaeini, Licinini, and Lebiini)","17-39","","Proceedings of the Linnean Society of New South Wales","","","","<!--MARK--><a href='nullc233b83a-3576-4512-80ce-16baacc4510a' class='mouseoverHref'>Sloane, T.G. 1923. Studies in Australian Entomology. No. XVIII New genera and species of Carabidae. (Scaritini, Pterostichini, Merizodini, Bembidiini, Trechini, Odacanthini, Panagaeini, Licinini, and Lebiini).</a> <!--MARK--><!--MARK--><a href='nullc12cd779-adb5-41ea-bd2c-75f6864cf22e' class='mouseoverHref'><em>Proceedings of the Linnean Society of New South Wales</em></a> <strong>48</strong>: 17-39<!--MARK-->","","Article in Journal","c233b83a-3576-4512-80ce-16baacc4510a","20081009T05:11:37.000+0000","c12cd779-adb5-41ea-bd2c-75f6864cf22e"
"Straneo, S.L.","1936","Sui tipi dei Platysmatini (Coleopt. Carabid.) Australiani della collezione Castelnau, nel Museo Civico di Genova","246-259","","Annali del Museo Civico di Storia Naturale Giacomo Doria, Genova","","","","<!--MARK--><a href='null3db9d529-3692-4390-ab50-e21607b4f8dd' class='mouseoverHref'>Straneo, S.L. 1936. Sui tipi dei Platysmatini (Coleopt. Carabid.) Australiani della collezione Castelnau, nel Museo Civico di Genova.</a> <!--MARK--><!--MARK--><a href='nulld85b9f36-d289-41ce-a8b6-f50087483d67' class='mouseoverHref'><em>Annali del Museo Civico di Storia Naturale Giacomo Doria, Genova</em></a> <strong>59</strong>: 246-259<!--MARK-->","","Article in Journal","3db9d529-3692-4390-ab50-e21607b4f8dd","20170407T01:45:20.772+0000","d85b9f36-d289-41ce-a8b6-f50087483d67"
"Straneo, S.L.","1941","Sui tipi dei Pterostichini (Coleopt. Carabid.) Australiani della collezione Castelnau nel Museo Civico di Genova Nota III","83-94","","Annali del Museo Civico di Storia Naturale Giacomo Doria, Genova","","","","<!--MARK--><a href='null7a562aa4-581f-4f3e-8238-362c6529afc7' class='mouseoverHref'>Straneo, S.L. 1941. Sui tipi dei Pterostichini (Coleopt. Carabid.) Australiani della collezione Castelnau nel Museo Civico di Genova Nota III.</a> <!--MARK--><!--MARK--><a href='nulld85b9f36-d289-41ce-a8b6-f50087483d67' class='mouseoverHref'><em>Annali del Museo Civico di Storia Naturale Giacomo Doria, Genova</em></a> <strong>61</strong>: 83-94<!--MARK-->","","Article in Journal","7a562aa4-581f-4f3e-8238-362c6529afc7","20170407T01:48:39.297+0000","d85b9f36-d289-41ce-a8b6-f50087483d67"
"Straneo, S.L.","1953","Nuovi Pterostichini VII","1-12","","Doriana. Supplemento agli Annali del Museo Civico di Storia Naturale G. Doria, Genova","","","","<!--MARK--><a href='nulle58bc497-400a-47f5-aab1-7a325cb749d9' class='mouseoverHref'>Straneo, S.L. 1953. Nuovi Pterostichini VII.</a> <!--MARK--><!--MARK--><a href='null64b794cc-e48d-4196-b327-74e084b3fc92' class='mouseoverHref'><em>Doriana. Supplemento agli Annali del Museo Civico di Storia Naturale G. Doria, Genova</em></a> <strong>1</strong>(36): 1-12<!--MARK-->","","Article in Journal","e58bc497-400a-47f5-aab1-7a325cb749d9","20081009T05:11:37.000+0000","64b794cc-e48d-4196-b327-74e084b3fc92"
"Tschitschérine, T.","1897","Matériaux pour servir à l'étude des Féroniens III","250-351","","Horae Societatis Entomologicae Rossicae","","","","<!--MARK--><a href='null1dbc7d0e-f14c-4150-beaf-ee7519775a52' class='mouseoverHref'>Tschitschérine, T. 1897. Matériaux pour servir à l'étude des Féroniens III.</a> <!--MARK--><!--MARK--><a href='null4170ee18-5d62-4bf0-9475-603bf65de2cc' class='mouseoverHref'><em>Horae Societatis Entomologicae Rossicae</em></a> <strong>30</strong>(1895-1896): 250-351<!--MARK-->","","Article in Journal","1dbc7d0e-f14c-4150-beaf-ee7519775a52","20081009T05:11:37.000+0000","4170ee18-5d62-4bf0-9475-603bf65de2cc"
"Tschitschérine, T.","1898","Matériaux pour servir à l'étude des Féroniens IV","1-224","","Horae Societatis Entomologicae Rossicae","","","","<!--MARK--><a href='null075f6791-74a9-4f28-b780-ec52c46cd6ed' class='mouseoverHref'>Tschitschérine, T. 1898. Matériaux pour servir à l'étude des Féroniens IV.</a> <!--MARK--><!--MARK--><a href='null4170ee18-5d62-4bf0-9475-603bf65de2cc' class='mouseoverHref'><em>Horae Societatis Entomologicae Rossicae</em></a> <strong>32</strong>: 1-224<!--MARK-->","","Article in Journal","075f6791-74a9-4f28-b780-ec52c46cd6ed","20081009T05:11:37.000+0000","4170ee18-5d62-4bf0-9475-603bf65de2cc"
"Will, K.","2015","A multigene phylogenetic analysis results in a redefinition of the genus <i>Notonomus</i> Chaudoir (Coleoptera, Carabidae) and descriptions of new species of the subgenus <i>Leiradira</i> Castelnau.","313-344","","Invertebrate Systematics","","","","<!--MARK--><a href='nulldc8492f1-e4d9-48e3-8cec-f602c491864d' class='mouseoverHref'>Will, K. 2015. A multigene phylogenetic analysis results in a redefinition of the genus <i>Notonomus</i> Chaudoir (Coleoptera, Carabidae) and descriptions of new species of the subgenus <i>Leiradira</i> Castelnau.</a> <!--MARK--><!--MARK--><a href='null7ef62e6c-73cc-4912-8ea7-5752f95e8e8a' class='mouseoverHref'><em>Invertebrate Systematics</em></a> <strong>29</strong>: 313-344<!--MARK-->","","Article in Journal","dc8492f1-e4d9-48e3-8cec-f602c491864d","20150907T23:13:57.464+0000","7ef62e6c-73cc-4912-8ea7-5752f95e8e8a"
