"PUB_AUTHOR","PUB_YEAR","PUB_TITLE","PUB_PAGES","PUB_PARENT_BOOK_TITLE","PUB_PARENT_JOURNAL_TITLE","PUB_PARENT_ARTICLE_TITLE","PUB_PUBLICATION_DATE","PUB_PUBLISHER","PUB_FORMATTED","PUB_QUALIFICATION","PUB_TYPE","PUBLICATION_GUID","PUBLICATION_LAST_UPDATE","PARENT_PUBLICATION_GUID"
"Bates, H.W.","1878","New genera and species of Carabidae from Tasmania","317-326","","Cistula Entomologica","","","","<!--MARK--><a href='null0b37df1c-d2f0-4578-ae56-b87efb8162ce' class='mouseoverHref'>Bates, H.W. 1878. New genera and species of Carabidae from Tasmania.</a> <!--MARK--><!--MARK--><a href='null6d769ad4-3958-459c-9047-dfb75cc3158f' class='mouseoverHref'><em>Cistula Entomologica</em></a> <strong>2</strong>: 317-326<!--MARK-->","","Article in Journal","0b37df1c-d2f0-4578-ae56-b87efb8162ce","20081009T05:11:37.000+0000","6d769ad4-3958-459c-9047-dfb75cc3158f"
"Castelnau, F.L. Laporte de","1840","Histoire Naturelle des Insectes, Animaux articulés. Coléoptères","cxxv 24 pp.","","","","","Duménil","<!--MARK--><a href='nullff9614cc-e927-49b9-bb47-a988b08d2ef0' class='mouseoverHref'>Castelnau, F.L. Laporte de 1840. <em>Histoire Naturelle des Insectes, Animaux articulés. Coléoptères</em>. Paris : Duménil Vol. 1 cxxv 24 pp.</a><!--MARK-->","","Book","ff9614cc-e927-49b9-bb47-a988b08d2ef0","20081009T05:11:37.000+0000",""
"Castelnau, F.L. Laporte de","1867","Notes on Australian Coleoptera","139 pp.","","","","","Royal Society of Victoria","<!--MARK--><a href='null24775344-c4a6-4169-a50c-6b5559f88a2a' class='mouseoverHref'>Castelnau, F.L. Laporte de 1867. <em>Notes on Australian Coleoptera</em>. Melbourne : Royal Society of Victoria 139 pp.</a><!--MARK--> [separates available prior to publication in <I>Trans. R. Soc. Vict. </I><B>8</B>: 30-38 (1867), 95-225 (1868)]","separates available prior to publication in <I>Trans. R. Soc. Vict. </I><B>8</B>: 30-38 (1867), 95-225 (1868)","Book","24775344-c4a6-4169-a50c-6b5559f88a2a","20100628T06:12:41.272+0000",""
"Chaudoir, M. de","1865","Essai sur les Féronides de l'Australie et de la Nouvelle-Zélande","65-112","","Bulletin de la Société Impériale des Naturalistes de Moscou","","","","<!--MARK--><a href='nullee484426-3bf5-4fe3-9bb8-fbe1c0ba14b6' class='mouseoverHref'>Chaudoir, M. de 1865. Essai sur les Féronides de l'Australie et de la Nouvelle-Zélande.</a> <!--MARK--><!--MARK--><a href='nulla7cbc93a-fdd0-40a5-9cc8-35de71b7d18a' class='mouseoverHref'><em>Bulletin de la Société Impériale des Naturalistes de Moscou</em></a> <strong>38</strong>(2): 65-112<!--MARK-->","","Article in Journal","ee484426-3bf5-4fe3-9bb8-fbe1c0ba14b6","20081009T05:11:37.000+0000","a7cbc93a-fdd0-40a5-9cc8-35de71b7d18a"
"Chaudoir, M. de","1868","Révision des Trigonotomides","151-164","","Annales de la Société Entomologique de Belgique (Comptes-rendus)","","","","<!--MARK--><a href='null8c22c544-5c51-4c35-8043-8728397a511b' class='mouseoverHref'>Chaudoir, M. de 1868. Révision des Trigonotomides.</a> <!--MARK--><!--MARK--><a href='nullacc7fcdb-707a-4cbe-8f70-d7595ac25c58' class='mouseoverHref'><em>Annales de la Société Entomologique de Belgique (Comptes-rendus)</em></a> <strong>11</strong>: 151-164<!--MARK-->","","Article in Journal","8c22c544-5c51-4c35-8043-8728397a511b","20081009T05:11:37.000+0000","acc7fcdb-707a-4cbe-8f70-d7595ac25c58"
"Chaudoir, M. de","1874","Supplément à l'essai sur les Féronies de l'Australie publié dans le Bulletin des Naturalistes de Moscou en 1865 T. ii, p. 56, Accompangé d'observations sur la synonymie","569-601","","Annali del Museo Civico di Storia Naturale, Genova","","","","<!--MARK--><a href='null015681ce-5643-4a7a-80e5-758d3acd4c99' class='mouseoverHref'>Chaudoir, M. de 1874. Supplément à l'essai sur les Féronies de l'Australie publié dans le Bulletin des Naturalistes de Moscou en 1865 T. ii, p. 56, Accompangé d'observations sur la synonymie.</a> <!--MARK--><!--MARK--><a href='null461059ea-ead7-4f6d-83f4-52913f06d09f' class='mouseoverHref'><em>Annali del Museo Civico di Storia Naturale, Genova</em></a> <strong>6</strong>: 569-601<!--MARK-->","","Article in Journal","015681ce-5643-4a7a-80e5-758d3acd4c99","20170407T02:06:27.416+0000","461059ea-ead7-4f6d-83f4-52913f06d09f"
"Csiki, E.","1929","Carabidae II: Harpalinae III","347-528","Coleopterorum Catalogus auspiciis et auxilio W. Junk","","","","","<!--MARK--><a href='null0bdfece6-43f8-4a41-9ad6-5d5d72f36911' class='mouseoverHref'>Csiki, E. 1929. Carabidae II: Harpalinae III. pp. 347-528</a> <!--MARK--><em>in</em> <!--MARK--><a href='null1eb1917a-b7ee-4122-b7a3-dd564b35249d' class='mouseoverHref'>Schenkling, S. (ed.). <em>Coleopterorum Catalogus auspiciis et auxilio W. Junk</em>. Berlin : W. Junk Vol. 1 Pars 104.</a><!--MARK--> [Date published 20/Mar/1929]","","Chapter in Book","0bdfece6-43f8-4a41-9ad6-5d5d72f36911","20081009T05:11:37.000+0000","1eb1917a-b7ee-4122-b7a3-dd564b35249d"
"Csiki, E.","1930","Carabidae II: Harpalinae IV","529-738","Coleopterorum Catalogus auspiciis et auxilio W. Junk","","","","","<!--MARK--><a href='null303324d0-f8b7-4bcb-9380-9b58ae5bd958' class='mouseoverHref'>Csiki, E. 1930. Carabidae II: Harpalinae IV. pp. 529-738</a> <!--MARK--><em>in</em> <!--MARK--><a href='nullf7bea1ea-f97e-44c2-ad9b-ce24adb03011' class='mouseoverHref'>Schenkling, S. (ed.). <em>Coleopterorum Catalogus auspiciis et auxilio W. Junk</em>. Berlin : W. Junk Vol. 2 Pars 112.</a><!--MARK--> [Date published 3/Jun/1930]","","Chapter in Book","303324d0-f8b7-4bcb-9380-9b58ae5bd958","20081009T05:11:37.000+0000","f7bea1ea-f97e-44c2-ad9b-ce24adb03011"
"Darlington, P.J. Jr","1953","Australian carabid beetles II. Some new Pterostichini","90-101","","Psyche (Cambridge)","","","","<!--MARK--><a href='null81451398-d0dd-486f-ad80-a420f8b7cb1c' class='mouseoverHref'>Darlington, P.J. Jr 1953. Australian carabid beetles II. Some new Pterostichini.</a> <!--MARK--><!--MARK--><a href='nulle5075c07-9cfd-4699-a945-bae664d3a3e2' class='mouseoverHref'><em>Psyche (Cambridge)</em></a> Camb. <strong>60</strong>: 90-101<!--MARK-->","","Article in Journal","81451398-d0dd-486f-ad80-a420f8b7cb1c","20081009T05:11:37.000+0000","e5075c07-9cfd-4699-a945-bae664d3a3e2"
"Darlington, P.J. Jr","1961","Australian carabid beetles IX. The tropical <i>Notonomus</i>","1-114","","Breviora. Museum of Comparative Zoology","","","","<!--MARK--><a href='null334ec711-d940-4111-885e-c8ce814d74bf' class='mouseoverHref'>Darlington, P.J. Jr 1961. Australian carabid beetles IX. The tropical <i>Notonomus</i>.</a> <!--MARK--><!--MARK--><a href='nullb5aca245-716d-4330-9421-57e8fe2d73d8' class='mouseoverHref'><em>Breviora. Museum of Comparative Zoology</em></a> <strong>148</strong>: 1-114<!--MARK-->","","Article in Journal","334ec711-d940-4111-885e-c8ce814d74bf","20081009T05:11:37.000+0000","b5aca245-716d-4330-9421-57e8fe2d73d8"
"Darlington, P.J. Jr","1961","Australian carabid beetles VIII. <i>Leiradira</i>, especially the tropical species.","1-12","","Breviora. Museum of Comparative Zoology","","","","<!--MARK--><a href='null937074c2-f7ed-4ee5-b800-8cf87011153c' class='mouseoverHref'>Darlington, P.J. Jr 1961. Australian carabid beetles VIII. <i>Leiradira</i>, especially the tropical species.</a> <!--MARK--><!--MARK--><a href='nullb5aca245-716d-4330-9421-57e8fe2d73d8' class='mouseoverHref'><em>Breviora. Museum of Comparative Zoology</em></a> <strong>147</strong>: 1-12<!--MARK-->","","Article in Journal","937074c2-f7ed-4ee5-b800-8cf87011153c","20150909T23:19:03.052+0000","b5aca245-716d-4330-9421-57e8fe2d73d8"
"Dejean, P.F.M.A.","1828","Spécies général des Coléoptères de la Collection de M. le Compte Dejean","vii 556 pp.","","","","","Méquignon-Marvis","<!--MARK--><a href='nulled097151-fd0d-4521-9a92-3099b9fea0dc' class='mouseoverHref'>Dejean, P.F.M.A. 1828. <em>Spécies général des Coléoptères de la Collection de M. le Compte Dejean</em>. Paris : Méquignon-Marvis Vol. III vii 556 pp.</a><!--MARK-->","","Book","ed097151-fd0d-4521-9a92-3099b9fea0dc","20081009T05:11:37.000+0000",""
"Horne, P.A.","1990","Parental care in <i>Notonomus</i> Chaudoir (Coleoptera: Carabidae: Pterostichinae)","65-69","","Australian Entomological Magazine","","28/Jun/1990","","<!--MARK--><a href='null40a6e950-f476-4a13-9c1f-71d67f85eb13' class='mouseoverHref'>Horne, P.A. 1990. Parental care in <i>Notonomus</i> Chaudoir (Coleoptera: Carabidae: Pterostichinae).</a> <!--MARK--><!--MARK--><a href='null33d99a92-3718-4094-b6bd-af8f9b31885d' class='mouseoverHref'><em>Australian Entomological Magazine</em></a> <strong>17</strong>(2): 65-69<!--MARK--> [Date published 28/Jun/1990]","","Article in Journal","40a6e950-f476-4a13-9c1f-71d67f85eb13","20081009T05:11:37.000+0000","33d99a92-3718-4094-b6bd-af8f9b31885d"
"Lutshnik, V.","1915","Sur quelques Platysmatini de la faune Australienne (Coleoptera, Carabidae)","418-421","","Revue Russe d'Entomologie","","","","<!--MARK--><a href='null58e44a74-4587-4669-bd39-7f60a19af2f8' class='mouseoverHref'>Lutshnik, V. 1915. Sur quelques Platysmatini de la faune Australienne (Coleoptera, Carabidae).</a> <!--MARK--><!--MARK--><a href='nullae560f66-598c-4d76-93c4-8b4f7ffba25b' class='mouseoverHref'><em>Revue Russe d'Entomologie</em></a> <strong>14</strong>: 418-421<!--MARK-->","","Article in Journal","58e44a74-4587-4669-bd39-7f60a19af2f8","20081009T05:11:37.000+0000","ae560f66-598c-4d76-93c4-8b4f7ffba25b"
"Lutshnik, V.","1922","On the Platysmatina","67-79","","Acta Instituti agronomici stauropolitani","","","","<!--MARK--><a href='null227c673e-a852-47ec-8863-ddedced899b6' class='mouseoverHref'>Lutshnik, V. 1922. On the Platysmatina.</a> <!--MARK--><!--MARK--><a href='nullfa7b62de-82d0-49d7-9d28-6c7edd38454a' class='mouseoverHref'><em>Acta Instituti agronomici stauropolitani</em></a> <strong>1</strong>: 67-79<!--MARK-->","","Article in Journal","227c673e-a852-47ec-8863-ddedced899b6","20081009T05:11:37.000+0000","fa7b62de-82d0-49d7-9d28-6c7edd38454a"
"Macleay, W.J.","1871","Notes on a collection of insects from Gayndah","79-205","","Transactions of the Entomological Society of New South Wales","","","","<!--MARK--><a href='null9e91362c-6ac4-452a-8ef5-9d82e451f0de' class='mouseoverHref'>Macleay, W.J. 1871. Notes on a collection of insects from Gayndah.</a> <!--MARK--><!--MARK--><a href='null69b821b6-f09d-44b0-ae3f-0e6c294b532e' class='mouseoverHref'><em>Transactions of the Entomological Society of New South Wales</em></a> <strong>2</strong>: 79-205<!--MARK-->","","Article in Journal","9e91362c-6ac4-452a-8ef5-9d82e451f0de","20081009T05:11:37.000+0000","69b821b6-f09d-44b0-ae3f-0e6c294b532e"
"Macleay, W.S.","1826","Annulosa, Catalogue of Insects, collected by Captain King, R.N. pp. 438-469 <i>in</i> King, P.P. <i>Narrative of a Survey of the Intertropical and Western Coasts of Australia performed between the years</i> 1818 <i>and</i> 1822. Vol. 2 App. B","","","","","","","<!--MARK--><a href='null7eb7856d-441d-414f-9a35-ef7e4e26c89b' class='mouseoverHref'>Macleay, W.S. 1826. Annulosa, Catalogue of Insects, collected by Captain King, R.N. pp. 438-469 <i>in</i> King, P.P. <i>Narrative of a Survey of the Intertropical and Western Coasts of Australia performed between the years</i> 1818 <i>and</i> 1822. Vol. 2 App. B.</a>","","Miscellaneous","7eb7856d-441d-414f-9a35-ef7e4e26c89b","20081009T05:11:37.000+0000",""
"Moore, B.P.","1960","Studies on Australian Carabidae (Coleoptera) 1. New species of the tribes Agonicini, Trechini and Pterostichini","165-169","","Proceedings of the Royal Entomological Society of London","","","","<!--MARK--><a href='null58525761-1300-42e9-91dc-9de6836e5646' class='mouseoverHref'>Moore, B.P. 1960. Studies on Australian Carabidae (Coleoptera) 1. New species of the tribes Agonicini, Trechini and Pterostichini.</a> <!--MARK--><!--MARK--><a href='null6ca99b2d-b4f7-49d4-8f5c-8db6ec2f5294' class='mouseoverHref'><em>Proceedings of the Royal Entomological Society of London</em></a> B <strong>29</strong>: 165-169<!--MARK-->","","Article in Journal","58525761-1300-42e9-91dc-9de6836e5646","20081009T05:11:37.000+0000","6ca99b2d-b4f7-49d4-8f5c-8db6ec2f5294"
"Moore, B.P.","1961","Notes on Australian Carabidae (Col.). II <i>Notonomus atridermis</i> Sloane","134-136","","Entomologist's Monthly Magazine","","","","<!--MARK--><a href='null8047a900-7a2f-4b44-84e3-fe254e89c915' class='mouseoverHref'>Moore, B.P. 1961. Notes on Australian Carabidae (Col.). II <i>Notonomus atridermis</i> Sloane.</a> <!--MARK--><!--MARK--><a href='nullcbd5c497-64d0-4fae-97ee-22719c3ca286' class='mouseoverHref'><em>Entomologist's Monthly Magazine</em></a> <strong>96</strong>: 134-136<!--MARK-->","","Article in Journal","8047a900-7a2f-4b44-84e3-fe254e89c915","20110124T04:04:53.010+0000","cbd5c497-64d0-4fae-97ee-22719c3ca286"
"Moore, B.P.","1963","New or little known Australian Carabidae in the Frey Museum (Col.)","435-444","","Entomologischen Arbeiten aus dem Museum Georg Frey","","","","<!--MARK--><a href='null8d6adcd3-0096-462d-9770-dafdc4580b40' class='mouseoverHref'>Moore, B.P. 1963. New or little known Australian Carabidae in the Frey Museum (Col.).</a> <!--MARK--><!--MARK--><a href='nulld9967b1d-fa66-4d5e-9c04-910b53ebb9b3' class='mouseoverHref'><em>Entomologischen Arbeiten aus dem Museum Georg Frey</em></a> <strong>14</strong>: 435-444<!--MARK-->","","Article in Journal","8d6adcd3-0096-462d-9770-dafdc4580b40","20121105T00:42:44.234+0000","d9967b1d-fa66-4d5e-9c04-910b53ebb9b3"
"Moore, B.P.","1979","Chemical defense in Carabids and its bearing on phylogeny","193-203","Carabid beetles: Their evolution, natural history, and classification","","","","","<!--MARK--><a href='null6488b883-bbc8-41c5-95bf-93354766b44e' class='mouseoverHref'>Moore, B.P. 1979. Chemical defense in Carabids and its bearing on phylogeny. pp. 193-203</a> <!--MARK--><em>in</em> <!--MARK--><a href='nulle364904b-0a23-44c0-9003-f6954883a0aa' class='mouseoverHref'>Erwin, T.L., Ball, G.E., Whitehead, D.R. & Halpern, A.L. (eds). <em>Carabid beetles: Their evolution, natural history, and classification</em>. The Hague : W. Junk vii 635 pp.</a><!--MARK-->","","Chapter in Book","6488b883-bbc8-41c5-95bf-93354766b44e","20081009T05:11:37.000+0000","e364904b-0a23-44c0-9003-f6954883a0aa"
"Moore, B.P.","1987","Suborder Adephaga","17-366","Zoological Catalogue of Australia. Coleoptera: Archostemata, Myxophaga and Adephaga","","","","","<!--MARK--><a href='null1f267174-3770-4e86-a2a6-fe1e8fdf52d2' class='mouseoverHref'>Moore, B.P. 1987. Suborder Adephaga. pp. 17-366</a> <!--MARK--><em>in</em> <!--MARK--><a href='nullbd74a387-ac31-4a80-8ac1-c19387a1eb98' class='mouseoverHref'>Houston, W.W.K. & Richardson, B.J.R. (eds). <em>Zoological Catalogue of Australia. Coleoptera: Archostemata, Myxophaga and Adephaga</em>. Canberra : Australian Government Publishing Service Vol. 4 viii 444 pp.</a><!--MARK-->","","Chapter in Book","1f267174-3770-4e86-a2a6-fe1e8fdf52d2","20081009T05:11:37.000+0000","bd74a387-ac31-4a80-8ac1-c19387a1eb98"
"Moore, B.P. & Wallbank, B.E.","1968","Chemical composition of the defensive secretion in carabid beetles and its importance as a taxonomic character","62-72","","Proceedings of the Royal Entomological Society of London","","","","<!--MARK--><a href='nulle84db0f1-2bda-440b-863b-5aa2a3f63cf1' class='mouseoverHref'>Moore, B.P. & Wallbank, B.E. 1968. Chemical composition of the defensive secretion in carabid beetles and its importance as a taxonomic character.</a> <!--MARK--><!--MARK--><a href='null6ca99b2d-b4f7-49d4-8f5c-8db6ec2f5294' class='mouseoverHref'><em>Proceedings of the Royal Entomological Society of London</em></a> <strong>37</strong>(5-6): 62-72<!--MARK-->","","Article in Journal","e84db0f1-2bda-440b-863b-5aa2a3f63cf1","20081009T05:11:37.000+0000","6ca99b2d-b4f7-49d4-8f5c-8db6ec2f5294"
"Motschulsky, V.","1865","Énumération des nouvelles espèces de Coléoptères rapportés de ses voyages. 4-ème article (Suite)","227-313","","Bulletin de la Société Impériale des Naturalistes de Moscou","","","","<!--MARK--><a href='null121d58cd-6d31-4917-953e-867f46d218df' class='mouseoverHref'>Motschulsky, V. 1865. Énumération des nouvelles espèces de Coléoptères rapportés de ses voyages. 4-ème article (Suite).</a> <!--MARK--><!--MARK--><a href='nulla7cbc93a-fdd0-40a5-9cc8-35de71b7d18a' class='mouseoverHref'><em>Bulletin de la Société Impériale des Naturalistes de Moscou</em></a> <strong>38</strong>: 227-313<!--MARK-->","","Article in Journal","121d58cd-6d31-4917-953e-867f46d218df","20081009T05:11:37.000+0000","a7cbc93a-fdd0-40a5-9cc8-35de71b7d18a"
"Newman, E.","1842","List of insects collected at Port Phillip, New South Wales, by Edmund Thomas Higgins, Esq. (continued)","401-405","","The Entomologist","","Oct. 1842","","<!--MARK--><a href='nulla3400700-fa6b-4bb1-9631-19dabc7930fc' class='mouseoverHref'>Newman, E. 1842. List of insects collected at Port Phillip, New South Wales, by Edmund Thomas Higgins, Esq. (continued).</a> <!--MARK--><!--MARK--><a href='nullf3b5bc68-9fcf-42d6-b01d-f490d96af7e9' class='mouseoverHref'><em>The Entomologist</em></a> <strong>1</strong>(24): 401-405<!--MARK--> [Date published Oct. 1842]","","Article in Journal","a3400700-fa6b-4bb1-9631-19dabc7930fc","20160922T06:52:52.527+0000","f3b5bc68-9fcf-42d6-b01d-f490d96af7e9"
"Rainbow, W.J.","1899","Descriptions of two beetles from Mount Kosciusko","147-149","","Records of the Australian Museum","","","","<!--MARK--><a href='null46309072-2cef-4c00-8dc1-013f970732c8' class='mouseoverHref'>Rainbow, W.J. 1899. Descriptions of two beetles from Mount Kosciusko.</a> <!--MARK--><!--MARK--><a href='null7c07530b-0b38-44f5-8f95-368da97d6ac2' class='mouseoverHref'><em>Records of the Australian Museum</em></a> <strong>3</strong>: 147-149<!--MARK-->","","Article in Journal","46309072-2cef-4c00-8dc1-013f970732c8","20081009T05:11:37.000+0000","7c07530b-0b38-44f5-8f95-368da97d6ac2"
"Sloane, T.G.","1890","Studies in Australian Entomology. No. II Six new species of Carabidae","1288-1296","","Proceedings of the Linnean Society of New South Wales","","","","<!--MARK--><a href='null4c416806-212b-44f9-954f-2fef85b8e240' class='mouseoverHref'>Sloane, T.G. 1890. Studies in Australian Entomology. No. II Six new species of Carabidae.</a> <!--MARK--><!--MARK--><a href='nullc12cd779-adb5-41ea-bd2c-75f6864cf22e' class='mouseoverHref'><em>Proceedings of the Linnean Society of New South Wales</em></a> 2 <strong>4</strong>: 1288-1296<!--MARK-->","","Article in Journal","4c416806-212b-44f9-954f-2fef85b8e240","20081009T05:11:37.000+0000","c12cd779-adb5-41ea-bd2c-75f6864cf22e"
"Sloane, T.G.","1898","On Carabidae from West Australia, sent by Mr. A.M. Lea (with descriptions of new genera and species, synoptic tables etc.)","444-520","","Proceedings of the Linnean Society of New South Wales","","","","<!--MARK--><a href='null703f4731-a143-4da9-a327-483a0f47f698' class='mouseoverHref'>Sloane, T.G. 1898. On Carabidae from West Australia, sent by Mr. A.M. Lea (with descriptions of new genera and species, synoptic tables etc.).</a> <!--MARK--><!--MARK--><a href='nullc12cd779-adb5-41ea-bd2c-75f6864cf22e' class='mouseoverHref'><em>Proceedings of the Linnean Society of New South Wales</em></a> <strong>23</strong>: 444-520<!--MARK-->","","Article in Journal","703f4731-a143-4da9-a327-483a0f47f698","20081009T05:11:37.000+0000","c12cd779-adb5-41ea-bd2c-75f6864cf22e"
"Sloane, T.G.","1902","A revision of the genus <i>Notonomus</i> (Family Carabidae; sub-family Feronini)","252-325","","Proceedings of the Linnean Society of New South Wales","","","","<!--MARK--><a href='null4f44401a-89f0-4a07-a55d-45d1e547359b' class='mouseoverHref'>Sloane, T.G. 1902. A revision of the genus <i>Notonomus</i> (Family Carabidae; sub-family Feronini).</a> <!--MARK--><!--MARK--><a href='nullc12cd779-adb5-41ea-bd2c-75f6864cf22e' class='mouseoverHref'><em>Proceedings of the Linnean Society of New South Wales</em></a> <strong>27</strong>: 252-325<!--MARK-->","","Article in Journal","4f44401a-89f0-4a07-a55d-45d1e547359b","20081009T05:11:37.000+0000","c12cd779-adb5-41ea-bd2c-75f6864cf22e"
"Sloane, T.G.","1903","Studies in Australian Entomology. No XII New Carabidae (Panageini, Bembidiini, Pogonini, Platysmatini, Platynini, Lebiini, with revisional lists of genera and speecis [<i>sic</i>], some notes on synonymy, etc.)","566-642","","Proceedings of the Linnean Society of New South Wales","","","","<!--MARK--><a href='null2e67762d-d5e3-4c1f-baa9-1c3510585d81' class='mouseoverHref'>Sloane, T.G. 1903. Studies in Australian Entomology. No XII New Carabidae (Panageini, Bembidiini, Pogonini, Platysmatini, Platynini, Lebiini, with revisional lists of genera and speecis [<i>sic</i>], some notes on synonymy, etc.).</a> <!--MARK--><!--MARK--><a href='nullc12cd779-adb5-41ea-bd2c-75f6864cf22e' class='mouseoverHref'><em>Proceedings of the Linnean Society of New South Wales</em></a> <strong>28</strong>: 566-642<!--MARK-->","","Article in Journal","2e67762d-d5e3-4c1f-baa9-1c3510585d81","20081009T05:11:37.000+0000","c12cd779-adb5-41ea-bd2c-75f6864cf22e"
"Sloane, T.G.","1907","Studies in Australian Entomology. No. XV New genera and species of Carabidae, with some notes of synonymy (Clivinini, Scaritini, Cuneipectini, Trigonotomini and Lebiini)","346-381","","Proceedings of the Linnean Society of New South Wales","","","","<!--MARK--><a href='nullfd2149cb-d97a-474a-a51f-361b58b17b67' class='mouseoverHref'>Sloane, T.G. 1907. Studies in Australian Entomology. No. XV New genera and species of Carabidae, with some notes of synonymy (Clivinini, Scaritini, Cuneipectini, Trigonotomini and Lebiini).</a> <!--MARK--><!--MARK--><a href='nullc12cd779-adb5-41ea-bd2c-75f6864cf22e' class='mouseoverHref'><em>Proceedings of the Linnean Society of New South Wales</em></a> <strong>32</strong>: 346-381<!--MARK-->","","Article in Journal","fd2149cb-d97a-474a-a51f-361b58b17b67","20081009T05:11:37.000+0000","c12cd779-adb5-41ea-bd2c-75f6864cf22e"
"Sloane, T.G.","1910","Studies in Australian Entomology. No. XVI New species of Carabidae","378-406","","Proceedings of the Linnean Society of New South Wales","","","","<!--MARK--><a href='null355d4bde-82ff-4077-8b39-cb3c7e70df04' class='mouseoverHref'>Sloane, T.G. 1910. Studies in Australian Entomology. No. XVI New species of Carabidae.</a> <!--MARK--><!--MARK--><a href='nullc12cd779-adb5-41ea-bd2c-75f6864cf22e' class='mouseoverHref'><em>Proceedings of the Linnean Society of New South Wales</em></a> <strong>35</strong>: 378-406<!--MARK-->","","Article in Journal","355d4bde-82ff-4077-8b39-cb3c7e70df04","20081009T05:11:37.000+0000","c12cd779-adb5-41ea-bd2c-75f6864cf22e"
"Sloane, T.G.","1911","Carabidae from Dorrigo, N.S.W","823-843","","Proceedings of the Linnean Society of New South Wales","","","","<!--MARK--><a href='null57e28523-c9f0-4680-8fd8-e36945efa076' class='mouseoverHref'>Sloane, T.G. 1911. Carabidae from Dorrigo, N.S.W.</a> <!--MARK--><!--MARK--><a href='nullc12cd779-adb5-41ea-bd2c-75f6864cf22e' class='mouseoverHref'><em>Proceedings of the Linnean Society of New South Wales</em></a> <strong>35</strong>: 823-843<!--MARK-->","","Article in Journal","57e28523-c9f0-4680-8fd8-e36945efa076","20081009T05:11:37.000+0000","c12cd779-adb5-41ea-bd2c-75f6864cf22e"
"Sloane, T.G.","1913","Revisional notes on Australian Carabidae. Part iv. The genus <i>Notonomus</i>","404-449","","Proceedings of the Linnean Society of New South Wales","","","","<!--MARK--><a href='nullf2f77e20-4ec7-4f5a-ac20-b7c9587cfda0' class='mouseoverHref'>Sloane, T.G. 1913. Revisional notes on Australian Carabidae. Part iv. The genus <i>Notonomus</i>.</a> <!--MARK--><!--MARK--><a href='nullc12cd779-adb5-41ea-bd2c-75f6864cf22e' class='mouseoverHref'><em>Proceedings of the Linnean Society of New South Wales</em></a> <strong>38</strong>: 404-449<!--MARK-->","","Article in Journal","f2f77e20-4ec7-4f5a-ac20-b7c9587cfda0","20081009T05:11:37.000+0000","c12cd779-adb5-41ea-bd2c-75f6864cf22e"
"Sloane, T.G.","1915","Studies in Australian Entomology. No. XVII New genera and species of Carabidae. (Pamborini, Migadopini, Broscini, Cunepectini, Nomoni, Pterostichini, Platynini, Oodini, Harpalini, Lebiini)","438-473","","Proceedings of the Linnean Society of New South Wales","","","","<!--MARK--><a href='nullcb216199-e565-46cd-b4a9-1989fec386ef' class='mouseoverHref'>Sloane, T.G. 1915. Studies in Australian Entomology. No. XVII New genera and species of Carabidae. (Pamborini, Migadopini, Broscini, Cunepectini, Nomoni, Pterostichini, Platynini, Oodini, Harpalini, Lebiini).</a> <!--MARK--><!--MARK--><a href='nullc12cd779-adb5-41ea-bd2c-75f6864cf22e' class='mouseoverHref'><em>Proceedings of the Linnean Society of New South Wales</em></a> <strong>40</strong>: 438-473<!--MARK-->","","Article in Journal","cb216199-e565-46cd-b4a9-1989fec386ef","20081009T05:11:37.000+0000","c12cd779-adb5-41ea-bd2c-75f6864cf22e"
"Sloane, T.G.","1916","Carabidae from the Upper Williams River, N.S.W. [Coleoptera]","196-208","","Proceedings of the Linnean Society of New South Wales","","","","<!--MARK--><a href='nullf479ce0a-d2c6-420a-a125-60ec60e730a3' class='mouseoverHref'>Sloane, T.G. 1916. Carabidae from the Upper Williams River, N.S.W. [Coleoptera].</a> <!--MARK--><!--MARK--><a href='nullc12cd779-adb5-41ea-bd2c-75f6864cf22e' class='mouseoverHref'><em>Proceedings of the Linnean Society of New South Wales</em></a> <strong>41</strong>: 196-208<!--MARK-->","","Article in Journal","f479ce0a-d2c6-420a-a125-60ec60e730a3","20081009T05:11:37.000+0000","c12cd779-adb5-41ea-bd2c-75f6864cf22e"
