"PUB_AUTHOR","PUB_YEAR","PUB_TITLE","PUB_PAGES","PUB_PARENT_BOOK_TITLE","PUB_PARENT_JOURNAL_TITLE","PUB_PARENT_ARTICLE_TITLE","PUB_PUBLICATION_DATE","PUB_PUBLISHER","PUB_FORMATTED","PUB_QUALIFICATION","PUB_TYPE","PUBLICATION_GUID","PUBLICATION_LAST_UPDATE","PARENT_PUBLICATION_GUID"
"Baehr, M.","1985","Revision of the Australian Zuphiinae 4. The genus <i>Parazuphium</i> Jeannel (Insecta, Coleoptera, Carabidae)","295-321","","Spixiana (Munich)","","30 Dec. 1985","","<!--MARK--><a href='nulle08b6613-7add-4f2e-b934-9869b1d68884' class='mouseoverHref'>Baehr, M. 1985. Revision of the Australian Zuphiinae 4. The genus <i>Parazuphium</i> Jeannel (Insecta, Coleoptera, Carabidae).</a> <!--MARK--><!--MARK--><a href='nullce825dec-bfed-4bd4-81bc-3368e292b581' class='mouseoverHref'><em>Spixiana (Munich)</em></a> <strong>8</strong>(3): 295-321<!--MARK--> [Date published 30 Dec. 1985]","","Article in Journal","e08b6613-7add-4f2e-b934-9869b1d68884","20081009T05:11:37.000+0000","ce825dec-bfed-4bd4-81bc-3368e292b581"
"Baehr, M.","2014","Three new species and a new genus of subterranean Zuphiini from the Pilbara region of north-western Australia (Coleoptera: Carabidae: Harpalinae).","95-104","","Records of the Western Australian Museum","","","","<!--MARK--><a href='null4d260e31-2b11-47ad-917a-3bfead5eba5e' class='mouseoverHref'>Baehr, M. 2014. Three new species and a new genus of subterranean Zuphiini from the Pilbara region of north-western Australia (Coleoptera: Carabidae: Harpalinae).</a> <!--MARK--><!--MARK--><a href='nulla2cbd1fb-97d5-493a-a1d7-c2b99709890b' class='mouseoverHref'><em>Records of the Western Australian Museum</em></a> <strong>29</strong>: 95-104<!--MARK-->","","Article in Journal","4d260e31-2b11-47ad-917a-3bfead5eba5e","20150304T23:34:45.063+0000","a2cbd1fb-97d5-493a-a1d7-c2b99709890b"
"Castelnau, F.L. Laporte de","1867","Notes on Australian Coleoptera","139 pp.","","","","","Royal Society of Victoria","<!--MARK--><a href='null24775344-c4a6-4169-a50c-6b5559f88a2a' class='mouseoverHref'>Castelnau, F.L. Laporte de 1867. <em>Notes on Australian Coleoptera</em>. Melbourne : Royal Society of Victoria 139 pp.</a><!--MARK--> [separates available prior to publication in <I>Trans. R. Soc. Vict. </I><B>8</B>: 30-38 (1867), 95-225 (1868)]","separates available prior to publication in <I>Trans. R. Soc. Vict. </I><B>8</B>: 30-38 (1867), 95-225 (1868)","Book","24775344-c4a6-4169-a50c-6b5559f88a2a","20100628T06:12:41.272+0000",""
"Darlington, P.J. Jr","1968","The carabid beetles of New Guinea Part III. Harpalinae (continued): Perigonini to Pseudomorphini","1-253","","Bulletin of the Museum of Comparative Zoology, Harvard","","","","<!--MARK--><a href='null0dd8382e-9237-40bb-8cbd-da7725b9934c' class='mouseoverHref'>Darlington, P.J. Jr 1968. The carabid beetles of New Guinea Part III. Harpalinae (continued): Perigonini to Pseudomorphini.</a> <!--MARK--><!--MARK--><a href='nullb2447030-bd13-4a45-9402-157082169a3d' class='mouseoverHref'><em>Bulletin of the Museum of Comparative Zoology, Harvard</em></a> <strong>137</strong>: 1-253<!--MARK-->","","Article in Journal","0dd8382e-9237-40bb-8cbd-da7725b9934c","20081009T05:11:37.000+0000","b2447030-bd13-4a45-9402-157082169a3d"
"Jeannel, R.","1942","Coléoptères carabiques, Deuxième partie","73-1173","","Faune de France","","","","<!--MARK--><a href='null24a45c0c-1d94-4541-a6db-6bec8e84af62' class='mouseoverHref'>Jeannel, R. 1942. Coléoptères carabiques, Deuxième partie.</a> <!--MARK--><!--MARK--><a href='null61be3d3c-669c-4c21-834d-9c4a47182fc0' class='mouseoverHref'><em>Faune de France</em></a> <strong>41</strong>: 73-1173<!--MARK-->","","Article in Journal","24a45c0c-1d94-4541-a6db-6bec8e84af62","20081009T05:11:37.000+0000","61be3d3c-669c-4c21-834d-9c4a47182fc0"
