"PUB_AUTHOR","PUB_YEAR","PUB_TITLE","PUB_PAGES","PUB_PARENT_BOOK_TITLE","PUB_PARENT_JOURNAL_TITLE","PUB_PARENT_ARTICLE_TITLE","PUB_PUBLICATION_DATE","PUB_PUBLISHER","PUB_FORMATTED","PUB_QUALIFICATION","PUB_TYPE","PUBLICATION_GUID","PUBLICATION_LAST_UPDATE","PARENT_PUBLICATION_GUID"
"Brown, W.L. jr","1973","A comparison of the Hylean and Congo-West African rain forest ant faunas. pp. 161-185 <i>in</i> Meggers, B.J., Ayensu, E.S. & Duckworth, W.D. (eds) <i>Tropical forest ecosystems in Africa and South America: a comparative review.</i> Washington : Smithsonian Institution Press","","","","","","","<!--MARK--><a href='null4532561f-402c-48e7-a6ee-c757dab82a0c' class='mouseoverHref'>Brown, W.L. jr 1973. A comparison of the Hylean and Congo-West African rain forest ant faunas. pp. 161-185 <i>in</i> Meggers, B.J., Ayensu, E.S. & Duckworth, W.D. (eds) <i>Tropical forest ecosystems in Africa and South America: a comparative review.</i> Washington : Smithsonian Institution Press.</a>","","Miscellaneous","4532561f-402c-48e7-a6ee-c757dab82a0c","20081009T05:11:37.000+0000",""
"Ettershank, G.","1966","A generic revision of the world Myrmicinae related to <i>Solenopsis</i> and <i>Pheidologeton</i> (Hymenoptera: Formicidae)","73-171","","Australian Journal of Zoology","","","","<!--MARK--><a href='nullda0ee5d3-55a9-4b4e-b1c7-69c9af18d2b4' class='mouseoverHref'>Ettershank, G. 1966. A generic revision of the world Myrmicinae related to <i>Solenopsis</i> and <i>Pheidologeton</i> (Hymenoptera: Formicidae).</a> <!--MARK--><!--MARK--><a href='null53c3abd8-0254-4532-a73e-d9ef6b7ac2ef' class='mouseoverHref'><em>Australian Journal of Zoology</em></a> <strong>14</strong>: 73-171<!--MARK-->","","Article in Journal","da0ee5d3-55a9-4b4e-b1c7-69c9af18d2b4","20081009T05:11:37.000+0000","53c3abd8-0254-4532-a73e-d9ef6b7ac2ef"
"Forel, A.","1915","Results of Dr. E. Mjöbergs Swedish Scientific Expeditions to Australia 1910-1913. 2. Ameisen","1-119, pls 1-3","","Arkiv för Zoologi","","4 Dec. 1915","","<!--MARK--><a href='null754605fe-9d76-4139-a599-27700cd29d6c' class='mouseoverHref'>Forel, A. 1915. Results of Dr. E. Mjöbergs Swedish Scientific Expeditions to Australia 1910-1913. 2. Ameisen.</a> <!--MARK--><!--MARK--><a href='nullea0f28cc-317a-4542-aaf0-5fa8122b7a93' class='mouseoverHref'><em>Arkiv för Zoologi</em></a> <strong>9</strong>(no.16): 1-119, pls 1-3<!--MARK--> [Date published 4 Dec. 1915]","","Article in Journal","754605fe-9d76-4139-a599-27700cd29d6c","20170119T05:38:42.679+0000","ea0f28cc-317a-4542-aaf0-5fa8122b7a93"
"Forel, A.","1918","Études myrmécologiques en 1917","717-727","","Bulletin de la Société Vaudoise des Sciences Naturelles","","","","<!--MARK--><a href='null9e9bcf61-f294-4148-88fb-324e0366c48d' class='mouseoverHref'>Forel, A. 1918. Études myrmécologiques en 1917.</a> <!--MARK--><!--MARK--><a href='null7cc7ca27-1066-4ebf-a5b4-4631f8d94eb6' class='mouseoverHref'><em>Bulletin de la Société Vaudoise des Sciences Naturelles</em></a> <strong>51</strong>: 717-727<!--MARK--> [5 Apr. 1918]","5 Apr. 1918","Article in Journal","9e9bcf61-f294-4148-88fb-324e0366c48d","20081009T05:11:37.000+0000","7cc7ca27-1066-4ebf-a5b4-4631f8d94eb6"
"Jerdon, T.C.","1851","A catalogue of the species of ants found in southern India","103-127","","Madras Journal of Literature and Science","","","","<!--MARK--><a href='nullb071eec1-f9bc-45c5-9b12-43cad9e24d9b' class='mouseoverHref'>Jerdon, T.C. 1851. A catalogue of the species of ants found in southern India.</a> <!--MARK--><!--MARK--><a href='nulla781e30e-ab78-4ecb-8b53-24ba9690458a' class='mouseoverHref'><em>Madras Journal of Literature and Science</em></a> <strong>17</strong>: 103-127<!--MARK-->","","Article in Journal","b071eec1-f9bc-45c5-9b12-43cad9e24d9b","20081009T05:11:37.000+0000","a781e30e-ab78-4ecb-8b53-24ba9690458a"
"Mayr, G.L.","1862","Myrmecologische Studien","Abhand. 649-776 pl. 19","","Verhandlungen der Zoologisch-Botanischen Gesellschaft in Wien","","","","<!--MARK--><a href='null60ba11b5-d484-46d9-b3bc-1688b91eaca7' class='mouseoverHref'>Mayr, G.L. 1862. Myrmecologische Studien.</a> <!--MARK--><!--MARK--><a href='null14e4d839-6bc2-42e9-ae1b-979730866002' class='mouseoverHref'><em>Verhandlungen der Zoologisch-Botanischen Gesellschaft in Wien</em></a> <strong>12</strong>: Abhand. 649-776 pl. 19<!--MARK-->","","Article in Journal","60ba11b5-d484-46d9-b3bc-1688b91eaca7","20081009T05:11:37.000+0000","14e4d839-6bc2-42e9-ae1b-979730866002"
"Taylor, R.W.","1991","Nomenclature and ditribution of some Australasian ants of the Myrmicinae (Hymenoptera: Formicidae)","599-614","","Memoirs of the Queensland Museum","","","","<!--MARK--><a href='nullfb787cbc-f7b8-4de5-8e4c-20e02b3f3f69' class='mouseoverHref'>Taylor, R.W. 1991. Nomenclature and ditribution of some Australasian ants of the Myrmicinae (Hymenoptera: Formicidae).</a> <!--MARK--><!--MARK--><a href='null1a0a2982-9f30-43e1-a641-b0379699837c' class='mouseoverHref'><em>Memoirs of the Queensland Museum</em></a> <strong>30</strong>: 599-614<!--MARK-->","","Article in Journal","fb787cbc-f7b8-4de5-8e4c-20e02b3f3f69","20081009T05:11:37.000+0000","1a0a2982-9f30-43e1-a641-b0379699837c"
