"PUB_AUTHOR","PUB_YEAR","PUB_TITLE","PUB_PAGES","PUB_PARENT_BOOK_TITLE","PUB_PARENT_JOURNAL_TITLE","PUB_PARENT_ARTICLE_TITLE","PUB_PUBLICATION_DATE","PUB_PUBLISHER","PUB_FORMATTED","PUB_QUALIFICATION","PUB_TYPE","PUBLICATION_GUID","PUBLICATION_LAST_UPDATE","PARENT_PUBLICATION_GUID"
"André, E.","1896","Fourmis nouvelles d'Asie et d'Australie","251-265","","Revue Française d'Entomologie","","","","<!--MARK--><a href='nulld1c2b1f6-d253-4e17-9b05-d14c13724488' class='mouseoverHref'>André, E. 1896. Fourmis nouvelles d'Asie et d'Australie.</a> <!--MARK--><!--MARK--><a href='nulle9f809d1-b273-4f37-ae15-92e14dc5b13b' class='mouseoverHref'><em>Revue Française d'Entomologie</em></a> <strong>15</strong>: 251-265<!--MARK-->","","Article in Journal","d1c2b1f6-d253-4e17-9b05-d14c13724488","20090807T02:41:05.828+0000","e9f809d1-b273-4f37-ae15-92e14dc5b13b"
"Brown, W.L. jr","1971","The identity and synonymy of <i>Pheidoleye vigilans</i> (Hymenoptera: Formicidae)","13-14","","Australian Journal of Zoology","","","","<!--MARK--><a href='nullea1321a5-f4f0-4b32-b916-9d33b2a68f34' class='mouseoverHref'>Brown, W.L. jr 1971. The identity and synonymy of <i>Pheidoleye vigilans</i> (Hymenoptera: Formicidae).</a> <!--MARK--><!--MARK--><a href='null53c3abd8-0254-4532-a73e-d9ef6b7ac2ef' class='mouseoverHref'><em>Australian Journal of Zoology</em></a> <strong>10</strong>: 13-14<!--MARK-->","","Article in Journal","ea1321a5-f4f0-4b32-b916-9d33b2a68f34","20081009T05:11:37.000+0000","53c3abd8-0254-4532-a73e-d9ef6b7ac2ef"
"Brown, W.L. jr","1973","A comparison of the Hylean and Congo-West African rain forest ant faunas. pp. 161-185 <i>in</i> Meggers, B.J., Ayensu, E.S. & Duckworth, W.D. (eds) <i>Tropical forest ecosystems in Africa and South America: a comparative review.</i> Washington : Smithsonian Institution Press","","","","","","","<!--MARK--><a href='null4532561f-402c-48e7-a6ee-c757dab82a0c' class='mouseoverHref'>Brown, W.L. jr 1973. A comparison of the Hylean and Congo-West African rain forest ant faunas. pp. 161-185 <i>in</i> Meggers, B.J., Ayensu, E.S. & Duckworth, W.D. (eds) <i>Tropical forest ecosystems in Africa and South America: a comparative review.</i> Washington : Smithsonian Institution Press.</a>","","Miscellaneous","4532561f-402c-48e7-a6ee-c757dab82a0c","20081009T05:11:37.000+0000",""
"Clark, J.","1934","Ants from the Otway Ranges","48-73","","Memoirs of the National Museum of Victoria, Melbourne","","","","<!--MARK--><a href='null7b9a23ad-5a84-4230-ad20-6eae8211b21e' class='mouseoverHref'>Clark, J. 1934. Ants from the Otway Ranges.</a> <!--MARK--><!--MARK--><a href='null6d019674-04b0-4fab-8903-0612d147ec4d' class='mouseoverHref'><em>Memoirs of the National Museum of Victoria, Melbourne</em></a> <strong>8</strong>: 48-73<!--MARK-->","","Article in Journal","7b9a23ad-5a84-4230-ad20-6eae8211b21e","20081009T05:11:37.000+0000","6d019674-04b0-4fab-8903-0612d147ec4d"
"Clark, J.","1938","Reports of the McCoy Society for Field Investigation and Research. No. 2. Sir Joseph Bank Islands. Part I. Formicidae (Hymenoptera)","356-382","","Proceedings of the Royal Society of Victoria","","","","<!--MARK--><a href='nullfa353c35-1515-4402-99e3-d809edda65cc' class='mouseoverHref'>Clark, J. 1938. Reports of the McCoy Society for Field Investigation and Research. No. 2. Sir Joseph Bank Islands. Part I. Formicidae (Hymenoptera).</a> <!--MARK--><!--MARK--><a href='nullce333794-3a02-427f-ba27-346079f1efa0' class='mouseoverHref'><em>Proceedings of the Royal Society of Victoria</em></a> <strong>50</strong>: 356-382<!--MARK-->","","Article in Journal","fa353c35-1515-4402-99e3-d809edda65cc","20081009T05:11:37.000+0000","ce333794-3a02-427f-ba27-346079f1efa0"
"Crawley, W.C.","1915","Ants from north and south-west Australia (G.F. Hill, Rowland Turner) and Christmas Island, Straits Settlements. Part II","232-239","","Annals and Magazine of Natural History","","","","<!--MARK--><a href='null7a89c605-713e-4b39-a683-f1fbf4f896b1' class='mouseoverHref'>Crawley, W.C. 1915. Ants from north and south-west Australia (G.F. Hill, Rowland Turner) and Christmas Island, Straits Settlements. Part II.</a> <!--MARK--><!--MARK--><a href='nullefa8de69-3a29-4a43-8ef2-cbefda205976' class='mouseoverHref'><em>Annals and Magazine of Natural History</em></a> 8 <strong>15</strong>: 232-239<!--MARK-->","","Article in Journal","7a89c605-713e-4b39-a683-f1fbf4f896b1","20081009T05:11:37.000+0000","efa8de69-3a29-4a43-8ef2-cbefda205976"
"Crawley, W.C.","1922","New ants from Australia","16-36","","Annals and Magazine of Natural History","","","","<!--MARK--><a href='nullfbb0b61e-3c36-4843-9167-529ce2ea9d9b' class='mouseoverHref'>Crawley, W.C. 1922. New ants from Australia.</a> <!--MARK--><!--MARK--><a href='nullefa8de69-3a29-4a43-8ef2-cbefda205976' class='mouseoverHref'><em>Annals and Magazine of Natural History</em></a> 9 <strong>10</strong>: 16-36<!--MARK-->","","Article in Journal","fbb0b61e-3c36-4843-9167-529ce2ea9d9b","20081009T05:11:37.000+0000","efa8de69-3a29-4a43-8ef2-cbefda205976"
"Emery, C.","1914","Formiche d'Australia e di Samoa raccolte dal Prof. Silvestri nel 1913","179-186","","Bollettino del Laboratorio di Zoologia Generale e Agraria della Facoltà Agraria in Portici","","","","<!--MARK--><a href='null10b5adae-a753-400b-9029-28db37c06341' class='mouseoverHref'>Emery, C. 1914. Formiche d'Australia e di Samoa raccolte dal Prof. Silvestri nel 1913.</a> <!--MARK--><!--MARK--><a href='null42089d4a-282f-4e49-931e-0fa8d2595891' class='mouseoverHref'><em>Bollettino del Laboratorio di Zoologia Generale e Agraria della Facoltà Agraria in Portici</em></a> <strong>8</strong>: 179-186<!--MARK--> [30 Jan. 1914]","30 Jan. 1914","Article in Journal","10b5adae-a753-400b-9029-28db37c06341","20081009T05:11:37.000+0000","42089d4a-282f-4e49-931e-0fa8d2595891"
"Fabricius, J.C.","1793","Entomologia Systematica Emendata et Aucta. Secundum, Classes, Ordines, Genera, Species, adjectis synonimis [sic], locis, observationibus, descriptionibus","viii 519 pp.","","","","","Christ. Gottl. Proft.","<!--MARK--><a href='nullb9ebeabd-b7a9-4e75-92a6-9fac4e6c76ab' class='mouseoverHref'>Fabricius, J.C. 1793. <em>Entomologia Systematica Emendata et Aucta. Secundum, Classes, Ordines, Genera, Species, adjectis synonimis [sic], locis, observationibus, descriptionibus</em>. Hafniae : Christ. Gottl. Proft. Vol. 2 viii 519 pp.</a><!--MARK-->","","Book","b9ebeabd-b7a9-4e75-92a6-9fac4e6c76ab","20150716T00:40:13.644+0000",""
"Forel, A.","1893","Nouvelles fourmis d'Australie et des Canaries","454-466","","Annales de la Société Entomologique de Belgique (Comptes-rendus)","","","","<!--MARK--><a href='nulleb32586e-d135-415b-b3f8-6345633d7c19' class='mouseoverHref'>Forel, A. 1893. Nouvelles fourmis d'Australie et des Canaries.</a> <!--MARK--><!--MARK--><a href='nullacc7fcdb-707a-4cbe-8f70-d7595ac25c58' class='mouseoverHref'><em>Annales de la Société Entomologique de Belgique (Comptes-rendus)</em></a> <strong>37</strong>: 454-466<!--MARK-->","","Article in Journal","eb32586e-d135-415b-b3f8-6345633d7c19","20081009T05:11:37.000+0000","acc7fcdb-707a-4cbe-8f70-d7595ac25c58"
"Forel, A.","1902","Fourmis nouvelles d'Australie","405-548","","Revue Suisse de Zoologie","","","","<!--MARK--><a href='nullea03fd29-80e8-4730-ab7b-ce0c94fa3353' class='mouseoverHref'>Forel, A. 1902. Fourmis nouvelles d'Australie.</a> <!--MARK--><!--MARK--><a href='nulldd4d5125-6d92-411c-86c0-7181702e62a5' class='mouseoverHref'><em>Revue Suisse de Zoologie</em></a> <strong>10</strong>: 405-548<!--MARK-->","","Article in Journal","ea03fd29-80e8-4730-ab7b-ce0c94fa3353","20081009T05:11:37.000+0000","dd4d5125-6d92-411c-86c0-7181702e62a5"
"Forel, A.","1907","Formicidae. pp. 263-310 <i>in</i> Michaelsen, W. & Hartmeyer, R. (eds) <i>Die Fauna Südwest-Australiens.</i> Jena : G. Fischer Vol. 1","","","","","","","<!--MARK--><a href='null00c4217b-e151-49b9-a71e-11cb85cb3930' class='mouseoverHref'>Forel, A. 1907. Formicidae. pp. 263-310 <i>in</i> Michaelsen, W. & Hartmeyer, R. (eds) <i>Die Fauna Südwest-Australiens.</i> Jena : G. Fischer Vol. 1.</a>","","Miscellaneous","00c4217b-e151-49b9-a71e-11cb85cb3930","20081009T05:11:37.000+0000",""
"Forel, A.","1910","Formicides australiens reçus de M. M. Froggatt et Rowland Turner","1-94","","Revue Suisse de Zoologie","","","","<!--MARK--><a href='null001b5384-1ce0-4e72-b79a-151ab261df31' class='mouseoverHref'>Forel, A. 1910. Formicides australiens reçus de M. M. Froggatt et Rowland Turner.</a> <!--MARK--><!--MARK--><a href='nulldd4d5125-6d92-411c-86c0-7181702e62a5' class='mouseoverHref'><em>Revue Suisse de Zoologie</em></a> <strong>18</strong>: 1-94<!--MARK-->","","Article in Journal","001b5384-1ce0-4e72-b79a-151ab261df31","20081009T05:11:37.000+0000","dd4d5125-6d92-411c-86c0-7181702e62a5"
"Forel, A.","1915","Results of Dr. E. Mjöbergs Swedish Scientific Expeditions to Australia 1910-1913. 2. Ameisen","1-119, pls 1-3","","Arkiv för Zoologi","","4 Dec. 1915","","<!--MARK--><a href='null754605fe-9d76-4139-a599-27700cd29d6c' class='mouseoverHref'>Forel, A. 1915. Results of Dr. E. Mjöbergs Swedish Scientific Expeditions to Australia 1910-1913. 2. Ameisen.</a> <!--MARK--><!--MARK--><a href='nullea0f28cc-317a-4542-aaf0-5fa8122b7a93' class='mouseoverHref'><em>Arkiv för Zoologi</em></a> <strong>9</strong>(no.16): 1-119, pls 1-3<!--MARK--> [Date published 4 Dec. 1915]","","Article in Journal","754605fe-9d76-4139-a599-27700cd29d6c","20170119T05:38:42.679+0000","ea0f28cc-317a-4542-aaf0-5fa8122b7a93"
"Framenau, V.W. & Thomas, M.L.","2008","Ants (Hymenoptera: Formicidae) of Christmas Island (Indian Ocean): identification and distribution.","45-85","","Records of the Western Australian Museum","","","","<!--MARK--><a href='nulla69c0f66-cdca-4741-8b6a-2fb97e2379bd' class='mouseoverHref'>Framenau, V.W. & Thomas, M.L. 2008. Ants (Hymenoptera: Formicidae) of Christmas Island (Indian Ocean): identification and distribution.</a> <!--MARK--><!--MARK--><a href='nulla2cbd1fb-97d5-493a-a1d7-c2b99709890b' class='mouseoverHref'><em>Records of the Western Australian Museum</em></a> <strong>25</strong>: 45-85<!--MARK-->","","Article in Journal","a69c0f66-cdca-4741-8b6a-2fb97e2379bd","20150310T00:29:15.918+0000","a2cbd1fb-97d5-493a-a1d7-c2b99709890b"
"Heterick, B.E.","2013","A taxonomic overview and key to the ants of Barrow Island, Western Australia","375-404","","Records of the Western Australian Museum, Supplement","","","","<!--MARK--><a href='null8c43a6c0-7d42-43ad-8b7c-97dad42f2bf6' class='mouseoverHref'>Heterick, B.E. 2013. A taxonomic overview and key to the ants of Barrow Island, Western Australia.</a> <!--MARK--><!--MARK--><a href='null841f1546-1bce-4548-adc9-7b08f6ca73a0' class='mouseoverHref'><em>Records of the Western Australian Museum, Supplement</em></a> <strong>83</strong>: 375-404<!--MARK-->","","Article in Journal","8c43a6c0-7d42-43ad-8b7c-97dad42f2bf6","20140327T02:14:35.059+0000","841f1546-1bce-4548-adc9-7b08f6ca73a0"
"Mayr, G.L.","1866","Myrmecologische Beiträge","484-517","","Sitzungsberichte der Akademie der Wissenschaften in Wien","","","","<!--MARK--><a href='null490d944d-e86d-4a27-b529-b1e1e0d33e69' class='mouseoverHref'>Mayr, G.L. 1866. Myrmecologische Beiträge.</a> <!--MARK--><!--MARK--><a href='null0f062e5b-29e5-4a6a-b0d9-9bcdad1024c9' class='mouseoverHref'><em>Sitzungsberichte der Akademie der Wissenschaften in Wien</em></a> <strong>53</strong>(1): 484-517<!--MARK-->","","Article in Journal","490d944d-e86d-4a27-b529-b1e1e0d33e69","20081009T05:11:37.000+0000","0f062e5b-29e5-4a6a-b0d9-9bcdad1024c9"
"Mayr, G.L.","1876","Die australischen Formiciden","56-115","","Journal des Museum Godeffroy, Hamburg","","","","<!--MARK--><a href='null670b4945-3376-478b-9cd3-c0553d5a3421' class='mouseoverHref'>Mayr, G.L. 1876. Die australischen Formiciden.</a> <!--MARK--><!--MARK--><a href='null28313c9a-6bca-4375-9643-f488f6e53c98' class='mouseoverHref'><em>Journal des Museum Godeffroy, Hamburg</em></a> <strong>5</strong>: 56-115<!--MARK-->","","Article in Journal","670b4945-3376-478b-9cd3-c0553d5a3421","20081009T05:11:37.000+0000","28313c9a-6bca-4375-9643-f488f6e53c98"
"Smith, F.","1858","Catalogue of hymenopterous insects in the collection of the British Museum. Part 6. Formicidae","216 pp. 14 pls","","","","","British Museum","<!--MARK--><a href='nullcccdfbf9-49f7-41b8-ae7d-090d5affdfb1' class='mouseoverHref'>Smith, F. 1858. <em>Catalogue of hymenopterous insects in the collection of the British Museum. Part 6. Formicidae</em>. London : British Museum 216 pp. 14 pls.</a><!--MARK--> [27 Mar. 1858]","27 Mar. 1858","Book","cccdfbf9-49f7-41b8-ae7d-090d5affdfb1","20081009T05:11:37.000+0000",""
"Viehmeyer, H.","1914","Neue und unvollständig bekannte Ameisen der Alten Welt","24-60","","Archiv für Naturgeschichte","","","","<!--MARK--><a href='nullc8329eb1-1eb7-4c0c-b810-00b19c390b93' class='mouseoverHref'>Viehmeyer, H. 1914. Neue und unvollständig bekannte Ameisen der Alten Welt.</a> <!--MARK--><!--MARK--><a href='nullf5b5f7c7-fc53-4502-951d-1c96b680d874' class='mouseoverHref'><em>Archiv für Naturgeschichte</em></a> <strong>79A [1913]</strong>(12): 24-60<!--MARK-->","","Article in Journal","c8329eb1-1eb7-4c0c-b810-00b19c390b93","20140430T23:24:28.232+0000","f5b5f7c7-fc53-4502-951d-1c96b680d874"
"Viehmeyer, H.","1924","Formiciden der australischen Faunenregion","310-319","","Entomologische Mitteilungen. Berlin-Dahlem","","","","<!--MARK--><a href='null865f42b5-ca42-471f-8c3f-1c0a5d232182' class='mouseoverHref'>Viehmeyer, H. 1924. Formiciden der australischen Faunenregion.</a> <!--MARK--><!--MARK--><a href='nullac06ba2d-be9d-4dfe-91bb-bb21ae357dec' class='mouseoverHref'><em>Entomologische Mitteilungen. Berlin-Dahlem</em></a> <strong>13</strong>: 310-319<!--MARK-->","","Article in Journal","865f42b5-ca42-471f-8c3f-1c0a5d232182","20081009T05:11:37.000+0000","ac06ba2d-be9d-4dfe-91bb-bb21ae357dec"
"Westwood, J.O.","1841","Observations on the genus <i>Typhlopone</i>, with descriptions of several exotic species of ants","81-89","","Annals and Magazine of Natural History","","","","<!--MARK--><a href='nullea88341e-580e-43b1-8a81-b358135b1590' class='mouseoverHref'>Westwood, J.O. 1841. Observations on the genus <i>Typhlopone</i>, with descriptions of several exotic species of ants.</a> <!--MARK--><!--MARK--><a href='nullefa8de69-3a29-4a43-8ef2-cbefda205976' class='mouseoverHref'><em>Annals and Magazine of Natural History</em></a> 1 <strong>6</strong>: 81-89<!--MARK-->","","Article in Journal","ea88341e-580e-43b1-8a81-b358135b1590","20081009T05:11:37.000+0000","efa8de69-3a29-4a43-8ef2-cbefda205976"
"Wheeler, W.M.","1927","The ants of Lord Howe Island and Norfolk Island","121-153","","Proceedings of the American Academy of Arts and Sciences","","","","<!--MARK--><a href='null0dfbfe71-fac4-437f-bd40-2cec5f3d2000' class='mouseoverHref'>Wheeler, W.M. 1927. The ants of Lord Howe Island and Norfolk Island.</a> <!--MARK--><!--MARK--><a href='nullf2b4781b-5420-4d64-8c37-1e2f1df0a1e3' class='mouseoverHref'><em>Proceedings of the American Academy of Arts and Sciences</em></a> <strong>62</strong>: 121-153<!--MARK-->","","Article in Journal","0dfbfe71-fac4-437f-bd40-2cec5f3d2000","20081009T05:11:37.000+0000","f2b4781b-5420-4d64-8c37-1e2f1df0a1e3"
