"PUB_AUTHOR","PUB_YEAR","PUB_TITLE","PUB_PAGES","PUB_PARENT_BOOK_TITLE","PUB_PARENT_JOURNAL_TITLE","PUB_PARENT_ARTICLE_TITLE","PUB_PUBLICATION_DATE","PUB_PUBLISHER","PUB_FORMATTED","PUB_QUALIFICATION","PUB_TYPE","PUBLICATION_GUID","PUBLICATION_LAST_UPDATE","PARENT_PUBLICATION_GUID"
"Lower, O.B.","1892","Descriptions of New South Australian Lepidoptera","5-17","","Transactions of the Royal Society of South Australia","","","","<!--MARK--><a href='null027c9617-a2b8-460e-ad36-b4cda02d2655' class='mouseoverHref'>Lower, O.B. 1892. Descriptions of New South Australian Lepidoptera.</a> <!--MARK--><!--MARK--><a href='null8b48b0a3-dd7a-4aea-be0d-10a223710ebc' class='mouseoverHref'><em>Transactions of the Royal Society of South Australia</em></a> <strong>15</strong>: 5-17<!--MARK-->","","Article in Journal","027c9617-a2b8-460e-ad36-b4cda02d2655","20081009T05:11:37.000+0000","8b48b0a3-dd7a-4aea-be0d-10a223710ebc"
"Meyrick, E.","1890","Revision of Australian Lepidoptera. III","1117-1216","","Proceedings of the Linnean Society of New South Wales","","","","<!--MARK--><a href='nulldcf74d3e-e6dc-4ada-93b9-020897c2937f' class='mouseoverHref'>Meyrick, E. 1890. Revision of Australian Lepidoptera. III.</a> <!--MARK--><!--MARK--><a href='nullc12cd779-adb5-41ea-bd2c-75f6864cf22e' class='mouseoverHref'><em>Proceedings of the Linnean Society of New South Wales</em></a> 2-n.s. <strong>4</strong>(4): 1117-1216<!--MARK--> [year of publication not confirmed]","year of publication not confirmed","Article in Journal","dcf74d3e-e6dc-4ada-93b9-020897c2937f","","c12cd779-adb5-41ea-bd2c-75f6864cf22e"
"Prout, L.B.","1910","Geometridae. Subfam. Oenochrominae","1-120, pls 1, 2","","Genera Insectorum","","","","<!--MARK--><a href='nullb4dfd4e2-67bc-440c-9aef-da014e9a5894' class='mouseoverHref'>Prout, L.B. 1910. Geometridae. Subfam. Oenochrominae.</a> <!--MARK--><!--MARK--><a href='null4c51e483-ab8d-45df-b8af-97a7abe21cba' class='mouseoverHref'><em>Genera Insectorum</em></a> <strong>104</strong>: 1-120, pls 1, 2<!--MARK-->","","Article in Journal","b4dfd4e2-67bc-440c-9aef-da014e9a5894","","4c51e483-ab8d-45df-b8af-97a7abe21cba"
"Turner, A.J.","1930","Revision of Australian Oenochromidae (Lepidoptera). II","1-40","","Proceedings of the Linnean Society of New South Wales","","","","<!--MARK--><a href='nullec11c261-1261-4cb8-88fa-981b8cdd1455' class='mouseoverHref'>Turner, A.J. 1930. Revision of Australian Oenochromidae (Lepidoptera). II.</a> <!--MARK--><!--MARK--><a href='nullc12cd779-adb5-41ea-bd2c-75f6864cf22e' class='mouseoverHref'><em>Proceedings of the Linnean Society of New South Wales</em></a> <strong>55</strong>: 1-40<!--MARK-->","","Article in Journal","ec11c261-1261-4cb8-88fa-981b8cdd1455","","c12cd779-adb5-41ea-bd2c-75f6864cf22e"
"Turner, A.J.","1936","New Australian Lepidoptera","25-50","","Proceedings of the Royal Society of Queensland","","","","<!--MARK--><a href='null5f85a55e-f94c-4578-b8a5-095ccf926da4' class='mouseoverHref'>Turner, A.J. 1936. New Australian Lepidoptera.</a> <!--MARK--><!--MARK--><a href='null642ab613-813a-48d0-8bc0-42c78157f7b0' class='mouseoverHref'><em>Proceedings of the Royal Society of Queensland</em></a> <strong>47</strong>: 25-50<!--MARK-->","","Article in Journal","5f85a55e-f94c-4578-b8a5-095ccf926da4","20081009T05:11:37.000+0000","642ab613-813a-48d0-8bc0-42c78157f7b0"
"Warren, W.","1900","New genera and species of Drepanulidae, Thyrididae, Epilemidae and geometridae from the Indo-Australian and Palaearctic regions","98-116","","Novitates Zoologicae","","","","<!--MARK--><a href='nullbe50caa1-7b4d-4884-b4fe-9b2a7ebb081d' class='mouseoverHref'>Warren, W. 1900. New genera and species of Drepanulidae, Thyrididae, Epilemidae and geometridae from the Indo-Australian and Palaearctic regions.</a> <!--MARK--><!--MARK--><a href='null25791c0c-6650-411b-b9d3-6433789fce38' class='mouseoverHref'><em>Novitates Zoologicae</em></a> <strong>7</strong>: 98-116<!--MARK-->","","Article in Journal","be50caa1-7b4d-4884-b4fe-9b2a7ebb081d","20081009T05:11:37.000+0000","25791c0c-6650-411b-b9d3-6433789fce38"
