"PUB_AUTHOR","PUB_YEAR","PUB_TITLE","PUB_PAGES","PUB_PARENT_BOOK_TITLE","PUB_PARENT_JOURNAL_TITLE","PUB_PARENT_ARTICLE_TITLE","PUB_PUBLICATION_DATE","PUB_PUBLISHER","PUB_FORMATTED","PUB_QUALIFICATION","PUB_TYPE","PUBLICATION_GUID","PUBLICATION_LAST_UPDATE","PARENT_PUBLICATION_GUID"
"Sauter, W. & Hättenschwiler, P.","1991","Zum System der palaearktischen Psychiden (Lep. Psychidae). 1. Teil: Liste der palaearktischen Arten","69-89","","Nota Lepidopterologica","","","","<!--MARK--><a href='null9e8d9d34-ee28-49aa-ae19-fe9be99e0193' class='mouseoverHref'>Sauter, W. & Hättenschwiler, P. 1991. Zum System der palaearktischen Psychiden (Lep. Psychidae). 1. Teil: Liste der palaearktischen Arten.</a> <!--MARK--><!--MARK--><a href='null0a701745-c673-4752-a58d-989d3a9cf426' class='mouseoverHref'><em>Nota Lepidopterologica</em></a> <strong>14</strong>: 69-89<!--MARK-->","","Article in Journal","9e8d9d34-ee28-49aa-ae19-fe9be99e0193","20081009T05:11:37.000+0000","0a701745-c673-4752-a58d-989d3a9cf426"
"Scott, A.W.","1864","Australian Lepidoptera and their transformations, drawn from the life by Harriet and Helena Scott. 1","[ii]+36 pp., pls 1-9","","","","","John van Voorst","<!--MARK--><a href='null32b21884-b02b-47a3-949f-bcaa9dfc9fb4' class='mouseoverHref'>Scott, A.W. 1864. <em>Australian Lepidoptera and their transformations, drawn from the life by Harriet and Helena Scott. 1</em>. London : John van Voorst [ii]+36 pp., pls 1-9.</a><!--MARK-->","","Book","32b21884-b02b-47a3-949f-bcaa9dfc9fb4","",""
"Strand, E.","1924","Lepidoptera aus Sudwest-Australien","135-148","","Deutsche entomologische Zeitschrift Iris","","","","<!--MARK--><a href='null56e98c70-9133-4a7a-ac08-06f8149b9be1' class='mouseoverHref'>Strand, E. 1924. Lepidoptera aus Sudwest-Australien.</a> <!--MARK--><!--MARK--><a href='nullb6150072-c4d1-4bbf-823d-88ba96707b39' class='mouseoverHref'><em>Deutsche entomologische Zeitschrift Iris</em></a> <strong>38</strong>: 135-148<!--MARK-->","","Article in Journal","56e98c70-9133-4a7a-ac08-06f8149b9be1","","b6150072-c4d1-4bbf-823d-88ba96707b39"
"Templeton, R.","1847","Description of some species of the lepidopterous genus <i>Oiketicus</i> from Ceylon","30-40","","Transactions of the Entomological Society of London","","","","<!--MARK--><a href='null5acd4818-ff4b-4dd8-91e7-7c1cb1cf3124' class='mouseoverHref'>Templeton, R. 1847. Description of some species of the lepidopterous genus <i>Oiketicus</i> from Ceylon.</a> <!--MARK--><!--MARK--><a href='null5cf355b3-abc5-451e-9abc-ed3282d7811a' class='mouseoverHref'><em>Transactions of the Entomological Society of London</em></a> <strong>5</strong>: 30-40<!--MARK-->","","Article in Journal","5acd4818-ff4b-4dd8-91e7-7c1cb1cf3124","","5cf355b3-abc5-451e-9abc-ed3282d7811a"
"Turner, A.J.","1900","New Micro-lepidoptera -- mostly from Queensland","6-23","","Transactions of the Royal Society of South Australia","","","","<!--MARK--><a href='nullb47dedc4-5cb8-4986-8c39-6ab9912ebce5' class='mouseoverHref'>Turner, A.J. 1900. New Micro-lepidoptera -- mostly from Queensland.</a> <!--MARK--><!--MARK--><a href='null8b48b0a3-dd7a-4aea-be0d-10a223710ebc' class='mouseoverHref'><em>Transactions of the Royal Society of South Australia</em></a> <strong>24</strong>: 6-23<!--MARK-->","","Article in Journal","b47dedc4-5cb8-4986-8c39-6ab9912ebce5","20081009T05:11:37.000+0000","8b48b0a3-dd7a-4aea-be0d-10a223710ebc"
"Turner, A.J.","1913","Studies in Australian Microlepidoptera","174-228","","Proceedings of the Linnean Society of New South Wales","","17 Sept. 1913","","<!--MARK--><a href='null9b62b459-52a8-4cf7-9556-bfa0944b0951' class='mouseoverHref'>Turner, A.J. 1913. Studies in Australian Microlepidoptera.</a> <!--MARK--><!--MARK--><a href='nullc12cd779-adb5-41ea-bd2c-75f6864cf22e' class='mouseoverHref'><em>Proceedings of the Linnean Society of New South Wales</em></a> <strong>38</strong>: 174-228<!--MARK--> [Date published 17 Sept. 1913]","","Article in Journal","9b62b459-52a8-4cf7-9556-bfa0944b0951","20110420T02:09:53.776+0000","c12cd779-adb5-41ea-bd2c-75f6864cf22e"
"Turner, A.J.","1914","On some moths from Melville and Bathurst Islands in the South Australian Museum","245-248","","Transactions of the Royal Society of South Australia","","","","<!--MARK--><a href='nulle222fee8-259c-49b9-b2e0-eb342c3ca080' class='mouseoverHref'>Turner, A.J. 1914. On some moths from Melville and Bathurst Islands in the South Australian Museum.</a> <!--MARK--><!--MARK--><a href='null8b48b0a3-dd7a-4aea-be0d-10a223710ebc' class='mouseoverHref'><em>Transactions of the Royal Society of South Australia</em></a> <strong>38</strong>: 245-248<!--MARK-->","","Article in Journal","e222fee8-259c-49b9-b2e0-eb342c3ca080","20081009T05:11:37.000+0000","8b48b0a3-dd7a-4aea-be0d-10a223710ebc"
"Turner, A.J.","1914","The Lepidoptera of Ebor Scrub, N.S.W.","546-564","","Proceedings of the Linnean Society of New South Wales","","24 Nov. 1914","","<!--MARK--><a href='null8fb62294-3732-4265-b680-c4e36d32dbc2' class='mouseoverHref'>Turner, A.J. 1914. The Lepidoptera of Ebor Scrub, N.S.W.</a> <!--MARK--><!--MARK--><a href='nullc12cd779-adb5-41ea-bd2c-75f6864cf22e' class='mouseoverHref'><em>Proceedings of the Linnean Society of New South Wales</em></a> <strong>39</strong>: 546-564<!--MARK--> [Date published 24 Nov. 1914]","","Article in Journal","8fb62294-3732-4265-b680-c4e36d32dbc2","20120110T02:39:36.493+0000","c12cd779-adb5-41ea-bd2c-75f6864cf22e"
"Turner, A.J.","1916","A third contribution to a knowledge of the Lepidopterous fauna of Ebor Scrub, N.S.W","249-260","","Proceedings of the Linnean Society of New South Wales","","13 Sept. 1916","","<!--MARK--><a href='null66566fe9-17d0-444b-8625-fb91cb5dd59b' class='mouseoverHref'>Turner, A.J. 1916. A third contribution to a knowledge of the Lepidopterous fauna of Ebor Scrub, N.S.W.</a> <!--MARK--><!--MARK--><a href='nullc12cd779-adb5-41ea-bd2c-75f6864cf22e' class='mouseoverHref'><em>Proceedings of the Linnean Society of New South Wales</em></a> <strong>41</strong>: 249-260<!--MARK--> [Date published 13 Sept. 1916]","","Article in Journal","66566fe9-17d0-444b-8625-fb91cb5dd59b","20110420T02:24:27.792+0000","c12cd779-adb5-41ea-bd2c-75f6864cf22e"
"Turner, A.J.","1916","New Australian Lepidoptera of the family Tortricidae","498-536","","Transactions of the Royal Society of South Australia","","","","<!--MARK--><a href='null647f5fbd-4912-4ad3-9be1-1d0d5a72d426' class='mouseoverHref'>Turner, A.J. 1916. New Australian Lepidoptera of the family Tortricidae.</a> <!--MARK--><!--MARK--><a href='null8b48b0a3-dd7a-4aea-be0d-10a223710ebc' class='mouseoverHref'><em>Transactions of the Royal Society of South Australia</em></a> <strong>40</strong>: 498-536<!--MARK-->","","Article in Journal","647f5fbd-4912-4ad3-9be1-1d0d5a72d426","20081009T05:11:37.000+0000","8b48b0a3-dd7a-4aea-be0d-10a223710ebc"
"Turner, A.J.","1917","Lepidopterological gleanings","70-106","","Proceedings of the Royal Society of Queensland","","","","<!--MARK--><a href='null8f73d455-f2c0-4511-9db1-ecd1a1548991' class='mouseoverHref'>Turner, A.J. 1917. Lepidopterological gleanings.</a> <!--MARK--><!--MARK--><a href='null642ab613-813a-48d0-8bc0-42c78157f7b0' class='mouseoverHref'><em>Proceedings of the Royal Society of Queensland</em></a> <strong>29</strong>: 70-106<!--MARK-->","","Article in Journal","8f73d455-f2c0-4511-9db1-ecd1a1548991","20081009T05:11:37.000+0000","642ab613-813a-48d0-8bc0-42c78157f7b0"
"Turner, A.J.","1923","New Australian Microlepidoptera","165-194","","Transactions and Proceedings of the Royal Society of South Australia","","","","<!--MARK--><a href='null20b00794-f19e-4ac8-82d2-603bbcba3da0' class='mouseoverHref'>Turner, A.J. 1923. New Australian Microlepidoptera.</a> <!--MARK--><!--MARK--><a href='null4f4be976-519e-451f-93bc-af70c0260caf' class='mouseoverHref'><em>Transactions and Proceedings of the Royal Society of South Australia</em></a> <strong>47</strong>: 165-194<!--MARK-->","","Article in Journal","20b00794-f19e-4ac8-82d2-603bbcba3da0","20160420T00:26:40.027+0000","4f4be976-519e-451f-93bc-af70c0260caf"
"Turner, A.J.","1926","Studies in Australian Lepidoptera","120-155","","Transactions and Proceedings of the Royal Society of South Australia","","","","<!--MARK--><a href='nullc0328e42-1332-4f87-985d-d7dc26f5d64f' class='mouseoverHref'>Turner, A.J. 1926. Studies in Australian Lepidoptera.</a> <!--MARK--><!--MARK--><a href='null4f4be976-519e-451f-93bc-af70c0260caf' class='mouseoverHref'><em>Transactions and Proceedings of the Royal Society of South Australia</em></a> <strong>50</strong>: 120-155<!--MARK-->","","Article in Journal","c0328e42-1332-4f87-985d-d7dc26f5d64f","20160420T00:22:58.765+0000","4f4be976-519e-451f-93bc-af70c0260caf"
"Turner, A.J.","1927","New and little known Tasmanian Lepidoptera. Part II","119-164","","Papers and Proceedings of the Royal Society of Tasmania","","","","<!--MARK--><a href='null4a235734-6eca-4d99-b8ad-9a26b751ea7e' class='mouseoverHref'>Turner, A.J. 1927. New and little known Tasmanian Lepidoptera. Part II.</a> <!--MARK--><!--MARK--><a href='nulldb793adc-ebf2-40c5-9d92-48a121ea03ae' class='mouseoverHref'><em>Papers and Proceedings of the Royal Society of Tasmania</em></a> <strong>1926</strong>: 119-164<!--MARK-->","","Article in Journal","4a235734-6eca-4d99-b8ad-9a26b751ea7e","20081009T05:11:37.000+0000","db793adc-ebf2-40c5-9d92-48a121ea03ae"
"Turner, A.J.","1931","Revision of Australian Lepidoptera. Supplementary","325-344","","Proceedings of the Linnean Society of New South Wales","","","","<!--MARK--><a href='nulle64ba8b4-5f86-403e-9ab7-73f227420acb' class='mouseoverHref'>Turner, A.J. 1931. Revision of Australian Lepidoptera. Supplementary.</a> <!--MARK--><!--MARK--><a href='nullc12cd779-adb5-41ea-bd2c-75f6864cf22e' class='mouseoverHref'><em>Proceedings of the Linnean Society of New South Wales</em></a> <strong>56</strong>: 325-344<!--MARK-->","","Article in Journal","e64ba8b4-5f86-403e-9ab7-73f227420acb","20081009T05:11:37.000+0000","c12cd779-adb5-41ea-bd2c-75f6864cf22e"
"Turner, A.J.","1932","New Australian Lepidoptera","175-196","","Transactions of the Royal Society of South Australia","","","","<!--MARK--><a href='nulld34df024-f18e-43e0-9870-4d02b095519a' class='mouseoverHref'>Turner, A.J. 1932. New Australian Lepidoptera.</a> <!--MARK--><!--MARK--><a href='null8b48b0a3-dd7a-4aea-be0d-10a223710ebc' class='mouseoverHref'><em>Transactions of the Royal Society of South Australia</em></a> <strong>56</strong>: 175-196<!--MARK-->","","Article in Journal","d34df024-f18e-43e0-9870-4d02b095519a","20081009T05:11:37.000+0000","8b48b0a3-dd7a-4aea-be0d-10a223710ebc"
"Turner, A.J.","1933","New Australian Lepidoptera","159-182","","Transactions of the Royal Society of South Australia","","","","<!--MARK--><a href='null2215ea4c-f8f1-4a7a-b097-b83a64f09fcc' class='mouseoverHref'>Turner, A.J. 1933. New Australian Lepidoptera.</a> <!--MARK--><!--MARK--><a href='null8b48b0a3-dd7a-4aea-be0d-10a223710ebc' class='mouseoverHref'><em>Transactions of the Royal Society of South Australia</em></a> <strong>57</strong>: 159-182<!--MARK-->","","Article in Journal","2215ea4c-f8f1-4a7a-b097-b83a64f09fcc","20081009T05:11:37.000+0000","8b48b0a3-dd7a-4aea-be0d-10a223710ebc"
"Turner, A.J.","1935","Revision of Australian Lepidoptera. Oecophoridae. III","1-15","","Proceedings of the Linnean Society of New South Wales","","","","<!--MARK--><a href='null61809d8a-bd73-42f0-af5a-f1d84a311a7e' class='mouseoverHref'>Turner, A.J. 1935. Revision of Australian Lepidoptera. Oecophoridae. III.</a> <!--MARK--><!--MARK--><a href='nullc12cd779-adb5-41ea-bd2c-75f6864cf22e' class='mouseoverHref'><em>Proceedings of the Linnean Society of New South Wales</em></a> <strong>60</strong>: 1-15<!--MARK-->","","Article in Journal","61809d8a-bd73-42f0-af5a-f1d84a311a7e","20081009T05:11:37.000+0000","c12cd779-adb5-41ea-bd2c-75f6864cf22e"
"Turner, A.J.","1939","A second revision of the Lepidoptera of Tasmania","57-115","","Papers and Proceedings of the Royal Society of Tasmania","","","","<!--MARK--><a href='nullae5b616d-506e-4494-8af4-408c5d334ef8' class='mouseoverHref'>Turner, A.J. 1939. A second revision of the Lepidoptera of Tasmania.</a> <!--MARK--><!--MARK--><a href='nulldb793adc-ebf2-40c5-9d92-48a121ea03ae' class='mouseoverHref'><em>Papers and Proceedings of the Royal Society of Tasmania</em></a> <strong>1938</strong>: 57-115<!--MARK-->","","Article in Journal","ae5b616d-506e-4494-8af4-408c5d334ef8","20110406T00:51:15.229+0000","db793adc-ebf2-40c5-9d92-48a121ea03ae"
"Turner, A.J.","1944","Studies in Australian Lepidoptera","3-17","","Transactions of the Royal Society of South Australia","","","","<!--MARK--><a href='nulla5031dee-aa28-4c1f-8b6d-9d2c3a7a16a4' class='mouseoverHref'>Turner, A.J. 1944. Studies in Australian Lepidoptera.</a> <!--MARK--><!--MARK--><a href='null8b48b0a3-dd7a-4aea-be0d-10a223710ebc' class='mouseoverHref'><em>Transactions of the Royal Society of South Australia</em></a> <strong>68</strong>: 3-17<!--MARK-->","","Article in Journal","a5031dee-aa28-4c1f-8b6d-9d2c3a7a16a4","20081009T05:11:37.000+0000","8b48b0a3-dd7a-4aea-be0d-10a223710ebc"
"Turner, A.J.","1945","A revision of the Australian Cossidae (Lepidoptera)","47-70","","Proceedings of the Royal Society of Queensland","","","","<!--MARK--><a href='null5d16077c-8945-43bd-bf8a-ececb7470154' class='mouseoverHref'>Turner, A.J. 1945. A revision of the Australian Cossidae (Lepidoptera).</a> <!--MARK--><!--MARK--><a href='null642ab613-813a-48d0-8bc0-42c78157f7b0' class='mouseoverHref'><em>Proceedings of the Royal Society of Queensland</em></a> <strong>56</strong>: 47-70<!--MARK-->","","Article in Journal","5d16077c-8945-43bd-bf8a-ececb7470154","20081009T05:11:37.000+0000","642ab613-813a-48d0-8bc0-42c78157f7b0"
"Turner, A.J.","1947","Revision of the Australian Psychidae (Lepidoptera)","57-64","","Proceedings of the Royal Society of Queensland","","","","<!--MARK--><a href='null39d98388-b002-4152-abf3-e18fea24f3c9' class='mouseoverHref'>Turner, A.J. 1947. Revision of the Australian Psychidae (Lepidoptera).</a> <!--MARK--><!--MARK--><a href='null642ab613-813a-48d0-8bc0-42c78157f7b0' class='mouseoverHref'><em>Proceedings of the Royal Society of Queensland</em></a> <strong>57</strong>: 57-64<!--MARK-->","","Article in Journal","39d98388-b002-4152-abf3-e18fea24f3c9","20081009T05:11:37.000+0000","642ab613-813a-48d0-8bc0-42c78157f7b0"
"Viette, P.","1963","A new injurious <i>Metura</i> (Lepidoptera: Psychidae) in New Caledonia and New Hebrides","142-144","","Proceedings of the IX Pacific Science Congress","","","","<!--MARK--><a href='null3b2be4e2-c5c5-40c9-a49b-6206e17cca15' class='mouseoverHref'>Viette, P. 1963. A new injurious <i>Metura</i> (Lepidoptera: Psychidae) in New Caledonia and New Hebrides.</a> <!--MARK--><!--MARK--><a href='null42f6cef6-6e15-46b1-9900-6a2c54151ada' class='mouseoverHref'><em>Proceedings of the IX Pacific Science Congress</em></a> Entomology <strong>9</strong>: 142-144<!--MARK-->","","Article in Journal","3b2be4e2-c5c5-40c9-a49b-6206e17cca15","20081009T05:11:37.000+0000","42f6cef6-6e15-46b1-9900-6a2c54151ada"
"Walker, F.","1854","Lepidoptera Heterocera","279-581","","List of the Specimens of Lepidopterous Insects in the Collection of the British Museum","","","","<!--MARK--><a href='null26af0554-7689-470c-b643-89bbbbe619c4' class='mouseoverHref'>Walker, F. 1854. Lepidoptera Heterocera.</a> <!--MARK--><!--MARK--><a href='null642c8f2c-b31c-4c9f-9ca3-4c940f907155' class='mouseoverHref'><em>List of the Specimens of Lepidopterous Insects in the Collection of the British Museum</em></a> <strong>2</strong>: 279-581<!--MARK-->","","Article in Journal","26af0554-7689-470c-b643-89bbbbe619c4","20081009T05:11:37.000+0000","642c8f2c-b31c-4c9f-9ca3-4c940f907155"
"Walker, F.","1855","Lepidoptera Heterocera","776-976","","List of the Specimens of Lepidopterous Insects in the Collection of the British Museum","","August","","<!--MARK--><a href='null9957c921-0190-4a22-9dcc-28cc7aae5224' class='mouseoverHref'>Walker, F. 1855. Lepidoptera Heterocera.</a> <!--MARK--><!--MARK--><a href='null642c8f2c-b31c-4c9f-9ca3-4c940f907155' class='mouseoverHref'><em>List of the Specimens of Lepidopterous Insects in the Collection of the British Museum</em></a> <strong>4</strong>: 776-976<!--MARK--> [Date published August]","","Article in Journal","9957c921-0190-4a22-9dcc-28cc7aae5224","20110407T00:11:40.831+0000","642c8f2c-b31c-4c9f-9ca3-4c940f907155"
"Walker, F.","1863","Tortricites & Tineites","287-561","","List of the Specimens of Lepidopterous Insects in the Collection of the British Museum","","","","<!--MARK--><a href='null6d1f91f1-0ddb-4695-9dae-b08e3d65cbcc' class='mouseoverHref'>Walker, F. 1863. Tortricites & Tineites.</a> <!--MARK--><!--MARK--><a href='null642c8f2c-b31c-4c9f-9ca3-4c940f907155' class='mouseoverHref'><em>List of the Specimens of Lepidopterous Insects in the Collection of the British Museum</em></a> <strong>28</strong>: 287-561<!--MARK-->","","Article in Journal","6d1f91f1-0ddb-4695-9dae-b08e3d65cbcc","","642c8f2c-b31c-4c9f-9ca3-4c940f907155"
"Walker, F.","1865","Supplement 2","322-706","","List of the Specimens of Lepidopterous Insects in the Collection of the British Museum","","April","","<!--MARK--><a href='nullc738e1f5-b13a-499c-a628-f4725c95223e' class='mouseoverHref'>Walker, F. 1865. Supplement 2.</a> <!--MARK--><!--MARK--><a href='null642c8f2c-b31c-4c9f-9ca3-4c940f907155' class='mouseoverHref'><em>List of the Specimens of Lepidopterous Insects in the Collection of the British Museum</em></a> <strong>32</strong>: 322-706<!--MARK--> [Date published April]","","Article in Journal","c738e1f5-b13a-499c-a628-f4725c95223e","20110406T23:34:19.723+0000","642c8f2c-b31c-4c9f-9ca3-4c940f907155"
"Walker, F.","1866","Supplement 5","1534-2040","","List of the Specimens of Lepidopterous Insects in the Collection of the British Museum","","","","<!--MARK--><a href='null56a82836-2f3e-4d80-9768-9feacf9e0642' class='mouseoverHref'>Walker, F. 1866. Supplement 5.</a> <!--MARK--><!--MARK--><a href='null642c8f2c-b31c-4c9f-9ca3-4c940f907155' class='mouseoverHref'><em>List of the Specimens of Lepidopterous Insects in the Collection of the British Museum</em></a> <strong>35</strong>: 1534-2040<!--MARK--> [incl. Summary and Index to parts 31-35]","incl. Summary and Index to parts 31-35","Article in Journal","56a82836-2f3e-4d80-9768-9feacf9e0642","20081009T05:11:37.000+0000","642c8f2c-b31c-4c9f-9ca3-4c940f907155"
"Walker, F.","1869","Characters of undescribed Lepidoptera Heterocera","112 pp.","","","","","E.W. Janson","<!--MARK--><a href='nulle27b1c7c-4c9a-4980-a291-3a649027edbe' class='mouseoverHref'>Walker, F. 1869. <em>Characters of undescribed Lepidoptera Heterocera</em>. London : E.W. Janson 112 pp.</a><!--MARK-->","","Book","e27b1c7c-4c9a-4980-a291-3a649027edbe","20081009T05:11:37.000+0000",""
"Wallengren, H.D.J.","1860","Lepidopterologische Mittheilungen","33-46, 161-176","","Wiener Entomologische Monatschrift","","","","<!--MARK--><a href='nulla38b9978-4213-48a6-ae57-38a9da9fd599' class='mouseoverHref'>Wallengren, H.D.J. 1860. Lepidopterologische Mittheilungen.</a> <!--MARK--><!--MARK--><a href='null7a8843c1-d1ee-4ce7-8e14-54f7451d3e99' class='mouseoverHref'><em>Wiener Entomologische Monatschrift</em></a> <strong>4</strong>: 33-46, 161-176<!--MARK-->","","Article in Journal","a38b9978-4213-48a6-ae57-38a9da9fd599","20081009T05:11:37.000+0000","7a8843c1-d1ee-4ce7-8e14-54f7451d3e99"
"Wallengren, H.D.J.","1861","Lepidoptera. Species novas descripsit. In: Kongliga svenska fregatten Eugenies resa omkring Jorden under befäl af C.A. Virgin Åren 1851-1853. Vetenskapliga iakttagelser på H.M. Konung Oscar Den Förstes befallning utgifna af K. Svenska vetenskaps Akademien","351-390, pls 6-7","","","","","","<!--MARK--><a href='null2a22729f-7f12-4cc5-9d6d-e95c9c3695ef' class='mouseoverHref'>Wallengren, H.D.J. 1861. Lepidoptera. Species novas descripsit. In: Kongliga svenska fregatten Eugenies resa omkring Jorden under befäl af C.A. Virgin Åren 1851-1853. Vetenskapliga iakttagelser på H.M. Konung Oscar Den Förstes befallning utgifna af K. Svenska vetenskaps Akademien. 2(Zoologi 1)(Insecta). 351-390, pls 6-7</a>","","Miscellaneous","2a22729f-7f12-4cc5-9d6d-e95c9c3695ef","20081009T05:11:37.000+0000",""
"Westwood, J.O.","1855","Descriptions of some species of Lepidopterous insects belonging to the genus <i>Oiketicus</i>","219-243, Annulosa pls 34-37","","Proceedings of the Zoological Society of London","","","","<!--MARK--><a href='null8f011e2c-062b-46ae-8da5-8060a09b8bcf' class='mouseoverHref'>Westwood, J.O. 1855. Descriptions of some species of Lepidopterous insects belonging to the genus <i>Oiketicus</i>.</a> <!--MARK--><!--MARK--><a href='null511f299d-99ec-413c-bc4c-04a380829c96' class='mouseoverHref'><em>Proceedings of the Zoological Society of London</em></a> <strong>1854</strong>(22): 219-243, Annulosa pls 34-37<!--MARK-->","","Article in Journal","8f011e2c-062b-46ae-8da5-8060a09b8bcf","20081009T05:11:37.000+0000","511f299d-99ec-413c-bc4c-04a380829c96"
