"PUB_AUTHOR","PUB_YEAR","PUB_TITLE","PUB_PAGES","PUB_PARENT_BOOK_TITLE","PUB_PARENT_JOURNAL_TITLE","PUB_PARENT_ARTICLE_TITLE","PUB_PUBLICATION_DATE","PUB_PUBLISHER","PUB_FORMATTED","PUB_QUALIFICATION","PUB_TYPE","PUBLICATION_GUID","PUBLICATION_LAST_UPDATE","PARENT_PUBLICATION_GUID"
"Aurivillius, P.O.C.","1920","Results of Dr E. Mjöberg's Swedish scientific expeditions to Australia 1910-1913. 21. Macrolepidoptera","1-44 pl. 1","","Arkiv för Zoologi","","","","<!--MARK--><a href='nulld219e8d0-e0cf-494e-8106-3296b4e2f038' class='mouseoverHref'>Aurivillius, P.O.C. 1920. Results of Dr E. Mjöberg's Swedish scientific expeditions to Australia 1910-1913. 21. Macrolepidoptera.</a> <!--MARK--><!--MARK--><a href='nullea0f28cc-317a-4542-aaf0-5fa8122b7a93' class='mouseoverHref'><em>Arkiv för Zoologi</em></a> <strong>13</strong>(2): 1-44 pl. 1<!--MARK-->","","Article in Journal","d219e8d0-e0cf-494e-8106-3296b4e2f038","20081009T05:11:37.000+0000","ea0f28cc-317a-4542-aaf0-5fa8122b7a93"
"Dalla Torre, K.W. von & Strand, E.","1929","Psychidae","1-211","","Lepidopterorum Catalogus","","","","<!--MARK--><a href='null9d78ed44-aab1-4e62-9fc1-8de35e902186' class='mouseoverHref'>Dalla Torre, K.W. von & Strand, E. 1929. Psychidae.</a> <!--MARK--><!--MARK--><a href='nullc4926fd5-876f-4936-b1a5-b81365038d4e' class='mouseoverHref'><em>Lepidopterorum Catalogus</em></a> <strong>34</strong>: 1-211<!--MARK-->","","Article in Journal","9d78ed44-aab1-4e62-9fc1-8de35e902186","20081009T05:11:37.000+0000","c4926fd5-876f-4936-b1a5-b81365038d4e"
"Davis, D.","2003","A Monograph of the Family Arrhenophanidae (Lepidoptera: Tineoidea)","1-80","","Smithsonian Contributions to Zoology","","","","<!--MARK--><a href='null60c7cc4a-dbc6-44c3-9159-04a4d231f1cf' class='mouseoverHref'>Davis, D. 2003. A Monograph of the Family Arrhenophanidae (Lepidoptera: Tineoidea).</a> <!--MARK--><!--MARK--><a href='nullcf8b640e-574a-4713-8a6f-74b8ef9e2f2c' class='mouseoverHref'><em>Smithsonian Contributions to Zoology</em></a> <strong>620</strong>: 1-80<!--MARK-->","","Article in Journal","60c7cc4a-dbc6-44c3-9159-04a4d231f1cf","20120201T22:14:02.754+0000","cf8b640e-574a-4713-8a6f-74b8ef9e2f2c"
"Doubleday, E.","1845","Descriptions of some new Australian lepidopterous insects","437, pl.5 fig.1","Journals of Expeditions of Discovery into Central Australia and Overland from Adelaide to King George's Sound in the Years 1840-1<i>; sent by the colonists of South Australia, with the sanction and support of the Government: including an account of the manners and customs of the Aborigines and the state of their relations with Europeans</i>","","","","","<!--MARK--><a href='nullca493f50-2dfe-4e93-991a-2deb2b0c11de' class='mouseoverHref'>Doubleday, E. 1845. Descriptions of some new Australian lepidopterous insects. 437, pl.5 fig.1</a> <!--MARK--><em>in</em> <!--MARK--><a href='null691052b2-f2ce-46cb-b2a4-525a0336a143' class='mouseoverHref'>Eyre, E.J. (ed.). <em>Journals of Expeditions of Discovery into Central Australia and Overland from Adelaide to King George's Sound in the Years 1840-1<i>; sent by the colonists of South Australia, with the sanction and support of the Government: including an account of the manners and customs of the Aborigines and the state of their relations with Europeans</i></em>. London : T. & W. Boone Vol. 1.</a><!--MARK-->","","Chapter in Book","ca493f50-2dfe-4e93-991a-2deb2b0c11de","20090513T03:49:42.404+0000","691052b2-f2ce-46cb-b2a4-525a0336a143"
"Felder, R. & Rogenhofer, A.F.","1875","[1874-1875]. Lepidoptera. Heft IV, V. Atlas der Heterocera Sphingida","vi+548 pp. 140 pls","","","","","","<!--MARK--><a href='null39d6916c-f787-4c9c-b06e-0bc14a8cd822' class='mouseoverHref'>Felder, R. & Rogenhofer, A.F. 1875. [1874-1875]. Lepidoptera. Heft IV, V. Atlas der Heterocera Sphingida. Noctuida. <I>Reise der Österreichischen Fregatte Novara um die Erde in den Jahren 1857, 1858, 1859. (Zoologischer Theil). Wien. Band 2 (Abtheilung 2)</I>. vi+548 pp. 140 pls</a>","","Miscellaneous","39d6916c-f787-4c9c-b06e-0bc14a8cd822","20110406T04:28:12.382+0000",""
"Gaede, M.","1932","Psychidae","730-742, pls 90, 91","The Macrolepidoptera of the World. <strong><em>10</em></strong>. Bombyces and Sphinges of the Indo-Australian Region. <em>2 vols</em>","","","","","<!--MARK--><a href='nullf9bb5847-0d8d-4977-bbeb-7c89c451580e' class='mouseoverHref'>Gaede, M. 1932. Psychidae. 730-742, pls 90, 91</a> <!--MARK--><em>in</em> <!--MARK--><a href='null02f4e117-2c37-4b17-890a-262cd3408301' class='mouseoverHref'>Seitz, A. (ed.). <em>The Macrolepidoptera of the World. <strong><em>10</em></strong>. Bombyces and Sphinges of the Indo-Australian Region. <em>2 vols</em></em>. Stuttgart : Alfred Kernen Verlag 909 pp., 100 pls.</a><!--MARK-->","","Chapter in Book","f9bb5847-0d8d-4977-bbeb-7c89c451580e","","02f4e117-2c37-4b17-890a-262cd3408301"
"Hättenschwiler, P.","1989","Genus <i>Scoriodyta</i> Meyrick, 1888, a new subfamily and description of new species and forms (Lepidoptera: Psychidae)","51-63","","New Zealand Journal of Zoology","","","","<!--MARK--><a href='null5907ee4e-54d2-4446-98d3-996fc1220a59' class='mouseoverHref'>Hättenschwiler, P. 1989. Genus <i>Scoriodyta</i> Meyrick, 1888, a new subfamily and description of new species and forms (Lepidoptera: Psychidae).</a> <!--MARK--><!--MARK--><a href='null97c5a68b-32f7-48d3-a9f9-b9d80159f4a2' class='mouseoverHref'><em>New Zealand Journal of Zoology</em></a> <strong>16</strong>: 51-63<!--MARK-->","","Article in Journal","5907ee4e-54d2-4446-98d3-996fc1220a59","20081009T05:11:37.000+0000","97c5a68b-32f7-48d3-a9f9-b9d80159f4a2"
"Heylaerts, F.J.M.","1881","Essai d'une Monographie des Psychides de la Faune européene, Précédéde considérations générales sur lar famille des Psychides","29-73","","Bulletin et Annales de la Société Royale Belgique d'Entomologie","","","","<!--MARK--><a href='nullcc5be72d-1271-456f-a324-5510ebc02797' class='mouseoverHref'>Heylaerts, F.J.M. 1881. Essai d'une Monographie des Psychides de la Faune européene, Précédéde considérations générales sur lar famille des Psychides.</a> <!--MARK--><!--MARK--><a href='null931619a7-755d-40e2-8d8a-2805dca68be9' class='mouseoverHref'><em>Bulletin et Annales de la Société Royale Belgique d'Entomologie</em></a> <strong>25</strong>: 29-73<!--MARK-->","","Article in Journal","cc5be72d-1271-456f-a324-5510ebc02797","","931619a7-755d-40e2-8d8a-2805dca68be9"
"Heylaerts, F.J.M.","1885","Quatre Psychides nouvelles de l'Australie","cxix-cxxi","","Annales de la Société Entomologique de Belgique (Comptes-rendus)","","","","<!--MARK--><a href='null5faafb23-f055-4aba-9cd6-cb3ed67f3b6e' class='mouseoverHref'>Heylaerts, F.J.M. 1885. Quatre Psychides nouvelles de l'Australie.</a> <!--MARK--><!--MARK--><a href='nullacc7fcdb-707a-4cbe-8f70-d7595ac25c58' class='mouseoverHref'><em>Annales de la Société Entomologique de Belgique (Comptes-rendus)</em></a> C.R. <strong>29</strong>: cxix-cxxi<!--MARK-->","","Article in Journal","5faafb23-f055-4aba-9cd6-cb3ed67f3b6e","","acc7fcdb-707a-4cbe-8f70-d7595ac25c58"
"Lower, O.B.","1899","Descriptions of new Australian Lepidoptera","83-116","","Proceedings of the Linnean Society of New South Wales","","","","<!--MARK--><a href='nullcbb3e153-d2cc-4e47-808e-249767e091f1' class='mouseoverHref'>Lower, O.B. 1899. Descriptions of new Australian Lepidoptera.</a> <!--MARK--><!--MARK--><a href='nullc12cd779-adb5-41ea-bd2c-75f6864cf22e' class='mouseoverHref'><em>Proceedings of the Linnean Society of New South Wales</em></a> <strong>24</strong>: 83-116<!--MARK-->","","Article in Journal","cbb3e153-d2cc-4e47-808e-249767e091f1","20081009T05:11:37.000+0000","c12cd779-adb5-41ea-bd2c-75f6864cf22e"
"Lower, O.B.","1900","Descriptions of new Australian Lepidoptera","29-51, 403-423","","Proceedings of the Linnean Society of New South Wales","","","","<!--MARK--><a href='null3b86edac-4f4a-4d7e-a94b-da8212083d3b' class='mouseoverHref'>Lower, O.B. 1900. Descriptions of new Australian Lepidoptera.</a> <!--MARK--><!--MARK--><a href='nullc12cd779-adb5-41ea-bd2c-75f6864cf22e' class='mouseoverHref'><em>Proceedings of the Linnean Society of New South Wales</em></a> <strong>25</strong>: 29-51, 403-423<!--MARK-->","","Article in Journal","3b86edac-4f4a-4d7e-a94b-da8212083d3b","20081009T05:11:37.000+0000","c12cd779-adb5-41ea-bd2c-75f6864cf22e"
"Lower, O.B.","1901","Descriptons of new genera and species of Australian Lepidoptera","63-98","","Transactions of the Royal Society of South Australia","","","","<!--MARK--><a href='null70680049-b093-46c8-a448-2b5a2c41b2bf' class='mouseoverHref'>Lower, O.B. 1901. Descriptons of new genera and species of Australian Lepidoptera.</a> <!--MARK--><!--MARK--><a href='null8b48b0a3-dd7a-4aea-be0d-10a223710ebc' class='mouseoverHref'><em>Transactions of the Royal Society of South Australia</em></a> <strong>25</strong>: 63-98<!--MARK-->","","Article in Journal","70680049-b093-46c8-a448-2b5a2c41b2bf","20081009T05:11:37.000+0000","8b48b0a3-dd7a-4aea-be0d-10a223710ebc"
"Lower, O.B.","1902","Descriptions of new genera and species of Australian Lepidoptera","212-247","","Transactions of the Royal Society of South Australia","","","","<!--MARK--><a href='null62356809-5b91-4c81-a817-346de4485261' class='mouseoverHref'>Lower, O.B. 1902. Descriptions of new genera and species of Australian Lepidoptera.</a> <!--MARK--><!--MARK--><a href='null8b48b0a3-dd7a-4aea-be0d-10a223710ebc' class='mouseoverHref'><em>Transactions of the Royal Society of South Australia</em></a> <strong>26</strong>: 212-247<!--MARK-->","","Article in Journal","62356809-5b91-4c81-a817-346de4485261","20081009T05:11:37.000+0000","8b48b0a3-dd7a-4aea-be0d-10a223710ebc"
"Lower, O.B.","1903","Descriptions of New Australian Noctuina, etc","27-74","","Transactions of the Royal Society of South Australia","","","","<!--MARK--><a href='null15b6a8dd-1156-4065-bc18-0420952802d3' class='mouseoverHref'>Lower, O.B. 1903. Descriptions of New Australian Noctuina, etc.</a> <!--MARK--><!--MARK--><a href='null8b48b0a3-dd7a-4aea-be0d-10a223710ebc' class='mouseoverHref'><em>Transactions of the Royal Society of South Australia</em></a> <strong>27</strong>: 27-74<!--MARK-->","","Article in Journal","15b6a8dd-1156-4065-bc18-0420952802d3","20081009T05:11:37.000+0000","8b48b0a3-dd7a-4aea-be0d-10a223710ebc"
"Lower, O.B.","1903","Descriptions of new species of <i>Xysmatodoma</i>, etc","216-239","","Transactions of the Royal Society of South Australia","","","","<!--MARK--><a href='null134b169f-2f56-48ef-ac3f-522a53313d36' class='mouseoverHref'>Lower, O.B. 1903. Descriptions of new species of <i>Xysmatodoma</i>, etc.</a> <!--MARK--><!--MARK--><a href='null8b48b0a3-dd7a-4aea-be0d-10a223710ebc' class='mouseoverHref'><em>Transactions of the Royal Society of South Australia</em></a> <strong>27</strong>: 216-239<!--MARK-->","","Article in Journal","134b169f-2f56-48ef-ac3f-522a53313d36","20081009T05:11:37.000+0000","8b48b0a3-dd7a-4aea-be0d-10a223710ebc"
"Lower, O.B.","1908","New Australian Lepidoptera. No. XXV","110-120","","Transactions of the Royal Society of South Australia","","","","<!--MARK--><a href='nulld49e733f-d278-48e7-b568-7ce35676817b' class='mouseoverHref'>Lower, O.B. 1908. New Australian Lepidoptera. No. XXV.</a> <!--MARK--><!--MARK--><a href='null8b48b0a3-dd7a-4aea-be0d-10a223710ebc' class='mouseoverHref'><em>Transactions of the Royal Society of South Australia</em></a> <strong>32</strong>: 110-120<!--MARK-->","","Article in Journal","d49e733f-d278-48e7-b568-7ce35676817b","20081009T05:11:37.000+0000","8b48b0a3-dd7a-4aea-be0d-10a223710ebc"
"Lower, O.B.","1916","Descriptions of new Australian Micro-lepidoptera","537-544","","Transactions of the Royal Society of South Australia","","","","<!--MARK--><a href='nullc6d32005-57f7-47ea-bdf6-d1cd7adbc60e' class='mouseoverHref'>Lower, O.B. 1916. Descriptions of new Australian Micro-lepidoptera.</a> <!--MARK--><!--MARK--><a href='null8b48b0a3-dd7a-4aea-be0d-10a223710ebc' class='mouseoverHref'><em>Transactions of the Royal Society of South Australia</em></a> <strong>40</strong>: 537-544<!--MARK-->","","Article in Journal","c6d32005-57f7-47ea-bdf6-d1cd7adbc60e","20081009T05:11:37.000+0000","8b48b0a3-dd7a-4aea-be0d-10a223710ebc"
"Lower, O.B.","1920","New Australian Lepidoptera","58-70","","Transactions of the Royal Society of South Australia","","","","<!--MARK--><a href='null58a9f2bc-0d88-4929-b8ce-0fa2f18fbf14' class='mouseoverHref'>Lower, O.B. 1920. New Australian Lepidoptera.</a> <!--MARK--><!--MARK--><a href='null8b48b0a3-dd7a-4aea-be0d-10a223710ebc' class='mouseoverHref'><em>Transactions of the Royal Society of South Australia</em></a> <strong>44</strong>: 58-70<!--MARK-->","","Article in Journal","58a9f2bc-0d88-4929-b8ce-0fa2f18fbf14","20081009T05:11:37.000+0000","8b48b0a3-dd7a-4aea-be0d-10a223710ebc"
"Lucas, T.P.","1890","On Queensland and other Australian macro-lepidoptera, with localities, and descriptions of new species","1065-1099","","Proceedings of the Linnean Society of New South Wales","","","","<!--MARK--><a href='null0de9d10b-97cf-45b4-8373-360a194353af' class='mouseoverHref'>Lucas, T.P. 1890. On Queensland and other Australian macro-lepidoptera, with localities, and descriptions of new species.</a> <!--MARK--><!--MARK--><a href='nullc12cd779-adb5-41ea-bd2c-75f6864cf22e' class='mouseoverHref'><em>Proceedings of the Linnean Society of New South Wales</em></a> 2 <strong>4</strong>(4): 1065-1099<!--MARK-->","","Article in Journal","0de9d10b-97cf-45b4-8373-360a194353af","20110520T06:41:57.695+0000","c12cd779-adb5-41ea-bd2c-75f6864cf22e"
"Lucas, T.P.","1894","Descriptions of new Australian Lepidoptera, with additional localities for known species","133-166","","Proceedings of the Linnean Society of New South Wales","","","","<!--MARK--><a href='nulldc9d861b-ed6f-4abc-91af-9e91d5fa8a02' class='mouseoverHref'>Lucas, T.P. 1894. Descriptions of new Australian Lepidoptera, with additional localities for known species.</a> <!--MARK--><!--MARK--><a href='nullc12cd779-adb5-41ea-bd2c-75f6864cf22e' class='mouseoverHref'><em>Proceedings of the Linnean Society of New South Wales</em></a> 2 <strong>8</strong>: 133-166<!--MARK-->","","Article in Journal","dc9d861b-ed6f-4abc-91af-9e91d5fa8a02","20120110T02:15:17.998+0000","c12cd779-adb5-41ea-bd2c-75f6864cf22e"
"Lucas, T.P.","1895","Australian Lepidoptera: thirty new species","103-116","","Transactions of the Natural History Society of Queensland","","","","<!--MARK--><a href='null6a65ba15-c6aa-4414-adaa-66e11667422f' class='mouseoverHref'>Lucas, T.P. 1895. Australian Lepidoptera: thirty new species.</a> <!--MARK--><!--MARK--><a href='null890eac74-0abc-4082-91b3-d055cabd9340' class='mouseoverHref'><em>Transactions of the Natural History Society of Queensland</em></a> <strong>1</strong>: 103-116<!--MARK-->","","Article in Journal","6a65ba15-c6aa-4414-adaa-66e11667422f","20081009T05:11:37.000+0000","890eac74-0abc-4082-91b3-d055cabd9340"
"Lucas, T.P.","1900","New species of Queensland Lepidoptera","137-161","","Proceedings of the Royal Society of Queensland","","","","<!--MARK--><a href='null17f4d3ae-22be-4be6-b01e-d848e0f0256d' class='mouseoverHref'>Lucas, T.P. 1900. New species of Queensland Lepidoptera.</a> <!--MARK--><!--MARK--><a href='null642ab613-813a-48d0-8bc0-42c78157f7b0' class='mouseoverHref'><em>Proceedings of the Royal Society of Queensland</em></a> <strong>15</strong>: 137-161<!--MARK-->","","Article in Journal","17f4d3ae-22be-4be6-b01e-d848e0f0256d","20081009T05:11:37.000+0000","642ab613-813a-48d0-8bc0-42c78157f7b0"
"Macalister, A.","1870","Notes on some larva-cases from Australia","129-135","","Proceedings of the Natural History Society of Dublin","","","","<!--MARK--><a href='null3da0068b-a50b-4d68-af6f-a59a4247c215' class='mouseoverHref'>Macalister, A. 1870. Notes on some larva-cases from Australia.</a> <!--MARK--><!--MARK--><a href='null35457b37-106e-4e45-b740-5f02ad820766' class='mouseoverHref'><em>Proceedings of the Natural History Society of Dublin</em></a> <strong>5</strong>: 129-135<!--MARK-->","","Article in Journal","3da0068b-a50b-4d68-af6f-a59a4247c215","","35457b37-106e-4e45-b740-5f02ad820766"
"Meyrick, E.","1893","Descriptions of Australian Micro-lepidoptera. XVI. Tineidae","477-612","","Proceedings of the Linnean Society of New South Wales","","1893","","<!--MARK--><a href='null1f754170-d366-4a6e-81b0-0b6ccbfa27bc' class='mouseoverHref'>Meyrick, E. 1893. Descriptions of Australian Micro-lepidoptera. XVI. Tineidae.</a> <!--MARK--><!--MARK--><a href='nullc12cd779-adb5-41ea-bd2c-75f6864cf22e' class='mouseoverHref'><em>Proceedings of the Linnean Society of New South Wales</em></a> 2-n.s. <strong>7</strong>(4): 477-612<!--MARK--> [Date published 1893: dated 1892]","dated 1892","Article in Journal","1f754170-d366-4a6e-81b0-0b6ccbfa27bc","20120305T21:48:14.443+0000","c12cd779-adb5-41ea-bd2c-75f6864cf22e"
"Meyrick, E.","1897","Descriptions of new Lepidoptera from Australia and New Zealand","367-390","","Transactions of the Entomological Society of London","","","","<!--MARK--><a href='null330ae97b-7163-4875-ab85-3a81856cb546' class='mouseoverHref'>Meyrick, E. 1897. Descriptions of new Lepidoptera from Australia and New Zealand.</a> <!--MARK--><!--MARK--><a href='null5cf355b3-abc5-451e-9abc-ed3282d7811a' class='mouseoverHref'><em>Transactions of the Entomological Society of London</em></a> <strong>1897</strong>: 367-390<!--MARK-->","","Article in Journal","330ae97b-7163-4875-ab85-3a81856cb546","20081009T05:11:37.000+0000","5cf355b3-abc5-451e-9abc-ed3282d7811a"
"Meyrick, E.","1907","Descriptions of Australasian Micro-lepidoptera. XIX. Plutellidae","47-150","","Proceedings of the Linnean Society of New South Wales","","","","<!--MARK--><a href='nulld90e2e90-5fbf-4cb6-a406-4ca4d0994217' class='mouseoverHref'>Meyrick, E. 1907. Descriptions of Australasian Micro-lepidoptera. XIX. Plutellidae.</a> <!--MARK--><!--MARK--><a href='nullc12cd779-adb5-41ea-bd2c-75f6864cf22e' class='mouseoverHref'><em>Proceedings of the Linnean Society of New South Wales</em></a> <strong>32</strong>: 47-150<!--MARK-->","","Article in Journal","d90e2e90-5fbf-4cb6-a406-4ca4d0994217","20081009T05:11:37.000+0000","c12cd779-adb5-41ea-bd2c-75f6864cf22e"
"Meyrick, E.","1917","<i>Exotic Microlepidoptera</i>","","","","","","","<!--MARK--><a href='null99bd7438-22e4-4772-b2a1-547943c019bc' class='mouseoverHref'>Meyrick, E. 1917. <i>Exotic Microlepidoptera</i>. Vol. <B>2</B>(2-3): 33-96.</a>","","Miscellaneous","99bd7438-22e4-4772-b2a1-547943c019bc","20120306T21:58:12.194+0000",""
"Meyrick, E.","1920","<i>Exotic Microlepidoptera</i>","","","","","","","<!--MARK--><a href='null01c7fc63-39ec-439f-b66b-5a7cd1933107' class='mouseoverHref'>Meyrick, E. 1920. <i>Exotic Microlepidoptera</i>. Vol. <B>2</B>(10-12): 189-384.</a>","","Miscellaneous","01c7fc63-39ec-439f-b66b-5a7cd1933107","20120306T21:57:05.942+0000",""
"Meyrick, E.","1921","Exotic Microlepidoptera","640 pp.","","","","","Taylor & Francis","<!--MARK--><a href='nulld31ac89e-270e-4c00-9539-678da0a90061' class='mouseoverHref'>Meyrick, E. 1921. <em>Exotic Microlepidoptera</em>. London : Taylor & Francis Vol. 2 640 pp.</a><!--MARK-->","","Book","d31ac89e-270e-4c00-9539-678da0a90061","",""
"Meyrick, E. & Lower, O.B.","1907","Revision of the Australian Psychidae","192-208","","Transactions of the Royal Society of South Australia","","","","<!--MARK--><a href='nullc49e6da9-f18b-48ef-b519-59274df548f9' class='mouseoverHref'>Meyrick, E. & Lower, O.B. 1907. Revision of the Australian Psychidae.</a> <!--MARK--><!--MARK--><a href='null8b48b0a3-dd7a-4aea-be0d-10a223710ebc' class='mouseoverHref'><em>Transactions of the Royal Society of South Australia</em></a> <strong>31</strong>: 192-208<!--MARK-->","","Article in Journal","c49e6da9-f18b-48ef-b519-59274df548f9","20081009T05:11:37.000+0000","8b48b0a3-dd7a-4aea-be0d-10a223710ebc"
"Moore, F.","1883","The Lepidoptera of Ceylon","viii 73-162 pls cviii-cxliii","","","","","L. Reeve & Co.","<!--MARK--><a href='nulle2270450-a03e-48de-9043-e9f24268ee91' class='mouseoverHref'>Moore, F. 1883. <em>The Lepidoptera of Ceylon</em>. London : L. Reeve & Co. Vol. ii viii 73-162 pls cviii-cxliii.</a><!--MARK-->","","Book","e2270450-a03e-48de-9043-e9f24268ee91","20081009T05:11:37.000+0000",""
"Nielsen, E.S., Edwards, E.D. & Rangsi, T.V. (eds)","1996","Checklist of the Lepidoptera of Australia. Monographs on Australian Lepidoptera","xiv 529 pp. & CD-ROM","","","","","CSIRO Publishing","<!--MARK--><a href='null378b3781-ecbb-4844-8fe3-625daadd926d' class='mouseoverHref'>Nielsen, E.S., Edwards, E.D. & Rangsi, T.V. (eds) 1996. <em>Checklist of the Lepidoptera of Australia. Monographs on Australian Lepidoptera</em>. Collingwood : CSIRO Publishing Vol. 4 xiv 529 pp. & CD-ROM.</a><!--MARK-->","","Book","378b3781-ecbb-4844-8fe3-625daadd926d","20121106T05:35:37.444+0000",""
"Nielsen, E.S. & Edwards, E.D.","1996","Tineoidea","pp. 33-43","Checklist of the Lepidoptera of Australia. Monographs on Australian Lepidoptera","","","","","<!--MARK--><a href='nullbc7c64d9-6a73-49a6-a316-904846799a1b' class='mouseoverHref'>Nielsen, E.S. & Edwards, E.D. 1996. Tineoidea. pp. 33-43</a> <!--MARK--><em>in</em> <!--MARK--><a href='null378b3781-ecbb-4844-8fe3-625daadd926d' class='mouseoverHref'>Nielsen, E.S., Edwards, E.D. & Rangsi, T.V. (eds). <em>Checklist of the Lepidoptera of Australia. Monographs on Australian Lepidoptera</em>. Collingwood : CSIRO Publishing Vol. 4 xiv 529 pp. & CD-ROM.</a><!--MARK-->","","Chapter in Book","bc7c64d9-6a73-49a6-a316-904846799a1b","20120215T22:18:30.707+0000","378b3781-ecbb-4844-8fe3-625daadd926d"
"Oke, C.G.","1948","Description of a new species of casemoth (Lepidoptera, Psychidae)","178-179","","Memoirs of the National Museum of Victoria, Melbourne","","","","<!--MARK--><a href='nullb86ba4f5-4235-4cd4-be3a-12673599186c' class='mouseoverHref'>Oke, C.G. 1948. Description of a new species of casemoth (Lepidoptera, Psychidae).</a> <!--MARK--><!--MARK--><a href='null6d019674-04b0-4fab-8903-0612d147ec4d' class='mouseoverHref'><em>Memoirs of the National Museum of Victoria, Melbourne</em></a> <strong>15</strong>: 178-179<!--MARK--> [dated 1947]","dated 1947","Article in Journal","b86ba4f5-4235-4cd4-be3a-12673599186c","","6d019674-04b0-4fab-8903-0612d147ec4d"
"Regier, J.C., Mitter, C., Davis, D.R. et al.","2015","A molecular phylogeny and revised classification for the oldest ditrysian moth lineages (Lepidoptera: Tineoidea), with implications for ancestral feeding habits of the mega-diverse Ditrysia.","409-432","","Systematic Entomology","","","","<!--MARK--><a href='null5d6674c7-fa3d-4f4c-92a5-99141eb0fca6' class='mouseoverHref'>Regier, J.C., Mitter, C., Davis, D.R. <i>et al</i>. 2015. A molecular phylogeny and revised classification for the oldest ditrysian moth lineages (Lepidoptera: Tineoidea), with implications for ancestral feeding habits of the mega-diverse Ditrysia.</a> <!--MARK--><!--MARK--><a href='null129a4a7d-1c4c-4650-87ea-27d58ad726d5' class='mouseoverHref'><em>Systematic Entomology</em></a> <strong>40</strong>: 409-432<!--MARK-->","","Article in Journal","5d6674c7-fa3d-4f4c-92a5-99141eb0fca6","20150720T00:41:06.611+0000","129a4a7d-1c4c-4650-87ea-27d58ad726d5"
"Robinson, G.S. & Nielsen, E.S.","1993","Tineid genera of Australia (Lepidoptera)","i-xvi, 1-344","","Monographs on Australian Lepidoptera","","","","<!--MARK--><a href='nulle0e21d26-1f8d-4c91-aba5-82be855c9d25' class='mouseoverHref'>Robinson, G.S. & Nielsen, E.S. 1993. Tineid genera of Australia (Lepidoptera).</a> <!--MARK--><!--MARK--><a href='null3820f42d-af14-449e-a37e-97e94dd8d1ce' class='mouseoverHref'><em>Monographs on Australian Lepidoptera</em></a> <strong>2</strong>: i-xvi, 1-344<!--MARK-->","","Article in Journal","e0e21d26-1f8d-4c91-aba5-82be855c9d25","20081009T05:11:37.000+0000","3820f42d-af14-449e-a37e-97e94dd8d1ce"
"Rosenstock, R.","1885","Notes on Australian Lepidoptera, with descriptions of new species","376-385, 421-443","","Annals and Magazine of Natural History","","","","<!--MARK--><a href='null0ce7fd7d-fdaa-4621-95c6-7768e3d6be99' class='mouseoverHref'>Rosenstock, R. 1885. Notes on Australian Lepidoptera, with descriptions of new species.</a> <!--MARK--><!--MARK--><a href='nullefa8de69-3a29-4a43-8ef2-cbefda205976' class='mouseoverHref'><em>Annals and Magazine of Natural History</em></a> 5 <strong>16</strong>: 376-385, 421-443<!--MARK-->","","Article in Journal","0ce7fd7d-fdaa-4621-95c6-7768e3d6be99","20110414T03:32:21.513+0000","efa8de69-3a29-4a43-8ef2-cbefda205976"
"Saunders, W.W.","1847","Remarks on the habits and economy of a species of <i>Oiketecus</i> found on shrubs in the vicinity of Sydney, N.S.W. [Drawn up from notes furnished by W. Stephenson, Esq.]","40-43","","Transactions of the Entomological Society of London","","","","<!--MARK--><a href='null8f90a1ac-090c-4f2b-b408-e53e6d12909e' class='mouseoverHref'>Saunders, W.W. 1847. Remarks on the habits and economy of a species of <i>Oiketecus</i> found on shrubs in the vicinity of Sydney, N.S.W. [Drawn up from notes furnished by W. Stephenson, Esq.].</a> <!--MARK--><!--MARK--><a href='null5cf355b3-abc5-451e-9abc-ed3282d7811a' class='mouseoverHref'><em>Transactions of the Entomological Society of London</em></a> <strong>5</strong>: 40-43<!--MARK-->","","Article in Journal","8f90a1ac-090c-4f2b-b408-e53e6d12909e","","5cf355b3-abc5-451e-9abc-ed3282d7811a"
