"PUB_AUTHOR","PUB_YEAR","PUB_TITLE","PUB_PAGES","PUB_PARENT_BOOK_TITLE","PUB_PARENT_JOURNAL_TITLE","PUB_PARENT_ARTICLE_TITLE","PUB_PUBLICATION_DATE","PUB_PUBLISHER","PUB_FORMATTED","PUB_QUALIFICATION","PUB_TYPE","PUBLICATION_GUID","PUBLICATION_LAST_UPDATE","PARENT_PUBLICATION_GUID"
"Bezzi, M.","1929","Australian Pyrgotidae (Diptera). With an appendix by J.R. Malloch","1-31","","Proceedings of the Linnean Society of New South Wales","","15 May","","<!--MARK--><a href='null76607644-5fe7-4407-87ab-66c039e7da29' class='mouseoverHref'>Bezzi, M. 1929. Australian Pyrgotidae (Diptera). With an appendix by J.R. Malloch.</a> <!--MARK--><!--MARK--><a href='nullc12cd779-adb5-41ea-bd2c-75f6864cf22e' class='mouseoverHref'><em>Proceedings of the Linnean Society of New South Wales</em></a> <strong>54</strong>: 1-31<!--MARK--> [Date published 15 May]","","Article in Journal","76607644-5fe7-4407-87ab-66c039e7da29","20120216T04:11:31.631+0000","c12cd779-adb5-41ea-bd2c-75f6864cf22e"
"Enderlein, G.","1942","Klassifikation der Pyrgotiden","98-134","","Sitzungsberichte der Gesellschaft Naturforschender Freunde zu Berlin","","15 December","","<!--MARK--><a href='null2efa6814-d802-4004-9861-12f30eef433c' class='mouseoverHref'>Enderlein, G. 1942. Klassifikation der Pyrgotiden.</a> <!--MARK--><!--MARK--><a href='null9f4f8fa8-8553-4807-a483-541b14e86c37' class='mouseoverHref'><em>Sitzungsberichte der Gesellschaft Naturforschender Freunde zu Berlin</em></a> <strong>1941</strong>: 98-134<!--MARK--> [Date published 15 December]","","Article in Journal","2efa6814-d802-4004-9861-12f30eef433c","20130123T06:51:47.338+0000","9f4f8fa8-8553-4807-a483-541b14e86c37"
"Evenhuis, N. (Originally by B.R. Pitkin)","1996","Family Pyrgotidae","","","","","","","<!--MARK--><a href='null88133fa5-8dbd-465c-87a8-22fcef5d769e' class='mouseoverHref'>Evenhuis, N. (Originally by B.R. Pitkin) 1996. Family Pyrgotidae. <em>In</em> Evenhuis, N.L.(ed.) Catalog of the Diptera of the Australasian and Oceanian Regions. last updated 5 October 1996.</a> <!--MARK--><a href=http://hbs.bishopmuseum.org/aocat/pyrgotidae.html>http://hbs.bishopmuseum.org/aocat/pyrgotidae.html</a>","","URL","88133fa5-8dbd-465c-87a8-22fcef5d769e","20120223T01:20:40.571+0000",""
"Hardy, D.E.","1954","Notes and descriptions on Australian fruit flies. (Diptera: Tephritidae)","327-333","","Proceedings of the Hawaiian Entomological Society","","5 March","","<!--MARK--><a href='null6a27f3b3-7c6c-4d8b-b6b3-464a86f57f79' class='mouseoverHref'>Hardy, D.E. 1954. Notes and descriptions on Australian fruit flies. (Diptera: Tephritidae).</a> <!--MARK--><!--MARK--><a href='nulldc684db4-5e18-40e3-9eb9-1d6fdec7d866' class='mouseoverHref'><em>Proceedings of the Hawaiian Entomological Society</em></a> <strong>15</strong>: 327-333<!--MARK--> [Date published 5 March]","","Article in Journal","6a27f3b3-7c6c-4d8b-b6b3-464a86f57f79","20120222T21:47:55.026+0000","dc684db4-5e18-40e3-9eb9-1d6fdec7d866"
"Hendel, F.","1908","Acht neue Pyrgotinen (Dipt.)","145-153","","Wiener Entomologische Zeitung","","15 April","","<!--MARK--><a href='null83a4abc6-54eb-4ba9-af94-b17530fe3f4a' class='mouseoverHref'>Hendel, F. 1908. Acht neue Pyrgotinen (Dipt.).</a> <!--MARK--><!--MARK--><a href='null9b6f9f14-04ca-437e-a5d2-714ac39f9aa0' class='mouseoverHref'><em>Wiener Entomologische Zeitung</em></a> <strong>27</strong>: 145-153<!--MARK--> [Date published 15 April]","","Article in Journal","83a4abc6-54eb-4ba9-af94-b17530fe3f4a","20120222T22:36:34.764+0000","9b6f9f14-04ca-437e-a5d2-714ac39f9aa0"
"Hendel, F.","1914","Neue Beiträge zur Kenntnis der Pyrgotinen","77-117","","Archiv für Naturgeschichte","","15 April","","<!--MARK--><a href='null67ecd720-faa1-45f7-b09f-8c74acb57442' class='mouseoverHref'>Hendel, F. 1914. Neue Beiträge zur Kenntnis der Pyrgotinen.</a> <!--MARK--><!--MARK--><a href='nullf5b5f7c7-fc53-4502-951d-1c96b680d874' class='mouseoverHref'><em>Archiv für Naturgeschichte</em></a> Abteilung A <strong>79</strong>(11): 77-117<!--MARK--> [Date published 15 April]","","Article in Journal","67ecd720-faa1-45f7-b09f-8c74acb57442","20140602T22:52:07.047+0000","f5b5f7c7-fc53-4502-951d-1c96b680d874"
"Hendel, F.","1934","Übersicht über die Gattungen der Pyrgotiden, nebst Beschreibung neuer Gattungen und Arten","141-156","","Encyclopédie Entomologique","","7 September","","<!--MARK--><a href='null02464a64-940b-4ff0-acc0-9eae788b91aa' class='mouseoverHref'>Hendel, F. 1934. Übersicht über die Gattungen der Pyrgotiden, nebst Beschreibung neuer Gattungen und Arten.</a> <!--MARK--><!--MARK--><a href='nullb1d448c4-0308-4e74-a29c-e44e86803532' class='mouseoverHref'><em>Encyclopédie Entomologique</em></a> (B) II <strong>7</strong>: 141-156<!--MARK--> [Date published 7 September]","","Article in Journal","02464a64-940b-4ff0-acc0-9eae788b91aa","20120216T04:27:01.232+0000","b1d448c4-0308-4e74-a29c-e44e86803532"
"Kocak, A.O. & Kemal, M.","2009","A replacement name in the family Pyrgotidae (Diptera)","4-5","","Miscellaneous Papers Centre for Entomological Studies","","21 December","","<!--MARK--><a href='nullfcf5f0d8-160e-4295-a190-ffa41c7ef14a' class='mouseoverHref'>Kocak, A.O. & Kemal, M. 2009. A replacement name in the family Pyrgotidae (Diptera).</a> <!--MARK--><!--MARK--><a href='nullf245df44-0ae1-4f0c-96ec-fa00510c8910' class='mouseoverHref'><em>Miscellaneous Papers Centre for Entomological Studies</em></a> <strong>149</strong>: 4-5<!--MARK--> [Date published 21 December]","","Article in Journal","fcf5f0d8-160e-4295-a190-ffa41c7ef14a","20120222T21:35:59.464+0000","f245df44-0ae1-4f0c-96ec-fa00510c8910"
"Macquart, J.","1843","Diptères exotiques nouveaux ou peu connus. Tome deuxième. -- 3e partie","162-460","","Mémoires de la Société Royale des Sciences, de l'Agriculture et des Arts de Lille","","","","<!--MARK--><a href='null37c1a55c-f08e-4689-8e1f-f399828e085e' class='mouseoverHref'>Macquart, J. 1843. Diptères exotiques nouveaux ou peu connus. Tome deuxième. -- 3e partie.</a> <!--MARK--><!--MARK--><a href='null6aad247f-0688-46ad-a6c4-3b3ce93aa650' class='mouseoverHref'><em>Mémoires de la Société Royale des Sciences, de l'Agriculture et des Arts de Lille</em></a> <strong>1842</strong>: 162-460<!--MARK-->","","Article in Journal","37c1a55c-f08e-4689-8e1f-f399828e085e","","6aad247f-0688-46ad-a6c4-3b3ce93aa650"
"Macquart, J.","1847","Diptères exotiques nouveaux ou peu connus. </em>[2.e supplément]","pp. 5-104, pls 1-6","","","","","Roret","<!--MARK--><a href='null08494ade-e0b2-4872-a9c1-85f13867e30b' class='mouseoverHref'>Macquart, J. 1847. <em>Diptères exotiques nouveaux ou peu connus. </em>[2.e supplément]</em>. Paris : Roret pp. 5-104, pls 1-6.</a><!--MARK--> [Published before 11 September]","Published before 11 September","Book","08494ade-e0b2-4872-a9c1-85f13867e30b","20120329T01:07:01.768+0000",""
"Macquart, J.","1851","Diptères exotiques nouveaux ou peu connus. Suite du 4.e supplément publié dans les mémoires de 1849","134-294","","Mémoires de la Société Royale des Sciences, de l'Agriculture et des Arts de Lille","","","","<!--MARK--><a href='null899a1ef1-a727-4c46-8621-d0d624d93087' class='mouseoverHref'>Macquart, J. 1851. Diptères exotiques nouveaux ou peu connus. Suite du 4.e supplément publié dans les mémoires de 1849.</a> <!--MARK--><!--MARK--><a href='null6aad247f-0688-46ad-a6c4-3b3ce93aa650' class='mouseoverHref'><em>Mémoires de la Société Royale des Sciences, de l'Agriculture et des Arts de Lille</em></a> <strong>1850</strong>: 134-294<!--MARK-->","","Article in Journal","899a1ef1-a727-4c46-8621-d0d624d93087","20081009T05:11:37.000+0000","6aad247f-0688-46ad-a6c4-3b3ce93aa650"
"Malloch, J.R.","1929","Appendix","pp. 20-31","","Proceedings of the Linnean Society of New South Wales","Australian Pyrgotidae (Diptera). With an appendix by J.R. Malloch","","","<!--MARK--><a href='null1b31d3be-d972-4812-994d-23884ff36b5f' class='mouseoverHref'>Malloch, J.R. 1929. Appendix. pp. 20-31</a> <!--MARK--><em>in</em> <!--MARK--><a href='null76607644-5fe7-4407-87ab-66c039e7da29' class='mouseoverHref'>Bezzi, M. Australian Pyrgotidae (Diptera). With an appendix by J.R. Malloch.</a> <!--MARK--><!--MARK--><a href='nullc12cd779-adb5-41ea-bd2c-75f6864cf22e' class='mouseoverHref'><em>Proceedings of the Linnean Society of New South Wales</em></a> <strong>54</strong>: 1-31<!--MARK--> [Date published 15 May]","","Section in Article","1b31d3be-d972-4812-994d-23884ff36b5f","20120216T04:11:31.631+0000","76607644-5fe7-4407-87ab-66c039e7da29"
"McAlpine, D.K.","1973","The Australian Platystomatidae (Diptera, Schizophora) with a revision of five genera","1-256","","Memoirs of the Australian Museum","","","","<!--MARK--><a href='null2c00fc02-8266-47d6-a2a7-9baa7ab3e9e2' class='mouseoverHref'>McAlpine, D.K. 1973. The Australian Platystomatidae (Diptera, Schizophora) with a revision of five genera.</a> <!--MARK--><!--MARK--><a href='null272826c2-c2bf-425b-bd6f-11ddaf2aaeaa' class='mouseoverHref'><em>Memoirs of the Australian Museum</em></a> <strong>15</strong>: 1-256<!--MARK-->","","Article in Journal","2c00fc02-8266-47d6-a2a7-9baa7ab3e9e2","20081009T05:11:37.000+0000","272826c2-c2bf-425b-bd6f-11ddaf2aaeaa"
"McAlpine, D.K.","1978","Notes on nomenclature and type-specimens of Australian Pyrgotidae (Diptera, Scizophora)","27-33","","Australian Entomological Magazine","","July","","<!--MARK--><a href='null684d265e-90df-4b95-98bb-6d58a3f31b2b' class='mouseoverHref'>McAlpine, D.K. 1978. Notes on nomenclature and type-specimens of Australian Pyrgotidae (Diptera, Scizophora).</a> <!--MARK--><!--MARK--><a href='null33d99a92-3718-4094-b6bd-af8f9b31885d' class='mouseoverHref'><em>Australian Entomological Magazine</em></a> <strong>5</strong>: 27-33<!--MARK--> [Date published July]","","Article in Journal","684d265e-90df-4b95-98bb-6d58a3f31b2b","20121109T01:07:55.195+0000","33d99a92-3718-4094-b6bd-af8f9b31885d"
"Paramonov, S.J.","1958","A review of Australian Pyrgotidae (Diptera)","89-137","","Australian Journal of Zoology","","May","","<!--MARK--><a href='null3528cdf7-6c30-4df5-a13d-492ee7404588' class='mouseoverHref'>Paramonov, S.J. 1958. A review of Australian Pyrgotidae (Diptera).</a> <!--MARK--><!--MARK--><a href='null53c3abd8-0254-4532-a73e-d9ef6b7ac2ef' class='mouseoverHref'><em>Australian Journal of Zoology</em></a> <strong>6</strong>: 89-137<!--MARK--> [Date published May]","","Article in Journal","3528cdf7-6c30-4df5-a13d-492ee7404588","20120216T01:59:53.316+0000","53c3abd8-0254-4532-a73e-d9ef6b7ac2ef"
"Paramonov, S.J.","1958","Notes on Australian Diptera (XXVI-XXVIII). XXVIII. On some new pyrgotids (Pyrgotidae, Acalyptrata)","598-600","","Annals and Magazine of Natural History","","31 December","","<!--MARK--><a href='null400ad604-a358-491a-8fb0-6cdf541e390f' class='mouseoverHref'>Paramonov, S.J. 1958. Notes on Australian Diptera (XXVI-XXVIII). XXVIII. On some new pyrgotids (Pyrgotidae, Acalyptrata).</a> <!--MARK--><!--MARK--><a href='nullefa8de69-3a29-4a43-8ef2-cbefda205976' class='mouseoverHref'><em>Annals and Magazine of Natural History</em></a> <strong>13</strong>(1): 598-600<!--MARK--> [Date published 31 December]","","Article in Journal","400ad604-a358-491a-8fb0-6cdf541e390f","20120216T03:41:11.397+0000","efa8de69-3a29-4a43-8ef2-cbefda205976"
"Steyskal, G.C.","1965","Notes on types of some species described in <em>Sciomyza</em> and <em>Tetanocera</em> by Loew, Walker, and Van der Wulp (Diptera: Sciomyzidae, Muscidae, Neriidae, Pyrgotidae)","445-448","","Studia Entomologica","","","","<!--MARK--><a href='null9a0a711e-fca6-4b9f-99b1-7e28c3962d88' class='mouseoverHref'>Steyskal, G.C. 1965. Notes on types of some species described in <em>Sciomyza</em> and <em>Tetanocera</em> by Loew, Walker, and Van der Wulp (Diptera: Sciomyzidae, Muscidae, Neriidae, Pyrgotidae).</a> <!--MARK--><!--MARK--><a href='nullc8d94c7c-ab66-4087-89dc-2561fe72cf9a' class='mouseoverHref'><em>Studia Entomologica</em></a> <strong>8</strong>: 445-448<!--MARK-->","","Article in Journal","9a0a711e-fca6-4b9f-99b1-7e28c3962d88","20120217T03:40:57.526+0000","c8d94c7c-ab66-4087-89dc-2561fe72cf9a"
"Waga, A.F.","1842","<em>Adapsilia</em> genre de diptres, appartenant la sous-tribu dolichocres de Macquart, voisin de <em>Sepedon</em> et <em>Tetanocera</em>","279-282","","Annales de la Société Entomologique de France","","January 1843","","<!--MARK--><a href='nullcbe7444d-0b41-412e-81f9-127b55e06e8b' class='mouseoverHref'>Waga, A.F. 1842. <em>Adapsilia</em> genre de diptres, appartenant la sous-tribu dolichocres de Macquart, voisin de <em>Sepedon</em> et <em>Tetanocera</em>.</a> <!--MARK--><!--MARK--><a href='null6462279b-2aaf-46a3-a434-cab7d8a2c33d' class='mouseoverHref'><em>Annales de la Société Entomologique de France</em></a> <strong>11</strong>: 279-282<!--MARK--> [Date published January 1843: apparently first published in <i>Rev. Zool</i>. (Soc. Cuv.), 5, 294, September 1842]","apparently first published in <i>Rev. Zool</i>. (Soc. Cuv.), 5, 294, September 1842","Article in Journal","cbe7444d-0b41-412e-81f9-127b55e06e8b","20140602T22:56:48.127+0000","6462279b-2aaf-46a3-a434-cab7d8a2c33d"
"Walker, F.","1849","List of the specimens of dipterous insects in the collection of the British Museum. Parts II-IV","","","","","","British Museum","<!--MARK--><a href='null4c001c3c-4c84-4083-9ec0-a2698e2f308b' class='mouseoverHref'>Walker, F. 1849. <em>List of the specimens of dipterous insects in the collection of the British Museum. Parts II-IV</em>. London : British Museum.</a><!--MARK--> [Publication split: p. [3] + 231-484 [= Part II] (21 April); p. [3] + 485-687 [= Part III] (30 June); p. [3] + 688-1172 + [2] [= Part IV]]","Publication split: p. [3] + 231-484 [= Part II] (21 April); p. [3] + 485-687 [= Part III] (30 June); p. [3] + 688-1172 + [2] [= Part IV]","Book","4c001c3c-4c84-4083-9ec0-a2698e2f308b","20081009T05:11:37.000+0000",""
