"PUB_AUTHOR","PUB_YEAR","PUB_TITLE","PUB_PAGES","PUB_PARENT_BOOK_TITLE","PUB_PARENT_JOURNAL_TITLE","PUB_PARENT_ARTICLE_TITLE","PUB_PUBLICATION_DATE","PUB_PUBLISHER","PUB_FORMATTED","PUB_QUALIFICATION","PUB_TYPE","PUBLICATION_GUID","PUBLICATION_LAST_UPDATE","PARENT_PUBLICATION_GUID"
"Abrams, K.M. & Harvey, M.S.","2015","A new troglobitic schizomid (Hubbardiidae: Paradraculoides) from the Pilbara region, Western Australia","132-136","","Records of the Western Australian Museum","","","","<!--MARK--><a href='null1c75105a-01db-495f-84af-5cbb7587a1fc' class='mouseoverHref'>Abrams, K.M. & Harvey, M.S. 2015. A new troglobitic schizomid (Hubbardiidae: Paradraculoides) from the Pilbara region, Western Australia.</a> <!--MARK--><!--MARK--><a href='nulla2cbd1fb-97d5-493a-a1d7-c2b99709890b' class='mouseoverHref'><em>Records of the Western Australian Museum</em></a> <strong>30</strong>: 132-136<!--MARK-->","","Article in Journal","1c75105a-01db-495f-84af-5cbb7587a1fc","20160525T01:14:40.336+0000","a2cbd1fb-97d5-493a-a1d7-c2b99709890b"
"Cokendolpher, J.C.","1981","The order Schizomida","6-7","","Australian Arachnologist","","","","<!--MARK--><a href='null55acda08-cbb9-4257-905b-29edafc3d7dc' class='mouseoverHref'>Cokendolpher, J.C. 1981. The order Schizomida.</a> <!--MARK--><!--MARK--><a href='null317441b8-2f21-4910-ad85-9c15dc3f7ee8' class='mouseoverHref'><em>Australian Arachnologist</em></a> <strong>5</strong>: 6-7<!--MARK-->","","Article in Journal","55acda08-cbb9-4257-905b-29edafc3d7dc","20081009T05:11:37.000+0000","317441b8-2f21-4910-ad85-9c15dc3f7ee8"
"Harvey, M.S.","1988","A new troglobitic schizomid from Cape Range, Western Australia (Chelicerata: Schizomida)","15-20","","Records of the Western Australian Museum","","","","<!--MARK--><a href='null26dfb6e5-c5ab-49aa-bd4b-7a110d95d57b' class='mouseoverHref'>Harvey, M.S. 1988. A new troglobitic schizomid from Cape Range, Western Australia (Chelicerata: Schizomida).</a> <!--MARK--><!--MARK--><a href='nulla2cbd1fb-97d5-493a-a1d7-c2b99709890b' class='mouseoverHref'><em>Records of the Western Australian Museum</em></a> <strong>14</strong>: 15-20<!--MARK-->","","Article in Journal","26dfb6e5-c5ab-49aa-bd4b-7a110d95d57b","20081009T05:11:37.000+0000","a2cbd1fb-97d5-493a-a1d7-c2b99709890b"
"Harvey, M.S.","1992","The Schizomida (Chelicerata) of Australia","77-129","","Invertebrate Taxonomy","","","","<!--MARK--><a href='null2e05e146-559e-4ff9-a59e-e9d21a7678b1' class='mouseoverHref'>Harvey, M.S. 1992. The Schizomida (Chelicerata) of Australia.</a> <!--MARK--><!--MARK--><a href='null9846f41b-d755-4682-9049-5e59d363951b' class='mouseoverHref'><em>Invertebrate Taxonomy</em></a> <strong>6</strong>: 77-129<!--MARK-->","","Article in Journal","2e05e146-559e-4ff9-a59e-e9d21a7678b1","20081009T05:11:37.000+0000","9846f41b-d755-4682-9049-5e59d363951b"
"Harvey, M.S.","2000","<i>Brignolizomus</i> and <i>Attenuizomus</i>, new schizomid genera from Australia (Arachnida: Schizomida: Hubbardiidae)","329-338","","Memorie della Società Entomologica Italiana. Genova","","30 November 2000","","<!--MARK--><a href='nullba6b9a5c-0da8-455f-a230-40e376039238' class='mouseoverHref'>Harvey, M.S. 2000. <i>Brignolizomus</i> and <i>Attenuizomus</i>, new schizomid genera from Australia (Arachnida: Schizomida: Hubbardiidae).</a> <!--MARK--><!--MARK--><a href='null2b4020b8-372e-4058-b982-84e9d80d225f' class='mouseoverHref'><em>Memorie della Società Entomologica Italiana. Genova</em></a> <strong>78</strong>: 329-338<!--MARK--> [Date published 30 November 2000]","","Article in Journal","ba6b9a5c-0da8-455f-a230-40e376039238","20081009T05:11:37.000+0000","2b4020b8-372e-4058-b982-84e9d80d225f"
"Harvey, M.S.","2000","A review of the Australian schizomid genus <i>Notozomus</i> (Hubbardiidae)","161-174","","Memoirs of the Queensland Museum","","","","<!--MARK--><a href='null1f550858-ad92-42c4-8f49-467651e3529e' class='mouseoverHref'>Harvey, M.S. 2000. A review of the Australian schizomid genus <i>Notozomus</i> (Hubbardiidae).</a> <!--MARK--><!--MARK--><a href='null1a0a2982-9f30-43e1-a641-b0379699837c' class='mouseoverHref'><em>Memoirs of the Queensland Museum</em></a> <strong>46</strong>: 161-174<!--MARK-->","","Article in Journal","1f550858-ad92-42c4-8f49-467651e3529e","20081009T05:11:37.000+0000","1a0a2982-9f30-43e1-a641-b0379699837c"
"Harvey, M.S.","2001","New cave-dwelling schizomids (Schizomida: Hubbardiidae) from Australia","171-185","","Records of the Western Australian Museum, Supplement","","","","<!--MARK--><a href='nullec1173e4-311a-4dc9-873e-174e36e65e71' class='mouseoverHref'>Harvey, M.S. 2001. New cave-dwelling schizomids (Schizomida: Hubbardiidae) from Australia.</a> <!--MARK--><!--MARK--><a href='null841f1546-1bce-4548-adc9-7b08f6ca73a0' class='mouseoverHref'><em>Records of the Western Australian Museum, Supplement</em></a> <strong>64</strong>: 171-185<!--MARK-->","","Article in Journal","ec1173e4-311a-4dc9-873e-174e36e65e71","20081009T05:11:37.000+0000","841f1546-1bce-4548-adc9-7b08f6ca73a0"
"Harvey, M.S.","2002","Short-range endemism in the Australian fauna: some examples from non-marine environments","555-570","","Invertebrate Systematics","","","","<!--MARK--><a href='null86a28df1-b85e-416a-8deb-14cd47e19d8c' class='mouseoverHref'>Harvey, M.S. 2002. Short-range endemism in the Australian fauna: some examples from non-marine environments.</a> <!--MARK--><!--MARK--><a href='null7ef62e6c-73cc-4912-8ea7-5752f95e8e8a' class='mouseoverHref'><em>Invertebrate Systematics</em></a> <strong>16</strong>: 555-570<!--MARK-->","","Article in Journal","86a28df1-b85e-416a-8deb-14cd47e19d8c","20081009T05:11:37.000+0000","7ef62e6c-73cc-4912-8ea7-5752f95e8e8a"
"Harvey, M.S.","2003","Order Schizomida","385","","","","","","<!--MARK--><a href='null52b30522-5841-43ec-bb13-d7507a66eaa7' class='mouseoverHref'>Harvey, M.S. 2003. Order Schizomida. pp. 101-148 <I>in, Catalogue of the Smaller Arachnid Orders of the World: Amblypygi, Uropygi, Schizomida, Palpigradi, Ricinulei and Solifugae</I>. Collingwood, Victoria : CSIRO Publishing. 385 pp.</a>","","Miscellaneous","52b30522-5841-43ec-bb13-d7507a66eaa7","20081009T05:11:37.000+0000",""
"Harvey, M.S., Berry, O., Edward, K.L. & Humphreys, G.","2008","Molecular and morphological systematics of hypogean schizomids (Schizomida: Hubbardiidae) in semiarid Australia","167-194","","Invertebrate Systematics","","","","<!--MARK--><a href='null04c3e9f1-6839-4850-8204-ee97c5b8f956' class='mouseoverHref'>Harvey, M.S., Berry, O., Edward, K.L. & Humphreys, G. 2008. Molecular and morphological systematics of hypogean schizomids (Schizomida: Hubbardiidae) in semiarid Australia.</a> <!--MARK--><!--MARK--><a href='null7ef62e6c-73cc-4912-8ea7-5752f95e8e8a' class='mouseoverHref'><em>Invertebrate Systematics</em></a> <strong>22</strong>: 167-194<!--MARK-->","","Article in Journal","04c3e9f1-6839-4850-8204-ee97c5b8f956","20081009T05:11:37.000+0000","7ef62e6c-73cc-4912-8ea7-5752f95e8e8a"
"Harvey, M.S. & Humphreys, W.F.","1995","Notes on the genus <i>Draculoides</i> Harvey (Schizomida: Hubbardiidae), with the description of a new troglobitic species","183-189","","Records of the Western Australian Museum, Supplement","","","","<!--MARK--><a href='nullc27ca996-3078-45a8-840a-7f55f4071b79' class='mouseoverHref'>Harvey, M.S. & Humphreys, W.F. 1995. Notes on the genus <i>Draculoides</i> Harvey (Schizomida: Hubbardiidae), with the description of a new troglobitic species.</a> <!--MARK--><!--MARK--><a href='null841f1546-1bce-4548-adc9-7b08f6ca73a0' class='mouseoverHref'><em>Records of the Western Australian Museum, Supplement</em></a> <strong>52</strong>: 183-189<!--MARK-->","","Article in Journal","c27ca996-3078-45a8-840a-7f55f4071b79","20081009T05:11:37.000+0000","841f1546-1bce-4548-adc9-7b08f6ca73a0"
"Main, B.Y.","1980","Record of the arachnid order Schizomida in Western Australia","236-237","","Western Australian Naturalist","","","","<!--MARK--><a href='null08d2a4bc-89bf-469d-9314-b4ff3d7913b0' class='mouseoverHref'>Main, B.Y. 1980. Record of the arachnid order Schizomida in Western Australia.</a> <!--MARK--><!--MARK--><a href='null79087cad-8f9f-4705-9d94-c867258ea317' class='mouseoverHref'><em>Western Australian Naturalist</em></a> <strong>14</strong>: 236-237<!--MARK-->","","Article in Journal","08d2a4bc-89bf-469d-9314-b4ff3d7913b0","20081009T05:11:37.000+0000","79087cad-8f9f-4705-9d94-c867258ea317"
"Reddell, J.R. & Cokendolpher, J.C.","1995","Catalogue, bibliography, and generic revision of the order Schizomida (Arachnida)","1-170","","Texas Memorial Museum, Speleological Monographs","","","","<!--MARK--><a href='null185c109b-fde9-4568-b5be-98b4b6796d80' class='mouseoverHref'>Reddell, J.R. & Cokendolpher, J.C. 1995. Catalogue, bibliography, and generic revision of the order Schizomida (Arachnida).</a> <!--MARK--><!--MARK--><a href='null45d329d9-c7b7-4e94-97bf-5ab060c748b6' class='mouseoverHref'><em>Texas Memorial Museum, Speleological Monographs</em></a> <strong>4</strong>: 1-170<!--MARK-->","","Article in Journal","185c109b-fde9-4568-b5be-98b4b6796d80","20081009T05:11:37.000+0000","45d329d9-c7b7-4e94-97bf-5ab060c748b6"
"Schultz, J.W.","1989","Morphology of locomotor appendages in Arachnida: evolutionary trends and phylogenetic implications","1-56","","Journal of the Linnean Society of London, Zoology","","","","<!--MARK--><a href='null6c8b891a-b290-4acc-ae56-c936c6a3f25b' class='mouseoverHref'>Schultz, J.W. 1989. Morphology of locomotor appendages in Arachnida: evolutionary trends and phylogenetic implications.</a> <!--MARK--><!--MARK--><a href='null9da0901d-c795-4d2c-b9ad-d6a85cdf1cce' class='mouseoverHref'><em>Journal of the Linnean Society of London, Zoology</em></a> <strong>97</strong>: 1-56<!--MARK-->","","Article in Journal","6c8b891a-b290-4acc-ae56-c936c6a3f25b","20081009T05:11:37.000+0000","9da0901d-c795-4d2c-b9ad-d6a85cdf1cce"
"Shultz, J.W.","1990","Evolutionary morphology and phylogeny of Arachnida","1-38","","Cladistics","","","","<!--MARK--><a href='null50a1db9d-2e00-45fc-a263-2c18bebee072' class='mouseoverHref'>Shultz, J.W. 1990. Evolutionary morphology and phylogeny of Arachnida.</a> <!--MARK--><!--MARK--><a href='null5fce340d-5163-4796-a5f1-192ae181af59' class='mouseoverHref'><em>Cladistics</em></a> <strong>6</strong>: 1-38<!--MARK-->","","Article in Journal","50a1db9d-2e00-45fc-a263-2c18bebee072","20081009T05:11:37.000+0000","5fce340d-5163-4796-a5f1-192ae181af59"
"Weygoldt, P. & Paulus, H.F.","1979","Untersuchungen zur Morphologie, Taxonomie und Phylogenie der Chelicerata. II. Cladogramme und die Entfaltung der Chelicerata","177-200","","Zeitschrift für Zoologische Systematik und Evolutionsforschung","","","","<!--MARK--><a href='nulla314bb7f-3ef1-41b3-970d-dfed25da40a1' class='mouseoverHref'>Weygoldt, P. & Paulus, H.F. 1979. Untersuchungen zur Morphologie, Taxonomie und Phylogenie der Chelicerata. II. Cladogramme und die Entfaltung der Chelicerata.</a> <!--MARK--><!--MARK--><a href='null4404168d-6c2e-4136-a2c9-5008c98d98b7' class='mouseoverHref'><em>Zeitschrift für Zoologische Systematik und Evolutionsforschung</em></a> <strong>17</strong>: 177-200<!--MARK-->","","Article in Journal","a314bb7f-3ef1-41b3-970d-dfed25da40a1","20081009T05:11:37.000+0000","4404168d-6c2e-4136-a2c9-5008c98d98b7"
"Woodward, T.E.","1963","Family Schizomidae in Australia","16","","Journal of the Entomological Society of Queensland","","","","<!--MARK--><a href='null8c2d3fed-2aeb-43f5-974b-740a731f86a1' class='mouseoverHref'>Woodward, T.E. 1963. Family Schizomidae in Australia.</a> <!--MARK--><!--MARK--><a href='nulld74a2165-1b16-4c07-94ca-5ccab50e6a86' class='mouseoverHref'><em>Journal of the Entomological Society of Queensland</em></a> <strong>2</strong>: 16<!--MARK-->","","Article in Journal","8c2d3fed-2aeb-43f5-974b-740a731f86a1","20081009T05:11:37.000+0000","d74a2165-1b16-4c07-94ca-5ccab50e6a86"
