"PUB_AUTHOR","PUB_YEAR","PUB_TITLE","PUB_PAGES","PUB_PARENT_BOOK_TITLE","PUB_PARENT_JOURNAL_TITLE","PUB_PARENT_ARTICLE_TITLE","PUB_PUBLICATION_DATE","PUB_PUBLISHER","PUB_FORMATTED","PUB_QUALIFICATION","PUB_TYPE","PUBLICATION_GUID","PUBLICATION_LAST_UPDATE","PARENT_PUBLICATION_GUID"
"Aurivillius, C.","1893","Verzeichniss der von den Herren C. Lumholtz und C. Fristedt im nördlichen Queensland gesammelten Cerambyciden","153-169","","Entomologisk Tidskrift","","","","<!--MARK--><a href='null54b138dc-8583-46fb-8001-a2cfce015449' class='mouseoverHref'>Aurivillius, C. 1893. Verzeichniss der von den Herren C. Lumholtz und C. Fristedt im nördlichen Queensland gesammelten Cerambyciden.</a> <!--MARK--><!--MARK--><a href='nullba33b082-f69d-4d6a-a319-837886ef96ce' class='mouseoverHref'><em>Entomologisk Tidskrift</em></a> <strong>1893</strong>: 153-169<!--MARK-->","","Article in Journal","54b138dc-8583-46fb-8001-a2cfce015449","20100802T01:41:01.240+0000","ba33b082-f69d-4d6a-a319-837886ef96ce"
"Aurivillius, C.","1917","Results of Dr E, Mjöberg's Swedish scientific expeditions to Australia 1910-1913. 12, Cerambycidae","1-50 pls 1-3","","Arkiv för Zoologi","","30 Jan. 1917","","<!--MARK--><a href='null29b57106-bb6c-4ffc-a987-6153b3fa351b' class='mouseoverHref'>Aurivillius, C. 1917. Results of Dr E, Mjöberg's Swedish scientific expeditions to Australia 1910-1913. 12, Cerambycidae.</a> <!--MARK--><!--MARK--><a href='nullea0f28cc-317a-4542-aaf0-5fa8122b7a93' class='mouseoverHref'><em>Arkiv för Zoologi</em></a> <strong>10</strong>(23): 1-50 pls 1-3<!--MARK--> [Date published 30 Jan. 1917]","","Article in Journal","29b57106-bb6c-4ffc-a987-6153b3fa351b","20120112T02:01:02.641+0000","ea0f28cc-317a-4542-aaf0-5fa8122b7a93"
"Blackburn, T.","1889","Further notes on Australian Coleoptera, with descriptions of new genera and species","1387-1506","","Proceedings of the Linnean Society of New South Wales","","22 March 1889","","<!--MARK--><a href='nulld4f8fef7-2826-4cc1-b828-320074ab3eb4' class='mouseoverHref'>Blackburn, T. 1889. Further notes on Australian Coleoptera, with descriptions of new genera and species.</a> <!--MARK--><!--MARK--><a href='nullc12cd779-adb5-41ea-bd2c-75f6864cf22e' class='mouseoverHref'><em>Proceedings of the Linnean Society of New South Wales</em></a> 2 <strong>3</strong>: 1387-1506<!--MARK--> [Date published 22 March 1889]","","Article in Journal","d4f8fef7-2826-4cc1-b828-320074ab3eb4","20111129T00:40:57.802+0000","c12cd779-adb5-41ea-bd2c-75f6864cf22e"
"Blackburn, T.","1890","Further notes on Australian Coleoptera, with descriptions of new genera and species. Part VIII","121-160","","Transactions of the Royal Society of South Australia","","","","<!--MARK--><a href='nullc8b0ad14-53d1-441a-a2c6-9d815ac39fba' class='mouseoverHref'>Blackburn, T. 1890. Further notes on Australian Coleoptera, with descriptions of new genera and species. Part VIII.</a> <!--MARK--><!--MARK--><a href='null8b48b0a3-dd7a-4aea-be0d-10a223710ebc' class='mouseoverHref'><em>Transactions of the Royal Society of South Australia</em></a> <strong>13</strong>: 121-160<!--MARK-->","","Article in Journal","c8b0ad14-53d1-441a-a2c6-9d815ac39fba","20081009T05:11:37.000+0000","8b48b0a3-dd7a-4aea-be0d-10a223710ebc"
"Blackburn, T.","1891","Notes on Australian Coleoptera, with descriptions of new species. Part IX","775-790","","Proceedings of the Linnean Society of New South Wales","","","","<!--MARK--><a href='nullda3dafe3-b36d-461a-b17c-587281083442' class='mouseoverHref'>Blackburn, T. 1891. Notes on Australian Coleoptera, with descriptions of new species. Part IX.</a> <!--MARK--><!--MARK--><a href='nullc12cd779-adb5-41ea-bd2c-75f6864cf22e' class='mouseoverHref'><em>Proceedings of the Linnean Society of New South Wales</em></a> 2 <strong>5</strong>: 775-790<!--MARK-->","","Article in Journal","da3dafe3-b36d-461a-b17c-587281083442","20081009T05:11:37.000+0000","c12cd779-adb5-41ea-bd2c-75f6864cf22e"
"Blackburn, T.","1892","Further notes on Australian Coleoptera with descriptions of new genera and species. Part XI","20-73","","Transactions of the Royal Society of South Australia","","July 1892","","<!--MARK--><a href='null9d396cf6-3248-4caf-9f5c-114c43249402' class='mouseoverHref'>Blackburn, T. 1892. Further notes on Australian Coleoptera with descriptions of new genera and species. Part XI.</a> <!--MARK--><!--MARK--><a href='null8b48b0a3-dd7a-4aea-be0d-10a223710ebc' class='mouseoverHref'><em>Transactions of the Royal Society of South Australia</em></a> <strong>15</strong>(1): 20-73<!--MARK--> [Date published July 1892]","","Article in Journal","9d396cf6-3248-4caf-9f5c-114c43249402","20111219T20:58:00.395+0000","8b48b0a3-dd7a-4aea-be0d-10a223710ebc"
"Blackburn, T.","1896","Further notes on Australian Coleoptera, with descriptions of new genera and species. Part XIX","35-109","","Transactions of the Royal Society of South Australia","","Sept. 30, 1896","","<!--MARK--><a href='null591c8d9c-b255-4c0b-ba45-6abd5b6440c6' class='mouseoverHref'>Blackburn, T. 1896. Further notes on Australian Coleoptera, with descriptions of new genera and species. Part XIX.</a> <!--MARK--><!--MARK--><a href='null8b48b0a3-dd7a-4aea-be0d-10a223710ebc' class='mouseoverHref'><em>Transactions of the Royal Society of South Australia</em></a> <strong>20</strong>: 35-109<!--MARK--> [Date published Sept. 30, 1896]","","Article in Journal","591c8d9c-b255-4c0b-ba45-6abd5b6440c6","20081009T05:11:37.000+0000","8b48b0a3-dd7a-4aea-be0d-10a223710ebc"
"Blackburn, T.","1896","Further notes on Australian Coleoptera, with descriptions of new genera and species. Part XX","233-259","","Transactions of the Royal Society of South Australia","","","","<!--MARK--><a href='null3e2028f7-617c-4af4-9fbe-a60a13f375b9' class='mouseoverHref'>Blackburn, T. 1896. Further notes on Australian Coleoptera, with descriptions of new genera and species. Part XX.</a> <!--MARK--><!--MARK--><a href='null8b48b0a3-dd7a-4aea-be0d-10a223710ebc' class='mouseoverHref'><em>Transactions of the Royal Society of South Australia</em></a> <strong>20</strong>: 233-259<!--MARK-->","","Article in Journal","3e2028f7-617c-4af4-9fbe-a60a13f375b9","20081009T05:11:37.000+0000","8b48b0a3-dd7a-4aea-be0d-10a223710ebc"
"Blackburn, T.","1901","Further notes on Australian Coleoptera with descriptions of new genera and species. Part XXVIII","15-44","","Transactions of the Royal Society of South Australia","","","","<!--MARK--><a href='null30630269-6c87-44af-9a43-f32e002f4e97' class='mouseoverHref'>Blackburn, T. 1901. Further notes on Australian Coleoptera with descriptions of new genera and species. Part XXVIII.</a> <!--MARK--><!--MARK--><a href='null8b48b0a3-dd7a-4aea-be0d-10a223710ebc' class='mouseoverHref'><em>Transactions of the Royal Society of South Australia</em></a> <strong>25</strong>: 15-44<!--MARK-->","","Article in Journal","30630269-6c87-44af-9a43-f32e002f4e97","","8b48b0a3-dd7a-4aea-be0d-10a223710ebc"
"Elliott, H.J. & McDonald, F.J.D.","1972","A revision of <i>Strongylurus</i> Hope (Coleoptera: Cerambycidae: Cerambycinae) including a description of the male genitalia","1-20","","Australian Journal of Zoology Supplementary Series","","28 Mar. 1972","","<!--MARK--><a href='null95477c86-e58c-4d8d-80bd-4495f282e4ee' class='mouseoverHref'>Elliott, H.J. & McDonald, F.J.D. 1972. A revision of <i>Strongylurus</i> Hope (Coleoptera: Cerambycidae: Cerambycinae) including a description of the male genitalia.</a> <!--MARK--><!--MARK--><a href='null0cf8bdc8-2852-42c3-824a-7d9a708d9672' class='mouseoverHref'><em>Australian Journal of Zoology Supplementary Series</em></a> <strong>11</strong>: 1-20<!--MARK--> [Date published 28 Mar. 1972]","","Article in Journal","95477c86-e58c-4d8d-80bd-4495f282e4ee","20120112T05:03:46.967+0000","0cf8bdc8-2852-42c3-824a-7d9a708d9672"
"Hope, F.W.","1834","Characters and descriptions of several new genera and species of coleopterous insects","91-112,  pls xiii-xvi","","Transactions of the Zoological Society of London","","23-25 April 1834","","<!--MARK--><a href='null20929e10-6e52-47e0-89b4-63c2834cbcd4' class='mouseoverHref'>Hope, F.W. 1834. Characters and descriptions of several new genera and species of coleopterous insects.</a> <!--MARK--><!--MARK--><a href='nulla7ae5a31-952c-4c34-b35a-2f3e0ad65828' class='mouseoverHref'><em>Transactions of the Zoological Society of London</em></a> <strong>1</strong>(2): 91-112,  pls xiii-xvi<!--MARK--> [Date published 23-25 April 1834]","","Article in Journal","20929e10-6e52-47e0-89b4-63c2834cbcd4","20120515T22:01:27.258+0000","a7ae5a31-952c-4c34-b35a-2f3e0ad65828"
"Kaup, J.J.","1866","Einige Cerambyciden der grossherzoglichen Sammlung zu Darmstadt","8 pp., 3 pl.","","","","","","<!--MARK--><a href='nullfe9476c9-997b-4161-b38d-b4b24d8155ee' class='mouseoverHref'>Kaup, J.J. 1866. <em>Einige Cerambyciden der grossherzoglichen Sammlung zu Darmstadt</em>. 8 pp., 3 pl.</a><!--MARK-->","","Book","fe9476c9-997b-4161-b38d-b4b24d8155ee","20110118T01:53:11.221+0000",""
"Lea, A.M.","1918","On Australian Coleoptera. Part I","83-104","","Records of the South Australian Museum (Adelaide)","","","","<!--MARK--><a href='null210674b8-10e8-4a93-a203-957153442bc2' class='mouseoverHref'>Lea, A.M. 1918. On Australian Coleoptera. Part I.</a> <!--MARK--><!--MARK--><a href='nullf7f76869-b0b8-4c0e-a1bc-1d8c43cc0f89' class='mouseoverHref'><em>Records of the South Australian Museum (Adelaide)</em></a> <strong>1</strong>: 83-104<!--MARK-->","","Article in Journal","210674b8-10e8-4a93-a203-957153442bc2","20081009T05:11:37.000+0000","f7f76869-b0b8-4c0e-a1bc-1d8c43cc0f89"
"McKeown, K.C.","1940","Notes on Australian Cerambycidae V","293-312, pls XXXI, XXXII","","Records of the Australian Museum","","15 Mar. 1940","","<!--MARK--><a href='null7363396e-e991-4fb6-a72e-21ff8d0185e0' class='mouseoverHref'>McKeown, K.C. 1940. Notes on Australian Cerambycidae V.</a> <!--MARK--><!--MARK--><a href='null7c07530b-0b38-44f5-8f95-368da97d6ac2' class='mouseoverHref'><em>Records of the Australian Museum</em></a> <strong>20</strong>(5): 293-312, pls XXXI, XXXII<!--MARK--> [Date published 15 Mar. 1940]","","Article in Journal","7363396e-e991-4fb6-a72e-21ff8d0185e0","20120111T21:23:15.239+0000","7c07530b-0b38-44f5-8f95-368da97d6ac2"
"McKeown, K.C.","1942","Australian Cerambycidae VI. Descriptions of new species mostly from Queensland","81-105","","Records of the Australian Museum","","8 Jul. 1942","","<!--MARK--><a href='nulld48acc4e-add5-4caa-aa9f-4ce47c32cc3a' class='mouseoverHref'>McKeown, K.C. 1942. Australian Cerambycidae VI. Descriptions of new species mostly from Queensland.</a> <!--MARK--><!--MARK--><a href='null7c07530b-0b38-44f5-8f95-368da97d6ac2' class='mouseoverHref'><em>Records of the Australian Museum</em></a> <strong>21</strong>(2): 81-105<!--MARK--> [Date published 8 Jul. 1942]","","Article in Journal","d48acc4e-add5-4caa-aa9f-4ce47c32cc3a","20120112T03:02:17.848+0000","7c07530b-0b38-44f5-8f95-368da97d6ac2"
"McKeown, K.C.","1945","Notes on Australian Cerambycidae VII","286-292","","Records of the Australian Museum","","25 Jun. 1945","","<!--MARK--><a href='null21a4c33d-eec9-4b11-89d0-cd37a2266910' class='mouseoverHref'>McKeown, K.C. 1945. Notes on Australian Cerambycidae VII.</a> <!--MARK--><!--MARK--><a href='null7c07530b-0b38-44f5-8f95-368da97d6ac2' class='mouseoverHref'><em>Records of the Australian Museum</em></a> <strong>21</strong>(6): 286-292<!--MARK--> [Date published 25 Jun. 1945]","","Article in Journal","21a4c33d-eec9-4b11-89d0-cd37a2266910","20121107T02:18:38.054+0000","7c07530b-0b38-44f5-8f95-368da97d6ac2"
"McKeown, K.C.","1947","Catalogue of the Cerambycidae (Coleoptera) of Australia","1-190","","Memoirs of the Australian Museum","","","","<!--MARK--><a href='null443a56bb-fa23-4fdb-b500-59295d698a7d' class='mouseoverHref'>McKeown, K.C. 1947. Catalogue of the Cerambycidae (Coleoptera) of Australia.</a> <!--MARK--><!--MARK--><a href='null272826c2-c2bf-425b-bd6f-11ddaf2aaeaa' class='mouseoverHref'><em>Memoirs of the Australian Museum</em></a> <strong>10</strong>: 1-190<!--MARK-->","","Article in Journal","443a56bb-fa23-4fdb-b500-59295d698a7d","","272826c2-c2bf-425b-bd6f-11ddaf2aaeaa"
"Newman, E.","1840","Entomological notes (continued)","1-16","","The Entomologist","","Nov. 1840","","<!--MARK--><a href='null66af3235-2072-4bd5-bd4f-eb3b3b827e06' class='mouseoverHref'>Newman, E. 1840. Entomological notes (continued).</a> <!--MARK--><!--MARK--><a href='nullf3b5bc68-9fcf-42d6-b01d-f490d96af7e9' class='mouseoverHref'><em>The Entomologist</em></a> <strong>1</strong>(1): 1-16<!--MARK--> [Date published Nov. 1840]","","Article in Journal","66af3235-2072-4bd5-bd4f-eb3b3b827e06","","f3b5bc68-9fcf-42d6-b01d-f490d96af7e9"
"Newman, E.","1840","Nonnullorum Cerambycitum novorum, Novam Hollandiam et Insulam Van Diemen habitantium characteres","14-21","","Annals of Natural History","","Mar. 1840","","<!--MARK--><a href='null912c75f2-d7d6-47e8-ac77-4c05a8f913c6' class='mouseoverHref'>Newman, E. 1840. Nonnullorum Cerambycitum novorum, Novam Hollandiam et Insulam Van Diemen habitantium characteres.</a> <!--MARK--><!--MARK--><a href='null49064907-7f69-404b-b6d0-6e1a9be97dbb' class='mouseoverHref'><em>Annals of Natural History</em></a> 1 <strong>5</strong>: 14-21<!--MARK--> [Date published Mar. 1840]","","Article in Journal","912c75f2-d7d6-47e8-ac77-4c05a8f913c6","20120111T21:22:26.391+0000","49064907-7f69-404b-b6d0-6e1a9be97dbb"
"Newman, E.","1842","List of longicorns collected at Port Phillip, South Australia, by Edmund Higgins, Esq","351-354","","The Entomologist","","Aug. 1842","","<!--MARK--><a href='null4d33b6bd-36cd-426b-a85d-63c8b7e9b1af' class='mouseoverHref'>Newman, E. 1842. List of longicorns collected at Port Phillip, South Australia, by Edmund Higgins, Esq.</a> <!--MARK--><!--MARK--><a href='nullf3b5bc68-9fcf-42d6-b01d-f490d96af7e9' class='mouseoverHref'><em>The Entomologist</em></a> <strong>1</strong>(22): 351-354<!--MARK--> [Date published Aug. 1842]","","Article in Journal","4d33b6bd-36cd-426b-a85d-63c8b7e9b1af","20120111T22:03:53.944+0000","f3b5bc68-9fcf-42d6-b01d-f490d96af7e9"
"Newman, E.","1851","Descriptions of new insects from New Holland","appendix cxxviii-cxxxii","","The Zoologist","","","","<!--MARK--><a href='nullfc03813e-4019-4caf-8817-746525211280' class='mouseoverHref'>Newman, E. 1851. Descriptions of new insects from New Holland.</a> <!--MARK--><!--MARK--><a href='null8e1a36ca-3e07-4349-a03e-0b086b2588b3' class='mouseoverHref'><em>The Zoologist</em></a> <strong>9</strong>: appendix cxxviii-cxxxii<!--MARK-->","","Article in Journal","fc03813e-4019-4caf-8817-746525211280","","8e1a36ca-3e07-4349-a03e-0b086b2588b3"
"Pascoe, F.P.","1857","On new genera and species of longicorn Coleoptera. Part II","89-112","","Transactions of the Entomological Society of London","","Apr. 1857","","<!--MARK--><a href='null80197d93-b925-4e62-bc5c-9a51666ede8f' class='mouseoverHref'>Pascoe, F.P. 1857. On new genera and species of longicorn Coleoptera. Part II.</a> <!--MARK--><!--MARK--><a href='null5cf355b3-abc5-451e-9abc-ed3282d7811a' class='mouseoverHref'><em>Transactions of the Entomological Society of London</em></a> n.s. <strong>4</strong>(3): 89-112<!--MARK--> [Date published Apr. 1857]","","Article in Journal","80197d93-b925-4e62-bc5c-9a51666ede8f","20150128T22:20:02.021+0000","5cf355b3-abc5-451e-9abc-ed3282d7811a"
"Pascoe, F.P.","1859","On new genera and species of longicorn Coleoptera. Part IV","12-16","","Transactions of the Entomological Society of London","","May 1859","","<!--MARK--><a href='nulla99e0f70-79cc-4991-a9a7-25e8a0fd9032' class='mouseoverHref'>Pascoe, F.P. 1859. On new genera and species of longicorn Coleoptera. Part IV.</a> <!--MARK--><!--MARK--><a href='null5cf355b3-abc5-451e-9abc-ed3282d7811a' class='mouseoverHref'><em>Transactions of the Entomological Society of London</em></a> n.s. <strong>5</strong>(1): 12-16<!--MARK--> [Date published May 1859: <B>5</B> (1): 17-32 [Feb. 1859]; <B>5 </B>(2): 33-61 pl. ii]","<B>5</B> (1): 17-32 [Feb. 1859]; <B>5 </B>(2): 33-61 pl. ii","Article in Journal","a99e0f70-79cc-4991-a9a7-25e8a0fd9032","20120111T21:50:31.191+0000","5cf355b3-abc5-451e-9abc-ed3282d7811a"
"Pascoe, F.P.","1863","Notes on the Australian longicornia, with descriptions of sixty new species","526-570 pls xxii, xxiii","","Transactions of the Entomological Society of London","","Oct. 1863","","<!--MARK--><a href='null1d4b509a-3fe0-48a3-be16-9b67b20fd1d1' class='mouseoverHref'>Pascoe, F.P. 1863. Notes on the Australian longicornia, with descriptions of sixty new species.</a> <!--MARK--><!--MARK--><a href='null5cf355b3-abc5-451e-9abc-ed3282d7811a' class='mouseoverHref'><em>Transactions of the Entomological Society of London</em></a> 3 <strong>1</strong>(7): 526-570 pls xxii, xxiii<!--MARK--> [Date published Oct. 1863]","","Article in Journal","1d4b509a-3fe0-48a3-be16-9b67b20fd1d1","20120111T21:43:35.515+0000","5cf355b3-abc5-451e-9abc-ed3282d7811a"
"Pascoe, F.P.","1864","Descriptions of some new Australian longicornia","223-245 pl. xi","","Journal of Entomology","","Jun. 1864","","<!--MARK--><a href='nulle855ebb8-2501-4503-bc3b-e07777e37cef' class='mouseoverHref'>Pascoe, F.P. 1864. Descriptions of some new Australian longicornia.</a> <!--MARK--><!--MARK--><a href='null594ca738-5ec4-4752-84d7-686b8074e352' class='mouseoverHref'><em>Journal of Entomology</em></a> <strong>2</strong>(10): 223-245 pl. xi<!--MARK--> [Date published Jun. 1864]","","Article in Journal","e855ebb8-2501-4503-bc3b-e07777e37cef","20120111T21:42:12.489+0000","594ca738-5ec4-4752-84d7-686b8074e352"
"Pascoe, F.P.","1865","A second series of descriptions of new Australian longicornia","352-374 pl. xvi","","Journal of Entomology","","Mar. 1865","","<!--MARK--><a href='nulla505bf2a-8876-4d35-9ba9-6eaa00622230' class='mouseoverHref'>Pascoe, F.P. 1865. A second series of descriptions of new Australian longicornia.</a> <!--MARK--><!--MARK--><a href='null594ca738-5ec4-4752-84d7-686b8074e352' class='mouseoverHref'><em>Journal of Entomology</em></a> <strong>2</strong>(12): 352-374 pl. xvi<!--MARK--> [Date published Mar. 1865]","","Article in Journal","a505bf2a-8876-4d35-9ba9-6eaa00622230","20120111T21:41:21.846+0000","594ca738-5ec4-4752-84d7-686b8074e352"
"Pascoe, F.P.","1866","Catalogue of longicorn Coleoptera collected in the Island of Penang by James Lamb, Esq","504-536","","Proceedings of the Zoological Society of London","","Aug. 1865","","<!--MARK--><a href='nulla27fa4f7-1c3a-4838-a835-99a6fed3758a' class='mouseoverHref'>Pascoe, F.P. 1866. Catalogue of longicorn Coleoptera collected in the Island of Penang by James Lamb, Esq.</a> <!--MARK--><!--MARK--><a href='null511f299d-99ec-413c-bc4c-04a380829c96' class='mouseoverHref'><em>Proceedings of the Zoological Society of London</em></a> <strong>1866</strong>: 504-536<!--MARK--> [Date published Aug. 1865]","","Article in Journal","a27fa4f7-1c3a-4838-a835-99a6fed3758a","20120111T21:40:47.125+0000","511f299d-99ec-413c-bc4c-04a380829c96"
"Pascoe, F.P.","1866","On the longicornia of Australia, with a list of all the described species","80-112","","Journal of the Linnean Society of London, Zoology","","11 Oct. 1866","","<!--MARK--><a href='null2ec70d1c-fb32-4b9e-8128-45e02847e454' class='mouseoverHref'>Pascoe, F.P. 1866. On the longicornia of Australia, with a list of all the described species.</a> <!--MARK--><!--MARK--><a href='null9da0901d-c795-4d2c-b9ad-d6a85cdf1cce' class='mouseoverHref'><em>Journal of the Linnean Society of London, Zoology</em></a> <strong>9</strong>: 80-112<!--MARK--> [Date published 11 Oct. 1866]","","Article in Journal","2ec70d1c-fb32-4b9e-8128-45e02847e454","20120111T21:38:27.579+0000","9da0901d-c795-4d2c-b9ad-d6a85cdf1cce"
"Pascoe, F.P.","1867","Characters of some new genera of the coleopterous family Cerambycidae","307-319","","Annals and Magazine of Natural History","","May 1867","","<!--MARK--><a href='null13445429-5114-4e4c-883e-12134f3f8272' class='mouseoverHref'>Pascoe, F.P. 1867. Characters of some new genera of the coleopterous family Cerambycidae.</a> <!--MARK--><!--MARK--><a href='nullefa8de69-3a29-4a43-8ef2-cbefda205976' class='mouseoverHref'><em>Annals and Magazine of Natural History</em></a> 3 <strong>19</strong>(113): 307-319<!--MARK--> [Date published May 1867]","","Article in Journal","13445429-5114-4e4c-883e-12134f3f8272","20120111T21:36:58.754+0000","efa8de69-3a29-4a43-8ef2-cbefda205976"
"Pascoe, F.P.","1867","Supplement to the list of Australian longicornia","300-308","","Journal of the Linnean Society of London, Zoology","","14 Nov. 1867","","<!--MARK--><a href='null7c7602b6-1800-41ec-a967-4629bcd56978' class='mouseoverHref'>Pascoe, F.P. 1867. Supplement to the list of Australian longicornia.</a> <!--MARK--><!--MARK--><a href='null9da0901d-c795-4d2c-b9ad-d6a85cdf1cce' class='mouseoverHref'><em>Journal of the Linnean Society of London, Zoology</em></a> <strong>9</strong>: 300-308<!--MARK--> [Date published 14 Nov. 1867]","","Article in Journal","7c7602b6-1800-41ec-a967-4629bcd56978","20120111T21:36:13.753+0000","9da0901d-c795-4d2c-b9ad-d6a85cdf1cce"
"Pascoe, F.P.","1869","Longicornia Malayana (continued)","497-552","","Transactions of the Entomological Society of London","","Jan. 1869","","<!--MARK--><a href='null68ccdeeb-ec67-4394-b587-7071a1383f95' class='mouseoverHref'>Pascoe, F.P. 1869. Longicornia Malayana (continued).</a> <!--MARK--><!--MARK--><a href='null5cf355b3-abc5-451e-9abc-ed3282d7811a' class='mouseoverHref'><em>Transactions of the Entomological Society of London</em></a> 3 <strong>3</strong>(6): 497-552<!--MARK--> [Date published Jan. 1869]","","Article in Journal","68ccdeeb-ec67-4394-b587-7071a1383f95","20120111T21:32:43.472+0000","5cf355b3-abc5-451e-9abc-ed3282d7811a"
"Pascoe, F.P.","1875","Notes on Coleoptera, with descriptions of new genera and species.--Part III","59-73, pl.viii","","Annals and Magazine of Natural History","","Jan. 1875","","<!--MARK--><a href='null6d67c479-1243-425e-9f87-82da60ad3d36' class='mouseoverHref'>Pascoe, F.P. 1875. Notes on Coleoptera, with descriptions of new genera and species.--Part III.</a> <!--MARK--><!--MARK--><a href='nullefa8de69-3a29-4a43-8ef2-cbefda205976' class='mouseoverHref'><em>Annals and Magazine of Natural History</em></a> 4 <strong>15</strong>(85): 59-73, pl.viii<!--MARK--> [Date published Jan. 1875]","","Article in Journal","6d67c479-1243-425e-9f87-82da60ad3d36","20120111T21:29:17.649+0000","efa8de69-3a29-4a43-8ef2-cbefda205976"
"?lipi?ski, A. & Escalona, H.","2016","Australian Longhorn Beetles (Coleoptera: Cerambycidae), Volume 2, Subfamily Cerambycinae","640 pp.","","","","","CSIRO Publishing","<!--MARK--><a href='null036ed928-8a2e-44dc-a15b-df5d0d7e5b6b' class='mouseoverHref'>?lipi?ski, A. & Escalona, H. 2016. <em>Australian Longhorn Beetles (Coleoptera: Cerambycidae), Volume 2, Subfamily Cerambycinae</em>. Melbourne, Australia : CSIRO Publishing 640 pp.</a><!--MARK-->","","Book","036ed928-8a2e-44dc-a15b-df5d0d7e5b6b","20170706T04:24:15.628+0000",""
"White, A.","1858","Descriptions of some apparently unrecorded species of longicorn beetles, belonging to the genera <i>Phrissoma</i>, <i>Nyphona</i>, etc.","264-276","","Annals and Magazine of Natural History","","","","<!--MARK--><a href='null03571383-ec3b-4f53-bd88-8b8b8e3df971' class='mouseoverHref'>White, A. 1858. Descriptions of some apparently unrecorded species of longicorn beetles, belonging to the genera <i>Phrissoma</i>, <i>Nyphona</i>, etc.</a> <!--MARK--><!--MARK--><a href='nullefa8de69-3a29-4a43-8ef2-cbefda205976' class='mouseoverHref'><em>Annals and Magazine of Natural History</em></a> 3 <strong>2</strong>(10): 264-276<!--MARK--> [Oct. 1858]","Oct. 1858","Article in Journal","03571383-ec3b-4f53-bd88-8b8b8e3df971","20120110T23:54:22.374+0000","efa8de69-3a29-4a43-8ef2-cbefda205976"
