"PUB_AUTHOR","PUB_YEAR","PUB_TITLE","PUB_PAGES","PUB_PARENT_BOOK_TITLE","PUB_PARENT_JOURNAL_TITLE","PUB_PARENT_ARTICLE_TITLE","PUB_PUBLICATION_DATE","PUB_PUBLISHER","PUB_FORMATTED","PUB_QUALIFICATION","PUB_TYPE","PUBLICATION_GUID","PUBLICATION_LAST_UPDATE","PARENT_PUBLICATION_GUID"
"Hartmann-Schröder, G.","1987","Teil 13. Die Polychaeten der antiborealen Küste von Victoria (Australien) (zwischen Warrnambool im Westen und Port Welshpool im Osten)","27-66","","","","","","<!--MARK--><a href='nullc2c7f25e-497b-4eed-ad71-e9efa95a8417' class='mouseoverHref'>Hartmann-Schröder, G. 1987. Teil 13. Die Polychaeten der antiborealen Küste von Victoria (Australien) (zwischen Warrnambool im Westen und Port Welshpool im Osten). <I>In</I> Hartmann-Schröder, G. & Hartmann, G. Zur Kenntnis des Eulitorals der australischen Küsten unter besonderer Berücksichtigung der Polychaeta.<I> Mitteilungen aus dem Hamburgischen Zoologischen Museum und Institut</I>. 27-66 pp.</a>","","Miscellaneous","c2c7f25e-497b-4eed-ad71-e9efa95a8417","20081009T05:11:37.000+0000",""
"Hartmann-Schröder, G.","1989","Teil 14. Die Polychaeten der antiborealen und subtropisch-tropischen Küste Südost-Australiens zwischen Lakes Entrance (Victoria) im Süden und Maclean (New South Wales) im Norden","11-63","","","","","","<!--MARK--><a href='nullcc7fb6e2-ce34-4afd-9bc4-7979e32d1946' class='mouseoverHref'>Hartmann-Schröder, G. 1989. Teil 14. Die Polychaeten der antiborealen und subtropisch-tropischen Küste Südost-Australiens zwischen Lakes Entrance (Victoria) im Süden und Maclean (New South Wales) im Norden. <I>In</I> Hartmann-Schröder, G. & Hartmann, G. Zur Kenntnis des Eulitorals der australischen Küsten unter besonderer Berücksichtigung der Polychaeta.<I> Mitteilungen aus dem Hamburgischen Zoologischen Museum und Institut</I>. 11-63 pp.</a>","","Miscellaneous","cc7fb6e2-ce34-4afd-9bc4-7979e32d1946","20081009T05:11:37.000+0000",""
"Hartmann-Schröder, G.","1990","Teil 15. Die Polychaeten der subtropisch-tropischen und tropischen Ostküste Australiens zwischen Lake Macquarie (New South Wales) im Süden und Gladstone (Queensland) im Norden","41-87","","","","","","<!--MARK--><a href='null4871cbb6-b56c-4375-9d50-d06b24e02121' class='mouseoverHref'>Hartmann-Schröder, G. 1990. Teil 15. Die Polychaeten der subtropisch-tropischen und tropischen Ostküste Australiens zwischen Lake Macquarie (New South Wales) im Süden und Gladstone (Queensland) im Norden. <I>In</I> Hartmann-Schröder, G. & Hartmann, G. Zur Kenntnis des Eulitorals der australischen Küsten unter besonderer Berücksichtigung der Polychaeta.<I> Mitteilungen aus dem Hamburgischen Zoologischen Museum und Institut</I>. 41-87 pp.</a>","","Miscellaneous","4871cbb6-b56c-4375-9d50-d06b24e02121","20081009T05:11:37.000+0000",""
"Hartmann-Schröder, G.","1991","Teil 16. Die Polychaeten der subtropisch-tropischen bis tropischen Ostküste Australiens zwischen Maclean (New South Wales) und Gladstone (Queensland) sowie von Heron Island (Groß Barriere-Riff)","17-71","","","","","","<!--MARK--><a href='nulla4038eea-1b22-4721-a196-7549221f26bd' class='mouseoverHref'>Hartmann-Schröder, G. 1991. Teil 16. Die Polychaeten der subtropisch-tropischen bis tropischen Ostküste Australiens zwischen Maclean (New South Wales) und Gladstone (Queensland) sowie von Heron Island (Groß Barriere-Riff). <I>In</I> Hartmann-Schröder, G. & Hartmann, G. Zur Kenntnis des Eulitorals der australischen Küsten unter besonderer Berücksichtigung der Polychaeta.<I> Mitteilungen aus dem Hamburgischen Zoologischen Museum und Institut</I>. 17-71 pp.</a>","","Miscellaneous","a4038eea-1b22-4721-a196-7549221f26bd","20081009T05:11:37.000+0000",""
"Hartmann-Schröder, G.","1996","Annelida, Borstenwûrmer, Polychaeta.","1-648","","Die Tierwelt Deutschlands und der angrenzenden Meeresteile","","","","<!--MARK--><a href='null7d6986d4-0cd7-49c6-9b86-e8e9360f8c8e' class='mouseoverHref'>Hartmann-Schröder, G. 1996. Annelida, Borstenwûrmer, Polychaeta.</a> <!--MARK--><!--MARK--><a href='nullb1c04a35-331b-4955-8b17-fa5eb6fe7d92' class='mouseoverHref'><em>Die Tierwelt Deutschlands und der angrenzenden Meeresteile</em></a> <strong>58</strong>: 1-648<!--MARK-->","","Article in Journal","7d6986d4-0cd7-49c6-9b86-e8e9360f8c8e","20151016T05:49:01.431+0000","b1c04a35-331b-4955-8b17-fa5eb6fe7d92"
"Hartmann-Schröder G.","1979","Teil 2. Die Polychaeten der tropischen Nordwestküste Australiens (zwischen Derby im Norden und Port Hedland im Süden)","","","Mitteilungen aus dem Hamburgischen Zoologischen Museum und Institut","Zur kenntnis des Eulitorals der australischen Küsten unter besonderer Berücksichtigung der Polychaeten und Ostracoden.","","","<!--MARK--><a href='nullc2560905-787f-41ed-bc7d-a7793323f391' class='mouseoverHref'>Hartmann-Schröder G. 1979. Teil 2. Die Polychaeten der tropischen Nordwestküste Australiens (zwischen Derby im Norden und Port Hedland im Süden).</a> <!--MARK--><em>In,</em> <!--MARK--><a href='nulle0e01b57-656a-47e5-89b7-5f57bb037853' class='mouseoverHref'>Hartmann-Schröder, G. & Hartmann, G. Zur kenntnis des Eulitorals der australischen Küsten unter besonderer Berücksichtigung der Polychaeten und Ostracoden.</a> <!--MARK--><!--MARK--><a href='null171ccd89-642b-4041-beef-26bac3a726db' class='mouseoverHref'><em>Mitteilungen aus dem Hamburgischen Zoologischen Museum und Institut</em></a> <strong>76</strong>: 75-218<!--MARK-->","","Section in Article","c2560905-787f-41ed-bc7d-a7793323f391","20130709T23:40:43.109+0000","e0e01b57-656a-47e5-89b7-5f57bb037853"
"Hessle, C.","1917","Zur Kenntnis der terebellomorphen Polychaeten","39-258","","Zoologiska Bidrag Från Uppsala","","","","<!--MARK--><a href='null2dfa90c2-3ced-4d0d-a51d-a75aefb2b1f2' class='mouseoverHref'>Hessle, C. 1917. Zur Kenntnis der terebellomorphen Polychaeten.</a> <!--MARK--><!--MARK--><a href='nulla6c1d740-f01c-495f-b534-a4b100beca5a' class='mouseoverHref'><em>Zoologiska Bidrag Från Uppsala</em></a> <strong>5</strong>: 39-258<!--MARK-->","","Article in Journal","2dfa90c2-3ced-4d0d-a51d-a75aefb2b1f2","20081009T05:11:37.000+0000","a6c1d740-f01c-495f-b534-a4b100beca5a"
"Hutchings, P.","1977","Terebelliform Polychaeta of the families Ampharetidiae, Terebellidae and Trichobranchidae from Australia, chiefly from Moreton Bay, Queensland","1-38","","Records of the Australian Museum","","","","<!--MARK--><a href='nulla604ea65-4927-4cce-97bf-c435ad343bb2' class='mouseoverHref'>Hutchings, P. 1977. Terebelliform Polychaeta of the families Ampharetidiae, Terebellidae and Trichobranchidae from Australia, chiefly from Moreton Bay, Queensland.</a> <!--MARK--><!--MARK--><a href='null7c07530b-0b38-44f5-8f95-368da97d6ac2' class='mouseoverHref'><em>Records of the Australian Museum</em></a> <strong>31</strong>: 1-38<!--MARK-->","","Article in Journal","a604ea65-4927-4cce-97bf-c435ad343bb2","20081009T05:11:37.000+0000","7c07530b-0b38-44f5-8f95-368da97d6ac2"
"Hutchings, P. & Glasby, C.J.","1995","Description of the widely reported terebellid polychaetes <i>Loimia medusa</i> (Savigny) and <i>Amphitrite rubra</i> (Risso)","149-154","","Mitteilungen aus dem Hamburgischen Zoologischen Museum und Institut","","","","<!--MARK--><a href='null62fe0aa2-4fad-4451-81de-1c55750fb716' class='mouseoverHref'>Hutchings, P. & Glasby, C.J. 1995. Description of the widely reported terebellid polychaetes <i>Loimia medusa</i> (Savigny) and <i>Amphitrite rubra</i> (Risso).</a> <!--MARK--><!--MARK--><a href='null171ccd89-642b-4041-beef-26bac3a726db' class='mouseoverHref'><em>Mitteilungen aus dem Hamburgischen Zoologischen Museum und Institut</em></a> <strong>92</strong>: 149-154<!--MARK-->","","Article in Journal","62fe0aa2-4fad-4451-81de-1c55750fb716","20081009T05:11:37.000+0000","171ccd89-642b-4041-beef-26bac3a726db"
"Hutchings, P. & Rainer, S.F.","1979","The polychaete fauna of Careel Bay, Pittwater, New South Wales, Australia","745-796","","Journal of Natural History","","","","<!--MARK--><a href='null82897402-e861-45cc-98de-01fa13669e75' class='mouseoverHref'>Hutchings, P. & Rainer, S.F. 1979. The polychaete fauna of Careel Bay, Pittwater, New South Wales, Australia.</a> <!--MARK--><!--MARK--><a href='nullad79edeb-4c47-4124-a7ea-9bcbbce0efa4' class='mouseoverHref'><em>Journal of Natural History</em></a> <strong>13</strong>: 745-796<!--MARK-->","","Article in Journal","82897402-e861-45cc-98de-01fa13669e75","20081009T05:11:37.000+0000","ad79edeb-4c47-4124-a7ea-9bcbbce0efa4"
"Hutchings, P.A.","1993","New species of the family Terebellidae (Polychaeta) from Rottnest Island, Western Australia","321-330","Proceedings of the Fifth International Marine Biological Workshop: The Marine Flora and Fauna of Rottnest Island, Western Australia","","","","","<!--MARK--><a href='null5c2bb337-2570-426c-8e09-48d604f134f9' class='mouseoverHref'>Hutchings, P.A. 1993. New species of the family Terebellidae (Polychaeta) from Rottnest Island, Western Australia. pp. 321-330</a> <!--MARK--><em>in</em> <!--MARK--><a href='nullc68185b3-db2c-4994-a68a-d12505286f13' class='mouseoverHref'>Wells, F.E., Walker, D.I., Kirkman, H. & Lethbridge, R. (eds). <em>Proceedings of the Fifth International Marine Biological Workshop: The Marine Flora and Fauna of Rottnest Island, Western Australia</em>. Perth : Western Australian Museum 2 vols 634 pp.</a><!--MARK-->","","Chapter in Book","5c2bb337-2570-426c-8e09-48d604f134f9","20140202T22:57:19.022+0000","c68185b3-db2c-4994-a68a-d12505286f13"
"Hutchings, P.A.","1997","New species of the family Terebellidae (Polychaeta) from Darwin Harbour Australia","133-161","The Marine Flora and Fauna of Darwin Harbour, Northern Territory, Australia. Proceedings of the Sixth International  Marine Biology Workshop","","","","","<!--MARK--><a href='nulldc6c7575-ee6e-4e1e-a140-dbcd2fb8668e' class='mouseoverHref'>Hutchings, P.A. 1997. New species of the family Terebellidae (Polychaeta) from Darwin Harbour Australia. pp. 133-161</a> <!--MARK--><em>in</em> <!--MARK--><a href='null70752299-3f11-4a85-baa1-80f42f74ab4c' class='mouseoverHref'>Hanley, H.R., Caswell, G., Megirian, D. & Larson, H.K. (eds). <em>The Marine Flora and Fauna of Darwin Harbour, Northern Territory, Australia. Proceedings of the Sixth International  Marine Biology Workshop</em>. Darwin : Museum and Art Gallery of the Northern Territory 466 pp.</a><!--MARK-->","","Chapter in Book","dc6c7575-ee6e-4e1e-a140-dbcd2fb8668e","20081009T05:11:37.000+0000","70752299-3f11-4a85-baa1-80f42f74ab4c"
"Hutchings, P.A.","1997","The Terebellidae (F. Polychaeta) from the Wallabi Group, Houtman Abrohlos Islands, Western Australia","459-502","The Marine Fauna and Flora of the Houtman Abrolhos Islands, Western Australia","","","","","<!--MARK--><a href='null04d1bf59-8bc0-4748-8bae-736449bf5d96' class='mouseoverHref'>Hutchings, P.A. 1997. The Terebellidae (F. Polychaeta) from the Wallabi Group, Houtman Abrohlos Islands, Western Australia. pp. 459-502</a> <!--MARK--><em>in</em> <!--MARK--><a href='null14a70b59-4b06-4849-8a9b-8d696a28713a' class='mouseoverHref'>Wells, F. (ed.). <em>The Marine Fauna and Flora of the Houtman Abrolhos Islands, Western Australia</em>. Perth : Western Australian Museum.</a><!--MARK-->","","Chapter in Book","04d1bf59-8bc0-4748-8bae-736449bf5d96","20150326T00:31:04.762+0000","14a70b59-4b06-4849-8a9b-8d696a28713a"
"Hutchings, P.A.","1997","The Terebellidae (Polychaeta) of northern Australia with a key to all the described species of the region","133-161","The Marine Flora and Fauna of Darwin Harbour, Northern Territory, Australia. Proceedings of the Sixth International  Marine Biology Workshop","","","","","<!--MARK--><a href='null0a1dd86a-9a60-4afd-b8a5-901bdf7857a9' class='mouseoverHref'>Hutchings, P.A. 1997. The Terebellidae (Polychaeta) of northern Australia with a key to all the described species of the region. pp. 133-161</a> <!--MARK--><em>in</em> <!--MARK--><a href='null70752299-3f11-4a85-baa1-80f42f74ab4c' class='mouseoverHref'>Hanley, H.R., Caswell, G., Megirian, D. & Larson, H.K. (eds). <em>The Marine Flora and Fauna of Darwin Harbour, Northern Territory, Australia. Proceedings of the Sixth International  Marine Biology Workshop</em>. Darwin : Museum and Art Gallery of the Northern Territory 466 pp.</a><!--MARK-->","","Chapter in Book","0a1dd86a-9a60-4afd-b8a5-901bdf7857a9","20081009T05:11:37.000+0000","70752299-3f11-4a85-baa1-80f42f74ab4c"
"Hutchings, P.A.","2000","Family Terebellidae","226-232","Polychaetes & Allies: The Southern Synthesis. Fauna of Australia Vol. 4A Polychaeta, Myzostomida, Pogonophora, Echiura, Sipuncula","","","","","<!--MARK--><a href='nullb8575d65-1d5d-4e9d-8b78-0b4d3d1d5d41' class='mouseoverHref'>Hutchings, P.A. 2000. Family Terebellidae. pp. 226-232</a> <!--MARK--><em>in</em> <!--MARK--><a href='nulle30ce010-16f4-407e-b759-58796f08d672' class='mouseoverHref'>Beesley, P.L., Ross, G.J.B. & Glasby, C.J. (eds). <em>Polychaetes & Allies: The Southern Synthesis. Fauna of Australia Vol. 4A Polychaeta, Myzostomida, Pogonophora, Echiura, Sipuncula</em>. Melbourne : CSIRO Publishing Vol. 4 Part A xii 1-465 pp.</a><!--MARK-->","","Chapter in Book","b8575d65-1d5d-4e9d-8b78-0b4d3d1d5d41","20081009T05:11:37.000+0000","e30ce010-16f4-407e-b759-58796f08d672"
"Hutchings, P.A. & Glasby, C.J.","1988","The Amphitritinae (Polychaeta: Terebellidae) from Australia","1-60","","Records of the Australian Museum","","","","<!--MARK--><a href='nullf41a6565-83a3-4715-8db6-87cc3ec7bfaa' class='mouseoverHref'>Hutchings, P.A. & Glasby, C.J. 1988. The Amphitritinae (Polychaeta: Terebellidae) from Australia.</a> <!--MARK--><!--MARK--><a href='null7c07530b-0b38-44f5-8f95-368da97d6ac2' class='mouseoverHref'><em>Records of the Australian Museum</em></a> <strong>40</strong>: 1-60<!--MARK-->","","Article in Journal","f41a6565-83a3-4715-8db6-87cc3ec7bfaa","20081009T05:11:37.000+0000","7c07530b-0b38-44f5-8f95-368da97d6ac2"
"Hutchings, P.A. & Glasby, C.J.","1990","Additional new species of the family Terebellidae (Polychaeta) from Western Australia, with a key to all described species of the region","251-289","Proceedings of the Third International Marine Biological Workshop: The Marine Flora and Fauna of Albany, Western Australia","","","","","<!--MARK--><a href='nulld896e56f-96a1-4e25-96ce-b78360c17992' class='mouseoverHref'>Hutchings, P.A. & Glasby, C.J. 1990. Additional new species of the family Terebellidae (Polychaeta) from Western Australia, with a key to all described species of the region. pp. 251-289</a> <!--MARK--><em>in</em> <!--MARK--><a href='nullabcfb706-f6f0-40c8-8476-0c0e9fe644c0' class='mouseoverHref'>Wells, F.E., Walker, D.I., Kirkman, H. & Lethbridge, R. (eds). <em>Proceedings of the Third International Marine Biological Workshop: The Marine Flora and Fauna of Albany, Western Australia</em>. Perth : Western Australian Museum Vol. 1.</a><!--MARK-->","","Chapter in Book","d896e56f-96a1-4e25-96ce-b78360c17992","20130802T02:18:16.059+0000","abcfb706-f6f0-40c8-8476-0c0e9fe644c0"
"Hutchings, P.A. & Johnson, R.T.","2011","<i>Lumbrineris latreilli</i> Audouin & Milne Edwards, 1834","","","","","","","<!--MARK--><a href='nullf75408f1-d280-43bd-9fc9-2388736f9078' class='mouseoverHref'>Hutchings, P.A. & Johnson, R.T. 2011. <i>Lumbrineris latreilli</i> Audouin & Milne Edwards, 1834,</a> <!--MARK--><a href=http://biodiversity.org.au/afd>http://biodiversity.org.au/afd</a>","","This Work","f75408f1-d280-43bd-9fc9-2388736f9078","20150130T03:31:47.254+0000",""
"Hutchings, P.A. & Murray, A.","1984","Taxonomy of Polychaetes from the Hawkesbury River and the southern estuaries of New South Wales, Australia","1-118","","Records of the Australian Museum, Supplement","","","","<!--MARK--><a href='null16d75e54-0720-4c55-b02e-782441bb6667' class='mouseoverHref'>Hutchings, P.A. & Murray, A. 1984. Taxonomy of Polychaetes from the Hawkesbury River and the southern estuaries of New South Wales, Australia.</a> <!--MARK--><!--MARK--><a href='null9b521238-2e20-4fb1-b587-c4c9e053bf0f' class='mouseoverHref'><em>Records of the Australian Museum, Supplement</em></a> <strong>3</strong>: 1-118<!--MARK-->","","Article in Journal","16d75e54-0720-4c55-b02e-782441bb6667","20170310T03:38:21.323+0000","9b521238-2e20-4fb1-b587-c4c9e053bf0f"
"Imajima, M. & Hartman, O.","1964","The polychaetous annelids of Japan. Part II.","1-452","","Occasional Papers of the Allan Hancock Foundation","","","","<!--MARK--><a href='null355beb74-be05-4f7c-bb7c-a5623fc3f3c9' class='mouseoverHref'>Imajima, M. & Hartman, O. 1964. The polychaetous annelids of Japan. Part II.</a> <!--MARK--><!--MARK--><a href='nullf871b38d-aa86-4db0-869d-87f3d2323c73' class='mouseoverHref'><em>Occasional Papers of the Allan Hancock Foundation</em></a> <strong>26</strong>: 1-452<!--MARK-->","","Article in Journal","355beb74-be05-4f7c-bb7c-a5623fc3f3c9","20160601T23:56:28.559+0000","f871b38d-aa86-4db0-869d-87f3d2323c73"
"Johnston, G.","1865","A Catalogue of the British Non-parasitical Worms in the Collection of the British Museum","366 pp.","","","","","British Museum (Natural History)","<!--MARK--><a href='null03653417-69a1-41e2-8d33-de4382b05a16' class='mouseoverHref'>Johnston, G. 1865. <em>A Catalogue of the British Non-parasitical Worms in the Collection of the British Museum</em>. London : British Museum (Natural History) 366 pp.</a><!--MARK-->","","Book","03653417-69a1-41e2-8d33-de4382b05a16","20081009T05:11:37.000+0000",""
"Knox, G.A. & Cameron, D.B.","1971","Port Phillip Survey 2. Polychaeta","21-41","","Memoirs of the National Museum of Victoria, Melbourne","","","","<!--MARK--><a href='null99a1fd88-c9e9-428d-bbf6-68f7772ceed3' class='mouseoverHref'>Knox, G.A. & Cameron, D.B. 1971. Port Phillip Survey 2. Polychaeta.</a> <!--MARK--><!--MARK--><a href='null6d019674-04b0-4fab-8903-0612d147ec4d' class='mouseoverHref'><em>Memoirs of the National Museum of Victoria, Melbourne</em></a> <strong>32</strong>: 21-41<!--MARK-->","","Article in Journal","99a1fd88-c9e9-428d-bbf6-68f7772ceed3","20081009T05:11:37.000+0000","6d019674-04b0-4fab-8903-0612d147ec4d"
"Linnaeus, C.","1767","Systema naturae, per regna tria naturae, secundum classes, ordines, genera, species, cum caracteribus, differentiis, synonymis, locis","533-1327","","","","","L. Salvii","<!--MARK--><a href='null174f0e14-83ab-4eda-b572-66433f089d67' class='mouseoverHref'>Linnaeus, C. 1767. <em>Systema naturae, per regna tria naturae, secundum classes, ordines, genera, species, cum caracteribus, differentiis, synonymis, locis</em>. Holmiae [= Stockholm] : L. Salvii Tomus I. Regnum Animale(pars 2) Editio duodecima, reformata [3 vols., 1766-68], pp. 533-1327.</a><!--MARK-->","","Book","174f0e14-83ab-4eda-b572-66433f089d67","20171116T03:21:59.597+0000",""
"Malm, A.W.","1874","Annulater i hafvet utmed Sverges vestkust och omkring Göteborg","67-105","","Göteborgs Kungliga Vetenskaps och Vitterhets Samhälles Handlingar","","","","<!--MARK--><a href='nullc9923df2-5374-4b75-bad6-465de9ca43d2' class='mouseoverHref'>Malm, A.W. 1874. Annulater i hafvet utmed Sverges vestkust och omkring Göteborg.</a> <!--MARK--><!--MARK--><a href='null84f4d9bc-bcd7-4344-87bc-e13ec60e9dd1' class='mouseoverHref'><em>Göteborgs Kungliga Vetenskaps och Vitterhets Samhälles Handlingar</em></a> B <strong>14</strong>: 67-105<!--MARK-->","","Article in Journal","c9923df2-5374-4b75-bad6-465de9ca43d2","20090724T02:46:02.465+0000","84f4d9bc-bcd7-4344-87bc-e13ec60e9dd1"
"Malmgren, A.J.","1866","Nordiska Hafs-Annulater","355-410","","Öfversigt af Kongelige Vetenskaps-Akademiens Förhandlingar, Stockholm","","","","<!--MARK--><a href='null3009ceaa-bd24-41fb-90ec-d71dbb714499' class='mouseoverHref'>Malmgren, A.J. 1866. Nordiska Hafs-Annulater.</a> <!--MARK--><!--MARK--><a href='nullfc20d137-84ff-49b6-854c-8ee249f9a6f4' class='mouseoverHref'><em>Öfversigt af Kongelige Vetenskaps-Akademiens Förhandlingar, Stockholm</em></a> <strong>22</strong>: 355-410<!--MARK-->","","Article in Journal","3009ceaa-bd24-41fb-90ec-d71dbb714499","20081009T05:11:37.000+0000","fc20d137-84ff-49b6-854c-8ee249f9a6f4"
"Malmgren, A.J.","1867","Annulata polychaeta Spetsbergiae, Grönlandiae, Islandiae et Scandinaviae hactenus cognita","127-255","","Öfversigt af Kongelige Vetenskaps-Akademiens Förhandlingar, Stockholm","","","","<!--MARK--><a href='nullc1c5986a-3f98-4bfa-86b9-329a203e8cf9' class='mouseoverHref'>Malmgren, A.J. 1867. Annulata polychaeta Spetsbergiae, Grönlandiae, Islandiae et Scandinaviae hactenus cognita.</a> <!--MARK--><!--MARK--><a href='nullfc20d137-84ff-49b6-854c-8ee249f9a6f4' class='mouseoverHref'><em>Öfversigt af Kongelige Vetenskaps-Akademiens Förhandlingar, Stockholm</em></a> <strong>24</strong>: 127-255<!--MARK-->","","Article in Journal","c1c5986a-3f98-4bfa-86b9-329a203e8cf9","20081009T05:11:37.000+0000","fc20d137-84ff-49b6-854c-8ee249f9a6f4"
"Marenzeller, E. von","1885","Südjapanische Anneliden. II. Ampharetea, Terebellacea, Sabellacea, Serpulacea","197-224","","Denkschriften der Kaiserlichen Akademie der Wissenschaften, Wien, Mathematisch-Naturwissenschaftliche Klasse","","","","<!--MARK--><a href='null8ce9aecc-db6d-4d76-89fb-0a178f2eb4ce' class='mouseoverHref'>Marenzeller, E. von 1885. Südjapanische Anneliden. II. Ampharetea, Terebellacea, Sabellacea, Serpulacea.</a> <!--MARK--><!--MARK--><a href='null4e4f7a37-e7aa-471d-9d9e-b2f36bfe94f1' class='mouseoverHref'><em>Denkschriften der Kaiserlichen Akademie der Wissenschaften, Wien, Mathematisch-Naturwissenschaftliche Klasse</em></a> <strong>49</strong>(2): 197-224<!--MARK-->","","Article in Journal","8ce9aecc-db6d-4d76-89fb-0a178f2eb4ce","20180220T04:03:10.292+0000","4e4f7a37-e7aa-471d-9d9e-b2f36bfe94f1"
"McHugh, D.","1995","Phylogenetic analysis of the Amphitritinae (Polychaeta: Terebellidae)","405-429","","Journal of the Linnean Society of London, Zoology","","","","<!--MARK--><a href='null41784989-31b3-4b05-a004-d0a6f05a48e4' class='mouseoverHref'>McHugh, D. 1995. Phylogenetic analysis of the Amphitritinae (Polychaeta: Terebellidae).</a> <!--MARK--><!--MARK--><a href='null9da0901d-c795-4d2c-b9ad-d6a85cdf1cce' class='mouseoverHref'><em>Journal of the Linnean Society of London, Zoology</em></a> <strong>114</strong>: 405-429<!--MARK-->","","Article in Journal","41784989-31b3-4b05-a004-d0a6f05a48e4","20081009T05:11:37.000+0000","9da0901d-c795-4d2c-b9ad-d6a85cdf1cce"
"McIntosh, W.C.","1885","Report on the Annelida Polychaeta collected by H.M.S. 'Challenger' during the years 1873-76","1-554","","Report on the Scientific Results of the Voyage of H.M.S. Challenger 1873-1876, Zoology","","","","<!--MARK--><a href='nullc5ed8a78-6d24-4313-822d-d00dbff7a807' class='mouseoverHref'>McIntosh, W.C. 1885. Report on the Annelida Polychaeta collected by H.M.S. 'Challenger' during the years 1873-76.</a> <!--MARK--><!--MARK--><a href='null1db4d8a3-1c27-4eff-aef5-d93514e06c4f' class='mouseoverHref'><em>Report on the Scientific Results of the Voyage of H.M.S. Challenger 1873-1876, Zoology</em></a> <strong>12</strong>: 1-554<!--MARK-->","","Article in Journal","c5ed8a78-6d24-4313-822d-d00dbff7a807","20130124T04:31:49.403+0000","1db4d8a3-1c27-4eff-aef5-d93514e06c4f"
"Monro, C.C.A.","1931","Polychaeta, Oligochaeta, Echiuroidea and Sipunculoidea","1-37","","Scientific Reports of the Great Barrier Reef Expedition 1928-1929","","","","<!--MARK--><a href='null09cc9722-217e-4092-826f-7dde85818e48' class='mouseoverHref'>Monro, C.C.A. 1931. Polychaeta, Oligochaeta, Echiuroidea and Sipunculoidea.</a> <!--MARK--><!--MARK--><a href='null53401020-54f9-4390-abdb-fc4acf775754' class='mouseoverHref'><em>Scientific Reports of the Great Barrier Reef Expedition 1928-1929</em></a> <strong>4</strong>: 1-37<!--MARK-->","","Article in Journal","09cc9722-217e-4092-826f-7dde85818e48","20081009T05:11:37.000+0000","53401020-54f9-4390-abdb-fc4acf775754"
"Müller, O.F.","1771","Von Würmern des süssen und salzigen Wassers.","200 pp.","","","","","H. Mumme and Faber","<!--MARK--><a href='null671ceff1-c61e-45b4-9b27-6a8c17f59834' class='mouseoverHref'>Müller, O.F. 1771. <em>Von Würmern des süssen und salzigen Wassers</em>. Copenhagen : H. Mumme and Faber 200 pp.</a><!--MARK-->","","Book","671ceff1-c61e-45b4-9b27-6a8c17f59834","20140714T01:04:25.540+0000",""
"Müller, O.F.","1776","Zoologicae Danicae Prodromus<i>, seu Animalium Daniae et Norvegiae indigenarum characteres, nomina et synonyma imprimis popularium</i>","1-282","","","","","Havniae","<!--MARK--><a href='null89df2eee-66f6-48ba-926b-2585691aee97' class='mouseoverHref'>Müller, O.F. 1776. <em>Zoologicae Danicae Prodromus<i>, seu Animalium Daniae et Norvegiae indigenarum characteres, nomina et synonyma imprimis popularium</i></em>. Copenhagen : Havniae Vol. 32 pp. 1-282.</a><!--MARK--> [pls published in 1777]","pls published in 1777","Book","89df2eee-66f6-48ba-926b-2585691aee97","20081009T05:11:37.000+0000",""
"Nogueira, J.M. de Matos & Hutchings, P.A.","2007","New species of terebellid polychaetes (Polychaeta: Terebellidae) from Australia","1-24","","Zootaxa","","","","<!--MARK--><a href='nulla99f9162-982d-46c8-bcf8-7297fca955e2' class='mouseoverHref'>Nogueira, J.M. de Matos & Hutchings, P.A. 2007. New species of terebellid polychaetes (Polychaeta: Terebellidae) from Australia.</a> <!--MARK--><!--MARK--><a href='null96466227-221c-4922-ac97-1ac2dd946d0a' class='mouseoverHref'><em>Zootaxa</em></a> <strong>1473</strong>: 1-24<!--MARK-->","","Article in Journal","a99f9162-982d-46c8-bcf8-7297fca955e2","","96466227-221c-4922-ac97-1ac2dd946d0a"
