"PUB_AUTHOR","PUB_YEAR","PUB_TITLE","PUB_PAGES","PUB_PARENT_BOOK_TITLE","PUB_PARENT_JOURNAL_TITLE","PUB_PARENT_ARTICLE_TITLE","PUB_PUBLICATION_DATE","PUB_PUBLISHER","PUB_FORMATTED","PUB_QUALIFICATION","PUB_TYPE","PUBLICATION_GUID","PUBLICATION_LAST_UPDATE","PARENT_PUBLICATION_GUID"
"Nogueira, J.M.M., Hutchings, P. & Carrerette, O.","2015","<i>Varanusia</i> nom. nov., a replacement name for <i>Lizardia</i> Nogueira, Hutchings & Carrerette, 2015 (Annelida: Terebellidae), preoccupied by <i>Lizardia</i> Pleijel & Rouse, 2005","141-141","","Zootaxa","","","","<!--MARK--><a href='nullc253caa3-1669-461b-b374-855935faff08' class='mouseoverHref'>Nogueira, J.M.M., Hutchings, P. & Carrerette, O. 2015. <i>Varanusia</i> nom. nov., a replacement name for <i>Lizardia</i> Nogueira, Hutchings & Carrerette, 2015 (Annelida: Terebellidae), preoccupied by <i>Lizardia</i> Pleijel & Rouse, 2005.</a> <!--MARK--><!--MARK--><a href='null96466227-221c-4922-ac97-1ac2dd946d0a' class='mouseoverHref'><em>Zootaxa</em></a> <strong>4058</strong>(1): 141-141<!--MARK-->","","Article in Journal","c253caa3-1669-461b-b374-855935faff08","20151215T20:25:44.993+0000","96466227-221c-4922-ac97-1ac2dd946d0a"
"Nogueira, J.M.M., Hutchings, P. & Carrerette, O.","2015","Terebellidae (Annelida, Terebelliformia) from Lizard Island, Great Barrier Reef, Australia.","484-576","","Zootaxa","","","","<!--MARK--><a href='null13a97544-78f7-49f5-8d00-b06a9f3cb2c4' class='mouseoverHref'>Nogueira, J.M.M., Hutchings, P. & Carrerette, O. 2015. Terebellidae (Annelida, Terebelliformia) from Lizard Island, Great Barrier Reef, Australia.</a> <!--MARK--><!--MARK--><a href='null96466227-221c-4922-ac97-1ac2dd946d0a' class='mouseoverHref'><em>Zootaxa</em></a> <strong>4019</strong>: 484-576<!--MARK-->","","Article in Journal","13a97544-78f7-49f5-8d00-b06a9f3cb2c4","20160110T23:01:18.245+0000","96466227-221c-4922-ac97-1ac2dd946d0a"
"Okuda, S. & Yamada, M.","1954","Polychaetous annelids from Matsushima Bay","175-199","","Journal of the Faculty of Science, Hokkaido University. Series VI. Zoology","","","","<!--MARK--><a href='nulla6bbd9a0-7f65-4268-82d8-85cb6ded9755' class='mouseoverHref'>Okuda, S. & Yamada, M. 1954. Polychaetous annelids from Matsushima Bay.</a> <!--MARK--><!--MARK--><a href='nullfd29c3df-25d8-4fce-a09d-a526bc2342c4' class='mouseoverHref'><em>Journal of the Faculty of Science, Hokkaido University. Series VI. Zoology</em></a> 6 <strong>12</strong>: 175-199<!--MARK-->","","Article in Journal","a6bbd9a0-7f65-4268-82d8-85cb6ded9755","20081009T05:11:37.000+0000","fd29c3df-25d8-4fce-a09d-a526bc2342c4"
"Quatrefages, A. de","1865","Histoire naturelle des Annéles marins et d'eau douce. Annélides et éephyriens","","","","","","Librairie Encyclopédique de Roret","<!--MARK--><a href='nullab4e5808-97c6-431d-972b-a434b7830616' class='mouseoverHref'>Quatrefages, A. de 1865. <em>Histoire naturelle des Annéles marins et d'eau douce. Annélides et éephyriens</em>. Paris : Librairie Encyclopédique de Roret.</a><!--MARK-->","","Book","ab4e5808-97c6-431d-972b-a434b7830616","20081009T05:11:37.000+0000",""
"Rullier, F.","1965","Contribution à la faune des Annélides Polychètes de l'Australie","163-201","","Papers of the Department of Zoology University of Queensland","","","","<!--MARK--><a href='null55b7ccdb-61ef-4c1e-8736-af8789e58318' class='mouseoverHref'>Rullier, F. 1965. Contribution à la faune des Annélides Polychètes de l'Australie.</a> <!--MARK--><!--MARK--><a href='null6ad93d2f-f1b8-4019-8076-d12ac0ab8306' class='mouseoverHref'><em>Papers of the Department of Zoology University of Queensland</em></a> <strong>2</strong>(9): 163-201<!--MARK-->","","Article in Journal","55b7ccdb-61ef-4c1e-8736-af8789e58318","20081009T05:11:37.000+0000","6ad93d2f-f1b8-4019-8076-d12ac0ab8306"
"Saint-Joseph, A. de","1894","Les Annélides polychètes des côtes de Dinard. Troisième Partie","1-395","","Annales des Sciences Naturelles, Paris","","","","<!--MARK--><a href='nullc75da558-455d-48a9-8701-a90c657673c3' class='mouseoverHref'>Saint-Joseph, A. de 1894. Les Annélides polychètes des côtes de Dinard. Troisième Partie.</a> <!--MARK--><!--MARK--><a href='null8728aca1-f2e1-4662-b5b6-40183f95151b' class='mouseoverHref'><em>Annales des Sciences Naturelles, Paris</em></a> 7 <strong>17</strong>: 1-395<!--MARK-->","","Article in Journal","c75da558-455d-48a9-8701-a90c657673c3","20081009T05:11:37.000+0000","8728aca1-f2e1-4662-b5b6-40183f95151b"
"Schmarda, L.K.","1861","Neue Turbellarian, Rotatorien und Anneliden beobachtet und gesammelt auf einer Reise un die Erde 1853 bis 1857. <i>Erster Band (zweite halfte)</i>","1-164","","","","","Wilhelm Engelmann","<!--MARK--><a href='null5b974fb7-7dda-4314-8248-962383487b18' class='mouseoverHref'>Schmarda, L.K. 1861. <em>Neue Turbellarian, Rotatorien und Anneliden beobachtet und gesammelt auf einer Reise un die Erde 1853 bis 1857. <i>Erster Band (zweite halfte)</i></em>. Leipzig : Wilhelm Engelmann pp. 1-164.</a><!--MARK-->","","Book","5b974fb7-7dda-4314-8248-962383487b18","20081009T05:11:37.000+0000",""
"Stephenson, W., Williams, W.T. & Cook, S.D.","1974","The benthic fauna of soft bottoms, southern Moreton Bay","73-123","","Memoirs of the Queensland Museum","","","","<!--MARK--><a href='nulle3558241-1602-490a-95ef-e8c927504941' class='mouseoverHref'>Stephenson, W., Williams, W.T. & Cook, S.D. 1974. The benthic fauna of soft bottoms, southern Moreton Bay.</a> <!--MARK--><!--MARK--><a href='null1a0a2982-9f30-43e1-a641-b0379699837c' class='mouseoverHref'><em>Memoirs of the Queensland Museum</em></a> <strong>17</strong>(1): 73-123<!--MARK-->","","Article in Journal","e3558241-1602-490a-95ef-e8c927504941","20081009T05:11:37.000+0000","1a0a2982-9f30-43e1-a641-b0379699837c"
"Stephenson, W., Williams, W.T. & Lance, G.N.","1970","The macrobenthos of Moreton Bay","459-494","","Ecological Monographs","","","","<!--MARK--><a href='null4a34656e-6e2e-4d51-b233-31cb56b5c5d3' class='mouseoverHref'>Stephenson, W., Williams, W.T. & Lance, G.N. 1970. The macrobenthos of Moreton Bay.</a> <!--MARK--><!--MARK--><a href='null16451cc1-346c-4e25-a399-1615f2b84eaa' class='mouseoverHref'><em>Ecological Monographs</em></a> <strong>40</strong>: 459-494<!--MARK-->","","Article in Journal","4a34656e-6e2e-4d51-b233-31cb56b5c5d3","20081009T05:11:37.000+0000","16451cc1-346c-4e25-a399-1615f2b84eaa"
"Sutton, M.F.","1957","The feeding mechanism, functional morphology and histology of the alimentary canal of <i>Terebella lapidaria</i> L. (Polychaeta)","487-523","","Proceedings of the Zoological Society of London","","","","<!--MARK--><a href='null0a754670-26f8-48bd-b19d-8714adb0b90c' class='mouseoverHref'>Sutton, M.F. 1957. The feeding mechanism, functional morphology and histology of the alimentary canal of <i>Terebella lapidaria</i> L. (Polychaeta).</a> <!--MARK--><!--MARK--><a href='null511f299d-99ec-413c-bc4c-04a380829c96' class='mouseoverHref'><em>Proceedings of the Zoological Society of London</em></a> <strong>129</strong>: 487-523<!--MARK-->","","Article in Journal","0a754670-26f8-48bd-b19d-8714adb0b90c","20081009T05:11:37.000+0000","511f299d-99ec-413c-bc4c-04a380829c96"
"Verrill, A.E.","1900","XVIII. -- Additions to the Turbellaria, Nemertina, and Annelida of the Bermudas, with revisions of some New England genera and species","595-671","","Transactions of the Connecticut Academy of Arts and Sciences","","","","<!--MARK--><a href='nulle67e183a-7a58-482b-876a-4b2deb70b459' class='mouseoverHref'>Verrill, A.E. 1900. XVIII. -- Additions to the Turbellaria, Nemertina, and Annelida of the Bermudas, with revisions of some New England genera and species.</a> <!--MARK--><!--MARK--><a href='nullceaf787a-0f1d-4c3a-9891-586659609e1d' class='mouseoverHref'><em>Transactions of the Connecticut Academy of Arts and Sciences</em></a> <strong>10</strong>(2): 595-671<!--MARK-->","","Article in Journal","e67e183a-7a58-482b-876a-4b2deb70b459","20140722T23:28:22.793+0000","ceaf787a-0f1d-4c3a-9891-586659609e1d"
"Wesenberg-Lund, E.","1950","Polychaeta","1-92","","Danish Ingolf-Expedition","","","","<!--MARK--><a href='nulla945e618-b637-405c-9e8e-07167441ab62' class='mouseoverHref'>Wesenberg-Lund, E. 1950. Polychaeta.</a> <!--MARK--><!--MARK--><a href='null78ff66b0-ea2e-4e22-bd4f-fb6398e78aeb' class='mouseoverHref'><em>Danish Ingolf-Expedition</em></a> <strong>4</strong>(14): 1-92<!--MARK-->","","Article in Journal","a945e618-b637-405c-9e8e-07167441ab62","20081009T05:11:37.000+0000","78ff66b0-ea2e-4e22-bd4f-fb6398e78aeb"
