"PUB_AUTHOR","PUB_YEAR","PUB_TITLE","PUB_PAGES","PUB_PARENT_BOOK_TITLE","PUB_PARENT_JOURNAL_TITLE","PUB_PARENT_ARTICLE_TITLE","PUB_PUBLICATION_DATE","PUB_PUBLISHER","PUB_FORMATTED","PUB_QUALIFICATION","PUB_TYPE","PUBLICATION_GUID","PUBLICATION_LAST_UPDATE","PARENT_PUBLICATION_GUID"
"Augener, H.","1914","Polychaeta Sedentaria","1-172","Die Fauna Südwest-Australiens","","","","","<!--MARK--><a href='nulla6d10b1f-c547-4aac-a197-68099efa2381' class='mouseoverHref'>Augener, H. 1914. Polychaeta Sedentaria. pp. 1-172</a> <!--MARK--><em>in</em> <!--MARK--><a href='nulld0252540-b58e-439d-8e2f-ad1ec1f21644' class='mouseoverHref'>Michaelsen, W. & Hartmeyer, R. (eds). <em>Die Fauna Südwest-Australiens</em>. Jena : Fischer Vol. 5 pp. 1-700.</a><!--MARK-->","","Chapter in Book","a6d10b1f-c547-4aac-a197-68099efa2381","20160531T00:10:19.791+0000","d0252540-b58e-439d-8e2f-ad1ec1f21644"
"Augener, H.","1922","Results of Dr. E. Mjöberg's Swedish Scientific Expeditions to Australia 1910-13. Polychaeten","1-49","","Kongliga Svenska Vetenskaps-Academiens Nya Handlingar, Stockholm","","","","<!--MARK--><a href='nulld4399de1-3402-430c-98c7-deb60f18c7c1' class='mouseoverHref'>Augener, H. 1922. Results of Dr. E. Mjöberg's Swedish Scientific Expeditions to Australia 1910-13. Polychaeten.</a> <!--MARK--><!--MARK--><a href='nullf145f16a-592b-484d-8689-ce403bec0970' class='mouseoverHref'><em>Kongliga Svenska Vetenskaps-Academiens Nya Handlingar, Stockholm</em></a> <strong>63</strong>: 1-49<!--MARK-->","","Article in Journal","d4399de1-3402-430c-98c7-deb60f18c7c1","20081009T05:11:37.000+0000","f145f16a-592b-484d-8689-ce403bec0970"
"Augener, H.","1922","Ueber litorale Polychaeten von Westindien","38-53","","Sitzungsberichte der Gesellschaft Naturforschender Freunde zu Berlin","","","","<!--MARK--><a href='null221595b3-7ca0-4a2f-8ebd-a7befbeedd57' class='mouseoverHref'>Augener, H. 1922. Ueber litorale Polychaeten von Westindien.</a> <!--MARK--><!--MARK--><a href='null9f4f8fa8-8553-4807-a483-541b14e86c37' class='mouseoverHref'><em>Sitzungsberichte der Gesellschaft Naturforschender Freunde zu Berlin</em></a> <strong>3</strong>: 38-53<!--MARK-->","","Article in Journal","221595b3-7ca0-4a2f-8ebd-a7befbeedd57","20081009T05:11:37.000+0000","9f4f8fa8-8553-4807-a483-541b14e86c37"
"Augener, H.","1927","Papers from Dr. Th. Mortensen's Pacific Expedition 1914-1916. No. 38. Polychaeten von Südost und Süd-Australien","71-275","","Videnskabelige Meddelelser fra Dansk Naturhistorisk Forening i Kjøbenhavn","","","","<!--MARK--><a href='null83e4a70c-321e-4103-956a-44bfdbd86309' class='mouseoverHref'>Augener, H. 1927. Papers from Dr. Th. Mortensen's Pacific Expedition 1914-1916. No. 38. Polychaeten von Südost und Süd-Australien.</a> <!--MARK--><!--MARK--><a href='null51082d4f-c72f-4223-8886-1a55698c5740' class='mouseoverHref'><em>Videnskabelige Meddelelser fra Dansk Naturhistorisk Forening i Kjøbenhavn</em></a> <strong>83</strong>: 71-275<!--MARK-->","","Article in Journal","83e4a70c-321e-4103-956a-44bfdbd86309","20081009T05:11:37.000+0000","51082d4f-c72f-4223-8886-1a55698c5740"
"Baird, W.","1865","On new tubicolous annelids in the collection of the British Museum. Part 2","157-160","","Journal of the Linnean Society of London, Zoology","","","","<!--MARK--><a href='null951c090b-2c8a-421e-a3f7-1660208da99b' class='mouseoverHref'>Baird, W. 1865. On new tubicolous annelids in the collection of the British Museum. Part 2.</a> <!--MARK--><!--MARK--><a href='null9da0901d-c795-4d2c-b9ad-d6a85cdf1cce' class='mouseoverHref'><em>Journal of the Linnean Society of London, Zoology</em></a> <strong>8</strong>: 157-160<!--MARK-->","","Article in Journal","951c090b-2c8a-421e-a3f7-1660208da99b","20081009T05:11:37.000+0000","9da0901d-c795-4d2c-b9ad-d6a85cdf1cce"
"Beesley, P.L., Ross, G.J.B. & Glasby, C.J. (eds)","2000","Polychaetes & Allies: The Southern Synthesis. Fauna of Australia Vol. 4A Polychaeta, Myzostomida, Pogonophora, Echiura, Sipuncula","xii 1-465 pp.","","","","","CSIRO Publishing","<!--MARK--><a href='nulle30ce010-16f4-407e-b759-58796f08d672' class='mouseoverHref'>Beesley, P.L., Ross, G.J.B. & Glasby, C.J. (eds) 2000. <em>Polychaetes & Allies: The Southern Synthesis. Fauna of Australia Vol. 4A Polychaeta, Myzostomida, Pogonophora, Echiura, Sipuncula</em>. Melbourne : CSIRO Publishing Vol. 4 Part A xii 1-465 pp.</a><!--MARK-->","","Book","e30ce010-16f4-407e-b759-58796f08d672","20090223T06:46:11.740+0000",""
"Benham, W.B.","1916","Report on the Polychaeta obtained by the F.I.S. Endeavour on the coasts of New South Wales, Victoria, Tasmania and South Australia, Part 2","","","","","","","<!--MARK--><a href='null215a1f7d-6cac-4beb-9c30-0414e10c7697' class='mouseoverHref'>Benham, W.B. 1916. Report on the Polychaeta obtained by the F.I.S. Endeavour on the coasts of New South Wales, Victoria, Tasmania and South Australia, Part 2. pp. 125-162 <I>in</I> Dannevig, H.C. (ed.) <I>Biological Results of the Fisheries Expedition F.I.S. Endeavour 1909-14</I>. Sydney Vol. 4.</a>","","Miscellaneous","215a1f7d-6cac-4beb-9c30-0414e10c7697","20081009T05:11:37.000+0000",""
"Berkeley, E & Berkeley, C.","1952","Annelida, Polychaeta sedentaria","1-139","","Canadian Pacific Fauna, Fisheries Reserve Board, Canada","","","","<!--MARK--><a href='null5ef9fa9c-894d-49a1-9e26-1ad7a32bdad0' class='mouseoverHref'>Berkeley, E & Berkeley, C. 1952. Annelida, Polychaeta sedentaria.</a> <!--MARK--><!--MARK--><a href='null31e644e2-72b7-4a6d-9ee5-7d1603c1a14b' class='mouseoverHref'><em>Canadian Pacific Fauna, Fisheries Reserve Board, Canada</em></a> <strong>9b</strong>(2): 1-139<!--MARK-->","","Article in Journal","5ef9fa9c-894d-49a1-9e26-1ad7a32bdad0","20081009T05:11:37.000+0000","31e644e2-72b7-4a6d-9ee5-7d1603c1a14b"
"Chamberlin, R.V.","1919","Albatross Polychaeta (Rep. Sci. Res. Exp. Albatross)","1-514","","Memoirs of the Museum of Comparative Zoology, Harvard University","","","","<!--MARK--><a href='nulldc56d64a-b2dc-44bc-b19d-6eeeaf7a8496' class='mouseoverHref'>Chamberlin, R.V. 1919. Albatross Polychaeta (Rep. Sci. Res. Exp. Albatross).</a> <!--MARK--><!--MARK--><a href='nullf5033169-6f6d-4f54-8cfe-dcab9e8cc5f8' class='mouseoverHref'><em>Memoirs of the Museum of Comparative Zoology, Harvard University</em></a> <strong>48</strong>: 1-514<!--MARK-->","","Article in Journal","dc56d64a-b2dc-44bc-b19d-6eeeaf7a8496","20081009T05:11:37.000+0000","f5033169-6f6d-4f54-8cfe-dcab9e8cc5f8"
"Costa, A.","1862","Descrizione di alcuni annellidi del Golfo di Napoli","82-90","","Annuario del Museo Zoologico della Reale Università de Napoli","","","","<!--MARK--><a href='null7481788d-0992-44ae-8007-bee7fc3aa0d6' class='mouseoverHref'>Costa, A. 1862. Descrizione di alcuni annellidi del Golfo di Napoli.</a> <!--MARK--><!--MARK--><a href='null27d66cc5-bc21-4957-a06c-9f1eaeec61af' class='mouseoverHref'><em>Annuario del Museo Zoologico della Reale Università de Napoli</em></a> <strong>1</strong>: 82-90<!--MARK-->","","Article in Journal","7481788d-0992-44ae-8007-bee7fc3aa0d6","20081009T05:11:37.000+0000","27d66cc5-bc21-4957-a06c-9f1eaeec61af"
"Day, J.H.","1967","A Monograph on the Polychaeta of Southern Africa","Pt 1, Erranta pp. 1-458; Pt 2, Sedentaria pp. 459-878","","","","","Publication of the British Museum (Natural History)","<!--MARK--><a href='nulldf7ef427-0b8f-4351-925c-a1ad4f76f1f6' class='mouseoverHref'>Day, J.H. 1967. <em>A Monograph on the Polychaeta of Southern Africa</em>. London : Publication of the British Museum (Natural History) Part 1 Pt 1, Erranta pp. 1-458; Pt 2, Sedentaria pp. 459-878.</a><!--MARK-->","","Book","df7ef427-0b8f-4351-925c-a1ad4f76f1f6","20101222T05:42:14.075+0000",""
"Day, J.H.","1975","On a collection of Polychaeta from intertidal and shallow reefs near Perth, Western Australia","167-208","","Records of the Western Australian Museum","","","","<!--MARK--><a href='nullb902f5c8-ecfe-4ad0-867e-2639b02c3492' class='mouseoverHref'>Day, J.H. 1975. On a collection of Polychaeta from intertidal and shallow reefs near Perth, Western Australia.</a> <!--MARK--><!--MARK--><a href='nulla2cbd1fb-97d5-493a-a1d7-c2b99709890b' class='mouseoverHref'><em>Records of the Western Australian Museum</em></a> <strong>3</strong>: 167-208<!--MARK-->","","Article in Journal","b902f5c8-ecfe-4ad0-867e-2639b02c3492","20081009T05:11:37.000+0000","a2cbd1fb-97d5-493a-a1d7-c2b99709890b"
"Day, J.H. & Hutchings, P.A.","1979","An annotated check-list of Australian and New Zealand Polychaeta, Archiannelida and Myzostomida","80-161","","Records of the Australian Museum","","","","<!--MARK--><a href='nullb6d37230-9816-4fbe-b430-1088e3440088' class='mouseoverHref'>Day, J.H. & Hutchings, P.A. 1979. An annotated check-list of Australian and New Zealand Polychaeta, Archiannelida and Myzostomida.</a> <!--MARK--><!--MARK--><a href='null7c07530b-0b38-44f5-8f95-368da97d6ac2' class='mouseoverHref'><em>Records of the Australian Museum</em></a> <strong>32</strong>: 80-161<!--MARK-->","","Article in Journal","b6d37230-9816-4fbe-b430-1088e3440088","20081009T05:11:37.000+0000","7c07530b-0b38-44f5-8f95-368da97d6ac2"
"Ehlers, E.","1887","Reports on the results of dredging, under the direction of L.F. Pourtales, during the years 1868-1870, and of Alexander Agassiz, in the Gulf of Mexico (1877-78), and in the Caribbean Sea (1878-79), in the U.S. Coast Survey Steamer Blake, Lieut.-Com. C.D","1-335","","Memoirs of the Museum of Comparative Zoology, Harvard University","","","","<!--MARK--><a href='nullfedd0d9a-164f-40ff-a6d0-d33eb40a38db' class='mouseoverHref'>Ehlers, E. 1887. Reports on the results of dredging, under the direction of L.F. Pourtales, during the years 1868-1870, and of Alexander Agassiz, in the Gulf of Mexico (1877-78), and in the Caribbean Sea (1878-79), in the U.S. Coast Survey Steamer Blake, Lieut.-Com. C.D.</a> <!--MARK--><!--MARK--><a href='nullf5033169-6f6d-4f54-8cfe-dcab9e8cc5f8' class='mouseoverHref'><em>Memoirs of the Museum of Comparative Zoology, Harvard University</em></a> <strong>15</strong>: 1-335<!--MARK-->","","Article in Journal","fedd0d9a-164f-40ff-a6d0-d33eb40a38db","20081009T05:11:37.000+0000","f5033169-6f6d-4f54-8cfe-dcab9e8cc5f8"
"Fauchald, K.","1977","The polychaete worms. Definitions and keys to the orders, families and genera","1-188","","Natural History Museum of Los Angeles County. Science Series","","","","<!--MARK--><a href='null2394e27b-b989-4b5f-815b-e5331daee7f6' class='mouseoverHref'>Fauchald, K. 1977. The polychaete worms. Definitions and keys to the orders, families and genera.</a> <!--MARK--><!--MARK--><a href='null96258f22-62bd-4cde-a6c2-357ed0d6e50b' class='mouseoverHref'><em>Natural History Museum of Los Angeles County. Science Series</em></a> <strong>28</strong>: 1-188<!--MARK-->","","Article in Journal","2394e27b-b989-4b5f-815b-e5331daee7f6","20081009T05:11:37.000+0000","96258f22-62bd-4cde-a6c2-357ed0d6e50b"
"Fauchald, K. & Rouse, G.","1997","Polychaete systematics: Past and present","71-138","","Zoologica Scripta","","","","<!--MARK--><a href='nulle7dd388b-a9e4-4123-bafd-82de6900fe01' class='mouseoverHref'>Fauchald, K. & Rouse, G. 1997. Polychaete systematics: Past and present.</a> <!--MARK--><!--MARK--><a href='nullb73ec244-df8b-4acd-858a-ffc326386b1e' class='mouseoverHref'><em>Zoologica Scripta</em></a> <strong>26</strong>: 71-138<!--MARK-->","","Article in Journal","e7dd388b-a9e4-4123-bafd-82de6900fe01","20081009T05:11:37.000+0000","b73ec244-df8b-4acd-858a-ffc326386b1e"
"Fauvel, P.","1917","Annélides polychètes de l'Australie meridionale","159-278","","Archives de Zoologie Expérimentale et Générale","","","","<!--MARK--><a href='nullb4e9ff6f-2498-430b-8298-02293d1a8491' class='mouseoverHref'>Fauvel, P. 1917. Annélides polychètes de l'Australie meridionale.</a> <!--MARK--><!--MARK--><a href='null1ee9e2fd-e394-4e8a-bdac-59c249e54978' class='mouseoverHref'><em>Archives de Zoologie Expérimentale et Générale</em></a> <strong>56</strong>: 159-278<!--MARK-->","","Article in Journal","b4e9ff6f-2498-430b-8298-02293d1a8491","20081009T05:11:37.000+0000","1ee9e2fd-e394-4e8a-bdac-59c249e54978"
"Fauvel, P.","1927","Faune de France: Polychètes sedentaires. Addenda aux Errantes, Archiannélides, Myzostomaires. Librairie de la Faculté des Sciences","494 pp.","","","","","Paul Lechevalier","<!--MARK--><a href='nullb976aa0f-f0a7-422e-b486-7eaadb985dd6' class='mouseoverHref'>Fauvel, P. 1927. <em>Faune de France: Polychètes sedentaires. Addenda aux Errantes, Archiannélides, Myzostomaires. Librairie de la Faculté des Sciences</em>. Paris : Paul Lechevalier Vol. 16 494 pp.</a><!--MARK-->","","Book","b976aa0f-f0a7-422e-b486-7eaadb985dd6","20100114T22:57:41.264+0000",""
"Fauvel, P.","1936","Annélides polychetes du Japon","41-92","","Memoirs of Collective Science of Kyoto University","","","","<!--MARK--><a href='null9fff3f64-e21a-43b4-96ff-0bcffa195a5b' class='mouseoverHref'>Fauvel, P. 1936. Annélides polychetes du Japon.</a> <!--MARK--><!--MARK--><a href='null0f4f5f16-f6dc-41c1-8138-ed843934167a' class='mouseoverHref'><em>Memoirs of Collective Science of Kyoto University</em></a> B <strong>12</strong>: 41-92<!--MARK-->","","Article in Journal","9fff3f64-e21a-43b4-96ff-0bcffa195a5b","20090730T23:13:11.391+0000","0f4f5f16-f6dc-41c1-8138-ed843934167a"
"Fournier, J.A. & Barrie, J.","1984","<i>Baffinia hesslei</i> (Annenkova), n. comb. (Polychaeta: Terebellidae) from eastern Canada","1397-1401","","Canadian Journal of Zoology","","","","<!--MARK--><a href='null4e5f9c75-4b09-4d54-846a-9f3709bd6398' class='mouseoverHref'>Fournier, J.A. & Barrie, J. 1984. <i>Baffinia hesslei</i> (Annenkova), n. comb. (Polychaeta: Terebellidae) from eastern Canada.</a> <!--MARK--><!--MARK--><a href='null6b4ad741-4e78-4504-8644-852d01ad47bb' class='mouseoverHref'><em>Canadian Journal of Zoology</em></a> <strong>62</strong>: 1397-1401<!--MARK-->","","Article in Journal","4e5f9c75-4b09-4d54-846a-9f3709bd6398","20081009T05:11:37.000+0000","6b4ad741-4e78-4504-8644-852d01ad47bb"
"Giard, A.","1878","Sur les <i>Wartelia</i>, genre nouveau d'Annélide, considerés à tort coome de embryos de Térébelles","1147-1149","","Comptes Rendus (Hebdomadaires) des Séances de l'Academie des Sciences. Série D. Sciences Naturelles","","","","<!--MARK--><a href='null5ffb5bea-80f1-46ae-9575-ccef36d1a592' class='mouseoverHref'>Giard, A. 1878. Sur les <i>Wartelia</i>, genre nouveau d'Annélide, considerés à tort coome de embryos de Térébelles.</a> <!--MARK--><!--MARK--><a href='null77294646-7b61-4cee-974d-0ed045692670' class='mouseoverHref'><em>Comptes Rendus (Hebdomadaires) des Séances de l'Academie des Sciences. Série D. Sciences Naturelles</em></a> <strong>86</strong>: 1147-1149<!--MARK-->","","Article in Journal","5ffb5bea-80f1-46ae-9575-ccef36d1a592","20081009T05:11:37.000+0000","77294646-7b61-4cee-974d-0ed045692670"
"Gibbs, P.E.","1971","The Polychaete fauna of the Solomon Islands","101-211","","Bulletin of the British Museum (Natural History) Zoology","","","","<!--MARK--><a href='null4283b027-50ce-4f7f-abf3-f4f0d0526bce' class='mouseoverHref'>Gibbs, P.E. 1971. The Polychaete fauna of the Solomon Islands.</a> <!--MARK--><!--MARK--><a href='nullb3f9c838-f530-4385-85ff-15e3c5466fb7' class='mouseoverHref'><em>Bulletin of the British Museum (Natural History) Zoology</em></a> <strong>21</strong>(5): 101-211<!--MARK-->","","Article in Journal","4283b027-50ce-4f7f-abf3-f4f0d0526bce","20081009T05:11:37.000+0000","b3f9c838-f530-4385-85ff-15e3c5466fb7"
"Grube, A.-E.","1872","Uebersicht der bisher beschriebenen Terebellen und uber <i>T. anguicomus</i> und einige Serpulacean","48-53","","Jahresbericht der Schlesischen Gesellschaft für Vaterländische Kultur, Breslau","","","","<!--MARK--><a href='null1d86826d-b9ea-4196-9c4b-87f95c294f0b' class='mouseoverHref'>Grube, A.-E. 1872. Uebersicht der bisher beschriebenen Terebellen und uber <i>T. anguicomus</i> und einige Serpulacean.</a> <!--MARK--><!--MARK--><a href='null20528d9e-0560-4ce8-a70d-17b35f8a8fec' class='mouseoverHref'><em>Jahresbericht der Schlesischen Gesellschaft für Vaterländische Kultur, Breslau</em></a> <strong>49</strong>: 48-53<!--MARK-->","","Article in Journal","1d86826d-b9ea-4196-9c4b-87f95c294f0b","20081009T05:11:37.000+0000","20528d9e-0560-4ce8-a70d-17b35f8a8fec"
"Grube, A.-E.","1878","Anneliden-Ausbeute SMS 'Gazelle'","509-554","","Monatsberichte der Königlichen Preussischen Akademie der Wissenschaften zu Berlin","","","","<!--MARK--><a href='nullf73977e3-3fc8-440e-ab11-d1c5b138ee01' class='mouseoverHref'>Grube, A.-E. 1878. Anneliden-Ausbeute SMS 'Gazelle'.</a> <!--MARK--><!--MARK--><a href='nullc55e435f-2529-4caf-8a6b-76e58b9412c8' class='mouseoverHref'><em>Monatsberichte der Königlichen Preussischen Akademie der Wissenschaften zu Berlin</em></a> <strong>1877</strong>: 509-554<!--MARK-->","","Article in Journal","f73977e3-3fc8-440e-ab11-d1c5b138ee01","20081009T05:11:37.000+0000","c55e435f-2529-4caf-8a6b-76e58b9412c8"
"Grube, A.-E.","1878","Annulata Semperiana. Beiträge zur kenntniss der annelidenfauna der Philippinen nach den von Herrn Prof. Semper mitgebrachten sammlungen","ix 1-300 pls 1-15","","Mémoires de l'Academie Imperial de la Société des Sciences, Saint Pétersburg","","","","<!--MARK--><a href='nulla33d53ae-dae8-4d74-928b-b39f36689fcc' class='mouseoverHref'>Grube, A.-E. 1878. Annulata Semperiana. Beiträge zur kenntniss der annelidenfauna der Philippinen nach den von Herrn Prof. Semper mitgebrachten sammlungen.</a> <!--MARK--><!--MARK--><a href='nulle0e564a6-69d1-4958-b893-400e49ca467e' class='mouseoverHref'><em>Mémoires de l'Academie Imperial de la Société des Sciences, Saint Pétersburg</em></a> 7 <strong>25</strong>: ix 1-300 pls 1-15<!--MARK-->","","Article in Journal","a33d53ae-dae8-4d74-928b-b39f36689fcc","20081009T05:11:37.000+0000","e0e564a6-69d1-4958-b893-400e49ca467e"
"Hartman, O.","1959","Catalogue of the Polychaetous Annelids of the World. Parts 1 & 2","1-628","","Occasional Papers of the Allan Hancock Foundation","","","","<!--MARK--><a href='null1899ef44-618b-491f-8e80-61cc6f8e04c0' class='mouseoverHref'>Hartman, O. 1959. Catalogue of the Polychaetous Annelids of the World. Parts 1 & 2.</a> <!--MARK--><!--MARK--><a href='nullf871b38d-aa86-4db0-869d-87f3d2323c73' class='mouseoverHref'><em>Occasional Papers of the Allan Hancock Foundation</em></a> <strong>23</strong>: 1-628<!--MARK-->","","Article in Journal","1899ef44-618b-491f-8e80-61cc6f8e04c0","20081009T05:11:37.000+0000","f871b38d-aa86-4db0-869d-87f3d2323c73"
"Hartman, O.","1963","<i>Reteterebella queenslandia</i>, a new genus and species of polychaetous annelid from Queensland, Australia","355-357","","Records of the Australian Museum","","","","<!--MARK--><a href='null10828ac4-bd69-41c2-93fc-2d360cea9d14' class='mouseoverHref'>Hartman, O. 1963. <i>Reteterebella queenslandia</i>, a new genus and species of polychaetous annelid from Queensland, Australia.</a> <!--MARK--><!--MARK--><a href='null7c07530b-0b38-44f5-8f95-368da97d6ac2' class='mouseoverHref'><em>Records of the Australian Museum</em></a> <strong>25</strong>: 355-357<!--MARK-->","","Article in Journal","10828ac4-bd69-41c2-93fc-2d360cea9d14","20081009T05:11:37.000+0000","7c07530b-0b38-44f5-8f95-368da97d6ac2"
"Hartman, O.","1965","Deep-water benthic polychaetous annelids off New England to Bermuda and other North Atlantic areas","1-378","","Allan Hancock Foundation Publications Occasional Papers","","","","<!--MARK--><a href='null9abe9427-5e44-41a3-8b9f-9df4d3f7cfed' class='mouseoverHref'>Hartman, O. 1965. Deep-water benthic polychaetous annelids off New England to Bermuda and other North Atlantic areas.</a> <!--MARK--><!--MARK--><a href='nullc9beb8c3-7f5d-4474-bb80-bae4715e5fdc' class='mouseoverHref'><em>Allan Hancock Foundation Publications Occasional Papers</em></a> <strong>28</strong>: 1-378<!--MARK-->","","Article in Journal","9abe9427-5e44-41a3-8b9f-9df4d3f7cfed","20081009T05:11:37.000+0000","c9beb8c3-7f5d-4474-bb80-bae4715e5fdc"
"Hartmann-Schröder, G.","1980","Teil 4. Die Polychaeten der tropischen Nordwestküste Australiens (zwischen Port Samson im Norden und Exmouth im Süden)","41-110","","","","","","<!--MARK--><a href='null854681ab-5832-47c7-9645-fa11eb1a5454' class='mouseoverHref'>Hartmann-Schröder, G. 1980. Teil 4. Die Polychaeten der tropischen Nordwestküste Australiens (zwischen Port Samson im Norden und Exmouth im Süden). <I>In</I> Hartmann-Schröder, G. & Hartmann, G. Zur Kenntnis des Eulitorals der australischen Küsten unter besonderer Berücksichtigung der Polychaeta.<I> Mitteilungen aus dem Hamburgischen Zoologischen Museum und Institut</I>. 41-110 pp.</a>","","Miscellaneous","854681ab-5832-47c7-9645-fa11eb1a5454","20081009T05:11:37.000+0000",""
"Hartmann-Schröder, G.","1981","Teil 6. Die Polychaeten der tropisch-asubtropischen Westküste Australiens (zwischen Exmouth im Norden und Cervantes im Süden","19-96","","","","","","<!--MARK--><a href='null56fa5e09-d187-4445-b05c-0ae7e715a52e' class='mouseoverHref'>Hartmann-Schröder, G. 1981. Teil 6. Die Polychaeten der tropisch-asubtropischen Westküste Australiens (zwischen Exmouth im Norden und Cervantes im Süden. <I>In</I> Hartmann-Schröder, G. & Hartmann, G. Zur Kenntnis des Eulitorals der australischen Küsten unter besonderer Berücksichtigung der Polychaeta.<I> Mitteilungen aus dem Hamburgischen Zoologischen Museum und Institut</I>. 19-96 pp.</a>","","Miscellaneous","56fa5e09-d187-4445-b05c-0ae7e715a52e","20081009T05:11:37.000+0000",""
"Hartmann-Schröder, G.","1982","Teil 8. Die Polychaeten der subtropisch-antiborealen Westküste Australiens (zwischen Cervantes im Norden und Cape Naturaliste im Süden)","51-118","","","","","","<!--MARK--><a href='null3ee3f19b-ca3e-4f92-a8d3-0321c145b1b1' class='mouseoverHref'>Hartmann-Schröder, G. 1982. Teil 8. Die Polychaeten der subtropisch-antiborealen Westküste Australiens (zwischen Cervantes im Norden und Cape Naturaliste im Süden). <I>In</I> Hartmann-Schröder, G. & Hartmann, G. Zur Kenntnis des Eulitorals der australischen Küsten unter besonderer Berücksichtigung der Polychaeta.<I> Mitteilungen aus dem Hamburgischen Zoologischen Museum und Institut</I>. 51-118 pp.</a>","","Miscellaneous","3ee3f19b-ca3e-4f92-a8d3-0321c145b1b1","20081009T05:11:37.000+0000",""
"Hartmann-Schröder, G.","1983","Teil 9. Die Polychaeten der antiborealen Südwestküste Australiens (zwischen Dunsborough im Norden und Denmark im Süden)","123-167","","","","","","<!--MARK--><a href='null079aff8f-b83e-475c-8fd0-4e06577a09db' class='mouseoverHref'>Hartmann-Schröder, G. 1983. Teil 9. Die Polychaeten der antiborealen Südwestküste Australiens (zwischen Dunsborough im Norden und Denmark im Süden). <I>In</I> Hartmann-Schröder, G. & Hartmann, G. Zur Kenntnis des Eulitorals der australischen Küsten unter besonderer Berücksichtigung der Polychaeta.<I> Mitteilungen aus dem Hamburgischen Zoologischen Museum und Institut</I>. 123-167 pp.</a>","","Miscellaneous","079aff8f-b83e-475c-8fd0-4e06577a09db","20081009T05:11:37.000+0000",""
"Hartmann-Schröder, G.","1984","Teil 10. Die Polychaeten der antiborealen Südküste Australiens (zwischen Albany im Westen und Ceduna im Osten)","7-62","","","","","","<!--MARK--><a href='null54d1beed-3710-4708-bc3a-f49e9ee90da4' class='mouseoverHref'>Hartmann-Schröder, G. 1984. Teil 10. Die Polychaeten der antiborealen Südküste Australiens (zwischen Albany im Westen und Ceduna im Osten). <I>In</I> Hartmann-Schröder, G. & Hartmann, G. Zur Kenntnis des Eulitorals der australischen Küsten unter besonderer Berücksichtigung der Polychaeta.<I> Mitteilungen aus dem Hamburgischen Zoologischen Museum und Institut</I>. 7-62 pp.</a>","","Miscellaneous","54d1beed-3710-4708-bc3a-f49e9ee90da4","20081009T05:11:37.000+0000",""
"Hartmann-Schröder, G.","1985","Teil 11. Die Polychaeten der antiborealen Südküste Australiens (zwischen Port Lincoln im Westen und Port Augusta im Osten)","pp. 61-99","","Mitteilungen aus dem Naturhistorischen Museum in Hamburg","Zur Kenntnis des Eulitorals der australischen Küsten unter besonderer Berücksichtigung der Polychaeta","","","<!--MARK--><a href='nullf9fd2c75-8cd1-48a7-959d-8b4b67085ac3' class='mouseoverHref'>Hartmann-Schröder, G. 1985. Teil 11. Die Polychaeten der antiborealen Südküste Australiens (zwischen Port Lincoln im Westen und Port Augusta im Osten). pp. 61-99</a> <!--MARK--><em>in</em> <!--MARK--><a href='null9555edd0-024b-4420-84cc-ad5a9acd32d2' class='mouseoverHref'>Hartmann-Schröder, G. & Hartmann, G. Zur Kenntnis des Eulitorals der australischen Küsten unter besonderer Berücksichtigung der Polychaeta.</a> <!--MARK--><!--MARK--><a href='null4cda25cf-3a79-4c6d-9438-24f6cf8a82de' class='mouseoverHref'><em>Mitteilungen aus dem Naturhistorischen Museum in Hamburg</em></a> <strong>82</strong><!--MARK-->","","Section in Article","f9fd2c75-8cd1-48a7-959d-8b4b67085ac3","20081009T05:11:37.000+0000","9555edd0-024b-4420-84cc-ad5a9acd32d2"
"Hartmann-Schröder, G.","1986","Teil 12. Die Polychaeten der antiborealen Südküste Australiens (zwischen Wallaroo im Westen und Port MacDonnell im Osten)","31-70","","","","","","<!--MARK--><a href='nulla0fed11c-65a4-4f2a-a265-72f756b1d4a0' class='mouseoverHref'>Hartmann-Schröder, G. 1986. Teil 12. Die Polychaeten der antiborealen Südküste Australiens (zwischen Wallaroo im Westen und Port MacDonnell im Osten). <I>In</I> Hartmann-Schröder, G. & Hartmann, G. Zur Kenntnis des Eulitorals der australischen Küsten unter besonderer Berücksichtigung der Polychaeta.<I> Mitteilungen aus dem Hamburgischen Zoologischen Museum und Institut</I>. 31-70 pp.</a>","","Miscellaneous","a0fed11c-65a4-4f2a-a265-72f756b1d4a0","20081009T05:11:37.000+0000",""
