"PUB_AUTHOR","PUB_YEAR","PUB_TITLE","PUB_PAGES","PUB_PARENT_BOOK_TITLE","PUB_PARENT_JOURNAL_TITLE","PUB_PARENT_ARTICLE_TITLE","PUB_PUBLICATION_DATE","PUB_PUBLISHER","PUB_FORMATTED","PUB_QUALIFICATION","PUB_TYPE","PUBLICATION_GUID","PUBLICATION_LAST_UPDATE","PARENT_PUBLICATION_GUID"
"Common, I.F.B.","1990","Moths of Australia","vi+535 pp., 32 pls","","","","","Melbourne University Press","<!--MARK--><a href='null4761eedc-fc6e-4ab6-bac8-6df695c08580' class='mouseoverHref'>Common, I.F.B. 1990. <em>Moths of Australia</em>. Carlton : Melbourne University Press vi+535 pp., 32 pls.</a><!--MARK-->","","Book","4761eedc-fc6e-4ab6-bac8-6df695c08580","20120306T02:32:31.896+0000",""
"Guenée, A.","1854","Deltoïdes et Pyralites","","Histoire Naturelle des Insectes. Species Général des Lépidoptères","","","","","<!--MARK--><a href='null316297ea-111c-46a3-880a-98f9e7f5b2c3' class='mouseoverHref'>Guenée, A. 1854. Deltoïdes et Pyralites.</a> <!--MARK--><em>In,</em> <!--MARK--><a href='null1a6da77c-cf2f-4385-992e-bd2934c3561d' class='mouseoverHref'>Boisduval, J.-A. & Guenée, A. (eds). <em>Histoire Naturelle des Insectes. Species Général des Lépidoptères</em>. Paris : Librarie Encyclopédique de Roret Vol. 8 448 pp., 10 pls.</a><!--MARK-->","","Chapter in Book","316297ea-111c-46a3-880a-98f9e7f5b2c3","20081009T05:11:37.000+0000","1a6da77c-cf2f-4385-992e-bd2934c3561d"
"Hampson, G.F.","1913","Descriptions of new species of Pyralidae of the subfamily Pyraustinae (continued)","1-38, 299-319","","Annals and Magazine of Natural History","","","","<!--MARK--><a href='null28abb9a8-515d-4ebf-a394-5c85c27efd1a' class='mouseoverHref'>Hampson, G.F. 1913. Descriptions of new species of Pyralidae of the subfamily Pyraustinae (continued).</a> <!--MARK--><!--MARK--><a href='nullefa8de69-3a29-4a43-8ef2-cbefda205976' class='mouseoverHref'><em>Annals and Magazine of Natural History</em></a> 8 <strong>12</strong>: 1-38, 299-319<!--MARK-->","","Article in Journal","28abb9a8-515d-4ebf-a394-5c85c27efd1a","","efa8de69-3a29-4a43-8ef2-cbefda205976"
"Meyrick, E.","1885","On the classification of the Australian Pyralidina","421-456","","Transactions of the Entomological Society of London","","","","<!--MARK--><a href='nullcbb6c155-ba93-4391-8eb3-289f66ff3132' class='mouseoverHref'>Meyrick, E. 1885. On the classification of the Australian Pyralidina.</a> <!--MARK--><!--MARK--><a href='null5cf355b3-abc5-451e-9abc-ed3282d7811a' class='mouseoverHref'><em>Transactions of the Entomological Society of London</em></a> <strong>1885</strong>(4): 421-456<!--MARK-->","","Article in Journal","cbb6c155-ba93-4391-8eb3-289f66ff3132","20081009T05:11:37.000+0000","5cf355b3-abc5-451e-9abc-ed3282d7811a"
"Meyrick, E.","1887","On Pyralidina from Australia and the South Pacific","185-268","","Transactions of the Entomological Society of London","","","","<!--MARK--><a href='nulle1b8f462-a6c6-43d1-8cf3-b03b831333a0' class='mouseoverHref'>Meyrick, E. 1887. On Pyralidina from Australia and the South Pacific.</a> <!--MARK--><!--MARK--><a href='null5cf355b3-abc5-451e-9abc-ed3282d7811a' class='mouseoverHref'><em>Transactions of the Entomological Society of London</em></a> <strong>1887</strong>: 185-268<!--MARK-->","","Article in Journal","e1b8f462-a6c6-43d1-8cf3-b03b831333a0","20081009T05:11:37.000+0000","5cf355b3-abc5-451e-9abc-ed3282d7811a"
"Minet, J.","1991","Tentative reconstruction of the ditrysian phylogeny (Lepidoptera: Glossata)","69-95","","Entomologica Scandinavica","","","","<!--MARK--><a href='null87b03b8b-f856-4639-a82c-79354960b683' class='mouseoverHref'>Minet, J. 1991. Tentative reconstruction of the ditrysian phylogeny (Lepidoptera: Glossata).</a> <!--MARK--><!--MARK--><a href='nullbb9374e3-b7d9-4c48-a5cd-2fb7a1185a84' class='mouseoverHref'><em>Entomologica Scandinavica</em></a> <strong>22</strong>: 69-95<!--MARK-->","","Article in Journal","87b03b8b-f856-4639-a82c-79354960b683","20081009T05:11:37.000+0000","bb9374e3-b7d9-4c48-a5cd-2fb7a1185a84"
"Shaffer, M. & Nielsen, E.S.","1996","Alucitoidea","pp. 154-155","Checklist of the Lepidoptera of Australia. Monographs on Australian Lepidoptera","","","","","<!--MARK--><a href='nullcc616f4c-6703-4870-b6e5-1e960581c21b' class='mouseoverHref'>Shaffer, M. & Nielsen, E.S. 1996. Alucitoidea. pp. 154-155</a> <!--MARK--><em>in</em> <!--MARK--><a href='null378b3781-ecbb-4844-8fe3-625daadd926d' class='mouseoverHref'>Nielsen, E.S., Edwards, E.D. & Rangsi, T.V. (eds). <em>Checklist of the Lepidoptera of Australia. Monographs on Australian Lepidoptera</em>. Collingwood : CSIRO Publishing Vol. 4 xiv 529 pp. & CD-ROM.</a><!--MARK-->","","Chapter in Book","cc616f4c-6703-4870-b6e5-1e960581c21b","20110512T07:30:29.879+0000","378b3781-ecbb-4844-8fe3-625daadd926d"
"Turner, A.J.","1908","New Australian Lepidoptera of the families Noctuidae and Pyralidae","55-109","","Transactions of the Royal Society of South Australia","","","","<!--MARK--><a href='null039b93f9-44fe-44af-9952-a7f6205701f9' class='mouseoverHref'>Turner, A.J. 1908. New Australian Lepidoptera of the families Noctuidae and Pyralidae.</a> <!--MARK--><!--MARK--><a href='null8b48b0a3-dd7a-4aea-be0d-10a223710ebc' class='mouseoverHref'><em>Transactions of the Royal Society of South Australia</em></a> <strong>32</strong>: 55-109<!--MARK-->","","Article in Journal","039b93f9-44fe-44af-9952-a7f6205701f9","20081009T05:11:37.000+0000","8b48b0a3-dd7a-4aea-be0d-10a223710ebc"
"Turner, A.J.","1922","Studies in Australian Lepidoptera","26-62","","Proceedings of the Royal Society of Victoria","","","","<!--MARK--><a href='null026dbd00-cc88-4c3d-b26c-cd0f88f59375' class='mouseoverHref'>Turner, A.J. 1922. Studies in Australian Lepidoptera.</a> <!--MARK--><!--MARK--><a href='nullce333794-3a02-427f-ba27-346079f1efa0' class='mouseoverHref'><em>Proceedings of the Royal Society of Victoria</em></a> <strong>35</strong>(1): 26-62<!--MARK-->","","Article in Journal","026dbd00-cc88-4c3d-b26c-cd0f88f59375","20101107T21:16:56.460+0000","ce333794-3a02-427f-ba27-346079f1efa0"
"Walker, F.","1859","Pyralides","254-508","","List of the Specimens of Lepidopterous Insects in the Collection of the British Museum","","","","<!--MARK--><a href='nulld867a4e3-987a-42ff-976c-eedc2b6aa7ff' class='mouseoverHref'>Walker, F. 1859. Pyralides.</a> <!--MARK--><!--MARK--><a href='null642c8f2c-b31c-4c9f-9ca3-4c940f907155' class='mouseoverHref'><em>List of the Specimens of Lepidopterous Insects in the Collection of the British Museum</em></a> <strong>17</strong>: 254-508<!--MARK-->","","Article in Journal","d867a4e3-987a-42ff-976c-eedc2b6aa7ff","20081009T05:11:37.000+0000","642c8f2c-b31c-4c9f-9ca3-4c940f907155"
"Walker, F.","1864","Tineites","836-1096","","List of the Specimens of Lepidopterous Insects in the Collection of the British Museum","","","","<!--MARK--><a href='nulla97e58de-7cdd-4187-8342-4a55fc3c90c5' class='mouseoverHref'>Walker, F. 1864. Tineites.</a> <!--MARK--><!--MARK--><a href='null642c8f2c-b31c-4c9f-9ca3-4c940f907155' class='mouseoverHref'><em>List of the Specimens of Lepidopterous Insects in the Collection of the British Museum</em></a> <strong>30</strong>: 836-1096<!--MARK--> [incl. Index to parts 27-30]","incl. Index to parts 27-30","Article in Journal","a97e58de-7cdd-4187-8342-4a55fc3c90c5","20081009T05:11:37.000+0000","642c8f2c-b31c-4c9f-9ca3-4c940f907155"
"Walsingham, Lord","1885","Characters of two new Pterophoridae, from specimens in the British Museum","175, 176","","Entomologist's Monthly Magazine","","","","<!--MARK--><a href='null944591be-421f-447b-b639-7b5ad9f025ba' class='mouseoverHref'>Walsingham, Lord 1885. Characters of two new Pterophoridae, from specimens in the British Museum.</a> <!--MARK--><!--MARK--><a href='nullcbd5c497-64d0-4fae-97ee-22719c3ca286' class='mouseoverHref'><em>Entomologist's Monthly Magazine</em></a> <strong>21</strong>: 175, 176<!--MARK-->","","Article in Journal","944591be-421f-447b-b639-7b5ad9f025ba","20081009T05:11:37.000+0000","cbd5c497-64d0-4fae-97ee-22719c3ca286"
