"PUB_AUTHOR","PUB_YEAR","PUB_TITLE","PUB_PAGES","PUB_PARENT_BOOK_TITLE","PUB_PARENT_JOURNAL_TITLE","PUB_PARENT_ARTICLE_TITLE","PUB_PUBLICATION_DATE","PUB_PUBLISHER","PUB_FORMATTED","PUB_QUALIFICATION","PUB_TYPE","PUBLICATION_GUID","PUBLICATION_LAST_UPDATE","PARENT_PUBLICATION_GUID"
"Ashmead, W.H.","1900","Notes on some New Zealand and Australian parasitic Hymenoptera, with descriptions of new genera and species","327-360","","Proceedings of the Linnean Society of New South Wales","","","","<!--MARK--><a href='nullceed36e0-88c9-4f5e-8adb-680445a28891' class='mouseoverHref'>Ashmead, W.H. 1900. Notes on some New Zealand and Australian parasitic Hymenoptera, with descriptions of new genera and species.</a> <!--MARK--><!--MARK--><a href='nullc12cd779-adb5-41ea-bd2c-75f6864cf22e' class='mouseoverHref'><em>Proceedings of the Linnean Society of New South Wales</em></a> <strong>25</strong>: 327-360<!--MARK-->","","Article in Journal","ceed36e0-88c9-4f5e-8adb-680445a28891","20081009T05:11:37.000+0000","c12cd779-adb5-41ea-bd2c-75f6864cf22e"
"Boheman, C.H.","1834","Skandinaviska Pteromaliner","329-380","","Kongliga Svenska Vetenskaps-Academiens Nya Handlingar, Stockholm","","","","<!--MARK--><a href='null69c64c64-2055-4549-a15c-c5a87e459034' class='mouseoverHref'>Boheman, C.H. 1834. Skandinaviska Pteromaliner.</a> <!--MARK--><!--MARK--><a href='nullf145f16a-592b-484d-8689-ce403bec0970' class='mouseoverHref'><em>Kongliga Svenska Vetenskaps-Academiens Nya Handlingar, Stockholm</em></a> <strong>1833</strong>: 329-380<!--MARK-->","","Article in Journal","69c64c64-2055-4549-a15c-c5a87e459034","20081009T05:11:37.000+0000","f145f16a-592b-484d-8689-ce403bec0970"
"Boucek, Z.","1988","Australasian Chalcidoidea (Hymenoptera). A biosystematic revision of genera of fourteen families, with a reclassification of species","832 pp.","","","","","CAB International","<!--MARK--><a href='null6538deee-ea6e-40e0-acb6-5d48bac37b52' class='mouseoverHref'>Boucek, Z. 1988. <em>Australasian Chalcidoidea (Hymenoptera). A biosystematic revision of genera of fourteen families, with a reclassification of species</em>. London : CAB International 832 pp.</a><!--MARK-->","","Book","6538deee-ea6e-40e0-acb6-5d48bac37b52","20081009T05:11:37.000+0000",""
"Cameron, P.","1912","On a collection of parasitic Hymenoptera (chiefly bred) made by Mr. Walter W. Froggatt F.L.S., in New South Wales, with descriptions of new genera and species. Part ii","636-655","","Proceedings of the Linnean Society of New South Wales","","16/05/1912","","<!--MARK--><a href='nullf3962c65-e370-47a0-bd36-594cee6ff085' class='mouseoverHref'>Cameron, P. 1912. On a collection of parasitic Hymenoptera (chiefly bred) made by Mr. Walter W. Froggatt F.L.S., in New South Wales, with descriptions of new genera and species. Part ii.</a> <!--MARK--><!--MARK--><a href='nullc12cd779-adb5-41ea-bd2c-75f6864cf22e' class='mouseoverHref'><em>Proceedings of the Linnean Society of New South Wales</em></a> <strong>36</strong>: 636-655<!--MARK--> [Date published 16/05/1912]","","Article in Journal","f3962c65-e370-47a0-bd36-594cee6ff085","20081009T05:11:37.000+0000","c12cd779-adb5-41ea-bd2c-75f6864cf22e"
"Crawford, J.C.","1912","Descriptions of new Hymenoptera. No. 4","1-10","","Proceedings of the United States National Museum","","6/03/1912","","<!--MARK--><a href='nullc339e084-3acc-48de-8cbb-e558410926c4' class='mouseoverHref'>Crawford, J.C. 1912. Descriptions of new Hymenoptera. No. 4.</a> <!--MARK--><!--MARK--><a href='null0e32c453-4bc6-48a2-a3a2-d40281874533' class='mouseoverHref'><em>Proceedings of the United States National Museum</em></a> <strong>42</strong>: 1-10<!--MARK--> [Date published 6/03/1912]","","Article in Journal","c339e084-3acc-48de-8cbb-e558410926c4","20081009T05:11:37.000+0000","0e32c453-4bc6-48a2-a3a2-d40281874533"
"Dalla Torre, K.W. van","1897","Zur Nomenclatur der Chalcididen-Genera","83-88","","Wiener Entomologische Zeitung","","","","<!--MARK--><a href='null5ea34477-c8ac-41d1-94de-c6da49d7b246' class='mouseoverHref'>Dalla Torre, K.W. van 1897. Zur Nomenclatur der Chalcididen-Genera.</a> <!--MARK--><!--MARK--><a href='null9b6f9f14-04ca-437e-a5d2-714ac39f9aa0' class='mouseoverHref'><em>Wiener Entomologische Zeitung</em></a> <strong>16</strong>: 83-88<!--MARK-->","","Article in Journal","5ea34477-c8ac-41d1-94de-c6da49d7b246","20081009T05:11:37.000+0000","9b6f9f14-04ca-437e-a5d2-714ac39f9aa0"
"Dalman, J.W.","1820","Försök till Uppställning af Insect-familjen Pteromalini, i synnerhet med afseen de på de i Sverige funne Arter","123-174, 177-182, Tab VII-VIII","","Kongliga Svenska Vetenskaps-Academiens Nya Handlingar, Stockholm","","","","<!--MARK--><a href='null72c22174-5428-4a1a-a9b7-ed4f1d1b6123' class='mouseoverHref'>Dalman, J.W. 1820. Försök till Uppställning af Insect-familjen Pteromalini, i synnerhet med afseen de på de i Sverige funne Arter.</a> <!--MARK--><!--MARK--><a href='nullf145f16a-592b-484d-8689-ce403bec0970' class='mouseoverHref'><em>Kongliga Svenska Vetenskaps-Academiens Nya Handlingar, Stockholm</em></a> <strong>41</strong>: 123-174, 177-182, Tab VII-VIII<!--MARK-->","","Article in Journal","72c22174-5428-4a1a-a9b7-ed4f1d1b6123","20081009T05:11:37.000+0000","f145f16a-592b-484d-8689-ce403bec0970"
"Dalman, J.W.","1825","Om Insekter inneslutne i Copal; jemte beskrifning på några deribland förekommande nya slägten och arter","375-410, Tab. V","","Kongliga Svenska Vetenskaps-Academiens Nya Handlingar, Stockholm","","","","<!--MARK--><a href='null63e0a802-a630-47ca-bcbf-72661dde85ba' class='mouseoverHref'>Dalman, J.W. 1825. Om Insekter inneslutne i Copal; jemte beskrifning på några deribland förekommande nya slägten och arter.</a> <!--MARK--><!--MARK--><a href='nullf145f16a-592b-484d-8689-ce403bec0970' class='mouseoverHref'><em>Kongliga Svenska Vetenskaps-Academiens Nya Handlingar, Stockholm</em></a> <strong>46</strong>: 375-410, Tab. V<!--MARK-->","","Article in Journal","63e0a802-a630-47ca-bcbf-72661dde85ba","20081009T05:11:37.000+0000","f145f16a-592b-484d-8689-ce403bec0970"
"Dodd, A.P.","1917","Records, etc., of Australian Chalcidoidea","344-368","","Transactions of the Royal Society of South Australia","","","","<!--MARK--><a href='nullbe1c732a-1d0d-408f-aba6-8a89d54e4fd2' class='mouseoverHref'>Dodd, A.P. 1917. Records, etc., of Australian Chalcidoidea.</a> <!--MARK--><!--MARK--><a href='null8b48b0a3-dd7a-4aea-be0d-10a223710ebc' class='mouseoverHref'><em>Transactions of the Royal Society of South Australia</em></a> <strong>41</strong>: 344-368<!--MARK-->","","Article in Journal","be1c732a-1d0d-408f-aba6-8a89d54e4fd2","20081009T05:11:37.000+0000","8b48b0a3-dd7a-4aea-be0d-10a223710ebc"
"Doganlar, M.","2011","Review of Palearctic and Australian species of <em>Bootanomyia</em> Girault 1915 (Hymenoptera: Torymidae: Megastigminae), with descriptions of new species.","123-157","","Turkish Journal of Zoology","","","","<!--MARK--><a href='null7cb2ac47-641e-43b4-90e9-c6700f6e0612' class='mouseoverHref'>Doganlar, M. 2011. Review of Palearctic and Australian species of <em>Bootanomyia</em> Girault 1915 (Hymenoptera: Torymidae: Megastigminae), with descriptions of new species.</a> <!--MARK--><!--MARK--><a href='nullba4e5fa3-bcaa-4294-8e0a-96da570eada0' class='mouseoverHref'><em>Turkish Journal of Zoology</em></a> <strong>35</strong>(2): 123-157<!--MARK-->","","Article in Journal","7cb2ac47-641e-43b4-90e9-c6700f6e0612","20120328T05:07:16.149+0000","ba4e5fa3-bcaa-4294-8e0a-96da570eada0"
"Do?anlar, M. & Hassan, E.","2010","Review of Australian species of <em>Megastigmus</em> (Hymenoptera: Torymidae) associated with <em>Eucalyptus</em>, with descriptions of new species.","5059-5120","","Australian Journal of Basic and Applied Sciences","","","","<!--MARK--><a href='null19c44e70-17bd-45cf-89fb-dc596e5da62a' class='mouseoverHref'>Do?anlar, M. & Hassan, E. 2010. Review of Australian species of <em>Megastigmus</em> (Hymenoptera: Torymidae) associated with <em>Eucalyptus</em>, with descriptions of new species.</a> <!--MARK--><!--MARK--><a href='nullf92e075a-1106-40c2-96e0-dfd424113f69' class='mouseoverHref'><em>Australian Journal of Basic and Applied Sciences</em></a> <strong>4</strong>(10): 5059-5120<!--MARK-->","","Article in Journal","19c44e70-17bd-45cf-89fb-dc596e5da62a","20120328T23:29:44.555+0000","f92e075a-1106-40c2-96e0-dfd424113f69"
"Froggatt, W.W.","1905","The insects of the Kurrajong (<i>Brachychiton populaneum</i>)","226-234, 2 pls","","Agricultural Gazette of New South Wales","","2/03/1905","","<!--MARK--><a href='nullfa561beb-0511-4c88-84c1-2ce241f8abf3' class='mouseoverHref'>Froggatt, W.W. 1905. The insects of the Kurrajong (<i>Brachychiton populaneum</i>).</a> <!--MARK--><!--MARK--><a href='null4197a935-3630-406b-b88e-759e63272a02' class='mouseoverHref'><em>Agricultural Gazette of New South Wales</em></a> <strong>16</strong>: 226-234, 2 pls<!--MARK--> [Date published 2/03/1905]","","Article in Journal","fa561beb-0511-4c88-84c1-2ce241f8abf3","20081009T05:11:37.000+0000","4197a935-3630-406b-b88e-759e63272a02"
"Girault, A.A.","1913","A few new chalcidoid Hymenoptera from Queensland, Australia","35-48","","Bulletin of the Wisconsin Natural History Society (new series)","","29/12/1913","","<!--MARK--><a href='nullbd70e6cd-5ba7-44f1-9ef8-a17b1af78e37' class='mouseoverHref'>Girault, A.A. 1913. A few new chalcidoid Hymenoptera from Queensland, Australia.</a> <!--MARK--><!--MARK--><a href='null90a85795-5301-4334-a058-35e277fb90c7' class='mouseoverHref'><em>Bulletin of the Wisconsin Natural History Society (new series)</em></a> <strong>11</strong>: 35-48<!--MARK--> [Date published 29/12/1913]","","Article in Journal","bd70e6cd-5ba7-44f1-9ef8-a17b1af78e37","20081009T05:11:37.000+0000","90a85795-5301-4334-a058-35e277fb90c7"
"Girault, A.A.","1913","A new species of Elasmidae of the genus <i>Euryischia</i> Howard from Australia, and a new <i>Podagrionella</i>","427-428","","Canadian Entomologist","","19/12/1913","","<!--MARK--><a href='null4932b073-0b43-429b-91fc-22410548a761' class='mouseoverHref'>Girault, A.A. 1913. A new species of Elasmidae of the genus <i>Euryischia</i> Howard from Australia, and a new <i>Podagrionella</i>.</a> <!--MARK--><!--MARK--><a href='null9d5731c8-13cf-4e25-a989-3cafc4ce3925' class='mouseoverHref'><em>Canadian Entomologist</em></a> <strong>45</strong>: 427-428<!--MARK--> [Date published 19/12/1913]","","Article in Journal","4932b073-0b43-429b-91fc-22410548a761","20081009T05:11:37.000+0000","9d5731c8-13cf-4e25-a989-3cafc4ce3925"
"Girault, A.A.","1913","Diagnoses of new chalcidoid Hymenoptera from Queensland, Australia","90-107","","Archiv für Naturgeschichte","","30/09/1913","","<!--MARK--><a href='null0ac2e041-9ebd-471f-bc10-75625746c75e' class='mouseoverHref'>Girault, A.A. 1913. Diagnoses of new chalcidoid Hymenoptera from Queensland, Australia.</a> <!--MARK--><!--MARK--><a href='nullf5b5f7c7-fc53-4502-951d-1c96b680d874' class='mouseoverHref'><em>Archiv für Naturgeschichte</em></a> <strong>79</strong>: 90-107<!--MARK--> [Date published 30/09/1913]","","Article in Journal","0ac2e041-9ebd-471f-bc10-75625746c75e","20081009T05:11:37.000+0000","f5b5f7c7-fc53-4502-951d-1c96b680d874"
"Girault, A.A.","1913","New genera and species of chalcidoid Hymenoptera from North Queensland","46-51","","Archiv für Naturgeschichte","","30/09/1913","","<!--MARK--><a href='nullbc327fa1-47fa-411f-b078-e7033cbbc0d6' class='mouseoverHref'>Girault, A.A. 1913. New genera and species of chalcidoid Hymenoptera from North Queensland.</a> <!--MARK--><!--MARK--><a href='nullf5b5f7c7-fc53-4502-951d-1c96b680d874' class='mouseoverHref'><em>Archiv für Naturgeschichte</em></a> <strong>79</strong>: 46-51<!--MARK--> [Date published 30/09/1913]","","Article in Journal","bc327fa1-47fa-411f-b078-e7033cbbc0d6","20081009T05:11:37.000+0000","f5b5f7c7-fc53-4502-951d-1c96b680d874"
"Girault, A.A.","1913","New genera and species of chalcidoid Hymenoptera in the South Australia Museum, Adelaide","67-115","","Transactions of the Royal Society of South Australia","","31/12/1913","","<!--MARK--><a href='null93dc246b-b07f-4dca-aac0-b11edc3e119a' class='mouseoverHref'>Girault, A.A. 1913. New genera and species of chalcidoid Hymenoptera in the South Australia Museum, Adelaide.</a> <!--MARK--><!--MARK--><a href='null8b48b0a3-dd7a-4aea-be0d-10a223710ebc' class='mouseoverHref'><em>Transactions of the Royal Society of South Australia</em></a> <strong>37</strong>: 67-115<!--MARK--> [Date published 31/12/1913]","","Article in Journal","93dc246b-b07f-4dca-aac0-b11edc3e119a","20081009T05:11:37.000+0000","8b48b0a3-dd7a-4aea-be0d-10a223710ebc"
"Girault, A.A.","1913","On several new genera and species of Australian Hymenoptera Chalcidoidea. (continued)","138-145","","Canadian Entomologist","","17/05/1913","","<!--MARK--><a href='nullfabf3888-b68e-471a-bd02-7fe1f2b2f2e2' class='mouseoverHref'>Girault, A.A. 1913. On several new genera and species of Australian Hymenoptera Chalcidoidea. (continued).</a> <!--MARK--><!--MARK--><a href='null9d5731c8-13cf-4e25-a989-3cafc4ce3925' class='mouseoverHref'><em>Canadian Entomologist</em></a> <strong>45</strong>: 138-145<!--MARK--> [Date published 17/05/1913]","","Article in Journal","fabf3888-b68e-471a-bd02-7fe1f2b2f2e2","20081009T05:11:37.000+0000","9d5731c8-13cf-4e25-a989-3cafc4ce3925"
"Girault, A.A.","1913","Some chalcidoid Hymenoptera from north Queensland","70-90","","Archiv für Naturgeschichte","","30/09/1913","","<!--MARK--><a href='null9d27e3aa-19b9-4884-9ca2-e2a06a5ddde2' class='mouseoverHref'>Girault, A.A. 1913. Some chalcidoid Hymenoptera from north Queensland.</a> <!--MARK--><!--MARK--><a href='nullf5b5f7c7-fc53-4502-951d-1c96b680d874' class='mouseoverHref'><em>Archiv für Naturgeschichte</em></a> <strong>79</strong>: 70-90<!--MARK--> [Date published 30/09/1913]","","Article in Journal","9d27e3aa-19b9-4884-9ca2-e2a06a5ddde2","20081009T05:11:37.000+0000","f5b5f7c7-fc53-4502-951d-1c96b680d874"
"Girault, A.A.","1913","Some new Australian genera in the Hymenopterous families Eurytomidae, Perilampidae, Eucharitidae and Cleonyminae","220-228","","Canadian Entomologist","","8/07/1913","","<!--MARK--><a href='null6a064a2f-1aa8-418d-96a7-3c4835524997' class='mouseoverHref'>Girault, A.A. 1913. Some new Australian genera in the Hymenopterous families Eurytomidae, Perilampidae, Eucharitidae and Cleonyminae.</a> <!--MARK--><!--MARK--><a href='null9d5731c8-13cf-4e25-a989-3cafc4ce3925' class='mouseoverHref'><em>Canadian Entomologist</em></a> <strong>45</strong>: 220-228<!--MARK--> [Date published 8/07/1913]","","Article in Journal","6a064a2f-1aa8-418d-96a7-3c4835524997","20081009T05:11:37.000+0000","9d5731c8-13cf-4e25-a989-3cafc4ce3925"
"Girault, A.A.","1914","A new megastigmid from Queensland, Australia","25","","Entomological News","","2/01/1914","","<!--MARK--><a href='nulla0e471db-1539-46b4-93f9-0f6685dc3206' class='mouseoverHref'>Girault, A.A. 1914. A new megastigmid from Queensland, Australia.</a> <!--MARK--><!--MARK--><a href='null5d005da8-9486-4c74-aff9-355663c15a73' class='mouseoverHref'><em>Entomological News</em></a> <strong>25</strong>: 25<!--MARK--> [Date published 2/01/1914]","","Article in Journal","a0e471db-1539-46b4-93f9-0f6685dc3206","20081009T05:11:37.000+0000","5d005da8-9486-4c74-aff9-355663c15a73"
"Girault, A.A.","1914","Descriptions of new chalcid-flies","109-119","","Proceedings of the Entomological Society of Washington","","26/09/1914","","<!--MARK--><a href='null1bc08224-0bcd-4d6d-a249-19e7312d5604' class='mouseoverHref'>Girault, A.A. 1914. Descriptions of new chalcid-flies.</a> <!--MARK--><!--MARK--><a href='null4ba9cd44-fd2a-4a01-b171-da890c5efd6b' class='mouseoverHref'><em>Proceedings of the Entomological Society of Washington</em></a> <strong>16</strong>: 109-119<!--MARK--> [Date published 26/09/1914]","","Article in Journal","1bc08224-0bcd-4d6d-a249-19e7312d5604","20081009T05:11:37.000+0000","4ba9cd44-fd2a-4a01-b171-da890c5efd6b"
"Girault, A.A.","1914","Some new Australian genera and species of chalcidoid Hymenoptera of the families Chalcididae, Callimomidae, Eurytomidae, Pteromalidae and Miscogasteridae","47-48","","Societas Entomologica. Frankfurt","","30/05/1914","","<!--MARK--><a href='null2ee3f372-6ce1-4594-9605-f605a0ac9e90' class='mouseoverHref'>Girault, A.A. 1914. Some new Australian genera and species of chalcidoid Hymenoptera of the families Chalcididae, Callimomidae, Eurytomidae, Pteromalidae and Miscogasteridae.</a> <!--MARK--><!--MARK--><a href='null7d572a9d-3cf0-4b2b-b6df-975506df8111' class='mouseoverHref'><em>Societas Entomologica. Frankfurt</em></a> <strong>29</strong>: 47-48<!--MARK--> [Date published 30/05/1914]","","Article in Journal","2ee3f372-6ce1-4594-9605-f605a0ac9e90","20081009T05:11:37.000+0000","7d572a9d-3cf0-4b2b-b6df-975506df8111"
"Girault, A.A.","1915","Australian Hymenoptera Chalcidoidea, XII. The family Callimomidae with descriptions of new genera and species","275-309","","Memoirs of the Queensland Museum","","4/06/1915","","<!--MARK--><a href='null20841b9a-35c4-4991-bc7c-5ddebd1a8c0a' class='mouseoverHref'>Girault, A.A. 1915. Australian Hymenoptera Chalcidoidea, XII. The family Callimomidae with descriptions of new genera and species.</a> <!--MARK--><!--MARK--><a href='null1a0a2982-9f30-43e1-a641-b0379699837c' class='mouseoverHref'><em>Memoirs of the Queensland Museum</em></a> <strong>4</strong>: 275-309<!--MARK--> [Date published 4/06/1915]","","Article in Journal","20841b9a-35c4-4991-bc7c-5ddebd1a8c0a","20081009T05:11:37.000+0000","1a0a2982-9f30-43e1-a641-b0379699837c"
"Girault, A.A.","1915","Australian Hymenoptera Chalcidoidea -- XIV. The family Chalcididae with descriptions of new genera and species","314-365","","Memoirs of the Queensland Museum","","4/06/1915","","<!--MARK--><a href='nullb6d24f06-66e0-4b61-9305-fdfc2af47df2' class='mouseoverHref'>Girault, A.A. 1915. Australian Hymenoptera Chalcidoidea -- XIV. The family Chalcididae with descriptions of new genera and species.</a> <!--MARK--><!--MARK--><a href='null1a0a2982-9f30-43e1-a641-b0379699837c' class='mouseoverHref'><em>Memoirs of the Queensland Museum</em></a> <strong>4</strong>: 314-365<!--MARK--> [Date published 4/06/1915]","","Article in Journal","b6d24f06-66e0-4b61-9305-fdfc2af47df2","20081009T05:11:37.000+0000","1a0a2982-9f30-43e1-a641-b0379699837c"
"Girault, A.A.","1915","Some chalcidoid Hymenoptera from north Queensland. (continued)","42-48","","Canadian Entomologist","","11/02/1915","","<!--MARK--><a href='null3ecfa3d2-6e15-482c-a4b7-64764c46605c' class='mouseoverHref'>Girault, A.A. 1915. Some chalcidoid Hymenoptera from north Queensland. (continued).</a> <!--MARK--><!--MARK--><a href='null9d5731c8-13cf-4e25-a989-3cafc4ce3925' class='mouseoverHref'><em>Canadian Entomologist</em></a> <strong>47</strong>: 42-48<!--MARK--> [Date published 11/02/1915]","","Article in Journal","3ecfa3d2-6e15-482c-a4b7-64764c46605c","20081009T05:11:37.000+0000","9d5731c8-13cf-4e25-a989-3cafc4ce3925"
"Girault, A.A.","1917","New Australian chalcid-flies (Hymenoptera Chalcididae)","133-155","","Insecutor Inscitiae Menstruus. Washington","","15/10/1917","","<!--MARK--><a href='null1e4297fc-7896-48ad-a50b-91a647fbb702' class='mouseoverHref'>Girault, A.A. 1917. New Australian chalcid-flies (Hymenoptera Chalcididae).</a> <!--MARK--><!--MARK--><a href='null9509b709-55bf-43bd-81e9-a24347df8b5b' class='mouseoverHref'><em>Insecutor Inscitiae Menstruus. Washington</em></a> <strong>5</strong>: 133-155<!--MARK--> [Date published 15/10/1917]","","Article in Journal","1e4297fc-7896-48ad-a50b-91a647fbb702","20081009T05:11:37.000+0000","9509b709-55bf-43bd-81e9-a24347df8b5b"
"Girault, A.A.","1921","New animals of Australia and old men of the Earth","3 pp.","","","","10/11/1921","","<!--MARK--><a href='null53285261-9e7f-459a-9e12-864806b8db40' class='mouseoverHref'>Girault, A.A. 1921. New animals of Australia and old men of the Earth. Privately Published. 3 pp.</a>","","Miscellaneous","53285261-9e7f-459a-9e12-864806b8db40","20081009T05:11:37.000+0000",""
"Girault, A.A.","1923","Microscopitis, womanitis and new hexapods","7 pp.","","","","31/10/1923","","<!--MARK--><a href='nullbc94830d-a2e8-43f6-9256-3aeb7ece32f6' class='mouseoverHref'>Girault, A.A. 1923. Microscopitis, womanitis and new hexapods. Privately Published. 7 pp.</a>","","Miscellaneous","bc94830d-a2e8-43f6-9256-3aeb7ece32f6","20081009T05:11:37.000+0000",""
"Girault, A.A.","1924","Notes and descriptions of Australian chalcid flies. II","172-176","","Insecutor Inscitiae Menstruus. Washington","","22/10/1924","","<!--MARK--><a href='null504e741f-7131-4b1d-9aa7-afd7c081ae6f' class='mouseoverHref'>Girault, A.A. 1924. Notes and descriptions of Australian chalcid flies. II.</a> <!--MARK--><!--MARK--><a href='null9509b709-55bf-43bd-81e9-a24347df8b5b' class='mouseoverHref'><em>Insecutor Inscitiae Menstruus. Washington</em></a> <strong>12</strong>: 172-176<!--MARK--> [Date published 22/10/1924]","","Article in Journal","504e741f-7131-4b1d-9aa7-afd7c081ae6f","20081009T05:11:37.000+0000","9509b709-55bf-43bd-81e9-a24347df8b5b"
"Girault, A.A.","1925","New Queensland Insecta captured without any reference to use","2 pp.","","","","15/12/1925","","<!--MARK--><a href='null14d9255a-d90a-436c-8227-0ed8e3e0553f' class='mouseoverHref'>Girault, A.A. 1925. New Queensland Insecta captured without any reference to use. Privately Published. 2 pp.</a>","","Miscellaneous","14d9255a-d90a-436c-8227-0ed8e3e0553f","20081009T05:11:37.000+0000",""
"Girault, A.A.","1925","Notes and descriptions of Australian chalcid-flies III. (Hymenoptera)","91-100","","Insecutor Inscitiae Menstruus. Washington","","15/05/1925","","<!--MARK--><a href='null8857365b-7988-419b-966f-a2949ceda530' class='mouseoverHref'>Girault, A.A. 1925. Notes and descriptions of Australian chalcid-flies III. (Hymenoptera).</a> <!--MARK--><!--MARK--><a href='null9509b709-55bf-43bd-81e9-a24347df8b5b' class='mouseoverHref'><em>Insecutor Inscitiae Menstruus. Washington</em></a> <strong>13</strong>: 91-100<!--MARK--> [Date published 15/05/1925]","","Article in Journal","8857365b-7988-419b-966f-a2949ceda530","20081009T05:11:37.000+0000","9509b709-55bf-43bd-81e9-a24347df8b5b"
"Girault, A.A.","1926","<i>Characteristics of new Australian insects</i>","2","","","","24 Feb. 1926","","<!--MARK--><a href='null6dfdf655-97cd-4c45-aaba-66a49b8241bd' class='mouseoverHref'>Girault, A.A. 1926. <i>Characteristics of new Australian insects</i>. Brisbane : Private Publication. 2 pp.</a>","","Miscellaneous","6dfdf655-97cd-4c45-aaba-66a49b8241bd","20081009T05:11:37.000+0000",""
"Girault, A.A.","1926","New pests from Australia II","3 pp.","","","","30/04/1926","","<!--MARK--><a href='nulld16482c9-27aa-44d1-834c-cdbc76dec945' class='mouseoverHref'>Girault, A.A. 1926. New pests from Australia II. Privately Published. 3 pp.</a>","","Miscellaneous","d16482c9-27aa-44d1-834c-cdbc76dec945","20081009T05:11:37.000+0000",""
"Girault, A.A.","1927","Notes on and descriptions of chalcid wasps (Chalcididae) in the South Australian Museum","309-338","","Records of the South Australian Museum (Adelaide)","","30/06/1927","","<!--MARK--><a href='nullde44c8bf-bf56-43d5-b820-402f770a07cb' class='mouseoverHref'>Girault, A.A. 1927. Notes on and descriptions of chalcid wasps (Chalcididae) in the South Australian Museum.</a> <!--MARK--><!--MARK--><a href='nullf7f76869-b0b8-4c0e-a1bc-1d8c43cc0f89' class='mouseoverHref'><em>Records of the South Australian Museum (Adelaide)</em></a> <strong>3</strong>: 309-338<!--MARK--> [Date published 30/06/1927]","","Article in Journal","de44c8bf-bf56-43d5-b820-402f770a07cb","20081009T05:11:37.000+0000","f7f76869-b0b8-4c0e-a1bc-1d8c43cc0f89"
"Girault, A.A.","1928","A prodigeous discourse on wild animals","3 pp.","","","","","Published privately","<!--MARK--><a href='nulle86a9765-7040-4a56-8967-a1c1bcb519f5' class='mouseoverHref'>Girault, A.A. 1928. <em>A prodigeous discourse on wild animals</em>. Brisbane : Published privately 3 pp.</a><!--MARK-->","","Book","e86a9765-7040-4a56-8967-a1c1bcb519f5","20081009T05:11:37.000+0000",""
"Girault, A.A.","1928","Australian chalcid-wasps","261-263","","Victorian Naturalist","","7/01/1928","","<!--MARK--><a href='nullf947a577-ffb6-4833-a90d-cb6e40f463bb' class='mouseoverHref'>Girault, A.A. 1928. Australian chalcid-wasps.</a> <!--MARK--><!--MARK--><a href='null97b8093b-d60f-43a6-94fc-97de34f03b6b' class='mouseoverHref'><em>Victorian Naturalist</em></a> <strong>44</strong>: 261-263<!--MARK--> [Date published 7/01/1928]","","Article in Journal","f947a577-ffb6-4833-a90d-cb6e40f463bb","20081009T05:11:37.000+0000","97b8093b-d60f-43a6-94fc-97de34f03b6b"
"Girault, A.A.","1929","New pests from Australia","4 pp.","","","","","Published privately","<!--MARK--><a href='nulle1be5ea3-9ef8-439c-a7c7-d2768064e018' class='mouseoverHref'>Girault, A.A. 1929. <em>New pests from Australia</em>. Brisbane : Published privately Vol. 6 4 pp.</a><!--MARK-->","","Book","e1be5ea3-9ef8-439c-a7c7-d2768064e018","20081009T05:11:37.000+0000",""
"Girault, A.A.","1929","Notes on, and descriptions of, chalcid wasps in South Australian Museum. Concluding paper","309-346","","Transactions of the Royal Society of South Australia","","24/12/1929","","<!--MARK--><a href='null237c3fc1-ff98-40aa-83cc-1c5ada2fdb31' class='mouseoverHref'>Girault, A.A. 1929. Notes on, and descriptions of, chalcid wasps in South Australian Museum. Concluding paper.</a> <!--MARK--><!--MARK--><a href='null8b48b0a3-dd7a-4aea-be0d-10a223710ebc' class='mouseoverHref'><em>Transactions of the Royal Society of South Australia</em></a> <strong>53</strong>: 309-346<!--MARK--> [Date published 24/12/1929]","","Article in Journal","237c3fc1-ff98-40aa-83cc-1c5ada2fdb31","20081009T05:11:37.000+0000","8b48b0a3-dd7a-4aea-be0d-10a223710ebc"
