"PUB_AUTHOR","PUB_YEAR","PUB_TITLE","PUB_PAGES","PUB_PARENT_BOOK_TITLE","PUB_PARENT_JOURNAL_TITLE","PUB_PARENT_ARTICLE_TITLE","PUB_PUBLICATION_DATE","PUB_PUBLISHER","PUB_FORMATTED","PUB_QUALIFICATION","PUB_TYPE","PUBLICATION_GUID","PUBLICATION_LAST_UPDATE","PARENT_PUBLICATION_GUID"
"Ball, G.E. & Hilchie, G.J.","1983","Cymindine Lebiini of authors: Redefinition and reclassification of genera (Coleoptera: Carabidae)","93-216","","Quaestiones Entomologicae","","","","<!--MARK--><a href='nullca43e1e0-b048-4cf4-8ab8-537570440084' class='mouseoverHref'>Ball, G.E. & Hilchie, G.J. 1983. Cymindine Lebiini of authors: Redefinition and reclassification of genera (Coleoptera: Carabidae).</a> <!--MARK--><!--MARK--><a href='null98f2c9e4-2641-4cb2-ab80-823823956331' class='mouseoverHref'><em>Quaestiones Entomologicae</em></a> <strong>19</strong>: 93-216<!--MARK-->","","Article in Journal","ca43e1e0-b048-4cf4-8ab8-537570440084","20081009T05:11:37.000+0000","98f2c9e4-2641-4cb2-ab80-823823956331"
"Blackburn, T.","1892","Notes on Australian Coleoptera, with descriptions of new species. Part XI.","65-151","","Proceedings of the Linnean Society of New South Wales","","","","<!--MARK--><a href='nullf1a03978-9bfc-4785-b8d7-9880fe4badeb' class='mouseoverHref'>Blackburn, T. 1892. Notes on Australian Coleoptera, with descriptions of new species. Part XI.</a> <!--MARK--><!--MARK--><a href='nullc12cd779-adb5-41ea-bd2c-75f6864cf22e' class='mouseoverHref'><em>Proceedings of the Linnean Society of New South Wales</em></a> 2 <strong>7</strong>(I): 65-151<!--MARK-->","","Article in Journal","f1a03978-9bfc-4785-b8d7-9880fe4badeb","20111219T20:59:06.127+0000","c12cd779-adb5-41ea-bd2c-75f6864cf22e"
"Blackburn, T.","1901","Further notes on Australian Coleoptera with descriptions of new genera and species. Part XXIX","99-131","","Transactions of the Royal Society of South Australia","","","","<!--MARK--><a href='null7bb17739-7198-43ec-9e9e-3f121b871b6d' class='mouseoverHref'>Blackburn, T. 1901. Further notes on Australian Coleoptera with descriptions of new genera and species. Part XXIX.</a> <!--MARK--><!--MARK--><a href='null8b48b0a3-dd7a-4aea-be0d-10a223710ebc' class='mouseoverHref'><em>Transactions of the Royal Society of South Australia</em></a> <strong>25</strong>: 99-131<!--MARK-->","","Article in Journal","7bb17739-7198-43ec-9e9e-3f121b871b6d","20081009T05:11:37.000+0000","8b48b0a3-dd7a-4aea-be0d-10a223710ebc"
"Chaudoir, M. de","1877","Genres nouveaux et espèces inédites de la famille des Carabiques","186-268","","Bulletin de la Société Impériale des Naturalistes de Moscou","","","","<!--MARK--><a href='null09d652c0-4cda-4999-9049-e6d08ee5a9c7' class='mouseoverHref'>Chaudoir, M. de 1877. Genres nouveaux et espèces inédites de la famille des Carabiques.</a> <!--MARK--><!--MARK--><a href='nulla7cbc93a-fdd0-40a5-9cc8-35de71b7d18a' class='mouseoverHref'><em>Bulletin de la Société Impériale des Naturalistes de Moscou</em></a> <strong>52</strong>(1): 186-268<!--MARK-->","","Article in Journal","09d652c0-4cda-4999-9049-e6d08ee5a9c7","","a7cbc93a-fdd0-40a5-9cc8-35de71b7d18a"
"Csiki, E.","1932","Carabidae III: Harpalinae VII","1279-1598","Coleopterorum Catalogus auspiciis et auxilio W. Junk","","","","","<!--MARK--><a href='nullfe59cfaf-51db-425a-b1f1-4affdc6b770b' class='mouseoverHref'>Csiki, E. 1932. Carabidae III: Harpalinae VII. pp. 1279-1598</a> <!--MARK--><em>in</em> <!--MARK--><a href='null6ca94772-2c57-4dda-b4cc-fda569a500d8' class='mouseoverHref'>Schenkling, S. (ed.). <em>Coleopterorum Catalogus auspiciis et auxilio W. Junk</em>. Berlin : W. Junk Vol. 3 Pars 124.</a><!--MARK--> [Date published 7/Nov/1932]","","Chapter in Book","fe59cfaf-51db-425a-b1f1-4affdc6b770b","20081009T05:11:37.000+0000","6ca94772-2c57-4dda-b4cc-fda569a500d8"
"Darlington, P.J. Jr","1968","The carabid beetles of New Guinea Part III. Harpalinae (continued): Perigonini to Pseudomorphini","1-253","","Bulletin of the Museum of Comparative Zoology, Harvard","","","","<!--MARK--><a href='null0dd8382e-9237-40bb-8cbd-da7725b9934c' class='mouseoverHref'>Darlington, P.J. Jr 1968. The carabid beetles of New Guinea Part III. Harpalinae (continued): Perigonini to Pseudomorphini.</a> <!--MARK--><!--MARK--><a href='nullb2447030-bd13-4a45-9402-157082169a3d' class='mouseoverHref'><em>Bulletin of the Museum of Comparative Zoology, Harvard</em></a> <strong>137</strong>: 1-253<!--MARK-->","","Article in Journal","0dd8382e-9237-40bb-8cbd-da7725b9934c","20081009T05:11:37.000+0000","b2447030-bd13-4a45-9402-157082169a3d"
"Erichson, W.F.","1842","Beitrag zur Insecten-fauna von Vandiemensland, mit besonderer Berucksichtigung der geographischen Verbreitung der Insecten","83-287, pls 4, 5","","Archiv für Naturgeschichte","","","","<!--MARK--><a href='null2ae5a27f-fd1b-4bb9-b72e-a5997ccf96b3' class='mouseoverHref'>Erichson, W.F. 1842. Beitrag zur Insecten-fauna von Vandiemensland, mit besonderer Berucksichtigung der geographischen Verbreitung der Insecten.</a> <!--MARK--><!--MARK--><a href='nullf5b5f7c7-fc53-4502-951d-1c96b680d874' class='mouseoverHref'><em>Archiv für Naturgeschichte</em></a> <strong>8</strong>(1): 83-287, pls 4, 5<!--MARK-->","","Article in Journal","2ae5a27f-fd1b-4bb9-b72e-a5997ccf96b3","20120514T22:59:43.847+0000","f5b5f7c7-fc53-4502-951d-1c96b680d874"
"Macleay, W.J.","1864","Descriptions of new genera and species of Coleoptera from Port Denison","106-130, pl. IX","","Transactions of the Entomological Society of New South Wales","","","","<!--MARK--><a href='null0faf71d8-e7ac-4888-bcce-7db38d1da638' class='mouseoverHref'>Macleay, W.J. 1864. Descriptions of new genera and species of Coleoptera from Port Denison.</a> <!--MARK--><!--MARK--><a href='null69b821b6-f09d-44b0-ae3f-0e6c294b532e' class='mouseoverHref'><em>Transactions of the Entomological Society of New South Wales</em></a> <strong>1</strong>: 106-130, pl. IX<!--MARK-->","","Article in Journal","0faf71d8-e7ac-4888-bcce-7db38d1da638","20081009T05:11:37.000+0000","69b821b6-f09d-44b0-ae3f-0e6c294b532e"
"Macleay, W.J.","1871","Notes on a collection of insects from Gayndah","79-205","","Transactions of the Entomological Society of New South Wales","","","","<!--MARK--><a href='null9e91362c-6ac4-452a-8ef5-9d82e451f0de' class='mouseoverHref'>Macleay, W.J. 1871. Notes on a collection of insects from Gayndah.</a> <!--MARK--><!--MARK--><a href='null69b821b6-f09d-44b0-ae3f-0e6c294b532e' class='mouseoverHref'><em>Transactions of the Entomological Society of New South Wales</em></a> <strong>2</strong>: 79-205<!--MARK-->","","Article in Journal","9e91362c-6ac4-452a-8ef5-9d82e451f0de","20081009T05:11:37.000+0000","69b821b6-f09d-44b0-ae3f-0e6c294b532e"
"Macleay, W.J.","1888","The insects of King's Sound and its vicinity","443-480","","Proceedings of the Linnean Society of New South Wales","","","","<!--MARK--><a href='nulldf6698ef-207f-422c-9694-7c4693c4f229' class='mouseoverHref'>Macleay, W.J. 1888. The insects of King's Sound and its vicinity.</a> <!--MARK--><!--MARK--><a href='nullc12cd779-adb5-41ea-bd2c-75f6864cf22e' class='mouseoverHref'><em>Proceedings of the Linnean Society of New South Wales</em></a> 2 <strong>3</strong>: 443-480<!--MARK-->","","Article in Journal","df6698ef-207f-422c-9694-7c4693c4f229","20081009T05:11:37.000+0000","c12cd779-adb5-41ea-bd2c-75f6864cf22e"
"Moore, B.P.","1967","New or little known Australian Carabidae in the Frey Museum (Col.)","308-322","","Entomologischen Arbeiten aus dem Museum Georg Frey","","","","<!--MARK--><a href='nullfbfa8323-eaf8-4ebf-926e-953ef9c57b5a' class='mouseoverHref'>Moore, B.P. 1967. New or little known Australian Carabidae in the Frey Museum (Col.).</a> <!--MARK--><!--MARK--><a href='nulld9967b1d-fa66-4d5e-9c04-910b53ebb9b3' class='mouseoverHref'><em>Entomologischen Arbeiten aus dem Museum Georg Frey</em></a> <strong>18</strong>: 308-322<!--MARK-->","","Article in Journal","fbfa8323-eaf8-4ebf-926e-953ef9c57b5a","20081009T05:11:37.000+0000","d9967b1d-fa66-4d5e-9c04-910b53ebb9b3"
"Oke, C.G.","1951","The Coleoptera of the Russell Grimwalde expedition","19-25","","Memoirs of the National Museum of Victoria, Melbourne","","","","<!--MARK--><a href='null2960a0a4-f1b3-42db-bbf5-311c03952a06' class='mouseoverHref'>Oke, C.G. 1951. The Coleoptera of the Russell Grimwalde expedition.</a> <!--MARK--><!--MARK--><a href='null6d019674-04b0-4fab-8903-0612d147ec4d' class='mouseoverHref'><em>Memoirs of the National Museum of Victoria, Melbourne</em></a> <strong>17</strong>: 19-25<!--MARK-->","","Article in Journal","2960a0a4-f1b3-42db-bbf5-311c03952a06","20081009T05:11:37.000+0000","6d019674-04b0-4fab-8903-0612d147ec4d"
"Sloane, T.G.","1898","On Carabidae from West Australia, sent by Mr. A.M. Lea (with descriptions of new genera and species, synoptic tables etc.)","444-520","","Proceedings of the Linnean Society of New South Wales","","","","<!--MARK--><a href='null703f4731-a143-4da9-a327-483a0f47f698' class='mouseoverHref'>Sloane, T.G. 1898. On Carabidae from West Australia, sent by Mr. A.M. Lea (with descriptions of new genera and species, synoptic tables etc.).</a> <!--MARK--><!--MARK--><a href='nullc12cd779-adb5-41ea-bd2c-75f6864cf22e' class='mouseoverHref'><em>Proceedings of the Linnean Society of New South Wales</em></a> <strong>23</strong>: 444-520<!--MARK-->","","Article in Journal","703f4731-a143-4da9-a327-483a0f47f698","20081009T05:11:37.000+0000","c12cd779-adb5-41ea-bd2c-75f6864cf22e"
"Sloane, T.G.","1908","[New species description]","p. 147","","Proceedings of the Royal Society of Victoria","The Coleoptera of King Island, Bass Strait","","","<!--MARK--><a href='null12ffda8a-8c66-41fd-af4e-3deec7a63a44' class='mouseoverHref'>Sloane, T.G. 1908. [New species description]. p. 147</a> <!--MARK--><em>in</em> <!--MARK--><a href='null209d9fce-70db-4d92-8ae9-eda3226f6ff4' class='mouseoverHref'>Lea, A.M (ed.). The Coleoptera of King Island, Bass Strait.</a> <!--MARK--><!--MARK--><a href='nullce333794-3a02-427f-ba27-346079f1efa0' class='mouseoverHref'><em>Proceedings of the Royal Society of Victoria</em></a> n.s. <strong>20</strong>(2): 143-207<!--MARK--> [Date published March 31, 1908]","","Section in Article","12ffda8a-8c66-41fd-af4e-3deec7a63a44","20120515T22:42:57.574+0000","209d9fce-70db-4d92-8ae9-eda3226f6ff4"
"Sloane, T.G.","1917","Carabidae from tropical Australia. (New genera and species, notes and synonymy, and synoptic tables. Tribes Scaritini, Harpalini, Odacanthini, Lebiini, and Helluonini)","406-438","","Proceedings of the Linnean Society of New South Wales","","","","<!--MARK--><a href='null92c163fd-334f-42f1-a99c-688998a6d1eb' class='mouseoverHref'>Sloane, T.G. 1917. Carabidae from tropical Australia. (New genera and species, notes and synonymy, and synoptic tables. Tribes Scaritini, Harpalini, Odacanthini, Lebiini, and Helluonini).</a> <!--MARK--><!--MARK--><a href='nullc12cd779-adb5-41ea-bd2c-75f6864cf22e' class='mouseoverHref'><em>Proceedings of the Linnean Society of New South Wales</em></a> <strong>42</strong>: 406-438<!--MARK-->","","Article in Journal","92c163fd-334f-42f1-a99c-688998a6d1eb","20081009T05:11:37.000+0000","c12cd779-adb5-41ea-bd2c-75f6864cf22e"
"Sloane, T.G.","1923","Studies in Australian Entomology. No. XVIII New genera and species of Carabidae. (Scaritini, Pterostichini, Merizodini, Bembidiini, Trechini, Odacanthini, Panagaeini, Licinini, and Lebiini)","17-39","","Proceedings of the Linnean Society of New South Wales","","","","<!--MARK--><a href='nullc233b83a-3576-4512-80ce-16baacc4510a' class='mouseoverHref'>Sloane, T.G. 1923. Studies in Australian Entomology. No. XVIII New genera and species of Carabidae. (Scaritini, Pterostichini, Merizodini, Bembidiini, Trechini, Odacanthini, Panagaeini, Licinini, and Lebiini).</a> <!--MARK--><!--MARK--><a href='nullc12cd779-adb5-41ea-bd2c-75f6864cf22e' class='mouseoverHref'><em>Proceedings of the Linnean Society of New South Wales</em></a> <strong>48</strong>: 17-39<!--MARK-->","","Article in Journal","c233b83a-3576-4512-80ce-16baacc4510a","20081009T05:11:37.000+0000","c12cd779-adb5-41ea-bd2c-75f6864cf22e"
