"PUB_AUTHOR","PUB_YEAR","PUB_TITLE","PUB_PAGES","PUB_PARENT_BOOK_TITLE","PUB_PARENT_JOURNAL_TITLE","PUB_PARENT_ARTICLE_TITLE","PUB_PUBLICATION_DATE","PUB_PUBLISHER","PUB_FORMATTED","PUB_QUALIFICATION","PUB_TYPE","PUBLICATION_GUID","PUBLICATION_LAST_UPDATE","PARENT_PUBLICATION_GUID"
"Dekker, H. & Orlin, Z.","2000","Checklist of Red Sea Mollusca","1-46","","Spirula","","","","<!--MARK--><a href='../../../../publication/6d78304d-267d-4899-8f90-96eedda6683b' class='mouseoverHref'>Dekker, H. & Orlin, Z. 2000. Checklist of Red Sea Mollusca.</a> <!--MARK--><!--MARK--><a href='../../../../publication/22d022f2-9f35-4faf-8396-3a78e5c3e513' class='mouseoverHref'><em>Spirula</em></a> <strong>47</strong>(Supplement): 1-46<!--MARK-->","","Article in Journal","6d78304d-267d-4899-8f90-96eedda6683b","","22d022f2-9f35-4faf-8396-3a78e5c3e513"
"Dell, R.K.","1972","Some Mollusca from the vicinity of Mawson Base, Antarctica, resulting from Anare collections","1-7","","Records of the Dominion Museum","","","","<!--MARK--><a href='../../../../publication/2ca6d499-fb01-4b8a-906f-9ecb0c57e816' class='mouseoverHref'>Dell, R.K. 1972. Some Mollusca from the vicinity of Mawson Base, Antarctica, resulting from Anare collections.</a> <!--MARK--><!--MARK--><a href='../../../../publication/ae78b80e-7837-4fa4-b0af-2f9c1737ffdb' class='mouseoverHref'><em>Records of the Dominion Museum</em></a> <strong>8</strong>(1): 1-7<!--MARK-->","","Article in Journal","2ca6d499-fb01-4b8a-906f-9ecb0c57e816","20110314T03:20:09.954+0000","ae78b80e-7837-4fa4-b0af-2f9c1737ffdb"
"Dell, R.K.","1990","Antarctic Mollusca: with special reference to the fauna of the Ross Sea","1-311","","Bulletin of the Royal Society of New Zealand","","","","<!--MARK--><a href='../../../../publication/3437aaa1-185c-41ab-ad75-c3303f68bfdc' class='mouseoverHref'>Dell, R.K. 1990. Antarctic Mollusca: with special reference to the fauna of the Ross Sea.</a> <!--MARK--><!--MARK--><a href='../../../../publication/57c8e98b-bd14-4ce7-9145-64651adfb156' class='mouseoverHref'><em>Bulletin of the Royal Society of New Zealand</em></a> <strong>27</strong>: 1-311<!--MARK-->","","Article in Journal","3437aaa1-185c-41ab-ad75-c3303f68bfdc","20171019T04:45:46.359+0000","57c8e98b-bd14-4ce7-9145-64651adfb156"
"Demond, J.","1957","Micronesian reef associated gastropods","275-341, fig. 2, pl. 1","","Pacific Science","","","","<!--MARK--><a href='../../../../publication/38113db1-b07e-4cf7-9cf6-6211e26c1f91' class='mouseoverHref'>Demond, J. 1957. Micronesian reef associated gastropods.</a> <!--MARK--><!--MARK--><a href='../../../../publication/cc032c8b-89bc-474b-8046-90fbdaad884c' class='mouseoverHref'><em>Pacific Science</em></a> <strong>11</strong>(3): 275-341, fig. 2, pl. 1<!--MARK-->","","Article in Journal","38113db1-b07e-4cf7-9cf6-6211e26c1f91","20171116T23:18:06.355+0000","cc032c8b-89bc-474b-8046-90fbdaad884c"
"Deshayes, G. P.","1839","Nouvelles espèces de mollusques, provenant des côtes de la Californie, du Mexique, de Kamtschatka et de Nouvelle-Zélande","356-361","","Revue et Magasin de Zoologie","","","","<!--MARK--><a href='../../../../publication/0c612dcb-3b77-447a-8338-b0739bffe7bc' class='mouseoverHref'>Deshayes, G. P. 1839. Nouvelles espèces de mollusques, provenant des côtes de la Californie, du Mexique, de Kamtschatka et de Nouvelle-Zélande.</a> <!--MARK--><!--MARK--><a href='../../../../publication/591f40b4-aae6-47bb-91f4-7ce920b52ad5' class='mouseoverHref'><em>Revue et Magasin de Zoologie</em></a> <strong>1</strong>(2): 356-361<!--MARK-->","","Article in Journal","0c612dcb-3b77-447a-8338-b0739bffe7bc","20110907T03:58:18.383+0000","591f40b4-aae6-47bb-91f4-7ce920b52ad5"
"Deshayes, G.P.","1843","Histoire naturelle des animaux sans vertèbres","728","","","","","J.B. Baillière","<!--MARK--><a href='../../../../publication/1e7d9279-9b96-4bbe-905b-e78c313cfd63' class='mouseoverHref'>Deshayes, G.P. 1843. <em>Histoire naturelle des animaux sans vertèbres</em>. Paris : J.B. Baillière Vol. 9 728 pp.</a><!--MARK-->","","Book","1e7d9279-9b96-4bbe-905b-e78c313cfd63","",""
"Deshayes, G.P.","1863","Catalogue des Mollusques de  l'Île de la Réunion (Bourbon)","Annexe E","Notes sur l'isle de La Réunion","","","","","<!--MARK--><a href='../../../../publication/741d6666-4147-47c3-88f2-b97101b2c849' class='mouseoverHref'>Deshayes, G.P. 1863. Catalogue des Mollusques de  l'Île de la Réunion (Bourbon). Annexe E</a> <!--MARK--><em>in</em> <!--MARK--><a href='../../../../publication/86a1fc2e-5d07-4dce-b419-af4a425ba164' class='mouseoverHref'>Maillard, L. (ed.). <em>Notes sur l'isle de La Réunion</em>. Paris : Dentu.</a><!--MARK-->","","Chapter in Book","741d6666-4147-47c3-88f2-b97101b2c849","","86a1fc2e-5d07-4dce-b419-af4a425ba164"
"Dillwyn, L.W.","1817","A Descriptive Catalogue of Recent Shells, arranged according to the Linnaean method; with particular attention to the synonymy.","1092 + 29 pp.","","","","","John and Arthur Arch","<!--MARK--><a href='../../../../publication/c42cf66c-23bf-4571-9a06-0c4063b32661' class='mouseoverHref'>Dillwyn, L.W. 1817. <em>A Descriptive Catalogue of Recent Shells, arranged according to the Linnaean method; with particular attention to the synonymy</em>. London : John and Arthur Arch 2 volumes 1092 + 29 pp.</a><!--MARK-->","","Book","c42cf66c-23bf-4571-9a06-0c4063b32661","20150827T00:38:44.471+0000",""
"Donald, K.M., Kennedy, M. & Spencer, H.G.","2005","The phylogeny and taxonomy of austral monodontine topshells (Mollusca : Gastropoda : Trochidae), inferred from DNA sequences","474-483","","Molecular Phylogenetics and Evolution","","","","<!--MARK--><a href='../../../../publication/9566a230-12de-42d4-85fd-4b41c4ac3c22' class='mouseoverHref'>Donald, K.M., Kennedy, M. & Spencer, H.G. 2005. The phylogeny and taxonomy of austral monodontine topshells (Mollusca : Gastropoda : Trochidae), inferred from DNA sequences.</a> <!--MARK--><!--MARK--><a href='../../../../publication/db034f3c-0160-42a2-a6c9-84156be3b7b8' class='mouseoverHref'><em>Molecular Phylogenetics and Evolution</em></a> <strong>37</strong>(2): 474-483<!--MARK-->","","Article in Journal","9566a230-12de-42d4-85fd-4b41c4ac3c22","20110906T07:08:07.959+0000","db034f3c-0160-42a2-a6c9-84156be3b7b8"
"Dufo, M.H.","1840","Observations sur les Mollusques marins, terrestres et fluviatiles des iles Séchelles et des Amirantes.","45-80 (extrait), 166-221(suite)","","Annales des Sciences Naturelles, Paris","","","","<!--MARK--><a href='../../../../publication/56796bfc-a8ed-4d5d-9560-d3f623115b08' class='mouseoverHref'>Dufo, M.H. 1840. Observations sur les Mollusques marins, terrestres et fluviatiles des iles Séchelles et des Amirantes.</a> <!--MARK--><!--MARK--><a href='../../../../publication/8728aca1-f2e1-4662-b5b6-40183f95151b' class='mouseoverHref'><em>Annales des Sciences Naturelles, Paris</em></a> 2 <strong>14, Zoologie</strong>: 45-80 (extrait), 166-221(suite)<!--MARK-->","","Article in Journal","56796bfc-a8ed-4d5d-9560-d3f623115b08","20171116T23:21:54.160+0000","8728aca1-f2e1-4662-b5b6-40183f95151b"
"Dunker, G.","1869","Catalog d. Museum Godeffroy","","","","","","","<!--MARK--><a href='../../../../publication/8317407a-4605-404b-b914-53feb656e1af' class='mouseoverHref'>Dunker, G. 1869. Catalog d. Museum Godeffroy. no IV : 99. Hamburg.</a>","","Miscellaneous","8317407a-4605-404b-b914-53feb656e1af","",""
"Dunker, G.","1871","Mollusca nova Musei Godeffroy Hamburgensis","150-175","","Malakozoologische Blätter","","","","<!--MARK--><a href='../../../../publication/3d885096-a97a-4e85-a54c-32f5d86fcb2c' class='mouseoverHref'>Dunker, G. 1871. Mollusca nova Musei Godeffroy Hamburgensis.</a> <!--MARK--><!--MARK--><a href='../../../../publication/a14e44fb-77a6-4eee-ba02-813dd0855aec' class='mouseoverHref'><em>Malakozoologische Blätter</em></a> <strong>18</strong>: 150-175<!--MARK-->","","Article in Journal","3d885096-a97a-4e85-a54c-32f5d86fcb2c","20171102T22:19:07.011+0000","a14e44fb-77a6-4eee-ba02-813dd0855aec"
"Dunker, G.","1871","Title unknown","403","Manual of Conchology","","","","","<!--MARK--><a href='../../../../publication/5fddab86-de52-4f44-841c-e362e5eec30a' class='mouseoverHref'>Dunker, G. 1871. Title unknown. 403</a> <!--MARK--><em>in</em> <!--MARK--><a href='../../../../publication/436cb99e-b6d7-44cc-b363-8861e08e8246' class='mouseoverHref'>Tryon, G.W. (ed). <em>Manual of Conchology</em>. Philadephia : G.W. Tryon Vol. 11.</a><!--MARK-->","","Chapter in Book","5fddab86-de52-4f44-841c-e362e5eec30a","","436cb99e-b6d7-44cc-b363-8861e08e8246"
"Egorova, E.N.","1982","Biological results of the Soviet Antarctic Expedition, 7. Explorations of the fauna of the seas.","144 pp.","","","","","Academy of Sciences of the USSR","<!--MARK--><a href='../../../../publication/502700f7-5b16-40f4-aa9b-9cc9abbc0b16' class='mouseoverHref'>Egorova, E.N. 1982. <em>Biological results of the Soviet Antarctic Expedition, 7. Explorations of the fauna of the seas</em>. Leningrad : Academy of Sciences of the USSR Vol. 26(34) 144 pp.</a><!--MARK-->","","Book","502700f7-5b16-40f4-aa9b-9cc9abbc0b16","20141026T20:40:12.493+0000",""
"Engl, W.","2012","Shells of Antarctica","402 pp.","","","","","Conchbooks","<!--MARK--><a href='../../../../publication/2901cbbc-02f1-4251-9e96-0f5e6109f5f0' class='mouseoverHref'>Engl, W. 2012. <em>Shells of Antarctica</em>. Hackenheim : Conchbooks 402 pp.</a><!--MARK-->","","Book","2901cbbc-02f1-4251-9e96-0f5e6109f5f0","20171019T05:01:23.598+0000",""
"Favanne, J. G. de","1784","Catalogue systématique et raisoné, ou description du magnifique cabinet appartenent ci-devant a M. le C. de ... [ M. le Comte de Latour d'Auvergne]. Paris","","","","","","","<!--MARK--><a href='../../../../publication/1db30ca2-d968-4967-b991-2102067694d8' class='mouseoverHref'>Favanne, J. G. de 1784. Catalogue systématique et raisoné, ou description du magnifique cabinet appartenent ci-devant a M. le C. de ... [ M. le Comte de Latour d'Auvergne]. Paris.</a>","","Miscellaneous","1db30ca2-d968-4967-b991-2102067694d8","20081009T05:11:37.000+0000",""
"Férussac, A.E.J. d'Audebard de","1822","Tableaux systématiques des animaux mollusques suivis d'un Prodrome général pour tous les mollusques terrestres ou fluviatiles vivants ou fossiles. Premier partie, Tableaux systematiques générous","i-xlvii","","","","","Anthus-Bertrand","<!--MARK--><a href='../../../../publication/61f6f740-6e34-4152-bc16-c0fd09a9152a' class='mouseoverHref'>Férussac, A.E.J. d'Audebard de 1822. <em>Tableaux systématiques des animaux mollusques suivis d'un Prodrome général pour tous les mollusques terrestres ou fluviatiles vivants ou fossiles. Premier partie, Tableaux systematiques générous</em>. Paris : Anthus-Bertrand pp. i-xlvii.</a><!--MARK-->","","Book","61f6f740-6e34-4152-bc16-c0fd09a9152a","20160725T01:45:55.256+0000",""
"Finlay, H.J.","1926","A further commentary on New Zealand molluscan systematics","320-485 pls 18-23","","Transactions of the New Zealand Institute","","","","<!--MARK--><a href='../../../../publication/038277f7-3875-4d01-9d51-11b0cc00146d' class='mouseoverHref'>Finlay, H.J. 1926. A further commentary on New Zealand molluscan systematics.</a> <!--MARK--><!--MARK--><a href='../../../../publication/ddaf4215-531f-425e-bd1e-b53ca8ded5a3' class='mouseoverHref'><em>Transactions of the New Zealand Institute</em></a> <strong>57</strong>: 320-485 pls 18-23<!--MARK--> [Issued separately 23 Dec 1926; but Vol. 57 issued 10 March, 1927]","Issued separately 23 Dec 1926; but Vol. 57 issued 10 March, 1927","Article in Journal","038277f7-3875-4d01-9d51-11b0cc00146d","20151027T21:06:26.692+0000","ddaf4215-531f-425e-bd1e-b53ca8ded5a3"
"Fischer, P.","1874","Diagnoses specierum novarum","372-374","","Journal de Conchyliologie","","","","<!--MARK--><a href='../../../../publication/a3f7eb79-b6ee-487e-a588-7b4b02b213d0' class='mouseoverHref'>Fischer, P. 1874. Diagnoses specierum novarum.</a> <!--MARK--><!--MARK--><a href='../../../../publication/52301b35-8099-424a-8c55-57ce4c6a0788' class='mouseoverHref'><em>Journal de Conchyliologie</em></a> <strong>22</strong>: 372-374<!--MARK-->","","Article in Journal","a3f7eb79-b6ee-487e-a588-7b4b02b213d0","","52301b35-8099-424a-8c55-57ce4c6a0788"
"Fischer, P.","1874","Note sur le <i>Turbo phasianellus</i> Deshayes.","156-157","","Journal de Conchyliologie","","","","<!--MARK--><a href='../../../../publication/cda2b964-e90f-4116-bff7-5016df771bb5' class='mouseoverHref'>Fischer, P. 1874. Note sur le <i>Turbo phasianellus</i> Deshayes.</a> <!--MARK--><!--MARK--><a href='../../../../publication/52301b35-8099-424a-8c55-57ce4c6a0788' class='mouseoverHref'><em>Journal de Conchyliologie</em></a> <strong>22</strong>: 156-157<!--MARK-->","","Article in Journal","cda2b964-e90f-4116-bff7-5016df771bb5","","52301b35-8099-424a-8c55-57ce4c6a0788"
"Fischer, P.","1875","Genres <i>Calcar</i>, <i>Trochus</i>, <i>Xenophora</i>, <i>Tectarius</i> et <i>Risella</i>","1-96","Spécies general et iconographie des coquilles vivantes","","","","","<!--MARK--><a href='../../../../publication/47af62dc-e179-489e-88f8-1758b6c4b502' class='mouseoverHref'>Fischer, P. 1875. Genres <i>Calcar</i>, <i>Trochus</i>, <i>Xenophora</i>, <i>Tectarius</i> et <i>Risella</i>. pp. 1-96</a> <!--MARK--><em>in</em> <!--MARK--><a href='../../../../publication/d2cd979a-adec-4655-a7f5-8db568675034' class='mouseoverHref'>Keiner, L.C. (ed.). <em>Spécies general et iconographie des coquilles vivantes</em>. Paris : J.B. Baillière Vol. 11.</a><!--MARK-->","","Chapter in Book","47af62dc-e179-489e-88f8-1758b6c4b502","","d2cd979a-adec-4655-a7f5-8db568675034"
"Fischer, P.","1876","Genres <i>Calcar</i>, <i>Trochus</i>, <i>Xenophora</i>, <i>Tectarius</i> et <i>Risella</i>","97-114","Spécies general et iconographie des coquilles vivantes","","","","","<!--MARK--><a href='../../../../publication/3cc9630e-e4c8-4a0d-bf57-3682427759bb' class='mouseoverHref'>Fischer, P. 1876. Genres <i>Calcar</i>, <i>Trochus</i>, <i>Xenophora</i>, <i>Tectarius</i> et <i>Risella</i>. pp. 97-114</a> <!--MARK--><em>in</em> <!--MARK--><a href='../../../../publication/3e4dcfe3-5f9d-4d37-b061-58af01d49ba6' class='mouseoverHref'>Keiner, L.C. (ed.). <em>Spécies general et iconographie des coquilles vivantes</em>. Paris : J.B. Baillière Vol. 11.</a><!--MARK-->","","Chapter in Book","3cc9630e-e4c8-4a0d-bf57-3682427759bb","","3e4dcfe3-5f9d-4d37-b061-58af01d49ba6"
"Fischer, P.","1877","Genres <i>Calcar</i>, <i>Trochus</i>, <i>Xenophora</i>, <i>Tectarius</i> et <i>Risella</i>","115-240","Spécies general et iconographie des coquilles vivantes","","","","","<!--MARK--><a href='../../../../publication/63fc0be1-6951-49f9-8270-7caa0137f24b' class='mouseoverHref'>Fischer, P. 1877. Genres <i>Calcar</i>, <i>Trochus</i>, <i>Xenophora</i>, <i>Tectarius</i> et <i>Risella</i>. pp. 115-240</a> <!--MARK--><em>in</em> <!--MARK--><a href='../../../../publication/85ea5084-2170-4b5d-b0c9-528e64b2ee3f' class='mouseoverHref'>Keiner, L.C. (ed.). <em>Spécies general et iconographie des coquilles vivantes</em>. Paris : J.B. Baillière Vol. 11.</a><!--MARK-->","","Chapter in Book","63fc0be1-6951-49f9-8270-7caa0137f24b","","85ea5084-2170-4b5d-b0c9-528e64b2ee3f"
"Fischer, P.","1878","Diagnoses Trochorum novorum","62-67","","Journal de Conchyliologie","","","","<!--MARK--><a href='../../../../publication/88a139b0-6189-405c-b8e9-c48a540217f1' class='mouseoverHref'>Fischer, P. 1878. Diagnoses Trochorum novorum.</a> <!--MARK--><!--MARK--><a href='../../../../publication/52301b35-8099-424a-8c55-57ce4c6a0788' class='mouseoverHref'><em>Journal de Conchyliologie</em></a> <strong>26</strong>: 62-67<!--MARK-->","","Article in Journal","88a139b0-6189-405c-b8e9-c48a540217f1","","52301b35-8099-424a-8c55-57ce4c6a0788"
"Fischer, P.","1878","Genres <i>Calcar</i>, <i>Trochus</i>, <i>Xenophora</i>, <i>Tectarius</i> et <i>Risella</i>","241-336","Spécies general et iconographie des coquilles vivantes","","","","","<!--MARK--><a href='../../../../publication/688f7821-6bfb-4d49-ad3c-7a3eee7b5990' class='mouseoverHref'>Fischer, P. 1878. Genres <i>Calcar</i>, <i>Trochus</i>, <i>Xenophora</i>, <i>Tectarius</i> et <i>Risella</i>. pp. 241-336</a> <!--MARK--><em>in</em> <!--MARK--><a href='../../../../publication/80874c49-f007-4c84-9d91-bec8f0ed0de5' class='mouseoverHref'>Keiner, L.C. (ed.). <em>Spécies general et iconographie des coquilles vivantes</em>. Paris : J.B. Baillière Vol. 11.</a><!--MARK-->","","Chapter in Book","688f7821-6bfb-4d49-ad3c-7a3eee7b5990","","80874c49-f007-4c84-9d91-bec8f0ed0de5"
"Fischer, P.","1879","Diagnoses Trochorum novorum","22-25","","Journal de Conchyliologie","","","","<!--MARK--><a href='../../../../publication/100534fc-5f9f-4fb5-811e-cadc82d8a0ac' class='mouseoverHref'>Fischer, P. 1879. Diagnoses Trochorum novorum.</a> <!--MARK--><!--MARK--><a href='../../../../publication/52301b35-8099-424a-8c55-57ce4c6a0788' class='mouseoverHref'><em>Journal de Conchyliologie</em></a> <strong>27</strong>: 22-25<!--MARK-->","","Article in Journal","100534fc-5f9f-4fb5-811e-cadc82d8a0ac","","52301b35-8099-424a-8c55-57ce4c6a0788"
"Fischer, P.","1879","Genres <i>Calcar</i>, <i>Trochus</i>, <i>Xenophora</i>, <i>Tectarius</i> et <i>Risella</i>","pp. 337-463, 120 pls","Spécies general et iconographie des coquilles vivantes","","","","","<!--MARK--><a href='../../../../publication/1a4ad5c9-391f-43d9-95d1-32bac1c44ae1' class='mouseoverHref'>Fischer, P. 1879. Genres <i>Calcar</i>, <i>Trochus</i>, <i>Xenophora</i>, <i>Tectarius</i> et <i>Risella</i>. pp. 337-463, 120 pls</a> <!--MARK--><em>in</em> <!--MARK--><a href='../../../../publication/cc8e8d22-024c-4d4d-82ae-730cb0437d8f' class='mouseoverHref'>Keiner, L.C. (ed.). <em>Spécies general et iconographie des coquilles vivantes</em>. Paris : J.B. Baillière Vol. 3.</a><!--MARK-->","","Chapter in Book","1a4ad5c9-391f-43d9-95d1-32bac1c44ae1","20141020T23:42:08.676+0000","cc8e8d22-024c-4d4d-82ae-730cb0437d8f"
"Fischer, P.","1879-1880","Spécies général et Iconographie des coquilles vivantes, comprenant la collection du Muséum d'histoire Naturelle de Paris, la collection de Lamarck, celle du Prince Massena (appartenant maintenant a M. le Baron B. Delessert) et les découvertes récentes des voyageurs","337-463","","","","","","<!--MARK--><a href='../../../../publication/add64591-0036-4975-b869-dd8be28e588f' class='mouseoverHref'>Fischer, P. 1879-1880. <em>Spécies général et Iconographie des coquilles vivantes, comprenant la collection du Muséum d'histoire Naturelle de Paris, la collection de Lamarck, celle du Prince Massena (appartenant maintenant a M. le Baron B. Delessert) et les découvertes récentes des voyageurs</em>. Paris Vol. 11(Xenophora, Tectarius, Risella) pp. 337-463.</a><!--MARK-->","","Book","add64591-0036-4975-b869-dd8be28e588f","20110316T01:51:06.187+0000",""
"Fischer, P.","1885","Manuel de Conchyliologie et de Paléontologie Conchyliologique ou histoire naturelle des mollusques vivant et fossiles","785-896","","","","","F. Savy","<!--MARK--><a href='../../../../publication/495d17a4-0d27-4557-b8f4-458bbe6a7fb1' class='mouseoverHref'>Fischer, P. 1885. <em>Manuel de Conchyliologie et de Paléontologie Conchyliologique ou histoire naturelle des mollusques vivant et fossiles</em>. Paris : F. Savy Vol. 9 pp. 785-896.</a><!--MARK-->","","Book","495d17a4-0d27-4557-b8f4-458bbe6a7fb1","",""
"Fischer, P.J.","1927","Beitrag zur Kenntnis der Pliozän- fauna der Mollusken-Inseln Seran und Obi","1-179, pls 212-217","Paläontologie von Timor","","","","","<!--MARK--><a href='../../../../publication/36630184-7572-4268-bcb2-7d81a3084928' class='mouseoverHref'>Fischer, P.J. 1927. Beitrag zur Kenntnis der Pliozän- fauna der Mollusken-Inseln Seran und Obi. 1-179, pls 212-217</a> <!--MARK--><em>in</em> <!--MARK--><a href='../../../../publication/23d5e582-981c-4538-82e6-c2e6bddfe1da' class='mouseoverHref'>Wanner, J. (ed.). <em>Paläontologie von Timor</em>. Vol. 15.</a><!--MARK-->","","Chapter in Book","36630184-7572-4268-bcb2-7d81a3084928","","23d5e582-981c-4538-82e6-c2e6bddfe1da"
"Fischer, R.H.","1878","Catalogue des Mollusques appartement aux genres <i>Turbo</i>, <i>Calcar</i> et <i>Trochus</i>, recueilles dans les mers de l'Archipel Calédonien (supplément), suivi de la liste des espèces des genres <i>Delphinula</i>, <i>Liotia</i> et <i>Phasianella</i>","205-211","","Journal de Conchyliologie","","","","<!--MARK--><a href='../../../../publication/b0d570c4-d135-442a-a401-a1e54464d2f2' class='mouseoverHref'>Fischer, R.H. 1878. Catalogue des Mollusques appartement aux genres <i>Turbo</i>, <i>Calcar</i> et <i>Trochus</i>, recueilles dans les mers de l'Archipel Calédonien (supplément), suivi de la liste des espèces des genres <i>Delphinula</i>, <i>Liotia</i> et <i>Phasianella</i>.</a> <!--MARK--><!--MARK--><a href='../../../../publication/52301b35-8099-424a-8c55-57ce4c6a0788' class='mouseoverHref'><em>Journal de Conchyliologie</em></a> <strong>26</strong>: 205-211<!--MARK-->","","Article in Journal","b0d570c4-d135-442a-a401-a1e54464d2f2","","52301b35-8099-424a-8c55-57ce4c6a0788"
"Forbes, E.","1852","On the Mollusca collected by Mr MacGillivray during the voyage of the <i>Rattlesnake</i>","360-386","Narrative of the Voyage of H.M.S. <i>Rattlesnake</i>, commanded by the late Captain Owen Stanley, R.N., F.R.S. etc, during the years 1846-1850","","","","","<!--MARK--><a href='../../../../publication/b765f6ba-5640-4ac5-b0ce-334a358e61f3' class='mouseoverHref'>Forbes, E. 1852. On the Mollusca collected by Mr MacGillivray during the voyage of the <i>Rattlesnake</i>. pp. 360-386</a> <!--MARK--><em>in</em> <!--MARK--><a href='../../../../publication/21bbea75-a69c-488a-9f45-561f184482aa' class='mouseoverHref'>MacGillivray, J. (ed). <em>Narrative of the Voyage of H.M.S. <i>Rattlesnake</i>, commanded by the late Captain Owen Stanley, R.N., F.R.S. etc, during the years 1846-1850</em>. London : Lords Commissioners of the Admiralty Vol. II 395 pp.</a><!--MARK-->","","Chapter in Book","b765f6ba-5640-4ac5-b0ce-334a358e61f3","20120221T01:06:25.586+0000","21bbea75-a69c-488a-9f45-561f184482aa"
"Gabriel, C. & Gatliff, J.H.","1921","Description of a new <i>Phasianella</i> (<i>P. tomlini</i>) from Western Australia.","173","","Proceedings of the Malacological Society of London","","","","<!--MARK--><a href='../../../../publication/4844f255-a6f9-4d8a-9199-f2a5aad1533b' class='mouseoverHref'>Gabriel, C. & Gatliff, J.H. 1921. Description of a new <i>Phasianella</i> (<i>P. tomlini</i>) from Western Australia.</a> <!--MARK--><!--MARK--><a href='../../../../publication/872b1d84-0b1e-4517-991d-83251d3517e5' class='mouseoverHref'><em>Proceedings of the Malacological Society of London</em></a> <strong>24</strong>(4-5): 173<!--MARK-->","","Article in Journal","4844f255-a6f9-4d8a-9199-f2a5aad1533b","","872b1d84-0b1e-4517-991d-83251d3517e5"
"Gabriel, C.J.","1956","Mollusca from south east of King Island, Bass Strait.","1-15","","Memoirs of the National Museum, Melbourne","","","","<!--MARK--><a href='../../../../publication/68aafd22-254c-4e7a-bad1-794ab86aa223' class='mouseoverHref'>Gabriel, C.J. 1956. Mollusca from south east of King Island, Bass Strait.</a> <!--MARK--><!--MARK--><a href='../../../../publication/f1ff42af-c2a7-4dca-b1e9-352ddfcb5b33' class='mouseoverHref'><em>Memoirs of the National Museum, Melbourne</em></a> <strong>22</strong>(4): 1-15<!--MARK-->","","Article in Journal","68aafd22-254c-4e7a-bad1-794ab86aa223","","f1ff42af-c2a7-4dca-b1e9-352ddfcb5b33"
"Gabriel, C.J.","1962","Additions to the marine molluscan fauna of south eastern Australia including descriptions of new genus <i>Pillarginella</i>, six new marine species and two subspecies","177-210, 1 pl.","","Memoirs of the National Museum of Victoria, Melbourne","","1 May 1962","","<!--MARK--><a href='../../../../publication/709fbe91-2a2b-4b6f-8bf5-5757112fffae' class='mouseoverHref'>Gabriel, C.J. 1962. Additions to the marine molluscan fauna of south eastern Australia including descriptions of new genus <i>Pillarginella</i>, six new marine species and two subspecies.</a> <!--MARK--><!--MARK--><a href='../../../../publication/6d019674-04b0-4fab-8903-0612d147ec4d' class='mouseoverHref'><em>Memoirs of the National Museum of Victoria, Melbourne</em></a> <strong>25</strong>: 177-210, 1 pl.<!--MARK--> [Date published 1 May 1962]","","Article in Journal","709fbe91-2a2b-4b6f-8bf5-5757112fffae","20140720T23:51:48.802+0000","6d019674-04b0-4fab-8903-0612d147ec4d"
"Gaillard, J.M.","1954","Missions du Bâtiment Polaire Commandant Charcot. Récoltés faites en Terre Adélie (1950) par M. Paul Tchernia. III. Mollusques","678-684","","Bulletin du Muséum National d'Histoire Naturelle, Paris","","","","<!--MARK--><a href='../../../../publication/ef7cf7d5-db90-48c4-b357-ee6e93b09e48' class='mouseoverHref'>Gaillard, J.M. 1954. Missions du Bâtiment Polaire Commandant Charcot. Récoltés faites en Terre Adélie (1950) par M. Paul Tchernia. III. Mollusques.</a> <!--MARK--><!--MARK--><a href='../../../../publication/796711f5-67db-4504-bf92-fda69a7bdc27' class='mouseoverHref'><em>Bulletin du Muséum National d'Histoire Naturelle, Paris</em></a><!--MARK--> [published 1907-1971] <strong>12</strong>: 678-684<!--MARK-->","","Article in Journal","ef7cf7d5-db90-48c4-b357-ee6e93b09e48","20170804T01:06:55.486+0000","796711f5-67db-4504-bf92-fda69a7bdc27"
"Garrard, T.A.","1961","Mollusca collected by M. V. Challenger off the east coast of Australia.","3-38","","Journal of the Malacological Society of Australia","","","","<!--MARK--><a href='../../../../publication/26f1790a-3e38-4669-8bc7-48cfb1a64bd7' class='mouseoverHref'>Garrard, T.A. 1961. Mollusca collected by M. V. Challenger off the east coast of Australia.</a> <!--MARK--><!--MARK--><a href='../../../../publication/1177fe8d-d8cb-45b8-a40c-704cb3564fd7' class='mouseoverHref'><em>Journal of the Malacological Society of Australia</em></a> <strong>5</strong>: 3-38<!--MARK-->","","Article in Journal","26f1790a-3e38-4669-8bc7-48cfb1a64bd7","20171102T22:46:14.666+0000","1177fe8d-d8cb-45b8-a40c-704cb3564fd7"
