"PUB_AUTHOR","PUB_YEAR","PUB_TITLE","PUB_PAGES","PUB_PARENT_BOOK_TITLE","PUB_PARENT_JOURNAL_TITLE","PUB_PARENT_ARTICLE_TITLE","PUB_PUBLICATION_DATE","PUB_PUBLISHER","PUB_FORMATTED","PUB_QUALIFICATION","PUB_TYPE","PUBLICATION_GUID","PUBLICATION_LAST_UPDATE","PARENT_PUBLICATION_GUID"
"André, E.","1905","Description d'un genre nouveau et de deux espèces nouvelles de fourmis d'Australie","205-208","","Revue d'Entomologie","","","","<!--MARK--><a href='null37fb5426-61e2-4232-ac01-01bc00b96be8' class='mouseoverHref'>André, E. 1905. Description d'un genre nouveau et de deux espèces nouvelles de fourmis d'Australie.</a> <!--MARK--><!--MARK--><a href='nullb9a99de4-db9d-4921-a88d-432a9bbfc09c' class='mouseoverHref'><em>Revue d'Entomologie</em></a> <strong>24</strong>: 205-208<!--MARK-->","","Article in Journal","37fb5426-61e2-4232-ac01-01bc00b96be8","20081009T05:11:37.000+0000","b9a99de4-db9d-4921-a88d-432a9bbfc09c"
"Borowiec, M.L.","2016","Generic revision of the ant subfamily Dorylinae (Hymenoptera, Formicidae)","1-280","","ZooKeys","","","","<!--MARK--><a href='null916871c9-f28c-49cc-a373-6a3bf6e68803' class='mouseoverHref'>Borowiec, M.L. 2016. Generic revision of the ant subfamily Dorylinae (Hymenoptera, Formicidae).</a> <!--MARK--><!--MARK--><a href='null8cb7bef9-51f4-441c-a060-649dc8095e71' class='mouseoverHref'><em>ZooKeys</em></a> <strong>608</strong>: 1-280<!--MARK-->","","Article in Journal","916871c9-f28c-49cc-a373-6a3bf6e68803","20161222T05:02:29.380+0000","8cb7bef9-51f4-441c-a060-649dc8095e71"
"Brown, W.L. jr","1975","Contributions toward a reclassification of the Formicidae. V. Ponerinae, tribes Platythreini, Cerapachyini, Cylindromyrmecini, Acanthostichini, and Aenictogitini","1-116","","Search. Agriculture (Ithaca, New York)","","","","<!--MARK--><a href='null1b67959f-10f7-4449-b700-3210e8795410' class='mouseoverHref'>Brown, W.L. jr 1975. Contributions toward a reclassification of the Formicidae. V. Ponerinae, tribes Platythreini, Cerapachyini, Cylindromyrmecini, Acanthostichini, and Aenictogitini.</a> <!--MARK--><!--MARK--><a href='nullbe1f64c7-bb5b-45db-8dfc-5447fdfc2f26' class='mouseoverHref'><em>Search. Agriculture (Ithaca, New York)</em></a> <strong>5</strong>: 1-116<!--MARK-->","","Article in Journal","1b67959f-10f7-4449-b700-3210e8795410","20081009T05:11:37.000+0000","be1f64c7-bb5b-45db-8dfc-5447fdfc2f26"
"Clark, J.","1924","Australian Formicidae","75-89 pls. VI-VII","","Journal and Proceedings of the Royal Society of Western Australia","","30 Apr. 1924","","<!--MARK--><a href='nulld6865b0d-104d-4a57-8da3-9684219200c4' class='mouseoverHref'>Clark, J. 1924. Australian Formicidae.</a> <!--MARK--><!--MARK--><a href='null6d0a243e-835c-41cd-8202-41a5fa2dd983' class='mouseoverHref'><em>Journal and Proceedings of the Royal Society of Western Australia</em></a> <strong>10</strong>: 75-89 pls. VI-VII<!--MARK--> [Date published 30 Apr. 1924]","","Article in Journal","d6865b0d-104d-4a57-8da3-9684219200c4","20170119T02:24:13.759+0000","6d0a243e-835c-41cd-8202-41a5fa2dd983"
"Clark, J.","1924","Australian Formicidae","72-89","","Journal and Proceedings of the Royal Society of Western Australia","","4 Jan. 1924","","<!--MARK--><a href='null2c993108-05ce-41a5-a7a0-77abeec0cb36' class='mouseoverHref'>Clark, J. 1924. Australian Formicidae.</a> <!--MARK--><!--MARK--><a href='null6d0a243e-835c-41cd-8202-41a5fa2dd983' class='mouseoverHref'><em>Journal and Proceedings of the Royal Society of Western Australia</em></a> <strong>9</strong>(1923): 72-89<!--MARK--> [Date published 4 Jan. 1924]","","Article in Journal","2c993108-05ce-41a5-a7a0-77abeec0cb36","20170119T02:29:11.509+0000","6d0a243e-835c-41cd-8202-41a5fa2dd983"
"Clark, J.","1926","Australian Formicidae","43-51 pl. 6","","Journal of the Royal Society of Western Australia","","","","<!--MARK--><a href='null33ebcb8b-5200-4430-855b-b62446997816' class='mouseoverHref'>Clark, J. 1926. Australian Formicidae.</a> <!--MARK--><!--MARK--><a href='null666efb8f-4a3f-4a3d-ae40-e9ab98f3cdf5' class='mouseoverHref'><em>Journal of the Royal Society of Western Australia</em></a> <strong>12</strong>: 43-51 pl. 6<!--MARK--> [25 Jan. 1926]","25 Jan. 1926","Article in Journal","33ebcb8b-5200-4430-855b-b62446997816","20081009T05:11:37.000+0000","666efb8f-4a3f-4a3d-ae40-e9ab98f3cdf5"
"Clark, J.","1929","Results of a collecting trip to the Cann River, East Gippsland","115-123","","Victorian Naturalist","","","","<!--MARK--><a href='nullcdf5805b-980d-4399-b50d-04bb90d1986b' class='mouseoverHref'>Clark, J. 1929. Results of a collecting trip to the Cann River, East Gippsland.</a> <!--MARK--><!--MARK--><a href='null97b8093b-d60f-43a6-94fc-97de34f03b6b' class='mouseoverHref'><em>Victorian Naturalist</em></a> <strong>46</strong>: 115-123<!--MARK--> [4 Oct. 1929]","4 Oct. 1929","Article in Journal","cdf5805b-980d-4399-b50d-04bb90d1986b","20081009T05:11:37.000+0000","97b8093b-d60f-43a6-94fc-97de34f03b6b"
"Clark, J.","1930","New Formicidae, with notes on some little-known species","2-25","","Proceedings of the Royal Society of Victoria","","","","<!--MARK--><a href='null5206afec-ac28-481b-959a-6bc144fcf778' class='mouseoverHref'>Clark, J. 1930. New Formicidae, with notes on some little-known species.</a> <!--MARK--><!--MARK--><a href='nullce333794-3a02-427f-ba27-346079f1efa0' class='mouseoverHref'><em>Proceedings of the Royal Society of Victoria</em></a> <strong>43</strong>: 2-25<!--MARK--> [30 Aug. 1930]","30 Aug. 1930","Article in Journal","5206afec-ac28-481b-959a-6bc144fcf778","20081009T05:11:37.000+0000","ce333794-3a02-427f-ba27-346079f1efa0"
"Clark, J.","1934","Ants from the Otway Ranges","48-73","","Memoirs of the National Museum of Victoria, Melbourne","","","","<!--MARK--><a href='null7b9a23ad-5a84-4230-ad20-6eae8211b21e' class='mouseoverHref'>Clark, J. 1934. Ants from the Otway Ranges.</a> <!--MARK--><!--MARK--><a href='null6d019674-04b0-4fab-8903-0612d147ec4d' class='mouseoverHref'><em>Memoirs of the National Museum of Victoria, Melbourne</em></a> <strong>8</strong>: 48-73<!--MARK-->","","Article in Journal","7b9a23ad-5a84-4230-ad20-6eae8211b21e","20081009T05:11:37.000+0000","6d019674-04b0-4fab-8903-0612d147ec4d"
"Crawley, W.C.","1925","New ants from Australia. II","577-598","","Annals and Magazine of Natural History","","","","<!--MARK--><a href='null0ed66b90-1363-46f0-b9e5-3aad1343ebb7' class='mouseoverHref'>Crawley, W.C. 1925. New ants from Australia. II.</a> <!--MARK--><!--MARK--><a href='nullefa8de69-3a29-4a43-8ef2-cbefda205976' class='mouseoverHref'><em>Annals and Magazine of Natural History</em></a> 9 <strong>16</strong>: 577-598<!--MARK-->","","Article in Journal","0ed66b90-1363-46f0-b9e5-3aad1343ebb7","20081009T05:11:37.000+0000","efa8de69-3a29-4a43-8ef2-cbefda205976"
"Forel, A.","1893","Nouvelles fourmis d'Australie et des Canaries","454-466","","Annales de la Société Entomologique de Belgique (Comptes-rendus)","","","","<!--MARK--><a href='nulleb32586e-d135-415b-b3f8-6345633d7c19' class='mouseoverHref'>Forel, A. 1893. Nouvelles fourmis d'Australie et des Canaries.</a> <!--MARK--><!--MARK--><a href='nullacc7fcdb-707a-4cbe-8f70-d7595ac25c58' class='mouseoverHref'><em>Annales de la Société Entomologique de Belgique (Comptes-rendus)</em></a> <strong>37</strong>: 454-466<!--MARK-->","","Article in Journal","eb32586e-d135-415b-b3f8-6345633d7c19","20081009T05:11:37.000+0000","acc7fcdb-707a-4cbe-8f70-d7595ac25c58"
"Forel, A.","1895","Nouvelles fourmis d'Australie, récoltée à The Ridge, Mackay, Queensland par M. Gilbert Turner","417-428","","Annales de la Société Entomologique de Belgique (Comptes-rendus)","","","","<!--MARK--><a href='null9c0e99b7-8d18-4c87-9cd0-57b34e688e09' class='mouseoverHref'>Forel, A. 1895. Nouvelles fourmis d'Australie, récoltée à The Ridge, Mackay, Queensland par M. Gilbert Turner.</a> <!--MARK--><!--MARK--><a href='nullacc7fcdb-707a-4cbe-8f70-d7595ac25c58' class='mouseoverHref'><em>Annales de la Société Entomologique de Belgique (Comptes-rendus)</em></a> <strong>39</strong>: 417-428<!--MARK-->","","Article in Journal","9c0e99b7-8d18-4c87-9cd0-57b34e688e09","20081009T05:11:37.000+0000","acc7fcdb-707a-4cbe-8f70-d7595ac25c58"
"Forel, A.","1900","Ponerinae et Dorylinae d'Australie récoltées par MM. Turner, Froggatt, Nugent, Chase, Rothney, J.J. Walker, etc","54-77","","Annales de la Société Entomologique de Belgique (Comptes-rendus)","","","","<!--MARK--><a href='null7b6ad079-b3b4-41e1-bf48-df8223edc27a' class='mouseoverHref'>Forel, A. 1900. Ponerinae et Dorylinae d'Australie récoltées par MM. Turner, Froggatt, Nugent, Chase, Rothney, J.J. Walker, etc.</a> <!--MARK--><!--MARK--><a href='nullacc7fcdb-707a-4cbe-8f70-d7595ac25c58' class='mouseoverHref'><em>Annales de la Société Entomologique de Belgique (Comptes-rendus)</em></a> <strong>44</strong>: 54-77<!--MARK-->","","Article in Journal","7b6ad079-b3b4-41e1-bf48-df8223edc27a","20081009T05:11:37.000+0000","acc7fcdb-707a-4cbe-8f70-d7595ac25c58"
"Forel, A.","1907","Formicidae. pp. 263-310 <i>in</i> Michaelsen, W. & Hartmeyer, R. (eds) <i>Die Fauna Südwest-Australiens.</i> Jena : G. Fischer Vol. 1","","","","","","","<!--MARK--><a href='null00c4217b-e151-49b9-a71e-11cb85cb3930' class='mouseoverHref'>Forel, A. 1907. Formicidae. pp. 263-310 <i>in</i> Michaelsen, W. & Hartmeyer, R. (eds) <i>Die Fauna Südwest-Australiens.</i> Jena : G. Fischer Vol. 1.</a>","","Miscellaneous","00c4217b-e151-49b9-a71e-11cb85cb3930","20081009T05:11:37.000+0000",""
"Forel, A.","1910","Formicides australiens reçus de M. M. Froggatt et Rowland Turner","1-94","","Revue Suisse de Zoologie","","","","<!--MARK--><a href='null001b5384-1ce0-4e72-b79a-151ab261df31' class='mouseoverHref'>Forel, A. 1910. Formicides australiens reçus de M. M. Froggatt et Rowland Turner.</a> <!--MARK--><!--MARK--><a href='nulldd4d5125-6d92-411c-86c0-7181702e62a5' class='mouseoverHref'><em>Revue Suisse de Zoologie</em></a> <strong>18</strong>: 1-94<!--MARK-->","","Article in Journal","001b5384-1ce0-4e72-b79a-151ab261df31","20081009T05:11:37.000+0000","dd4d5125-6d92-411c-86c0-7181702e62a5"
"Forel, A.","1915","Results of Dr. E. Mjöbergs Swedish Scientific Expeditions to Australia 1910-1913. 2. Ameisen","1-119, pls 1-3","","Arkiv för Zoologi","","4 Dec. 1915","","<!--MARK--><a href='null754605fe-9d76-4139-a599-27700cd29d6c' class='mouseoverHref'>Forel, A. 1915. Results of Dr. E. Mjöbergs Swedish Scientific Expeditions to Australia 1910-1913. 2. Ameisen.</a> <!--MARK--><!--MARK--><a href='nullea0f28cc-317a-4542-aaf0-5fa8122b7a93' class='mouseoverHref'><em>Arkiv för Zoologi</em></a> <strong>9</strong>(no.16): 1-119, pls 1-3<!--MARK--> [Date published 4 Dec. 1915]","","Article in Journal","754605fe-9d76-4139-a599-27700cd29d6c","20170119T05:38:42.679+0000","ea0f28cc-317a-4542-aaf0-5fa8122b7a93"
"Heterick, B.E.","2013","A taxonomic overview and key to the ants of Barrow Island, Western Australia","375-404","","Records of the Western Australian Museum, Supplement","","","","<!--MARK--><a href='null8c43a6c0-7d42-43ad-8b7c-97dad42f2bf6' class='mouseoverHref'>Heterick, B.E. 2013. A taxonomic overview and key to the ants of Barrow Island, Western Australia.</a> <!--MARK--><!--MARK--><a href='null841f1546-1bce-4548-adc9-7b08f6ca73a0' class='mouseoverHref'><em>Records of the Western Australian Museum, Supplement</em></a> <strong>83</strong>: 375-404<!--MARK-->","","Article in Journal","8c43a6c0-7d42-43ad-8b7c-97dad42f2bf6","20140327T02:14:35.059+0000","841f1546-1bce-4548-adc9-7b08f6ca73a0"
"Wheeler, W.M.","1918","The Australian ants of the ponerine tribe Cerapachyini","213-265","","Proceedings of the American Academy of Arts and Sciences","","","","<!--MARK--><a href='null363fc761-9e55-4397-a8e7-1c37d851d165' class='mouseoverHref'>Wheeler, W.M. 1918. The Australian ants of the ponerine tribe Cerapachyini.</a> <!--MARK--><!--MARK--><a href='nullf2b4781b-5420-4d64-8c37-1e2f1df0a1e3' class='mouseoverHref'><em>Proceedings of the American Academy of Arts and Sciences</em></a> <strong>53</strong>: 213-265<!--MARK-->","","Article in Journal","363fc761-9e55-4397-a8e7-1c37d851d165","20081009T05:11:37.000+0000","f2b4781b-5420-4d64-8c37-1e2f1df0a1e3"
